[I 2025-10-16 03:36:48,463] Trial 3 finished with value: 0.22409075352926242 and parameters: {'n_estimators': 69, 'max_depth': 6, 'learning_rate': 0.01579798694359177, 'num_leaves': 61, 'feature_fraction': 0.9941139781953205, 'bagging_fraction': 0.6839059856481977, 'bagging_freq': 9, 'lambda_l1': 0.16277898929607926, 'lambda_l2': 1.2920117081136309, 'min_data_in_leaf': 46}. Best is trial 1 with value: 0.005071582859403817.
[I 2025-10-16 03:40:06,172] Trial 4 finished with value: 0.04051700825131838 and parameters: {'n_estimators': 111, 'max_depth': 5, 'learning_rate': 0.02233749584419721, 'num_leaves': 50, 'feature_fraction': 0.6766205966189164, 'bagging_fraction': 0.9004953431803019, 'bagging_freq': 1, 'lambda_l1': 0.9390062158614993, 'lambda_l2': 0.046027113348016124, 'min_data_in_leaf': 9}. Best is trial 1 with value: 0.005071582859403817.
[I 2025-10-16 03:42:21,536] Trial 5 finished with value: 0.008987067374962614 and parameters: {'n_estimators': 105, 'max_depth': 7, 'learning_rate': 0.09501761448434157, 'num_leaves': 32, 'feature_fraction': 0.9727978370650907, 'bagging_fraction': 0.6649979020561276, 'bagging_freq': 8, 'lambda_l1': 0.6499764388388307, 'lambda_l2': 0.1944881441296511, 'min_data_in_leaf': 44}. Best is trial 1 with value: 0.005071582859403817.
[I 2025-10-16 03:46:51,825] Trial 6 finished with value: 0.004036282802029957 and parameters: {'n_estimators': 199, 'max_depth': 8, 'learning_rate': 0.03828639548086915, 'num_leaves': 63, 'feature_fraction': 0.9083683833700449, 'bagging_fraction': 0.9415650373191451, 'bagging_freq': 6, 'lambda_l1': 0.22865245770535858, 'lambda_l2': 1.66627827374884, 'min_data_in_leaf': 31}. Best is trial 6 with value: 0.004036282802029957.
[I 2025-10-16 03:49:44,799] Trial 7 finished with value: 0.010546803950820707 and parameters: {'n_estimators': 105, 'max_depth': 7, 'learning_rate': 0.06451566229753611, 'num_leaves': 72, 'feature_fraction': 0.965611772565711, 'bagging_fraction': 0.8328553130147253, 'bagging_freq': 3, 'lambda_l1': 0.894783985597958, 'lambda_l2': 0.566305801573652, 'min_data_in_leaf': 16}. Best is trial 6 with value: 0.004036282802029957.
[I 2025-10-16 03:54:30,185] Trial 8 finished with value: 0.009137401434240007 and parameters: {'n_estimators': 188, 'max_depth': 5, 'learning_rate': 0.03603354185668789, 'num_leaves': 88, 'feature_fraction': 0.8134100428552453, 'bagging_fraction': 0.8498512068600187, 'bagging_freq': 1, 'lambda_l1': 0.7284289721838615, 'lambda_l2': 1.1126344215114004, 'min_data_in_leaf': 43}. Best is trial 6 with value: 0.004036282802029957.
[I 2025-10-16 03:56:11,424] Trial 9 finished with value: 0.008809094724028575 and parameters: {'n_estimators': 93, 'max_depth': 6, 'learning_rate': 0.08468613014403328, 'num_leaves': 33, 'feature_fraction': 0.9545539722235885, 'bagging_fraction': 0.8182683834876823, 'bagging_freq': 3, 'lambda_l1': 0.7599196366691595, 'lambda_l2': 0.46542693158770887, 'min_data_in_leaf': 20}. Best is trial 6 with value: 0.004036282802029957.
INFO:non_major_league_hyperparameter_tuning:lightgbm optimization complete
INFO:non_major_league_hyperparameter_tuning:Best score: 0.0040
INFO:non_major_league_hyperparameter_tuning:Best params: {'n_estimators': 199, 'max_depth': 8, 'learning_rate': 0.03828639548086915, 'num_leaves': 63, 'feature_fraction': 0.9083683833700449, 'bagging_fraction': 0.9415650373191451, 'bagging_freq': 6, 'lambda_l1': 0.22865245770535858, 'lambda_l2': 1.66627827374884, 'min_data_in_leaf': 31}
INFO:non_major_league_hyperparameter_tuning:Optimizing random_forest (priority: 3)
INFO:non_major_league_hyperparameter_tuning:Optimizing hyperparameters for random_forest
[I 2025-10-16 03:56:11,434] A new study created in memory with name: no-name-607cfbc8-db71-4501-9ff9-907fc9d07b25
[I 2025-10-16 03:56:14,866] Trial 0 finished with value: 0.2412011055662474 and parameters: {'n_estimators': 191, 'max_depth': 13, 'min_samples_split': 11, 'min_samples_leaf': 4, 'max_features': 'log2'}. Best is trial 0 with value: 0.2412011055662474.
[I 2025-10-16 03:56:17,107] Trial 1 finished with value: 0.08359685643714147 and parameters: {'n_estimators': 153, 'max_depth': 13, 'min_samples_split': 3, 'min_samples_leaf': 5, 'max_features': 'sqrt'}. Best is trial 1 with value: 0.08359685643714147.
[I 2025-10-16 03:56:19,599] Trial 2 finished with value: 0.22719839076939155 and parameters: {'n_estimators': 174, 'max_depth': 8, 'min_samples_split': 9, 'min_samples_leaf': 3, 'max_features': 'log2'}. Best is trial 1 with value: 0.08359685643714147.
[I 2025-10-16 03:56:21,165] Trial 3 finished with value: 0.06112731156946396 and parameters: {'n_estimators': 113, 'max_depth': 13, 'min_samples_split': 7, 'min_samples_leaf': 3, 'max_features': 'sqrt'}. Best is trial 3 with value: 0.06112731156946396.
[I 2025-10-16 03:56:23,291] Trial 4 finished with value: 0.11630376660393714 and parameters: {'n_estimators': 148, 'max_depth': 5, 'min_samples_split': 18, 'min_samples_leaf': 6, 'max_features': 'sqrt'}. Best is trial 3 with value: 0.06112731156946396.
[I 2025-10-16 03:56:24,077] Trial 5 finished with value: 0.30328345982856697 and parameters: {'n_estimators': 60, 'max_depth': 7, 'min_samples_split': 6, 'min_samples_leaf': 6, 'max_features': 'log2'}. Best is trial 3 with value: 0.06112731156946396.
[I 2025-10-16 03:56:28,640] Trial 6 finished with value: 2.2204460492503136e-16 and parameters: {'n_estimators': 120, 'max_depth': 7, 'min_samples_split': 19, 'min_samples_leaf': 9, 'max_features': None}. Best is trial 6 with value: 2.2204460492503136e-16.
[I 2025-10-16 03:56:30,567] Trial 7 finished with value: 0.34393354126081604 and parameters: {'n_estimators': 127, 'max_depth': 9, 'min_samples_split': 3, 'min_samples_leaf': 10, 'max_features': 'log2'}. Best is trial 6 with value: 2.2204460492503136e-16.
[I 2025-10-16 03:56:35,154] Trial 8 finished with value: 2.2204460492503136e-16 and parameters: {'n_estimators': 121, 'max_depth': 3, 'min_samples_split': 16, 'min_samples_leaf': 2, 'max_features': None}. Best is trial 6 with value: 2.2204460492503136e-16.
[I 2025-10-16 03:56:36,477] Trial 9 finished with value: 0.33292194550854926 and parameters: {'n_estimators': 106, 'max_depth': 13, 'min_samples_split': 12, 'min_samples_leaf': 9, 'max_features': 'log2'}. Best is trial 6 with value: 2.2204460492503136e-16.
[I 2025-10-16 03:56:39,013] Trial 10 finished with value: 2.2204460492503136e-16 and parameters: {'n_estimators': 74, 'max_depth': 6, 'min_samples_split': 20, 'min_samples_leaf': 8, 'max_features': None}. Best is trial 6 with value: 2.2204460492503136e-16.
[I 2025-10-16 03:56:41,942] Trial 11 finished with value: 2.2204460492503136e-16 and parameters: {'n_estimators': 87, 'max_depth': 3, 'min_samples_split': 16, 'min_samples_leaf': 1, 'max_features': None}. Best is trial 6 with value: 2.2204460492503136e-16.
[I 2025-10-16 03:56:45,550] Trial 12 finished with value: 2.2204460492503136e-16 and parameters: {'n_estimators': 137, 'max_depth': 3, 'min_samples_split': 15, 'min_samples_leaf': 8, 'max_features': None}. Best is trial 6 with value: 2.2204460492503136e-16.
[I 2025-10-16 03:56:48,441] Trial 13 finished with value: 2.2204460492503136e-16 and parameters: {'n_estimators': 97, 'max_depth': 10, 'min_samples_split': 20, 'min_samples_leaf': 1, 'max_features': None}. Best is trial 6 with value: 2.2204460492503136e-16.
[I 2025-10-16 03:56:51,776] Trial 14 finished with value: 2.2204460492503136e-16 and parameters: {'n_estimators': 120, 'max_depth': 5, 'min_samples_split': 15, 'min_samples_leaf': 7, 'max_features': None}. Best is trial 6 with value: 2.2204460492503136e-16.
[I 2025-10-16 03:56:56,277] Trial 15 finished with value: 2.2204460492503136e-16 and parameters: {'n_estimators': 162, 'max_depth': 11, 'min_samples_split': 17, 'min_samples_leaf': 10, 'max_features': None}. Best is trial 6 with value: 2.2204460492503136e-16.
[I 2025-10-16 03:56:59,738] Trial 16 finished with value: 2.2204460492503136e-16 and parameters: {'n_estimators': 131, 'max_depth': 4, 'min_samples_split': 13, 'min_samples_leaf': 2, 'max_features': None}. Best is trial 6 with value: 2.2204460492503136e-16.
[I 2025-10-16 03:57:02,473] Trial 17 finished with value: 2.2204460492503136e-16 and parameters: {'n_estimators': 94, 'max_depth': 7, 'min_samples_split': 18, 'min_samples_leaf': 4, 'max_features': None}. Best is trial 6 with value: 2.2204460492503136e-16.
[I 2025-10-16 03:57:04,183] Trial 18 finished with value: 2.2204460492503136e-16 and parameters: {'n_estimators': 66, 'max_depth': 15, 'min_samples_split': 14, 'min_samples_leaf': 7, 'max_features': None}. Best is trial 6 with value: 2.2204460492503136e-16.
[I 2025-10-16 03:57:06,661] Trial 19 finished with value: 2.2204460492503136e-16 and parameters: {'n_estimators': 85, 'max_depth': 5, 'min_samples_split': 19, 'min_samples_leaf': 5, 'max_features': None}. Best is trial 6 with value: 2.2204460492503136e-16.
[I 2025-10-16 03:57:07,338] Trial 20 finished with value: 0.09366804610402395 and parameters: {'n_estimators': 51, 'max_depth': 8, 'min_samples_split': 17, 'min_samples_leaf': 2, 'max_features': 'sqrt'}. Best is trial 6 with value: 2.2204460492503136e-16.
[I 2025-10-16 03:57:09,494] Trial 21 finished with value: 2.2204460492503136e-16 and parameters: {'n_estimators': 73, 'max_depth': 6, 'min_samples_split': 20, 'min_samples_leaf': 8, 'max_features': None}. Best is trial 6 with value: 2.2204460492503136e-16.
[I 2025-10-16 03:57:12,256] Trial 22 finished with value: 2.2204460492503136e-16 and parameters: {'n_estimators': 110, 'max_depth': 6, 'min_samples_split': 20, 'min_samples_leaf': 9, 'max_features': None}. Best is trial 6 with value: 2.2204460492503136e-16.
[I 2025-10-16 03:57:13,921] Trial 23 finished with value: 2.2204460492503136e-16 and parameters: {'n_estimators': 77, 'max_depth': 4, 'min_samples_split': 18, 'min_samples_leaf': 8, 'max_features': None}. Best is trial 6 with value: 2.2204460492503136e-16.
[I 2025-10-16 03:57:16,765] Trial 24 finished with value: 2.2204460492503136e-16 and parameters: {'n_estimators': 147, 'max_depth': 7, 'min_samples_split': 16, 'min_samples_leaf': 9, 'max_features': None}. Best is trial 6 with value: 2.2204460492503136e-16.
[I 2025-10-16 03:57:19,204] Trial 25 finished with value: 2.2204460492503136e-16 and parameters: {'n_estimators': 100, 'max_depth': 4, 'min_samples_split': 19, 'min_samples_leaf': 7, 'max_features': None}. Best is trial 6 with value: 2.2204460492503136e-16.
[I 2025-10-16 03:57:21,627] Trial 26 finished with value: 2.2204460492503136e-16 and parameters: {'n_estimators': 118, 'max_depth': 6, 'min_samples_split': 11, 'min_samples_leaf': 10, 'max_features': None}. Best is trial 6 with value: 2.2204460492503136e-16.
[I 2025-10-16 03:57:24,250] Trial 27 finished with value: 2.2204460492503136e-16 and parameters: {'n_estimators': 139, 'max_depth': 9, 'min_samples_split': 16, 'min_samples_leaf': 9, 'max_features': None}. Best is trial 6 with value: 2.2204460492503136e-16.
[I 2025-10-16 03:57:25,224] Trial 28 finished with value: 0.2337180953154855 and parameters: {'n_estimators': 166, 'max_depth': 3, 'min_samples_split': 14, 'min_samples_leaf': 8, 'max_features': 'sqrt'}. Best is trial 6 with value: 2.2204460492503136e-16.
[I 2025-10-16 03:57:29,124] Trial 29 finished with value: 2.2204460492503136e-16 and parameters: {'n_estimators': 200, 'max_depth': 8, 'min_samples_split': 19, 'min_samples_leaf': 4, 'max_features': None}. Best is trial 6 with value: 2.2204460492503136e-16.
INFO:non_major_league_hyperparameter_tuning:random_forest optimization complete
INFO:non_major_league_hyperparameter_tuning:Best score: 0.0000
INFO:non_major_league_hyperparameter_tuning:Best params: {'n_estimators': 120, 'max_depth': 7, 'min_samples_split': 19, 'min_samples_leaf': 9, 'max_features': None}
INFO:non_major_league_hyperparameter_tuning:Optimizing logistic_regression (priority: 4)
INFO:non_major_league_hyperparameter_tuning:Optimizing hyperparameters for logistic_regression
[I 2025-10-16 03:57:29,128] A new study created in memory with name: no-name-05369531-9a19-4d28-9fbb-5dcf40cd3340
[I 2025-10-16 03:57:29,189] Trial 0 finished with value: 0.0026011203820135516 and parameters: {'C': 9.680349272679015, 'max_iter': 263, 'solver': 'lbfgs'}. Best is trial 0 with value: 0.0026011203820135516.
[I 2025-10-16 03:57:29,247] Trial 1 finished with value: 0.002617718041330155 and parameters: {'C': 9.553677820314634, 'max_iter': 930, 'solver': 'lbfgs'}. Best is trial 0 with value: 0.0026011203820135516.
[I 2025-10-16 03:57:29,410] Trial 2 finished with value: 0.06018654394344466 and parameters: {'C': 1.2344223782974952, 'max_iter': 210, 'solver': 'liblinear'}. Best is trial 0 with value: 0.0026011203820135516.
[I 2025-10-16 03:57:29,585] Trial 3 finished with value: 0.03571414986766977 and parameters: {'C': 4.23546963030322, 'max_iter': 981, 'solver': 'liblinear'}. Best is trial 0 with value: 0.0026011203820135516.
[I 2025-10-16 03:57:29,765] Trial 4 finished with value: 0.026710382203660718 and parameters: {'C': 8.795535243166297, 'max_iter': 382, 'solver': 'liblinear'}. Best is trial 0 with value: 0.0026011203820135516.
[I 2025-10-16 03:57:29,966] Trial 5 finished with value: 0.035449171165216266 and parameters: {'C': 4.3143345120153835, 'max_iter': 662, 'solver': 'liblinear'}. Best is trial 0 with value: 0.0026011203820135516.
[I 2025-10-16 03:57:30,081] Trial 6 finished with value: 0.014271576228700908 and parameters: {'C': 0.5198867528174979, 'max_iter': 259, 'solver': 'lbfgs'}. Best is trial 0 with value: 0.0026011203820135516.
[I 2025-10-16 03:57:30,170] Trial 7 finished with value: 0.003088261321917941 and parameters: {'C': 4.8472500314709865, 'max_iter': 551, 'solver': 'lbfgs'}. Best is trial 0 with value: 0.0026011203820135516.
[I 2025-10-16 03:57:30,390] Trial 8 finished with value: 0.04261655957094662 and parameters: {'C': 2.7619611138786335, 'max_iter': 197, 'solver': 'liblinear'}. Best is trial 0 with value: 0.0026011203820135516.
[I 2025-10-16 03:57:30,608] Trial 9 finished with value: 0.033711519439378335 and parameters: {'C': 4.877844364491265, 'max_iter': 940, 'solver': 'liblinear'}. Best is trial 0 with value: 0.0026011203820135516.
[I 2025-10-16 03:57:30,701] Trial 10 finished with value: 0.0030400957110422503 and parameters: {'C': 7.170105625058854, 'max_iter': 395, 'solver': 'lbfgs'}. Best is trial 0 with value: 0.0026011203820135516.
[I 2025-10-16 03:57:30,794] Trial 11 finished with value: 0.002561432092245496 and parameters: {'C': 9.994897663999, 'max_iter': 789, 'solver': 'lbfgs'}. Best is trial 11 with value: 0.002561432092245496.
[I 2025-10-16 03:57:30,892] Trial 12 finished with value: 0.002948395165895167 and parameters: {'C': 7.620855800538487, 'max_iter': 722, 'solver': 'lbfgs'}. Best is trial 11 with value: 0.002561432092245496.
[I 2025-10-16 03:57:30,986] Trial 13 finished with value: 0.0030730049095353796 and parameters: {'C': 7.018824234968011, 'max_iter': 726, 'solver': 'lbfgs'}. Best is trial 11 with value: 0.002561432092245496.
[I 2025-10-16 03:57:31,082] Trial 14 finished with value: 0.0025695350349772537 and parameters: {'C': 9.929301712203467, 'max_iter': 417, 'solver': 'lbfgs'}. Best is trial 11 with value: 0.002561432092245496.
[I 2025-10-16 03:57:31,195] Trial 15 finished with value: 0.002847136781195886 and parameters: {'C': 8.174437989359678, 'max_iter': 528, 'solver': 'lbfgs'}. Best is trial 11 with value: 0.002561432092245496.
[I 2025-10-16 03:57:31,311] Trial 16 finished with value: 0.0029208179982521273 and parameters: {'C': 6.155358364586553, 'max_iter': 811, 'solver': 'lbfgs'}. Best is trial 11 with value: 0.002561432092245496.
[I 2025-10-16 03:57:31,406] Trial 17 finished with value: 0.0025785637248241767 and parameters: {'C': 9.857055320846873, 'max_iter': 531, 'solver': 'lbfgs'}. Best is trial 11 with value: 0.002561432092245496.
[I 2025-10-16 03:57:31,512] Trial 18 finished with value: 0.002822233766272141 and parameters: {'C': 6.404880243701136, 'max_iter': 402, 'solver': 'lbfgs'}. Best is trial 11 with value: 0.002561432092245496.
[I 2025-10-16 03:57:31,617] Trial 19 finished with value: 0.002798815323487899 and parameters: {'C': 8.632632779907246, 'max_iter': 866, 'solver': 'lbfgs'}. Best is trial 11 with value: 0.002561432092245496.
[I 2025-10-16 03:57:31,768] Trial 20 finished with value: 0.003995698645342898 and parameters: {'C': 2.896102444180133, 'max_iter': 652, 'solver': 'lbfgs'}. Best is trial 11 with value: 0.002561432092245496.
[I 2025-10-16 03:57:31,876] Trial 21 finished with value: 0.0025846396496224523 and parameters: {'C': 9.808929813708568, 'max_iter': 524, 'solver': 'lbfgs'}. Best is trial 11 with value: 0.002561432092245496.
[I 2025-10-16 03:57:31,973] Trial 22 finished with value: 0.0027456103851904966 and parameters: {'C': 8.978359714832797, 'max_iter': 459, 'solver': 'lbfgs'}. Best is trial 11 with value: 0.002561432092245496.
[I 2025-10-16 03:57:32,078] Trial 23 finished with value: 0.0028449022778702965 and parameters: {'C': 8.18738313795716, 'max_iter': 592, 'solver': 'lbfgs'}. Best is trial 11 with value: 0.002561432092245496.
[I 2025-10-16 03:57:32,174] Trial 24 finished with value: 0.002562094195195015 and parameters: {'C': 9.989510564344783, 'max_iter': 320, 'solver': 'lbfgs'}. Best is trial 11 with value: 0.002561432092245496.
[I 2025-10-16 03:57:32,292] Trial 25 finished with value: 0.0027032818087991545 and parameters: {'C': 9.270729179389837, 'max_iter': 131, 'solver': 'lbfgs'}. Best is trial 11 with value: 0.002561432092245496.
[I 2025-10-16 03:57:32,459] Trial 26 finished with value: 0.002862776871053042 and parameters: {'C': 8.084751188329584, 'max_iter': 314, 'solver': 'lbfgs'}. Best is trial 11 with value: 0.002561432092245496.
[I 2025-10-16 03:57:32,596] Trial 27 finished with value: 0.002562537488385764 and parameters: {'C': 9.98590649067215, 'max_iter': 318, 'solver': 'lbfgs'}. Best is trial 11 with value: 0.002561432092245496.
[I 2025-10-16 03:57:32,703] Trial 28 finished with value: 0.0028367550874651144 and parameters: {'C': 6.290742616237065, 'max_iter': 121, 'solver': 'lbfgs'}. Best is trial 11 with value: 0.002561432092245496.
