[I 2025-10-16 03:25:12,116] Trial 2 finished with value: inf and parameters: {'n_estimators': 82, 'max_depth': 4, 'learning_rate': 0.06710915738648685, 'subsample': 0.6281890887305596, 'colsample_bytree': 0.8452005241239122, 'min_child_weight': 7, 'reg_alpha': 0.6711686774351872, 'reg_lambda': 1.9220368970710813}. Best is trial 0 with value: inf.
WARNING:non_major_league_hyperparameter_tuning:Error in fold: feature_names must be string, and may not contain [, ] or <
WARNING:non_major_league_hyperparameter_tuning:Error in fold: feature_names must be string, and may not contain [, ] or <
WARNING:non_major_league_hyperparameter_tuning:Error in fold: feature_names must be string, and may not contain [, ] or <
[I 2025-10-16 03:25:12,260] Trial 3 finished with value: inf and parameters: {'n_estimators': 112, 'max_depth': 5, 'learning_rate': 0.021734156310568825, 'subsample': 0.7546635526510523, 'colsample_bytree': 0.8739308013731699, 'min_child_weight': 7, 'reg_alpha': 0.2567409247585236, 'reg_lambda': 1.1084251660160203}. Best is trial 0 with value: inf.
WARNING:non_major_league_hyperparameter_tuning:Error in fold: feature_names must be string, and may not contain [, ] or <
WARNING:non_major_league_hyperparameter_tuning:Error in fold: feature_names must be string, and may not contain [, ] or <
WARNING:non_major_league_hyperparameter_tuning:Error in fold: feature_names must be string, and may not contain [, ] or <
[I 2025-10-16 03:25:12,365] Trial 4 finished with value: inf and parameters: {'n_estimators': 76, 'max_depth': 5, 'learning_rate': 0.024735129068459663, 'subsample': 0.9041529202409941, 'colsample_bytree': 0.7379782791127655, 'min_child_weight': 2, 'reg_alpha': 0.6453772711730466, 'reg_lambda': 1.0074572255823002}. Best is trial 0 with value: inf.
WARNING:non_major_league_hyperparameter_tuning:Error in fold: feature_names must be string, and may not contain [, ] or <
WARNING:non_major_league_hyperparameter_tuning:Error in fold: feature_names must be string, and may not contain [, ] or <
WARNING:non_major_league_hyperparameter_tuning:Error in fold: feature_names must be string, and may not contain [, ] or <
[I 2025-10-16 03:25:12,493] Trial 5 finished with value: inf and parameters: {'n_estimators': 195, 'max_depth': 5, 'learning_rate': 0.08138268306795156, 'subsample': 0.9637948157036241, 'colsample_bytree': 0.9583275965851505, 'min_child_weight': 1, 'reg_alpha': 0.8836119409158574, 'reg_lambda': 1.7064881014992292}. Best is trial 0 with value: inf.
WARNING:non_major_league_hyperparameter_tuning:Error in fold: feature_names must be string, and may not contain [, ] or <
WARNING:non_major_league_hyperparameter_tuning:Error in fold: feature_names must be string, and may not contain [, ] or <
WARNING:non_major_league_hyperparameter_tuning:Error in fold: feature_names must be string, and may not contain [, ] or <
[I 2025-10-16 03:25:12,791] Trial 6 finished with value: inf and parameters: {'n_estimators': 119, 'max_depth': 7, 'learning_rate': 0.028125467793770398, 'subsample': 0.9430083265425973, 'colsample_bytree': 0.7085691271462258, 'min_child_weight': 7, 'reg_alpha': 0.5788536005257594, 'reg_lambda': 1.1230903797732807}. Best is trial 0 with value: inf.
WARNING:non_major_league_hyperparameter_tuning:Error in fold: feature_names must be string, and may not contain [, ] or <
WARNING:non_major_league_hyperparameter_tuning:Error in fold: feature_names must be string, and may not contain [, ] or <
WARNING:non_major_league_hyperparameter_tuning:Error in fold: feature_names must be string, and may not contain [, ] or <
[I 2025-10-16 03:25:12,895] Trial 7 finished with value: inf and parameters: {'n_estimators': 165, 'max_depth': 8, 'learning_rate': 0.06682450550540282, 'subsample': 0.7510644799210121, 'colsample_bytree': 0.6755329690955174, 'min_child_weight': 1, 'reg_alpha': 0.21333441280631982, 'reg_lambda': 1.3225702442813356}. Best is trial 0 with value: inf.
WARNING:non_major_league_hyperparameter_tuning:Error in fold: feature_names must be string, and may not contain [, ] or <
WARNING:non_major_league_hyperparameter_tuning:Error in fold: feature_names must be string, and may not contain [, ] or <
WARNING:non_major_league_hyperparameter_tuning:Error in fold: feature_names must be string, and may not contain [, ] or <
[I 2025-10-16 03:25:13,019] Trial 8 finished with value: inf and parameters: {'n_estimators': 132, 'max_depth': 8, 'learning_rate': 0.044261703424232836, 'subsample': 0.691047301668881, 'colsample_bytree': 0.7494163274307702, 'min_child_weight': 9, 'reg_alpha': 0.37810223018298694, 'reg_lambda': 0.9404878948166111}. Best is trial 0 with value: inf.
WARNING:non_major_league_hyperparameter_tuning:Error in fold: feature_names must be string, and may not contain [, ] or <
WARNING:non_major_league_hyperparameter_tuning:Error in fold: feature_names must be string, and may not contain [, ] or <
WARNING:non_major_league_hyperparameter_tuning:Error in fold: feature_names must be string, and may not contain [, ] or <
[I 2025-10-16 03:25:13,132] Trial 9 finished with value: inf and parameters: {'n_estimators': 98, 'max_depth': 4, 'learning_rate': 0.07141274626976621, 'subsample': 0.72549161294246, 'colsample_bytree': 0.7313462034498565, 'min_child_weight': 10, 'reg_alpha': 0.7411495724357348, 'reg_lambda': 0.28778087292931853}. Best is trial 0 with value: inf.
WARNING:non_major_league_hyperparameter_tuning:Error in fold: feature_names must be string, and may not contain [, ] or <
WARNING:non_major_league_hyperparameter_tuning:Error in fold: feature_names must be string, and may not contain [, ] or <
WARNING:non_major_league_hyperparameter_tuning:Error in fold: feature_names must be string, and may not contain [, ] or <
[I 2025-10-16 03:25:13,268] Trial 10 finished with value: inf and parameters: {'n_estimators': 163, 'max_depth': 3, 'learning_rate': 0.09746779841630028, 'subsample': 0.865401580868762, 'colsample_bytree': 0.600128724151504, 'min_child_weight': 4, 'reg_alpha': 0.013277154294151772, 'reg_lambda': 0.35638025793024897}. Best is trial 0 with value: inf.
WARNING:non_major_league_hyperparameter_tuning:Error in fold: feature_names must be string, and may not contain [, ] or <
WARNING:non_major_league_hyperparameter_tuning:Error in fold: feature_names must be string, and may not contain [, ] or <
WARNING:non_major_league_hyperparameter_tuning:Error in fold: feature_names must be string, and may not contain [, ] or <
[I 2025-10-16 03:25:13,403] Trial 11 finished with value: inf and parameters: {'n_estimators': 144, 'max_depth': 6, 'learning_rate': 0.04580266139396856, 'subsample': 0.8355660621489538, 'colsample_bytree': 0.9290959241207302, 'min_child_weight': 4, 'reg_alpha': 0.46884085640861284, 'reg_lambda': 0.7737284985809745}. Best is trial 0 with value: inf.
WARNING:non_major_league_hyperparameter_tuning:Error in fold: feature_names must be string, and may not contain [, ] or <
WARNING:non_major_league_hyperparameter_tuning:Error in fold: feature_names must be string, and may not contain [, ] or <
WARNING:non_major_league_hyperparameter_tuning:Error in fold: feature_names must be string, and may not contain [, ] or <
[I 2025-10-16 03:25:13,577] Trial 12 finished with value: inf and parameters: {'n_estimators': 153, 'max_depth': 6, 'learning_rate': 0.04786089554383772, 'subsample': 0.8062936521032396, 'colsample_bytree': 0.8177586746070288, 'min_child_weight': 5, 'reg_alpha': 0.38457110015980034, 'reg_lambda': 0.5700253907761919}. Best is trial 0 with value: inf.
WARNING:non_major_league_hyperparameter_tuning:Error in fold: feature_names must be string, and may not contain [, ] or <
WARNING:non_major_league_hyperparameter_tuning:Error in fold: feature_names must be string, and may not contain [, ] or <
WARNING:non_major_league_hyperparameter_tuning:Error in fold: feature_names must be string, and may not contain [, ] or <
[I 2025-10-16 03:25:13,705] Trial 13 finished with value: inf and parameters: {'n_estimators': 54, 'max_depth': 4, 'learning_rate': 0.03539322209977817, 'subsample': 0.8782162478110304, 'colsample_bytree': 0.6311054676674891, 'min_child_weight': 3, 'reg_alpha': 0.8543574103411516, 'reg_lambda': 1.6061574183277738}. Best is trial 0 with value: inf.
WARNING:non_major_league_hyperparameter_tuning:Error in fold: feature_names must be string, and may not contain [, ] or <
WARNING:non_major_league_hyperparameter_tuning:Error in fold: feature_names must be string, and may not contain [, ] or <
WARNING:non_major_league_hyperparameter_tuning:Error in fold: feature_names must be string, and may not contain [, ] or <
[I 2025-10-16 03:25:13,838] Trial 14 finished with value: inf and parameters: {'n_estimators': 190, 'max_depth': 3, 'learning_rate': 0.058939590155122276, 'subsample': 0.8026809803364564, 'colsample_bytree': 0.8996165638420587, 'min_child_weight': 6, 'reg_alpha': 0.1983034631813675, 'reg_lambda': 0.031845959769457255}. Best is trial 0 with value: inf.
WARNING:non_major_league_hyperparameter_tuning:Error in fold: feature_names must be string, and may not contain [, ] or <
WARNING:non_major_league_hyperparameter_tuning:Error in fold: feature_names must be string, and may not contain [, ] or <
WARNING:non_major_league_hyperparameter_tuning:Error in fold: feature_names must be string, and may not contain [, ] or <
[I 2025-10-16 03:25:13,979] Trial 15 finished with value: inf and parameters: {'n_estimators': 133, 'max_depth': 6, 'learning_rate': 0.05531020549456383, 'subsample': 0.6702786855377121, 'colsample_bytree': 0.7890607144838756, 'min_child_weight': 8, 'reg_alpha': 0.4824604792982306, 'reg_lambda': 1.5008617579506742}. Best is trial 0 with value: inf.
WARNING:non_major_league_hyperparameter_tuning:Error in fold: feature_names must be string, and may not contain [, ] or <
WARNING:non_major_league_hyperparameter_tuning:Error in fold: feature_names must be string, and may not contain [, ] or <
WARNING:non_major_league_hyperparameter_tuning:Error in fold: feature_names must be string, and may not contain [, ] or <
[I 2025-10-16 03:25:14,130] Trial 16 finished with value: inf and parameters: {'n_estimators': 103, 'max_depth': 7, 'learning_rate': 0.010556132897406485, 'subsample': 0.765662656614045, 'colsample_bytree': 0.9790705745008117, 'min_child_weight': 5, 'reg_alpha': 0.344793725978795, 'reg_lambda': 0.7409133773522931}. Best is trial 0 with value: inf.
WARNING:non_major_league_hyperparameter_tuning:Error in fold: feature_names must be string, and may not contain [, ] or <
WARNING:non_major_league_hyperparameter_tuning:Error in fold: feature_names must be string, and may not contain [, ] or <
WARNING:non_major_league_hyperparameter_tuning:Error in fold: feature_names must be string, and may not contain [, ] or <
[I 2025-10-16 03:25:14,267] Trial 17 finished with value: inf and parameters: {'n_estimators': 176, 'max_depth': 4, 'learning_rate': 0.08328879904261591, 'subsample': 0.9979496803637897, 'colsample_bytree': 0.6490826142570842, 'min_child_weight': 3, 'reg_alpha': 0.9972380592885925, 'reg_lambda': 1.8995818313069808}. Best is trial 0 with value: inf.
WARNING:non_major_league_hyperparameter_tuning:Error in fold: feature_names must be string, and may not contain [, ] or <
WARNING:non_major_league_hyperparameter_tuning:Error in fold: feature_names must be string, and may not contain [, ] or <
WARNING:non_major_league_hyperparameter_tuning:Error in fold: feature_names must be string, and may not contain [, ] or <
[I 2025-10-16 03:25:14,421] Trial 18 finished with value: inf and parameters: {'n_estimators': 87, 'max_depth': 5, 'learning_rate': 0.0393043844454344, 'subsample': 0.8364407443542278, 'colsample_bytree': 0.7970285265726159, 'min_child_weight': 9, 'reg_alpha': 0.06268283320919588, 'reg_lambda': 1.3722909235852199}. Best is trial 0 with value: inf.
WARNING:non_major_league_hyperparameter_tuning:Error in fold: feature_names must be string, and may not contain [, ] or <
WARNING:non_major_league_hyperparameter_tuning:Error in fold: feature_names must be string, and may not contain [, ] or <
WARNING:non_major_league_hyperparameter_tuning:Error in fold: feature_names must be string, and may not contain [, ] or <
[I 2025-10-16 03:25:14,571] Trial 19 finished with value: inf and parameters: {'n_estimators': 137, 'max_depth': 7, 'learning_rate': 0.05437274439508462, 'subsample': 0.8972222280953263, 'colsample_bytree': 0.8585119316215792, 'min_child_weight': 6, 'reg_alpha': 0.5739269670795132, 'reg_lambda': 0.4753007543168821}. Best is trial 0 with value: inf.
WARNING:non_major_league_hyperparameter_tuning:Error in fold: feature_names must be string, and may not contain [, ] or <
WARNING:non_major_league_hyperparameter_tuning:Error in fold: feature_names must be string, and may not contain [, ] or <
WARNING:non_major_league_hyperparameter_tuning:Error in fold: feature_names must be string, and may not contain [, ] or <
[I 2025-10-16 03:25:14,768] Trial 20 finished with value: inf and parameters: {'n_estimators': 119, 'max_depth': 6, 'learning_rate': 0.0783651115461633, 'subsample': 0.7064314718251095, 'colsample_bytree': 0.7694994504538339, 'min_child_weight': 3, 'reg_alpha': 0.7564618874001948, 'reg_lambda': 0.7810007152671501}. Best is trial 0 with value: inf.
WARNING:non_major_league_hyperparameter_tuning:Error in fold: feature_names must be string, and may not contain [, ] or <
WARNING:non_major_league_hyperparameter_tuning:Error in fold: feature_names must be string, and may not contain [, ] or <
WARNING:non_major_league_hyperparameter_tuning:Error in fold: feature_names must be string, and may not contain [, ] or <
[I 2025-10-16 03:25:14,931] Trial 21 finished with value: inf and parameters: {'n_estimators': 67, 'max_depth': 4, 'learning_rate': 0.06642830680700754, 'subsample': 0.6125218816314949, 'colsample_bytree': 0.831259505507345, 'min_child_weight': 7, 'reg_alpha': 0.6822385473847425, 'reg_lambda': 1.9305118096852008}. Best is trial 0 with value: inf.
WARNING:non_major_league_hyperparameter_tuning:Error in fold: feature_names must be string, and may not contain [, ] or <
WARNING:non_major_league_hyperparameter_tuning:Error in fold: feature_names must be string, and may not contain [, ] or <
WARNING:non_major_league_hyperparameter_tuning:Error in fold: feature_names must be string, and may not contain [, ] or <
[I 2025-10-16 03:25:15,074] Trial 22 finished with value: inf and parameters: {'n_estimators': 91, 'max_depth': 4, 'learning_rate': 0.05858291532264702, 'subsample': 0.6224818683759393, 'colsample_bytree': 0.8497641541743576, 'min_child_weight': 8, 'reg_alpha': 0.5249981297114491, 'reg_lambda': 1.7634149753239854}. Best is trial 0 with value: inf.
WARNING:non_major_league_hyperparameter_tuning:Error in fold: feature_names must be string, and may not contain [, ] or <
WARNING:non_major_league_hyperparameter_tuning:Error in fold: feature_names must be string, and may not contain [, ] or <
WARNING:non_major_league_hyperparameter_tuning:Error in fold: feature_names must be string, and may not contain [, ] or <
[I 2025-10-16 03:25:15,190] Trial 23 finished with value: inf and parameters: {'n_estimators': 77, 'max_depth': 3, 'learning_rate': 0.09268845008913462, 'subsample': 0.6530351014312797, 'colsample_bytree': 0.9028513529029998, 'min_child_weight': 8, 'reg_alpha': 0.6232845975707749, 'reg_lambda': 1.9626492554371024}. Best is trial 0 with value: inf.
WARNING:non_major_league_hyperparameter_tuning:Error in fold: feature_names must be string, and may not contain [, ] or <
WARNING:non_major_league_hyperparameter_tuning:Error in fold: feature_names must be string, and may not contain [, ] or <
WARNING:non_major_league_hyperparameter_tuning:Error in fold: feature_names must be string, and may not contain [, ] or <
[I 2025-10-16 03:25:15,331] Trial 24 finished with value: inf and parameters: {'n_estimators': 58, 'max_depth': 5, 'learning_rate': 0.07038674175802329, 'subsample': 0.7762986007380517, 'colsample_bytree': 0.6962992242201419, 'min_child_weight': 6, 'reg_alpha': 0.46312800983511304, 'reg_lambda': 1.3864288397258746}. Best is trial 0 with value: inf.
WARNING:non_major_league_hyperparameter_tuning:Error in fold: feature_names must be string, and may not contain [, ] or <
WARNING:non_major_league_hyperparameter_tuning:Error in fold: feature_names must be string, and may not contain [, ] or <
WARNING:non_major_league_hyperparameter_tuning:Error in fold: feature_names must be string, and may not contain [, ] or <
[I 2025-10-16 03:25:15,466] Trial 25 finished with value: inf and parameters: {'n_estimators': 106, 'max_depth': 4, 'learning_rate': 0.05059846188417519, 'subsample': 0.8400481650206651, 'colsample_bytree': 0.898123309380389, 'min_child_weight': 5, 'reg_alpha': 0.32578494273151826, 'reg_lambda': 1.7157394102261847}. Best is trial 0 with value: inf.
WARNING:non_major_league_hyperparameter_tuning:Error in fold: feature_names must be string, and may not contain [, ] or <
WARNING:non_major_league_hyperparameter_tuning:Error in fold: feature_names must be string, and may not contain [, ] or <
WARNING:non_major_league_hyperparameter_tuning:Error in fold: feature_names must be string, and may not contain [, ] or <
[I 2025-10-16 03:25:15,610] Trial 26 finished with value: inf and parameters: {'n_estimators': 148, 'max_depth': 5, 'learning_rate': 0.061727016213566896, 'subsample': 0.6449406127428254, 'colsample_bytree': 0.8225192570971583, 'min_child_weight': 7, 'reg_alpha': 0.7887412366392714, 'reg_lambda': 1.2079994760060555}. Best is trial 0 with value: inf.
WARNING:non_major_league_hyperparameter_tuning:Error in fold: feature_names must be string, and may not contain [, ] or <
WARNING:non_major_league_hyperparameter_tuning:Error in fold: feature_names must be string, and may not contain [, ] or <
WARNING:non_major_league_hyperparameter_tuning:Error in fold: feature_names must be string, and may not contain [, ] or <
[I 2025-10-16 03:25:15,802] Trial 27 finished with value: inf and parameters: {'n_estimators': 123, 'max_depth': 3, 'learning_rate': 0.03445210036317685, 'subsample': 0.6002899030334232, 'colsample_bytree': 0.7686583687636173, 'min_child_weight': 9, 'reg_alpha': 0.6868059323912864, 'reg_lambda': 1.5449927819615372}. Best is trial 0 with value: inf.
WARNING:non_major_league_hyperparameter_tuning:Error in fold: feature_names must be string, and may not contain [, ] or <
WARNING:non_major_league_hyperparameter_tuning:Error in fold: feature_names must be string, and may not contain [, ] or <
WARNING:non_major_league_hyperparameter_tuning:Error in fold: feature_names must be string, and may not contain [, ] or <
[I 2025-10-16 03:25:15,945] Trial 28 finished with value: inf and parameters: {'n_estimators': 84, 'max_depth': 4, 'learning_rate': 0.07559484680872898, 'subsample': 0.7236010497797116, 'colsample_bytree': 0.933247934985706, 'min_child_weight': 4, 'reg_alpha': 0.43500598415000025, 'reg_lambda': 1.8174497672280556}. Best is trial 0 with value: inf.
WARNING:non_major_league_hyperparameter_tuning:Error in fold: feature_names must be string, and may not contain [, ] or <
WARNING:non_major_league_hyperparameter_tuning:Error in fold: feature_names must be string, and may not contain [, ] or <
WARNING:non_major_league_hyperparameter_tuning:Error in fold: feature_names must be string, and may not contain [, ] or <
[I 2025-10-16 03:25:16,093] Trial 29 finished with value: inf and parameters: {'n_estimators': 112, 'max_depth': 5, 'learning_rate': 0.08857824111934706, 'subsample': 0.7400861965354043, 'colsample_bytree': 0.8542541051937275, 'min_child_weight': 7, 'reg_alpha': 0.2673553359147097, 'reg_lambda': 0.9459893947221987}. Best is trial 0 with value: inf.
INFO:non_major_league_hyperparameter_tuning:xgboost optimization complete
INFO:non_major_league_hyperparameter_tuning:Best score: inf
INFO:non_major_league_hyperparameter_tuning:Best params: {'n_estimators': 118, 'max_depth': 5, 'learning_rate': 0.054079046641072444, 'subsample': 0.8475350485811274, 'colsample_bytree': 0.6881170951580878, 'min_child_weight': 7, 'reg_alpha': 0.3910627586703235, 'reg_lambda': 0.7795595893655498}
INFO:non_major_league_hyperparameter_tuning:Optimizing lightgbm (priority: 2)
INFO:non_major_league_hyperparameter_tuning:Optimizing hyperparameters for lightgbm
[I 2025-10-16 03:25:16,106] A new study created in memory with name: no-name-66f3bef2-14ef-4018-99ba-e7693956b5fa
[I 2025-10-16 03:28:15,065] Trial 0 finished with value: 0.010186696544409098 and parameters: {'n_estimators': 124, 'max_depth': 5, 'learning_rate': 0.086442405845837, 'num_leaves': 55, 'feature_fraction': 0.8112270001152619, 'bagging_fraction': 0.6555324993474607, 'bagging_freq': 8, 'lambda_l1': 0.6690486722488288, 'lambda_l2': 1.7373975344592856, 'min_data_in_leaf': 23}. Best is trial 0 with value: 0.010186696544409098.
[I 2025-10-16 03:32:46,394] Trial 1 finished with value: 0.005071582859403817 and parameters: {'n_estimators': 162, 'max_depth': 6, 'learning_rate': 0.04975088432603065, 'num_leaves': 14, 'feature_fraction': 0.8060011827416564, 'bagging_fraction': 0.9693229480774669, 'bagging_freq': 4, 'lambda_l1': 0.4942976765853708, 'lambda_l2': 0.6561045522890201, 'min_data_in_leaf': 10}. Best is trial 1 with value: 0.005071582859403817.
[I 2025-10-16 03:34:57,518] Trial 2 finished with value: 0.010253678525090236 and parameters: {'n_estimators': 77, 'max_depth': 4, 'learning_rate': 0.08981659574867135, 'num_leaves': 22, 'feature_fraction': 0.7872362903690544, 'bagging_fraction': 0.8395894386497513, 'bagging_freq': 5, 'lambda_l1': 0.8327269591572211, 'lambda_l2': 1.015270776909287, 'min_data_in_leaf': 29}. Best is trial 1 with value: 0.005071582859403817.
