[I 2025-10-15 23:43:14,940] Trial 8 finished with value: inf and parameters: {'n_estimators': 71, 'max_depth': 8, 'learning_rate': 0.019631360930438622, 'subsample': 0.8776007595325908, 'colsample_bytree': 0.7176237257291972, 'min_child_weight': 3, 'reg_alpha': 0.6810899716204188, 'reg_lambda': 0.6091465742625453}. Best is trial 0 with value: inf.
2025-10-15 23:43:14,950 - non_major_league_hyperparameter_tuning - WARNING - Error in fold: DataFrame.dtypes for data must be int, float, bool or category. When categorical type is supplied, the experimental DMatrix parameter`enable_categorical` must be set to `True`.  Invalid columns:Div: object, Date: object, Time: object, HomeTeam: object, AwayTeam: object, FTR: object, HTR: object, Referee: object, league: object, season: object, data_source: object, season_phase: object
2025-10-15 23:43:14,956 - non_major_league_hyperparameter_tuning - WARNING - Error in fold: DataFrame.dtypes for data must be int, float, bool or category. When categorical type is supplied, the experimental DMatrix parameter`enable_categorical` must be set to `True`.  Invalid columns:Div: object, Date: object, Time: object, HomeTeam: object, AwayTeam: object, FTR: object, HTR: object, Referee: object, league: object, season: object, data_source: object, season_phase: object
2025-10-15 23:43:14,962 - non_major_league_hyperparameter_tuning - WARNING - Error in fold: DataFrame.dtypes for data must be int, float, bool or category. When categorical type is supplied, the experimental DMatrix parameter`enable_categorical` must be set to `True`.  Invalid columns:Div: object, Date: object, Time: object, HomeTeam: object, AwayTeam: object, FTR: object, HTR: object, Referee: object, league: object, season: object, data_source: object, season_phase: object
[I 2025-10-15 23:43:14,962] Trial 9 finished with value: inf and parameters: {'n_estimators': 129, 'max_depth': 8, 'learning_rate': 0.09098089600772344, 'subsample': 0.864703954560385, 'colsample_bytree': 0.8363894943913549, 'min_child_weight': 10, 'reg_alpha': 0.07344194712393703, 'reg_lambda': 0.143868228487946}. Best is trial 0 with value: inf.
2025-10-15 23:43:14,999 - non_major_league_hyperparameter_tuning - WARNING - Error in fold: DataFrame.dtypes for data must be int, float, bool or category. When categorical type is supplied, the experimental DMatrix parameter`enable_categorical` must be set to `True`.  Invalid columns:Div: object, Date: object, Time: object, HomeTeam: object, AwayTeam: object, FTR: object, HTR: object, Referee: object, league: object, season: object, data_source: object, season_phase: object
2025-10-15 23:43:15,005 - non_major_league_hyperparameter_tuning - WARNING - Error in fold: DataFrame.dtypes for data must be int, float, bool or category. When categorical type is supplied, the experimental DMatrix parameter`enable_categorical` must be set to `True`.  Invalid columns:Div: object, Date: object, Time: object, HomeTeam: object, AwayTeam: object, FTR: object, HTR: object, Referee: object, league: object, season: object, data_source: object, season_phase: object
2025-10-15 23:43:15,011 - non_major_league_hyperparameter_tuning - WARNING - Error in fold: DataFrame.dtypes for data must be int, float, bool or category. When categorical type is supplied, the experimental DMatrix parameter`enable_categorical` must be set to `True`.  Invalid columns:Div: object, Date: object, Time: object, HomeTeam: object, AwayTeam: object, FTR: object, HTR: object, Referee: object, league: object, season: object, data_source: object, season_phase: object
[I 2025-10-15 23:43:15,011] Trial 10 finished with value: inf and parameters: {'n_estimators': 157, 'max_depth': 3, 'learning_rate': 0.03677052624194036, 'subsample': 0.6040893935119667, 'colsample_bytree': 0.6000759163965814, 'min_child_weight': 4, 'reg_alpha': 0.41608797501771533, 'reg_lambda': 0.5179352732647509}. Best is trial 0 with value: inf.
2025-10-15 23:43:15,045 - non_major_league_hyperparameter_tuning - WARNING - Error in fold: DataFrame.dtypes for data must be int, float, bool or category. When categorical type is supplied, the experimental DMatrix parameter`enable_categorical` must be set to `True`.  Invalid columns:Div: object, Date: object, Time: object, HomeTeam: object, AwayTeam: object, FTR: object, HTR: object, Referee: object, league: object, season: object, data_source: object, season_phase: object
2025-10-15 23:43:15,051 - non_major_league_hyperparameter_tuning - WARNING - Error in fold: DataFrame.dtypes for data must be int, float, bool or category. When categorical type is supplied, the experimental DMatrix parameter`enable_categorical` must be set to `True`.  Invalid columns:Div: object, Date: object, Time: object, HomeTeam: object, AwayTeam: object, FTR: object, HTR: object, Referee: object, league: object, season: object, data_source: object, season_phase: object
2025-10-15 23:43:15,059 - non_major_league_hyperparameter_tuning - WARNING - Error in fold: DataFrame.dtypes for data must be int, float, bool or category. When categorical type is supplied, the experimental DMatrix parameter`enable_categorical` must be set to `True`.  Invalid columns:Div: object, Date: object, Time: object, HomeTeam: object, AwayTeam: object, FTR: object, HTR: object, Referee: object, league: object, season: object, data_source: object, season_phase: object
[I 2025-10-15 23:43:15,059] Trial 11 finished with value: inf and parameters: {'n_estimators': 143, 'max_depth': 6, 'learning_rate': 0.040286430061455394, 'subsample': 0.6957574582965901, 'colsample_bytree': 0.9063589027121736, 'min_child_weight': 10, 'reg_alpha': 0.6384266746109211, 'reg_lambda': 0.9499892748787166}. Best is trial 0 with value: inf.
2025-10-15 23:43:15,099 - non_major_league_hyperparameter_tuning - WARNING - Error in fold: DataFrame.dtypes for data must be int, float, bool or category. When categorical type is supplied, the experimental DMatrix parameter`enable_categorical` must be set to `True`.  Invalid columns:Div: object, Date: object, Time: object, HomeTeam: object, AwayTeam: object, FTR: object, HTR: object, Referee: object, league: object, season: object, data_source: object, season_phase: object
2025-10-15 23:43:15,104 - non_major_league_hyperparameter_tuning - WARNING - Error in fold: DataFrame.dtypes for data must be int, float, bool or category. When categorical type is supplied, the experimental DMatrix parameter`enable_categorical` must be set to `True`.  Invalid columns:Div: object, Date: object, Time: object, HomeTeam: object, AwayTeam: object, FTR: object, HTR: object, Referee: object, league: object, season: object, data_source: object, season_phase: object
2025-10-15 23:43:15,110 - non_major_league_hyperparameter_tuning - WARNING - Error in fold: DataFrame.dtypes for data must be int, float, bool or category. When categorical type is supplied, the experimental DMatrix parameter`enable_categorical` must be set to `True`.  Invalid columns:Div: object, Date: object, Time: object, HomeTeam: object, AwayTeam: object, FTR: object, HTR: object, Referee: object, league: object, season: object, data_source: object, season_phase: object
[I 2025-10-15 23:43:15,110] Trial 12 finished with value: inf and parameters: {'n_estimators': 100, 'max_depth': 7, 'learning_rate': 0.04161924290486682, 'subsample': 0.7558748743678284, 'colsample_bytree': 0.7892678481967887, 'min_child_weight': 8, 'reg_alpha': 0.5863202740370533, 'reg_lambda': 1.87054140608058}. Best is trial 0 with value: inf.
2025-10-15 23:43:15,150 - non_major_league_hyperparameter_tuning - WARNING - Error in fold: DataFrame.dtypes for data must be int, float, bool or category. When categorical type is supplied, the experimental DMatrix parameter`enable_categorical` must be set to `True`.  Invalid columns:Div: object, Date: object, Time: object, HomeTeam: object, AwayTeam: object, FTR: object, HTR: object, Referee: object, league: object, season: object, data_source: object, season_phase: object
2025-10-15 23:43:15,157 - non_major_league_hyperparameter_tuning - WARNING - Error in fold: DataFrame.dtypes for data must be int, float, bool or category. When categorical type is supplied, the experimental DMatrix parameter`enable_categorical` must be set to `True`.  Invalid columns:Div: object, Date: object, Time: object, HomeTeam: object, AwayTeam: object, FTR: object, HTR: object, Referee: object, league: object, season: object, data_source: object, season_phase: object
2025-10-15 23:43:15,162 - non_major_league_hyperparameter_tuning - WARNING - Error in fold: DataFrame.dtypes for data must be int, float, bool or category. When categorical type is supplied, the experimental DMatrix parameter`enable_categorical` must be set to `True`.  Invalid columns:Div: object, Date: object, Time: object, HomeTeam: object, AwayTeam: object, FTR: object, HTR: object, Referee: object, league: object, season: object, data_source: object, season_phase: object
[I 2025-10-15 23:43:15,163] Trial 13 finished with value: inf and parameters: {'n_estimators': 54, 'max_depth': 5, 'learning_rate': 0.07827824666435554, 'subsample': 0.9909540588159635, 'colsample_bytree': 0.9380201239253396, 'min_child_weight': 8, 'reg_alpha': 0.7902800578257244, 'reg_lambda': 1.6129618266197598}. Best is trial 0 with value: inf.
2025-10-15 23:43:15,200 - non_major_league_hyperparameter_tuning - WARNING - Error in fold: DataFrame.dtypes for data must be int, float, bool or category. When categorical type is supplied, the experimental DMatrix parameter`enable_categorical` must be set to `True`.  Invalid columns:Div: object, Date: object, Time: object, HomeTeam: object, AwayTeam: object, FTR: object, HTR: object, Referee: object, league: object, season: object, data_source: object, season_phase: object
2025-10-15 23:43:15,206 - non_major_league_hyperparameter_tuning - WARNING - Error in fold: DataFrame.dtypes for data must be int, float, bool or category. When categorical type is supplied, the experimental DMatrix parameter`enable_categorical` must be set to `True`.  Invalid columns:Div: object, Date: object, Time: object, HomeTeam: object, AwayTeam: object, FTR: object, HTR: object, Referee: object, league: object, season: object, data_source: object, season_phase: object
2025-10-15 23:43:15,211 - non_major_league_hyperparameter_tuning - WARNING - Error in fold: DataFrame.dtypes for data must be int, float, bool or category. When categorical type is supplied, the experimental DMatrix parameter`enable_categorical` must be set to `True`.  Invalid columns:Div: object, Date: object, Time: object, HomeTeam: object, AwayTeam: object, FTR: object, HTR: object, Referee: object, league: object, season: object, data_source: object, season_phase: object
[I 2025-10-15 23:43:15,211] Trial 14 finished with value: inf and parameters: {'n_estimators': 160, 'max_depth': 7, 'learning_rate': 0.047919877748371476, 'subsample': 0.6017102710921843, 'colsample_bytree': 0.7991173377724662, 'min_child_weight': 10, 'reg_alpha': 0.5415960650520345, 'reg_lambda': 0.0034357920352225957}. Best is trial 0 with value: inf.
2025-10-15 23:43:15,251 - non_major_league_hyperparameter_tuning - WARNING - Error in fold: DataFrame.dtypes for data must be int, float, bool or category. When categorical type is supplied, the experimental DMatrix parameter`enable_categorical` must be set to `True`.  Invalid columns:Div: object, Date: object, Time: object, HomeTeam: object, AwayTeam: object, FTR: object, HTR: object, Referee: object, league: object, season: object, data_source: object, season_phase: object
2025-10-15 23:43:15,257 - non_major_league_hyperparameter_tuning - WARNING - Error in fold: DataFrame.dtypes for data must be int, float, bool or category. When categorical type is supplied, the experimental DMatrix parameter`enable_categorical` must be set to `True`.  Invalid columns:Div: object, Date: object, Time: object, HomeTeam: object, AwayTeam: object, FTR: object, HTR: object, Referee: object, league: object, season: object, data_source: object, season_phase: object
2025-10-15 23:43:15,262 - non_major_league_hyperparameter_tuning - WARNING - Error in fold: DataFrame.dtypes for data must be int, float, bool or category. When categorical type is supplied, the experimental DMatrix parameter`enable_categorical` must be set to `True`.  Invalid columns:Div: object, Date: object, Time: object, HomeTeam: object, AwayTeam: object, FTR: object, HTR: object, Referee: object, league: object, season: object, data_source: object, season_phase: object
[I 2025-10-15 23:43:15,263] Trial 15 finished with value: inf and parameters: {'n_estimators': 117, 'max_depth': 5, 'learning_rate': 0.03055731070043038, 'subsample': 0.6934575942490236, 'colsample_bytree': 0.9323977065975241, 'min_child_weight': 5, 'reg_alpha': 0.7272988281118788, 'reg_lambda': 1.0738760966716305}. Best is trial 0 with value: inf.
2025-10-15 23:43:15,298 - non_major_league_hyperparameter_tuning - WARNING - Error in fold: DataFrame.dtypes for data must be int, float, bool or category. When categorical type is supplied, the experimental DMatrix parameter`enable_categorical` must be set to `True`.  Invalid columns:Div: object, Date: object, Time: object, HomeTeam: object, AwayTeam: object, FTR: object, HTR: object, Referee: object, league: object, season: object, data_source: object, season_phase: object
2025-10-15 23:43:15,303 - non_major_league_hyperparameter_tuning - WARNING - Error in fold: DataFrame.dtypes for data must be int, float, bool or category. When categorical type is supplied, the experimental DMatrix parameter`enable_categorical` must be set to `True`.  Invalid columns:Div: object, Date: object, Time: object, HomeTeam: object, AwayTeam: object, FTR: object, HTR: object, Referee: object, league: object, season: object, data_source: object, season_phase: object
2025-10-15 23:43:15,309 - non_major_league_hyperparameter_tuning - WARNING - Error in fold: DataFrame.dtypes for data must be int, float, bool or category. When categorical type is supplied, the experimental DMatrix parameter`enable_categorical` must be set to `True`.  Invalid columns:Div: object, Date: object, Time: object, HomeTeam: object, AwayTeam: object, FTR: object, HTR: object, Referee: object, league: object, season: object, data_source: object, season_phase: object
[I 2025-10-15 23:43:15,309] Trial 16 finished with value: inf and parameters: {'n_estimators': 139, 'max_depth': 7, 'learning_rate': 0.010149312943249153, 'subsample': 0.7380371262304511, 'colsample_bytree': 0.8256485557722243, 'min_child_weight': 9, 'reg_alpha': 0.43282633359548284, 'reg_lambda': 0.7267618893758687}. Best is trial 0 with value: inf.
2025-10-15 23:43:15,348 - non_major_league_hyperparameter_tuning - WARNING - Error in fold: DataFrame.dtypes for data must be int, float, bool or category. When categorical type is supplied, the experimental DMatrix parameter`enable_categorical` must be set to `True`.  Invalid columns:Div: object, Date: object, Time: object, HomeTeam: object, AwayTeam: object, FTR: object, HTR: object, Referee: object, league: object, season: object, data_source: object, season_phase: object
2025-10-15 23:43:15,357 - non_major_league_hyperparameter_tuning - WARNING - Error in fold: DataFrame.dtypes for data must be int, float, bool or category. When categorical type is supplied, the experimental DMatrix parameter`enable_categorical` must be set to `True`.  Invalid columns:Div: object, Date: object, Time: object, HomeTeam: object, AwayTeam: object, FTR: object, HTR: object, Referee: object, league: object, season: object, data_source: object, season_phase: object
2025-10-15 23:43:15,363 - non_major_league_hyperparameter_tuning - WARNING - Error in fold: DataFrame.dtypes for data must be int, float, bool or category. When categorical type is supplied, the experimental DMatrix parameter`enable_categorical` must be set to `True`.  Invalid columns:Div: object, Date: object, Time: object, HomeTeam: object, AwayTeam: object, FTR: object, HTR: object, Referee: object, league: object, season: object, data_source: object, season_phase: object
[I 2025-10-15 23:43:15,363] Trial 17 finished with value: inf and parameters: {'n_estimators': 195, 'max_depth': 4, 'learning_rate': 0.09881766445675419, 'subsample': 0.8001218597974027, 'colsample_bytree': 0.7608881550908896, 'min_child_weight': 1, 'reg_alpha': 0.4425843514813357, 'reg_lambda': 0.3710920096101126}. Best is trial 0 with value: inf.
2025-10-15 23:43:15,395 - non_major_league_hyperparameter_tuning - WARNING - Error in fold: DataFrame.dtypes for data must be int, float, bool or category. When categorical type is supplied, the experimental DMatrix parameter`enable_categorical` must be set to `True`.  Invalid columns:Div: object, Date: object, Time: object, HomeTeam: object, AwayTeam: object, FTR: object, HTR: object, Referee: object, league: object, season: object, data_source: object, season_phase: object
2025-10-15 23:43:15,403 - non_major_league_hyperparameter_tuning - WARNING - Error in fold: DataFrame.dtypes for data must be int, float, bool or category. When categorical type is supplied, the experimental DMatrix parameter`enable_categorical` must be set to `True`.  Invalid columns:Div: object, Date: object, Time: object, HomeTeam: object, AwayTeam: object, FTR: object, HTR: object, Referee: object, league: object, season: object, data_source: object, season_phase: object
2025-10-15 23:43:15,409 - non_major_league_hyperparameter_tuning - WARNING - Error in fold: DataFrame.dtypes for data must be int, float, bool or category. When categorical type is supplied, the experimental DMatrix parameter`enable_categorical` must be set to `True`.  Invalid columns:Div: object, Date: object, Time: object, HomeTeam: object, AwayTeam: object, FTR: object, HTR: object, Referee: object, league: object, season: object, data_source: object, season_phase: object
[I 2025-10-15 23:43:15,409] Trial 18 finished with value: inf and parameters: {'n_estimators': 97, 'max_depth': 6, 'learning_rate': 0.06288275352317685, 'subsample': 0.9310111662670584, 'colsample_bytree': 0.9400643868512153, 'min_child_weight': 7, 'reg_alpha': 0.800077137347809, 'reg_lambda': 1.6790547928110564}. Best is trial 0 with value: inf.
2025-10-15 23:43:15,445 - non_major_league_hyperparameter_tuning - WARNING - Error in fold: DataFrame.dtypes for data must be int, float, bool or category. When categorical type is supplied, the experimental DMatrix parameter`enable_categorical` must be set to `True`.  Invalid columns:Div: object, Date: object, Time: object, HomeTeam: object, AwayTeam: object, FTR: object, HTR: object, Referee: object, league: object, season: object, data_source: object, season_phase: object
2025-10-15 23:43:15,453 - non_major_league_hyperparameter_tuning - WARNING - Error in fold: DataFrame.dtypes for data must be int, float, bool or category. When categorical type is supplied, the experimental DMatrix parameter`enable_categorical` must be set to `True`.  Invalid columns:Div: object, Date: object, Time: object, HomeTeam: object, AwayTeam: object, FTR: object, HTR: object, Referee: object, league: object, season: object, data_source: object, season_phase: object
2025-10-15 23:43:15,460 - non_major_league_hyperparameter_tuning - WARNING - Error in fold: DataFrame.dtypes for data must be int, float, bool or category. When categorical type is supplied, the experimental DMatrix parameter`enable_categorical` must be set to `True`.  Invalid columns:Div: object, Date: object, Time: object, HomeTeam: object, AwayTeam: object, FTR: object, HTR: object, Referee: object, league: object, season: object, data_source: object, season_phase: object
[I 2025-10-15 23:43:15,461] Trial 19 finished with value: inf and parameters: {'n_estimators': 168, 'max_depth': 5, 'learning_rate': 0.08058241950202587, 'subsample': 0.6610360575846176, 'colsample_bytree': 0.8624690759139974, 'min_child_weight': 9, 'reg_alpha': 0.3229965639850804, 'reg_lambda': 1.0412104376870917}. Best is trial 0 with value: inf.
2025-10-15 23:43:15,500 - non_major_league_hyperparameter_tuning - WARNING - Error in fold: DataFrame.dtypes for data must be int, float, bool or category. When categorical type is supplied, the experimental DMatrix parameter`enable_categorical` must be set to `True`.  Invalid columns:Div: object, Date: object, Time: object, HomeTeam: object, AwayTeam: object, FTR: object, HTR: object, Referee: object, league: object, season: object, data_source: object, season_phase: object
2025-10-15 23:43:15,507 - non_major_league_hyperparameter_tuning - WARNING - Error in fold: DataFrame.dtypes for data must be int, float, bool or category. When categorical type is supplied, the experimental DMatrix parameter`enable_categorical` must be set to `True`.  Invalid columns:Div: object, Date: object, Time: object, HomeTeam: object, AwayTeam: object, FTR: object, HTR: object, Referee: object, league: object, season: object, data_source: object, season_phase: object
2025-10-15 23:43:15,513 - non_major_league_hyperparameter_tuning - WARNING - Error in fold: DataFrame.dtypes for data must be int, float, bool or category. When categorical type is supplied, the experimental DMatrix parameter`enable_categorical` must be set to `True`.  Invalid columns:Div: object, Date: object, Time: object, HomeTeam: object, AwayTeam: object, FTR: object, HTR: object, Referee: object, league: object, season: object, data_source: object, season_phase: object
