[I 2025-10-15 23:43:15,513] Trial 20 finished with value: inf and parameters: {'n_estimators': 80, 'max_depth': 3, 'learning_rate': 0.04930824081944654, 'subsample': 0.7888460704952842, 'colsample_bytree': 0.6780438900108964, 'min_child_weight': 7, 'reg_alpha': 0.5393369857361809, 'reg_lambda': 1.3722515111518492}. Best is trial 0 with value: inf.
2025-10-15 23:43:15,553 - non_major_league_hyperparameter_tuning - WARNING - Error in fold: DataFrame.dtypes for data must be int, float, bool or category. When categorical type is supplied, the experimental DMatrix parameter`enable_categorical` must be set to `True`.  Invalid columns:Div: object, Date: object, Time: object, HomeTeam: object, AwayTeam: object, FTR: object, HTR: object, Referee: object, league: object, season: object, data_source: object, season_phase: object
2025-10-15 23:43:15,560 - non_major_league_hyperparameter_tuning - WARNING - Error in fold: DataFrame.dtypes for data must be int, float, bool or category. When categorical type is supplied, the experimental DMatrix parameter`enable_categorical` must be set to `True`.  Invalid columns:Div: object, Date: object, Time: object, HomeTeam: object, AwayTeam: object, FTR: object, HTR: object, Referee: object, league: object, season: object, data_source: object, season_phase: object
2025-10-15 23:43:15,568 - non_major_league_hyperparameter_tuning - WARNING - Error in fold: DataFrame.dtypes for data must be int, float, bool or category. When categorical type is supplied, the experimental DMatrix parameter`enable_categorical` must be set to `True`.  Invalid columns:Div: object, Date: object, Time: object, HomeTeam: object, AwayTeam: object, FTR: object, HTR: object, Referee: object, league: object, season: object, data_source: object, season_phase: object
[I 2025-10-15 23:43:15,568] Trial 21 finished with value: inf and parameters: {'n_estimators': 50, 'max_depth': 4, 'learning_rate': 0.027128696865519376, 'subsample': 0.8280181942397594, 'colsample_bytree': 0.99913489357336, 'min_child_weight': 5, 'reg_alpha': 0.8734856532763489, 'reg_lambda': 1.9666126401233415}. Best is trial 0 with value: inf.
2025-10-15 23:43:15,609 - non_major_league_hyperparameter_tuning - WARNING - Error in fold: DataFrame.dtypes for data must be int, float, bool or category. When categorical type is supplied, the experimental DMatrix parameter`enable_categorical` must be set to `True`.  Invalid columns:Div: object, Date: object, Time: object, HomeTeam: object, AwayTeam: object, FTR: object, HTR: object, Referee: object, league: object, season: object, data_source: object, season_phase: object
2025-10-15 23:43:15,614 - non_major_league_hyperparameter_tuning - WARNING - Error in fold: DataFrame.dtypes for data must be int, float, bool or category. When categorical type is supplied, the experimental DMatrix parameter`enable_categorical` must be set to `True`.  Invalid columns:Div: object, Date: object, Time: object, HomeTeam: object, AwayTeam: object, FTR: object, HTR: object, Referee: object, league: object, season: object, data_source: object, season_phase: object
2025-10-15 23:43:15,624 - non_major_league_hyperparameter_tuning - WARNING - Error in fold: DataFrame.dtypes for data must be int, float, bool or category. When categorical type is supplied, the experimental DMatrix parameter`enable_categorical` must be set to `True`.  Invalid columns:Div: object, Date: object, Time: object, HomeTeam: object, AwayTeam: object, FTR: object, HTR: object, Referee: object, league: object, season: object, data_source: object, season_phase: object
[I 2025-10-15 23:43:15,625] Trial 22 finished with value: inf and parameters: {'n_estimators': 62, 'max_depth': 4, 'learning_rate': 0.014522775268345674, 'subsample': 0.939201418656781, 'colsample_bytree': 0.9640718677082364, 'min_child_weight': 6, 'reg_alpha': 0.8792338576487807, 'reg_lambda': 1.8126039137871988}. Best is trial 0 with value: inf.
2025-10-15 23:43:15,666 - non_major_league_hyperparameter_tuning - WARNING - Error in fold: DataFrame.dtypes for data must be int, float, bool or category. When categorical type is supplied, the experimental DMatrix parameter`enable_categorical` must be set to `True`.  Invalid columns:Div: object, Date: object, Time: object, HomeTeam: object, AwayTeam: object, FTR: object, HTR: object, Referee: object, league: object, season: object, data_source: object, season_phase: object
2025-10-15 23:43:15,672 - non_major_league_hyperparameter_tuning - WARNING - Error in fold: DataFrame.dtypes for data must be int, float, bool or category. When categorical type is supplied, the experimental DMatrix parameter`enable_categorical` must be set to `True`.  Invalid columns:Div: object, Date: object, Time: object, HomeTeam: object, AwayTeam: object, FTR: object, HTR: object, Referee: object, league: object, season: object, data_source: object, season_phase: object
2025-10-15 23:43:15,678 - non_major_league_hyperparameter_tuning - WARNING - Error in fold: DataFrame.dtypes for data must be int, float, bool or category. When categorical type is supplied, the experimental DMatrix parameter`enable_categorical` must be set to `True`.  Invalid columns:Div: object, Date: object, Time: object, HomeTeam: object, AwayTeam: object, FTR: object, HTR: object, Referee: object, league: object, season: object, data_source: object, season_phase: object
[I 2025-10-15 23:43:15,679] Trial 23 finished with value: inf and parameters: {'n_estimators': 83, 'max_depth': 6, 'learning_rate': 0.02212434126632631, 'subsample': 0.9545161457276621, 'colsample_bytree': 0.9030205337443813, 'min_child_weight': 8, 'reg_alpha': 0.6983313146429492, 'reg_lambda': 1.6650644190955481}. Best is trial 0 with value: inf.
2025-10-15 23:43:15,718 - non_major_league_hyperparameter_tuning - WARNING - Error in fold: DataFrame.dtypes for data must be int, float, bool or category. When categorical type is supplied, the experimental DMatrix parameter`enable_categorical` must be set to `True`.  Invalid columns:Div: object, Date: object, Time: object, HomeTeam: object, AwayTeam: object, FTR: object, HTR: object, Referee: object, league: object, season: object, data_source: object, season_phase: object
2025-10-15 23:43:15,724 - non_major_league_hyperparameter_tuning - WARNING - Error in fold: DataFrame.dtypes for data must be int, float, bool or category. When categorical type is supplied, the experimental DMatrix parameter`enable_categorical` must be set to `True`.  Invalid columns:Div: object, Date: object, Time: object, HomeTeam: object, AwayTeam: object, FTR: object, HTR: object, Referee: object, league: object, season: object, data_source: object, season_phase: object
2025-10-15 23:43:15,730 - non_major_league_hyperparameter_tuning - WARNING - Error in fold: DataFrame.dtypes for data must be int, float, bool or category. When categorical type is supplied, the experimental DMatrix parameter`enable_categorical` must be set to `True`.  Invalid columns:Div: object, Date: object, Time: object, HomeTeam: object, AwayTeam: object, FTR: object, HTR: object, Referee: object, league: object, season: object, data_source: object, season_phase: object
[I 2025-10-15 23:43:15,731] Trial 24 finished with value: inf and parameters: {'n_estimators': 110, 'max_depth': 5, 'learning_rate': 0.06624271945281494, 'subsample': 0.8218511156493078, 'colsample_bytree': 0.9692806185872395, 'min_child_weight': 9, 'reg_alpha': 0.8955985025668318, 'reg_lambda': 1.908725055944069}. Best is trial 0 with value: inf.
2025-10-15 23:43:15,769 - non_major_league_hyperparameter_tuning - WARNING - Error in fold: DataFrame.dtypes for data must be int, float, bool or category. When categorical type is supplied, the experimental DMatrix parameter`enable_categorical` must be set to `True`.  Invalid columns:Div: object, Date: object, Time: object, HomeTeam: object, AwayTeam: object, FTR: object, HTR: object, Referee: object, league: object, season: object, data_source: object, season_phase: object
2025-10-15 23:43:15,777 - non_major_league_hyperparameter_tuning - WARNING - Error in fold: DataFrame.dtypes for data must be int, float, bool or category. When categorical type is supplied, the experimental DMatrix parameter`enable_categorical` must be set to `True`.  Invalid columns:Div: object, Date: object, Time: object, HomeTeam: object, AwayTeam: object, FTR: object, HTR: object, Referee: object, league: object, season: object, data_source: object, season_phase: object
2025-10-15 23:43:15,783 - non_major_league_hyperparameter_tuning - WARNING - Error in fold: DataFrame.dtypes for data must be int, float, bool or category. When categorical type is supplied, the experimental DMatrix parameter`enable_categorical` must be set to `True`.  Invalid columns:Div: object, Date: object, Time: object, HomeTeam: object, AwayTeam: object, FTR: object, HTR: object, Referee: object, league: object, season: object, data_source: object, season_phase: object
[I 2025-10-15 23:43:15,783] Trial 25 finished with value: inf and parameters: {'n_estimators': 69, 'max_depth': 7, 'learning_rate': 0.033204559387493914, 'subsample': 0.6466568700954407, 'colsample_bytree': 0.9118500980468431, 'min_child_weight': 6, 'reg_alpha': 0.7522074216177252, 'reg_lambda': 1.989690131524884}. Best is trial 0 with value: inf.
2025-10-15 23:43:15,820 - non_major_league_hyperparameter_tuning - WARNING - Error in fold: DataFrame.dtypes for data must be int, float, bool or category. When categorical type is supplied, the experimental DMatrix parameter`enable_categorical` must be set to `True`.  Invalid columns:Div: object, Date: object, Time: object, HomeTeam: object, AwayTeam: object, FTR: object, HTR: object, Referee: object, league: object, season: object, data_source: object, season_phase: object
2025-10-15 23:43:15,827 - non_major_league_hyperparameter_tuning - WARNING - Error in fold: DataFrame.dtypes for data must be int, float, bool or category. When categorical type is supplied, the experimental DMatrix parameter`enable_categorical` must be set to `True`.  Invalid columns:Div: object, Date: object, Time: object, HomeTeam: object, AwayTeam: object, FTR: object, HTR: object, Referee: object, league: object, season: object, data_source: object, season_phase: object
2025-10-15 23:43:15,835 - non_major_league_hyperparameter_tuning - WARNING - Error in fold: DataFrame.dtypes for data must be int, float, bool or category. When categorical type is supplied, the experimental DMatrix parameter`enable_categorical` must be set to `True`.  Invalid columns:Div: object, Date: object, Time: object, HomeTeam: object, AwayTeam: object, FTR: object, HTR: object, Referee: object, league: object, season: object, data_source: object, season_phase: object
[I 2025-10-15 23:43:15,836] Trial 26 finished with value: inf and parameters: {'n_estimators': 89, 'max_depth': 3, 'learning_rate': 0.04787262286745586, 'subsample': 0.7597894594190047, 'colsample_bytree': 0.9637144596813929, 'min_child_weight': 7, 'reg_alpha': 0.6073923264932918, 'reg_lambda': 1.4839821419729122}. Best is trial 0 with value: inf.
2025-10-15 23:43:15,878 - non_major_league_hyperparameter_tuning - WARNING - Error in fold: DataFrame.dtypes for data must be int, float, bool or category. When categorical type is supplied, the experimental DMatrix parameter`enable_categorical` must be set to `True`.  Invalid columns:Div: object, Date: object, Time: object, HomeTeam: object, AwayTeam: object, FTR: object, HTR: object, Referee: object, league: object, season: object, data_source: object, season_phase: object
2025-10-15 23:43:15,884 - non_major_league_hyperparameter_tuning - WARNING - Error in fold: DataFrame.dtypes for data must be int, float, bool or category. When categorical type is supplied, the experimental DMatrix parameter`enable_categorical` must be set to `True`.  Invalid columns:Div: object, Date: object, Time: object, HomeTeam: object, AwayTeam: object, FTR: object, HTR: object, Referee: object, league: object, season: object, data_source: object, season_phase: object
2025-10-15 23:43:15,893 - non_major_league_hyperparameter_tuning - WARNING - Error in fold: DataFrame.dtypes for data must be int, float, bool or category. When categorical type is supplied, the experimental DMatrix parameter`enable_categorical` must be set to `True`.  Invalid columns:Div: object, Date: object, Time: object, HomeTeam: object, AwayTeam: object, FTR: object, HTR: object, Referee: object, league: object, season: object, data_source: object, season_phase: object
[I 2025-10-15 23:43:15,893] Trial 27 finished with value: inf and parameters: {'n_estimators': 134, 'max_depth': 6, 'learning_rate': 0.023500903449742656, 'subsample': 0.9140785704279548, 'colsample_bytree': 0.8405128729046147, 'min_child_weight': 4, 'reg_alpha': 0.9741306215906766, 'reg_lambda': 1.7503839392413432}. Best is trial 0 with value: inf.
2025-10-15 23:43:15,932 - non_major_league_hyperparameter_tuning - WARNING - Error in fold: DataFrame.dtypes for data must be int, float, bool or category. When categorical type is supplied, the experimental DMatrix parameter`enable_categorical` must be set to `True`.  Invalid columns:Div: object, Date: object, Time: object, HomeTeam: object, AwayTeam: object, FTR: object, HTR: object, Referee: object, league: object, season: object, data_source: object, season_phase: object
2025-10-15 23:43:15,938 - non_major_league_hyperparameter_tuning - WARNING - Error in fold: DataFrame.dtypes for data must be int, float, bool or category. When categorical type is supplied, the experimental DMatrix parameter`enable_categorical` must be set to `True`.  Invalid columns:Div: object, Date: object, Time: object, HomeTeam: object, AwayTeam: object, FTR: object, HTR: object, Referee: object, league: object, season: object, data_source: object, season_phase: object
2025-10-15 23:43:15,944 - non_major_league_hyperparameter_tuning - WARNING - Error in fold: DataFrame.dtypes for data must be int, float, bool or category. When categorical type is supplied, the experimental DMatrix parameter`enable_categorical` must be set to `True`.  Invalid columns:Div: object, Date: object, Time: object, HomeTeam: object, AwayTeam: object, FTR: object, HTR: object, Referee: object, league: object, season: object, data_source: object, season_phase: object
[I 2025-10-15 23:43:15,945] Trial 28 finished with value: inf and parameters: {'n_estimators': 149, 'max_depth': 4, 'learning_rate': 0.05433043625485056, 'subsample': 0.7183486440716593, 'colsample_bytree': 0.8853715924158134, 'min_child_weight': 10, 'reg_alpha': 0.8350713754428287, 'reg_lambda': 0.8546448544269303}. Best is trial 0 with value: inf.
2025-10-15 23:43:15,987 - non_major_league_hyperparameter_tuning - WARNING - Error in fold: DataFrame.dtypes for data must be int, float, bool or category. When categorical type is supplied, the experimental DMatrix parameter`enable_categorical` must be set to `True`.  Invalid columns:Div: object, Date: object, Time: object, HomeTeam: object, AwayTeam: object, FTR: object, HTR: object, Referee: object, league: object, season: object, data_source: object, season_phase: object
2025-10-15 23:43:15,994 - non_major_league_hyperparameter_tuning - WARNING - Error in fold: DataFrame.dtypes for data must be int, float, bool or category. When categorical type is supplied, the experimental DMatrix parameter`enable_categorical` must be set to `True`.  Invalid columns:Div: object, Date: object, Time: object, HomeTeam: object, AwayTeam: object, FTR: object, HTR: object, Referee: object, league: object, season: object, data_source: object, season_phase: object
2025-10-15 23:43:16,003 - non_major_league_hyperparameter_tuning - WARNING - Error in fold: DataFrame.dtypes for data must be int, float, bool or category. When categorical type is supplied, the experimental DMatrix parameter`enable_categorical` must be set to `True`.  Invalid columns:Div: object, Date: object, Time: object, HomeTeam: object, AwayTeam: object, FTR: object, HTR: object, Referee: object, league: object, season: object, data_source: object, season_phase: object
[I 2025-10-15 23:43:16,003] Trial 29 finished with value: inf and parameters: {'n_estimators': 120, 'max_depth': 6, 'learning_rate': 0.08871735662446602, 'subsample': 0.9750008388110005, 'colsample_bytree': 0.7471759215660132, 'min_child_weight': 9, 'reg_alpha': 0.9266021643399849, 'reg_lambda': 1.2783551166765168}. Best is trial 0 with value: inf.
2025-10-15 23:43:16,018 - non_major_league_hyperparameter_tuning - INFO - xgboost optimization complete
2025-10-15 23:43:16,018 - non_major_league_hyperparameter_tuning - INFO - Best score: inf
2025-10-15 23:43:16,019 - non_major_league_hyperparameter_tuning - INFO - Best params: {'n_estimators': 147, 'max_depth': 6, 'learning_rate': 0.04329224561404604, 'subsample': 0.6252859146052442, 'colsample_bytree': 0.8219908317418846, 'min_child_weight': 10, 'reg_alpha': 0.7638353352557705, 'reg_lambda': 0.5737967482168251}
2025-10-15 23:43:16,019 - non_major_league_hyperparameter_tuning - INFO - Optimizing lightgbm (priority: 2)
2025-10-15 23:43:16,019 - non_major_league_hyperparameter_tuning - INFO - Optimizing hyperparameters for lightgbm
[I 2025-10-15 23:43:16,020] A new study created in memory with name: no-name-65a6ceba-96a2-421f-8c3c-ead8c285d02a
2025-10-15 23:43:16,032 - non_major_league_hyperparameter_tuning - WARNING - Error in fold: pandas dtypes must be int, float or bool.
Fields with bad pandas dtypes: Div: object, Date: object, Time: object, HomeTeam: object, AwayTeam: object, FTR: object, HTR: object, Referee: object, league: object, season: object, data_source: object, season_phase: object
2025-10-15 23:43:16,039 - non_major_league_hyperparameter_tuning - WARNING - Error in fold: pandas dtypes must be int, float or bool.
Fields with bad pandas dtypes: Div: object, Date: object, Time: object, HomeTeam: object, AwayTeam: object, FTR: object, HTR: object, Referee: object, league: object, season: object, data_source: object, season_phase: object
2025-10-15 23:43:16,045 - non_major_league_hyperparameter_tuning - WARNING - Error in fold: pandas dtypes must be int, float or bool.
Fields with bad pandas dtypes: Div: object, Date: object, Time: object, HomeTeam: object, AwayTeam: object, FTR: object, HTR: object, Referee: object, league: object, season: object, data_source: object, season_phase: object
[I 2025-10-15 23:43:16,045] Trial 0 finished with value: inf and parameters: {'n_estimators': 122, 'max_depth': 7, 'learning_rate': 0.03071760070595622, 'num_leaves': 57, 'feature_fraction': 0.7039271427999032, 'bagging_fraction': 0.6774972221358695, 'bagging_freq': 2, 'lambda_l1': 0.7696001860298304, 'lambda_l2': 1.6987715199118822, 'min_data_in_leaf': 11}. Best is trial 0 with value: inf.
2025-10-15 23:43:16,053 - non_major_league_hyperparameter_tuning - WARNING - Error in fold: pandas dtypes must be int, float or bool.
Fields with bad pandas dtypes: Div: object, Date: object, Time: object, HomeTeam: object, AwayTeam: object, FTR: object, HTR: object, Referee: object, league: object, season: object, data_source: object, season_phase: object
2025-10-15 23:43:16,061 - non_major_league_hyperparameter_tuning - WARNING - Error in fold: pandas dtypes must be int, float or bool.
Fields with bad pandas dtypes: Div: object, Date: object, Time: object, HomeTeam: object, AwayTeam: object, FTR: object, HTR: object, Referee: object, league: object, season: object, data_source: object, season_phase: object
2025-10-15 23:43:16,068 - non_major_league_hyperparameter_tuning - WARNING - Error in fold: pandas dtypes must be int, float or bool.
Fields with bad pandas dtypes: Div: object, Date: object, Time: object, HomeTeam: object, AwayTeam: object, FTR: object, HTR: object, Referee: object, league: object, season: object, data_source: object, season_phase: object
[I 2025-10-15 23:43:16,069] Trial 1 finished with value: inf and parameters: {'n_estimators': 69, 'max_depth': 4, 'learning_rate': 0.04272396804352993, 'num_leaves': 23, 'feature_fraction': 0.6383594478392218, 'bagging_fraction': 0.8312148883238755, 'bagging_freq': 4, 'lambda_l1': 0.29942190489804876, 'lambda_l2': 0.10821818747189105, 'min_data_in_leaf': 19}. Best is trial 0 with value: inf.
2025-10-15 23:43:16,078 - non_major_league_hyperparameter_tuning - WARNING - Error in fold: pandas dtypes must be int, float or bool.
Fields with bad pandas dtypes: Div: object, Date: object, Time: object, HomeTeam: object, AwayTeam: object, FTR: object, HTR: object, Referee: object, league: object, season: object, data_source: object, season_phase: object
2025-10-15 23:43:16,084 - non_major_league_hyperparameter_tuning - WARNING - Error in fold: pandas dtypes must be int, float or bool.
Fields with bad pandas dtypes: Div: object, Date: object, Time: object, HomeTeam: object, AwayTeam: object, FTR: object, HTR: object, Referee: object, league: object, season: object, data_source: object, season_phase: object
2025-10-15 23:43:16,094 - non_major_league_hyperparameter_tuning - WARNING - Error in fold: pandas dtypes must be int, float or bool.
Fields with bad pandas dtypes: Div: object, Date: object, Time: object, HomeTeam: object, AwayTeam: object, FTR: object, HTR: object, Referee: object, league: object, season: object, data_source: object, season_phase: object
