[I 2025-10-15 23:51:13,105] Trial 20 finished with value: inf and parameters: {'n_estimators': 138, 'max_depth': 8, 'learning_rate': 0.09012208981728655, 'subsample': 0.9989478782792899, 'colsample_bytree': 0.6023023500971693, 'min_child_weight': 4, 'reg_alpha': 0.9849431650827803, 'reg_lambda': 0.6272076965858954}. Best is trial 0 with value: inf.
2025-10-15 23:51:13,170 - non_major_league_hyperparameter_tuning - WARNING - Error in fold: feature_names must be string, and may not contain [, ] or <
2025-10-15 23:51:13,192 - non_major_league_hyperparameter_tuning - WARNING - Error in fold: feature_names must be string, and may not contain [, ] or <
2025-10-15 23:51:13,225 - non_major_league_hyperparameter_tuning - WARNING - Error in fold: feature_names must be string, and may not contain [, ] or <
[I 2025-10-15 23:51:13,226] Trial 21 finished with value: inf and parameters: {'n_estimators': 103, 'max_depth': 6, 'learning_rate': 0.05522982998091171, 'subsample': 0.7497146934516817, 'colsample_bytree': 0.8616804278942962, 'min_child_weight': 10, 'reg_alpha': 0.8458697344513627, 'reg_lambda': 0.7614673006204181}. Best is trial 0 with value: inf.
2025-10-15 23:51:13,295 - non_major_league_hyperparameter_tuning - WARNING - Error in fold: feature_names must be string, and may not contain [, ] or <
2025-10-15 23:51:13,324 - non_major_league_hyperparameter_tuning - WARNING - Error in fold: feature_names must be string, and may not contain [, ] or <
2025-10-15 23:51:13,360 - non_major_league_hyperparameter_tuning - WARNING - Error in fold: feature_names must be string, and may not contain [, ] or <
[I 2025-10-15 23:51:13,360] Trial 22 finished with value: inf and parameters: {'n_estimators': 88, 'max_depth': 6, 'learning_rate': 0.06500561717191519, 'subsample': 0.6907405296513598, 'colsample_bytree': 0.8596956242262966, 'min_child_weight': 9, 'reg_alpha': 0.9555296090741882, 'reg_lambda': 0.9893837636157334}. Best is trial 0 with value: inf.
2025-10-15 23:51:13,412 - non_major_league_hyperparameter_tuning - WARNING - Error in fold: feature_names must be string, and may not contain [, ] or <
2025-10-15 23:51:13,437 - non_major_league_hyperparameter_tuning - WARNING - Error in fold: feature_names must be string, and may not contain [, ] or <
2025-10-15 23:51:13,464 - non_major_league_hyperparameter_tuning - WARNING - Error in fold: feature_names must be string, and may not contain [, ] or <
[I 2025-10-15 23:51:13,465] Trial 23 finished with value: inf and parameters: {'n_estimators': 101, 'max_depth': 5, 'learning_rate': 0.03680077258169574, 'subsample': 0.694486314159514, 'colsample_bytree': 0.8567635768639059, 'min_child_weight': 6, 'reg_alpha': 0.7608437012897199, 'reg_lambda': 0.5552470858209337}. Best is trial 0 with value: inf.
2025-10-15 23:51:13,529 - non_major_league_hyperparameter_tuning - WARNING - Error in fold: feature_names must be string, and may not contain [, ] or <
2025-10-15 23:51:13,561 - non_major_league_hyperparameter_tuning - WARNING - Error in fold: feature_names must be string, and may not contain [, ] or <
2025-10-15 23:51:13,586 - non_major_league_hyperparameter_tuning - WARNING - Error in fold: feature_names must be string, and may not contain [, ] or <
[I 2025-10-15 23:51:13,587] Trial 24 finished with value: inf and parameters: {'n_estimators': 76, 'max_depth': 7, 'learning_rate': 0.05238763415201237, 'subsample': 0.7887798112075373, 'colsample_bytree': 0.8942930889710824, 'min_child_weight': 9, 'reg_alpha': 0.40210346262186075, 'reg_lambda': 1.0759021647017488}. Best is trial 0 with value: inf.
2025-10-15 23:51:13,642 - non_major_league_hyperparameter_tuning - WARNING - Error in fold: feature_names must be string, and may not contain [, ] or <
2025-10-15 23:51:13,669 - non_major_league_hyperparameter_tuning - WARNING - Error in fold: feature_names must be string, and may not contain [, ] or <
2025-10-15 23:51:13,694 - non_major_league_hyperparameter_tuning - WARNING - Error in fold: feature_names must be string, and may not contain [, ] or <
[I 2025-10-15 23:51:13,695] Trial 25 finished with value: inf and parameters: {'n_estimators': 114, 'max_depth': 6, 'learning_rate': 0.07590409940509914, 'subsample': 0.7212390671020709, 'colsample_bytree': 0.7654139967528943, 'min_child_weight': 2, 'reg_alpha': 0.5388990940001006, 'reg_lambda': 1.35064716497393}. Best is trial 0 with value: inf.
2025-10-15 23:51:13,758 - non_major_league_hyperparameter_tuning - WARNING - Error in fold: feature_names must be string, and may not contain [, ] or <
2025-10-15 23:51:13,790 - non_major_league_hyperparameter_tuning - WARNING - Error in fold: feature_names must be string, and may not contain [, ] or <
2025-10-15 23:51:13,825 - non_major_league_hyperparameter_tuning - WARNING - Error in fold: feature_names must be string, and may not contain [, ] or <
[I 2025-10-15 23:51:13,826] Trial 26 finished with value: inf and parameters: {'n_estimators': 69, 'max_depth': 7, 'learning_rate': 0.05828076875625643, 'subsample': 0.8394555730575872, 'colsample_bytree': 0.8171175745592287, 'min_child_weight': 7, 'reg_alpha': 0.37575473238108603, 'reg_lambda': 1.580747346437899}. Best is trial 0 with value: inf.
2025-10-15 23:51:13,896 - non_major_league_hyperparameter_tuning - WARNING - Error in fold: feature_names must be string, and may not contain [, ] or <
2025-10-15 23:51:13,930 - non_major_league_hyperparameter_tuning - WARNING - Error in fold: feature_names must be string, and may not contain [, ] or <
2025-10-15 23:51:13,964 - non_major_league_hyperparameter_tuning - WARNING - Error in fold: feature_names must be string, and may not contain [, ] or <
[I 2025-10-15 23:51:13,964] Trial 27 finished with value: inf and parameters: {'n_estimators': 96, 'max_depth': 4, 'learning_rate': 0.0284972164084422, 'subsample': 0.7840736904555325, 'colsample_bytree': 0.7074311348644722, 'min_child_weight': 8, 'reg_alpha': 0.9102595662712312, 'reg_lambda': 0.8542149701825162}. Best is trial 0 with value: inf.
2025-10-15 23:51:14,043 - non_major_league_hyperparameter_tuning - WARNING - Error in fold: feature_names must be string, and may not contain [, ] or <
2025-10-15 23:51:14,078 - non_major_league_hyperparameter_tuning - WARNING - Error in fold: feature_names must be string, and may not contain [, ] or <
2025-10-15 23:51:14,119 - non_major_league_hyperparameter_tuning - WARNING - Error in fold: feature_names must be string, and may not contain [, ] or <
[I 2025-10-15 23:51:14,120] Trial 28 finished with value: inf and parameters: {'n_estimators': 122, 'max_depth': 8, 'learning_rate': 0.06631877921142297, 'subsample': 0.8846428638989856, 'colsample_bytree': 0.8318647336140198, 'min_child_weight': 5, 'reg_alpha': 0.23528298425542998, 'reg_lambda': 1.7951634256130173}. Best is trial 0 with value: inf.
2025-10-15 23:51:14,183 - non_major_league_hyperparameter_tuning - WARNING - Error in fold: feature_names must be string, and may not contain [, ] or <
2025-10-15 23:51:14,209 - non_major_league_hyperparameter_tuning - WARNING - Error in fold: feature_names must be string, and may not contain [, ] or <
2025-10-15 23:51:14,239 - non_major_league_hyperparameter_tuning - WARNING - Error in fold: feature_names must be string, and may not contain [, ] or <
[I 2025-10-15 23:51:14,240] Trial 29 finished with value: inf and parameters: {'n_estimators': 52, 'max_depth': 7, 'learning_rate': 0.03457285281442337, 'subsample': 0.6563676464708947, 'colsample_bytree': 0.7656988796074969, 'min_child_weight': 1, 'reg_alpha': 0.5845528648216113, 'reg_lambda': 1.177285782155414}. Best is trial 0 with value: inf.
2025-10-15 23:51:14,245 - non_major_league_hyperparameter_tuning - INFO - xgboost optimization complete
2025-10-15 23:51:14,246 - non_major_league_hyperparameter_tuning - INFO - Best score: inf
2025-10-15 23:51:14,247 - non_major_league_hyperparameter_tuning - INFO - Best params: {'n_estimators': 70, 'max_depth': 7, 'learning_rate': 0.0633962790098781, 'subsample': 0.9600453213426712, 'colsample_bytree': 0.6815642249743875, 'min_child_weight': 1, 'reg_alpha': 0.4212723787372108, 'reg_lambda': 1.0430989234542152}
2025-10-15 23:51:14,247 - non_major_league_hyperparameter_tuning - INFO - Optimizing lightgbm (priority: 2)
2025-10-15 23:51:14,247 - non_major_league_hyperparameter_tuning - INFO - Optimizing hyperparameters for lightgbm
[I 2025-10-15 23:51:14,247] A new study created in memory with name: no-name-683cec07-10f0-48e6-9f6e-423f2482cab0
[I 2025-10-15 23:51:51,352] Trial 0 finished with value: 0.01245026382948305 and parameters: {'n_estimators': 151, 'max_depth': 3, 'learning_rate': 0.048343099740527556, 'num_leaves': 81, 'feature_fraction': 0.6793120421261261, 'bagging_fraction': 0.965908679749032, 'bagging_freq': 5, 'lambda_l1': 0.8511047778790823, 'lambda_l2': 1.5654031054120887, 'min_data_in_leaf': 10}. Best is trial 0 with value: 0.01245026382948305.
[I 2025-10-15 23:52:07,125] Trial 1 finished with value: 0.003916321629969389 and parameters: {'n_estimators': 101, 'max_depth': 6, 'learning_rate': 0.08500709059862542, 'num_leaves': 84, 'feature_fraction': 0.8791504696557131, 'bagging_fraction': 0.8810451401284286, 'bagging_freq': 4, 'lambda_l1': 0.2584695005693992, 'lambda_l2': 0.2302016782729468, 'min_data_in_leaf': 8}. Best is trial 1 with value: 0.003916321629969389.
[I 2025-10-15 23:52:35,957] Trial 2 finished with value: 0.0036655635377966862 and parameters: {'n_estimators': 144, 'max_depth': 5, 'learning_rate': 0.062043190235866255, 'num_leaves': 93, 'feature_fraction': 0.7628613169956593, 'bagging_fraction': 0.9055399010281917, 'bagging_freq': 2, 'lambda_l1': 0.21379402662588198, 'lambda_l2': 0.8493665745508243, 'min_data_in_leaf': 8}. Best is trial 2 with value: 0.0036655635377966862.
[I 2025-10-15 23:52:59,662] Trial 3 finished with value: 0.0038172670467500314 and parameters: {'n_estimators': 130, 'max_depth': 7, 'learning_rate': 0.07031971066934305, 'num_leaves': 28, 'feature_fraction': 0.8682896696117964, 'bagging_fraction': 0.8271260338833015, 'bagging_freq': 9, 'lambda_l1': 0.2341397086763164, 'lambda_l2': 0.32410880500286177, 'min_data_in_leaf': 10}. Best is trial 2 with value: 0.0036655635377966862.
[I 2025-10-15 23:53:15,736] Trial 4 finished with value: 0.029626391532378827 and parameters: {'n_estimators': 55, 'max_depth': 5, 'learning_rate': 0.060600260654641705, 'num_leaves': 83, 'feature_fraction': 0.7426416671819511, 'bagging_fraction': 0.9498673689463092, 'bagging_freq': 4, 'lambda_l1': 0.8000663933761879, 'lambda_l2': 1.6759061963464699, 'min_data_in_leaf': 32}. Best is trial 2 with value: 0.0036655635377966862.
[I 2025-10-15 23:53:53,999] Trial 5 finished with value: 0.0016842382733425613 and parameters: {'n_estimators': 161, 'max_depth': 5, 'learning_rate': 0.03512440820672768, 'num_leaves': 52, 'feature_fraction': 0.6064923277472901, 'bagging_fraction': 0.8906559004629206, 'bagging_freq': 4, 'lambda_l1': 0.01283251621084891, 'lambda_l2': 0.18402030535686986, 'min_data_in_leaf': 12}. Best is trial 5 with value: 0.0016842382733425613.
[I 2025-10-15 23:54:23,350] Trial 6 finished with value: 0.010521461598500538 and parameters: {'n_estimators': 119, 'max_depth': 3, 'learning_rate': 0.044148828124973234, 'num_leaves': 65, 'feature_fraction': 0.7710418903329153, 'bagging_fraction': 0.8321915298776695, 'bagging_freq': 1, 'lambda_l1': 0.22681889678172507, 'lambda_l2': 1.8424545733357516, 'min_data_in_leaf': 13}. Best is trial 5 with value: 0.0016842382733425613.
[I 2025-10-15 23:54:47,171] Trial 7 finished with value: 0.012527258883244642 and parameters: {'n_estimators': 128, 'max_depth': 7, 'learning_rate': 0.07351504273455561, 'num_leaves': 27, 'feature_fraction': 0.812518063141933, 'bagging_fraction': 0.7413102348883429, 'bagging_freq': 4, 'lambda_l1': 0.6668387003142676, 'lambda_l2': 1.21330015720876, 'min_data_in_leaf': 42}. Best is trial 5 with value: 0.0016842382733425613.
[I 2025-10-15 23:55:05,984] Trial 8 finished with value: 0.033056026075745926 and parameters: {'n_estimators': 107, 'max_depth': 3, 'learning_rate': 0.03562735916482121, 'num_leaves': 34, 'feature_fraction': 0.6170096609008704, 'bagging_fraction': 0.6721514551333188, 'bagging_freq': 6, 'lambda_l1': 0.8952867701701728, 'lambda_l2': 1.5283898332360875, 'min_data_in_leaf': 21}. Best is trial 5 with value: 0.0016842382733425613.
[I 2025-10-15 23:55:37,385] Trial 9 finished with value: 0.019654388105701404 and parameters: {'n_estimators': 200, 'max_depth': 5, 'learning_rate': 0.02058662912317711, 'num_leaves': 23, 'feature_fraction': 0.8508806898654051, 'bagging_fraction': 0.8239477732499375, 'bagging_freq': 3, 'lambda_l1': 0.6901810587548242, 'lambda_l2': 1.2007622300874972, 'min_data_in_leaf': 17}. Best is trial 5 with value: 0.0016842382733425613.
[I 2025-10-15 23:56:18,800] Trial 10 finished with value: 0.058230405978809234 and parameters: {'n_estimators': 185, 'max_depth': 8, 'learning_rate': 0.0116709195414881, 'num_leaves': 51, 'feature_fraction': 0.9978597451269996, 'bagging_fraction': 0.6148066371129541, 'bagging_freq': 7, 'lambda_l1': 0.030129844391907024, 'lambda_l2': 0.7338655299193735, 'min_data_in_leaf': 26}. Best is trial 5 with value: 0.0016842382733425613.
[I 2025-10-15 23:57:19,685] Trial 11 finished with value: 0.00430337788617019 and parameters: {'n_estimators': 163, 'max_depth': 4, 'learning_rate': 0.03202240386054947, 'num_leaves': 98, 'feature_fraction': 0.6100668363727398, 'bagging_fraction': 0.9102695725375366, 'bagging_freq': 1, 'lambda_l1': 0.027437031341942086, 'lambda_l2': 0.6559828665802465, 'min_data_in_leaf': 5}. Best is trial 5 with value: 0.0016842382733425613.
[I 2025-10-15 23:57:41,770] Trial 12 finished with value: 0.005970574121501424 and parameters: {'n_estimators': 164, 'max_depth': 6, 'learning_rate': 0.09971241500526323, 'num_leaves': 52, 'feature_fraction': 0.6919350668451564, 'bagging_fraction': 0.9956277334421174, 'bagging_freq': 2, 'lambda_l1': 0.4624109753922586, 'lambda_l2': 0.6202932858870609, 'min_data_in_leaf': 34}. Best is trial 5 with value: 0.0016842382733425613.
[I 2025-10-15 23:58:16,333] Trial 13 finished with value: 0.006849463922175842 and parameters: {'n_estimators': 148, 'max_depth': 4, 'learning_rate': 0.05641892080802531, 'num_leaves': 63, 'feature_fraction': 0.9499050115329472, 'bagging_fraction': 0.7585124839792723, 'bagging_freq': 8, 'lambda_l1': 0.39755379928395507, 'lambda_l2': 0.13784582580153593, 'min_data_in_leaf': 20}. Best is trial 5 with value: 0.0016842382733425613.
[I 2025-10-15 23:58:40,222] Trial 14 finished with value: 0.04383190101558563 and parameters: {'n_estimators': 81, 'max_depth': 5, 'learning_rate': 0.029974481076331303, 'num_leaves': 11, 'feature_fraction': 0.6858270686029593, 'bagging_fraction': 0.8895832747473615, 'bagging_freq': 2, 'lambda_l1': 0.14847067334839298, 'lambda_l2': 0.902084594125656, 'min_data_in_leaf': 15}. Best is trial 5 with value: 0.0016842382733425613.
[I 2025-10-15 23:59:18,274] Trial 15 finished with value: 0.005558072347646042 and parameters: {'n_estimators': 178, 'max_depth': 4, 'learning_rate': 0.06814727422847455, 'num_leaves': 43, 'feature_fraction': 0.7318877166362754, 'bagging_fraction': 0.9230269370460983, 'bagging_freq': 10, 'lambda_l1': 0.37512531011103645, 'lambda_l2': 0.5154953041072434, 'min_data_in_leaf': 50}. Best is trial 5 with value: 0.0016842382733425613.
[I 2025-10-15 23:59:54,137] Trial 16 finished with value: 0.0019861780198386697 and parameters: {'n_estimators': 145, 'max_depth': 6, 'learning_rate': 0.04422518211187482, 'num_leaves': 68, 'feature_fraction': 0.6504126670140277, 'bagging_fraction': 0.8642687782998613, 'bagging_freq': 3, 'lambda_l1': 0.10450397828111756, 'lambda_l2': 0.06687197159068548, 'min_data_in_leaf': 5}. Best is trial 5 with value: 0.0016842382733425613.
[I 2025-10-16 00:00:41,724] Trial 17 finished with value: 0.00010515328942091435 and parameters: {'n_estimators': 180, 'max_depth': 7, 'learning_rate': 0.044155348585934756, 'num_leaves': 69, 'feature_fraction': 0.6454648841585607, 'bagging_fraction': 0.7671828052679323, 'bagging_freq': 5, 'lambda_l1': 0.0009365388901337052, 'lambda_l2': 0.010781998857585295, 'min_data_in_leaf': 24}. Best is trial 17 with value: 0.00010515328942091435.
[I 2025-10-16 00:01:36,267] Trial 18 finished with value: 0.005422458893698322 and parameters: {'n_estimators': 197, 'max_depth': 8, 'learning_rate': 0.02307995389731229, 'num_leaves': 75, 'feature_fraction': 0.6427107139180743, 'bagging_fraction': 0.7534694413799344, 'bagging_freq': 6, 'lambda_l1': 0.011806981510596837, 'lambda_l2': 0.40507423354550454, 'min_data_in_leaf': 25}. Best is trial 17 with value: 0.00010515328942091435.
[I 2025-10-16 00:02:18,004] Trial 19 finished with value: 0.016639212278245608 and parameters: {'n_estimators': 175, 'max_depth': 7, 'learning_rate': 0.03839435237064927, 'num_leaves': 43, 'feature_fraction': 0.601382603381317, 'bagging_fraction': 0.7745413474235323, 'bagging_freq': 5, 'lambda_l1': 0.9907812622127743, 'lambda_l2': 0.029447234200175657, 'min_data_in_leaf': 36}. Best is trial 17 with value: 0.00010515328942091435.
[I 2025-10-16 00:02:56,754] Trial 20 finished with value: 0.091622817192896 and parameters: {'n_estimators': 164, 'max_depth': 7, 'learning_rate': 0.010841938710381284, 'num_leaves': 55, 'feature_fraction': 0.7194377046981586, 'bagging_fraction': 0.7030141542073068, 'bagging_freq': 7, 'lambda_l1': 0.5504283852047012, 'lambda_l2': 5.501666690261968e-05, 'min_data_in_leaf': 30}. Best is trial 17 with value: 0.00010515328942091435.
[I 2025-10-16 00:03:38,993] Trial 21 finished with value: 0.002498111288895035 and parameters: {'n_estimators': 142, 'max_depth': 6, 'learning_rate': 0.048072085691921146, 'num_leaves': 67, 'feature_fraction': 0.6654807435853956, 'bagging_fraction': 0.8544366219211308, 'bagging_freq': 3, 'lambda_l1': 0.11490148602315416, 'lambda_l2': 0.2730250249433346, 'min_data_in_leaf': 21}. Best is trial 17 with value: 0.00010515328942091435.
[I 2025-10-16 00:04:26,836] Trial 22 finished with value: 0.0026024437899873007 and parameters: {'n_estimators': 183, 'max_depth': 6, 'learning_rate': 0.04305396324433993, 'num_leaves': 68, 'feature_fraction': 0.6457022807984886, 'bagging_fraction': 0.7936595731850032, 'bagging_freq': 3, 'lambda_l1': 0.11054176788218409, 'lambda_l2': 0.4408134248452281, 'min_data_in_leaf': 5}. Best is trial 17 with value: 0.00010515328942091435.
[I 2025-10-16 00:05:05,488] Trial 23 finished with value: 0.004856477746874478 and parameters: {'n_estimators': 160, 'max_depth': 6, 'learning_rate': 0.05279116368621979, 'num_leaves': 74, 'feature_fraction': 0.6540657169592018, 'bagging_fraction': 0.8631520377564615, 'bagging_freq': 5, 'lambda_l1': 0.32197965677760426, 'lambda_l2': 0.11475055270975829, 'min_data_in_leaf': 14}. Best is trial 17 with value: 0.00010515328942091435.
[I 2025-10-16 00:05:42,497] Trial 24 finished with value: 0.011222815655990072 and parameters: {'n_estimators': 135, 'max_depth': 8, 'learning_rate': 0.026103966853685868, 'num_leaves': 60, 'feature_fraction': 0.711877677301595, 'bagging_fraction': 0.8014073352480938, 'bagging_freq': 4, 'lambda_l1': 0.11035832008597551, 'lambda_l2': 0.20213291153645438, 'min_data_in_leaf': 11}. Best is trial 17 with value: 0.00010515328942091435.
[I 2025-10-16 00:06:15,066] Trial 25 finished with value: 0.002907186513559734 and parameters: {'n_estimators': 116, 'max_depth': 7, 'learning_rate': 0.03751788103581455, 'num_leaves': 43, 'feature_fraction': 0.6497759155802403, 'bagging_fraction': 0.7007133856049169, 'bagging_freq': 6, 'lambda_l1': 0.004466140209387445, 'lambda_l2': 0.01616696423706726, 'min_data_in_leaf': 17}. Best is trial 17 with value: 0.00010515328942091435.
[I 2025-10-16 00:06:59,872] Trial 26 finished with value: 0.016085127144121966 and parameters: {'n_estimators': 174, 'max_depth': 5, 'learning_rate': 0.019345073943011062, 'num_leaves': 74, 'feature_fraction': 0.6249537983133656, 'bagging_fraction': 0.9397056511874935, 'bagging_freq': 3, 'lambda_l1': 0.1511433349949279, 'lambda_l2': 0.48621447425527065, 'min_data_in_leaf': 39}. Best is trial 17 with value: 0.00010515328942091435.
[I 2025-10-16 00:07:17,288] Trial 27 finished with value: 0.0021089810721941493 and parameters: {'n_estimators': 155, 'max_depth': 6, 'learning_rate': 0.04411852327840015, 'num_leaves': 58, 'feature_fraction': 0.8037817052258959, 'bagging_fraction': 0.8529755204483811, 'bagging_freq': 7, 'lambda_l1': 0.08460724877248915, 'lambda_l2': 0.2824482924437991, 'min_data_in_leaf': 24}. Best is trial 17 with value: 0.00010515328942091435.
[I 2025-10-16 00:08:07,922] Trial 28 finished with value: 0.0029636069480403504 and parameters: {'n_estimators': 185, 'max_depth': 4, 'learning_rate': 0.05330236318217684, 'num_leaves': 48, 'feature_fraction': 0.7017754346833391, 'bagging_fraction': 0.7970249988949815, 'bagging_freq': 5, 'lambda_l1': 0.1823332158288528, 'lambda_l2': 0.1427312565070975, 'min_data_in_leaf': 29}. Best is trial 17 with value: 0.00010515328942091435.
