[I 2025-10-15 23:43:16,095] Trial 2 finished with value: inf and parameters: {'n_estimators': 60, 'max_depth': 6, 'learning_rate': 0.0821179402128635, 'num_leaves': 50, 'feature_fraction': 0.9988646983357414, 'bagging_fraction': 0.6016428877271934, 'bagging_freq': 1, 'lambda_l1': 0.7869594674811641, 'lambda_l2': 0.4735035349386456, 'min_data_in_leaf': 17}. Best is trial 0 with value: inf.
2025-10-15 23:43:16,104 - non_major_league_hyperparameter_tuning - WARNING - Error in fold: pandas dtypes must be int, float or bool.
Fields with bad pandas dtypes: Div: object, Date: object, Time: object, HomeTeam: object, AwayTeam: object, FTR: object, HTR: object, Referee: object, league: object, season: object, data_source: object, season_phase: object
2025-10-15 23:43:16,112 - non_major_league_hyperparameter_tuning - WARNING - Error in fold: pandas dtypes must be int, float or bool.
Fields with bad pandas dtypes: Div: object, Date: object, Time: object, HomeTeam: object, AwayTeam: object, FTR: object, HTR: object, Referee: object, league: object, season: object, data_source: object, season_phase: object
2025-10-15 23:43:16,121 - non_major_league_hyperparameter_tuning - WARNING - Error in fold: pandas dtypes must be int, float or bool.
Fields with bad pandas dtypes: Div: object, Date: object, Time: object, HomeTeam: object, AwayTeam: object, FTR: object, HTR: object, Referee: object, league: object, season: object, data_source: object, season_phase: object
[I 2025-10-15 23:43:16,121] Trial 3 finished with value: inf and parameters: {'n_estimators': 147, 'max_depth': 5, 'learning_rate': 0.05337676079666865, 'num_leaves': 97, 'feature_fraction': 0.6099780736839796, 'bagging_fraction': 0.8948463657736958, 'bagging_freq': 7, 'lambda_l1': 0.7263247672179061, 'lambda_l2': 1.4064073208684837, 'min_data_in_leaf': 33}. Best is trial 0 with value: inf.
2025-10-15 23:43:16,130 - non_major_league_hyperparameter_tuning - WARNING - Error in fold: pandas dtypes must be int, float or bool.
Fields with bad pandas dtypes: Div: object, Date: object, Time: object, HomeTeam: object, AwayTeam: object, FTR: object, HTR: object, Referee: object, league: object, season: object, data_source: object, season_phase: object
2025-10-15 23:43:16,136 - non_major_league_hyperparameter_tuning - WARNING - Error in fold: pandas dtypes must be int, float or bool.
Fields with bad pandas dtypes: Div: object, Date: object, Time: object, HomeTeam: object, AwayTeam: object, FTR: object, HTR: object, Referee: object, league: object, season: object, data_source: object, season_phase: object
2025-10-15 23:43:16,143 - non_major_league_hyperparameter_tuning - WARNING - Error in fold: pandas dtypes must be int, float or bool.
Fields with bad pandas dtypes: Div: object, Date: object, Time: object, HomeTeam: object, AwayTeam: object, FTR: object, HTR: object, Referee: object, league: object, season: object, data_source: object, season_phase: object
[I 2025-10-15 23:43:16,144] Trial 4 finished with value: inf and parameters: {'n_estimators': 181, 'max_depth': 3, 'learning_rate': 0.04917358376256399, 'num_leaves': 13, 'feature_fraction': 0.8899242044815268, 'bagging_fraction': 0.6564550994696152, 'bagging_freq': 10, 'lambda_l1': 0.3069740461171341, 'lambda_l2': 0.8700083831106358, 'min_data_in_leaf': 25}. Best is trial 0 with value: inf.
2025-10-15 23:43:16,154 - non_major_league_hyperparameter_tuning - WARNING - Error in fold: pandas dtypes must be int, float or bool.
Fields with bad pandas dtypes: Div: object, Date: object, Time: object, HomeTeam: object, AwayTeam: object, FTR: object, HTR: object, Referee: object, league: object, season: object, data_source: object, season_phase: object
2025-10-15 23:43:16,161 - non_major_league_hyperparameter_tuning - WARNING - Error in fold: pandas dtypes must be int, float or bool.
Fields with bad pandas dtypes: Div: object, Date: object, Time: object, HomeTeam: object, AwayTeam: object, FTR: object, HTR: object, Referee: object, league: object, season: object, data_source: object, season_phase: object
2025-10-15 23:43:16,167 - non_major_league_hyperparameter_tuning - WARNING - Error in fold: pandas dtypes must be int, float or bool.
Fields with bad pandas dtypes: Div: object, Date: object, Time: object, HomeTeam: object, AwayTeam: object, FTR: object, HTR: object, Referee: object, league: object, season: object, data_source: object, season_phase: object
[I 2025-10-15 23:43:16,168] Trial 5 finished with value: inf and parameters: {'n_estimators': 82, 'max_depth': 7, 'learning_rate': 0.07730917357837476, 'num_leaves': 67, 'feature_fraction': 0.6599501509991293, 'bagging_fraction': 0.7192273310959352, 'bagging_freq': 8, 'lambda_l1': 0.18689745781424605, 'lambda_l2': 1.8808890177733748, 'min_data_in_leaf': 13}. Best is trial 0 with value: inf.
2025-10-15 23:43:16,179 - non_major_league_hyperparameter_tuning - WARNING - Error in fold: pandas dtypes must be int, float or bool.
Fields with bad pandas dtypes: Div: object, Date: object, Time: object, HomeTeam: object, AwayTeam: object, FTR: object, HTR: object, Referee: object, league: object, season: object, data_source: object, season_phase: object
2025-10-15 23:43:16,186 - non_major_league_hyperparameter_tuning - WARNING - Error in fold: pandas dtypes must be int, float or bool.
Fields with bad pandas dtypes: Div: object, Date: object, Time: object, HomeTeam: object, AwayTeam: object, FTR: object, HTR: object, Referee: object, league: object, season: object, data_source: object, season_phase: object
2025-10-15 23:43:16,192 - non_major_league_hyperparameter_tuning - WARNING - Error in fold: pandas dtypes must be int, float or bool.
Fields with bad pandas dtypes: Div: object, Date: object, Time: object, HomeTeam: object, AwayTeam: object, FTR: object, HTR: object, Referee: object, league: object, season: object, data_source: object, season_phase: object
[I 2025-10-15 23:43:16,193] Trial 6 finished with value: inf and parameters: {'n_estimators': 190, 'max_depth': 8, 'learning_rate': 0.0522082747306078, 'num_leaves': 42, 'feature_fraction': 0.8073382269193569, 'bagging_fraction': 0.9521937060331422, 'bagging_freq': 5, 'lambda_l1': 0.9882865208288341, 'lambda_l2': 0.5877198038635771, 'min_data_in_leaf': 9}. Best is trial 0 with value: inf.
2025-10-15 23:43:16,204 - non_major_league_hyperparameter_tuning - WARNING - Error in fold: pandas dtypes must be int, float or bool.
Fields with bad pandas dtypes: Div: object, Date: object, Time: object, HomeTeam: object, AwayTeam: object, FTR: object, HTR: object, Referee: object, league: object, season: object, data_source: object, season_phase: object
2025-10-15 23:43:16,212 - non_major_league_hyperparameter_tuning - WARNING - Error in fold: pandas dtypes must be int, float or bool.
Fields with bad pandas dtypes: Div: object, Date: object, Time: object, HomeTeam: object, AwayTeam: object, FTR: object, HTR: object, Referee: object, league: object, season: object, data_source: object, season_phase: object
2025-10-15 23:43:16,219 - non_major_league_hyperparameter_tuning - WARNING - Error in fold: pandas dtypes must be int, float or bool.
Fields with bad pandas dtypes: Div: object, Date: object, Time: object, HomeTeam: object, AwayTeam: object, FTR: object, HTR: object, Referee: object, league: object, season: object, data_source: object, season_phase: object
[I 2025-10-15 23:43:16,220] Trial 7 finished with value: inf and parameters: {'n_estimators': 145, 'max_depth': 6, 'learning_rate': 0.06127388389601003, 'num_leaves': 49, 'feature_fraction': 0.8042111556162547, 'bagging_fraction': 0.8773085604260891, 'bagging_freq': 2, 'lambda_l1': 0.05855240959084962, 'lambda_l2': 0.5258682006969244, 'min_data_in_leaf': 26}. Best is trial 0 with value: inf.
2025-10-15 23:43:16,228 - non_major_league_hyperparameter_tuning - WARNING - Error in fold: pandas dtypes must be int, float or bool.
Fields with bad pandas dtypes: Div: object, Date: object, Time: object, HomeTeam: object, AwayTeam: object, FTR: object, HTR: object, Referee: object, league: object, season: object, data_source: object, season_phase: object
2025-10-15 23:43:16,236 - non_major_league_hyperparameter_tuning - WARNING - Error in fold: pandas dtypes must be int, float or bool.
Fields with bad pandas dtypes: Div: object, Date: object, Time: object, HomeTeam: object, AwayTeam: object, FTR: object, HTR: object, Referee: object, league: object, season: object, data_source: object, season_phase: object
2025-10-15 23:43:16,243 - non_major_league_hyperparameter_tuning - WARNING - Error in fold: pandas dtypes must be int, float or bool.
Fields with bad pandas dtypes: Div: object, Date: object, Time: object, HomeTeam: object, AwayTeam: object, FTR: object, HTR: object, Referee: object, league: object, season: object, data_source: object, season_phase: object
[I 2025-10-15 23:43:16,244] Trial 8 finished with value: inf and parameters: {'n_estimators': 62, 'max_depth': 8, 'learning_rate': 0.05324087714416465, 'num_leaves': 56, 'feature_fraction': 0.8503311076817697, 'bagging_fraction': 0.9982822093663104, 'bagging_freq': 10, 'lambda_l1': 0.15062076311365102, 'lambda_l2': 0.9676094601098493, 'min_data_in_leaf': 26}. Best is trial 0 with value: inf.
2025-10-15 23:43:16,253 - non_major_league_hyperparameter_tuning - WARNING - Error in fold: pandas dtypes must be int, float or bool.
Fields with bad pandas dtypes: Div: object, Date: object, Time: object, HomeTeam: object, AwayTeam: object, FTR: object, HTR: object, Referee: object, league: object, season: object, data_source: object, season_phase: object
2025-10-15 23:43:16,259 - non_major_league_hyperparameter_tuning - WARNING - Error in fold: pandas dtypes must be int, float or bool.
Fields with bad pandas dtypes: Div: object, Date: object, Time: object, HomeTeam: object, AwayTeam: object, FTR: object, HTR: object, Referee: object, league: object, season: object, data_source: object, season_phase: object
2025-10-15 23:43:16,266 - non_major_league_hyperparameter_tuning - WARNING - Error in fold: pandas dtypes must be int, float or bool.
Fields with bad pandas dtypes: Div: object, Date: object, Time: object, HomeTeam: object, AwayTeam: object, FTR: object, HTR: object, Referee: object, league: object, season: object, data_source: object, season_phase: object
[I 2025-10-15 23:43:16,267] Trial 9 finished with value: inf and parameters: {'n_estimators': 132, 'max_depth': 8, 'learning_rate': 0.05215953663520567, 'num_leaves': 60, 'feature_fraction': 0.8581977262470615, 'bagging_fraction': 0.7226878457940394, 'bagging_freq': 4, 'lambda_l1': 0.3279791267554615, 'lambda_l2': 1.54179805433177, 'min_data_in_leaf': 41}. Best is trial 0 with value: inf.
2025-10-15 23:43:16,313 - non_major_league_hyperparameter_tuning - WARNING - Error in fold: pandas dtypes must be int, float or bool.
Fields with bad pandas dtypes: Div: object, Date: object, Time: object, HomeTeam: object, AwayTeam: object, FTR: object, HTR: object, Referee: object, league: object, season: object, data_source: object, season_phase: object
2025-10-15 23:43:16,321 - non_major_league_hyperparameter_tuning - WARNING - Error in fold: pandas dtypes must be int, float or bool.
Fields with bad pandas dtypes: Div: object, Date: object, Time: object, HomeTeam: object, AwayTeam: object, FTR: object, HTR: object, Referee: object, league: object, season: object, data_source: object, season_phase: object
2025-10-15 23:43:16,327 - non_major_league_hyperparameter_tuning - WARNING - Error in fold: pandas dtypes must be int, float or bool.
Fields with bad pandas dtypes: Div: object, Date: object, Time: object, HomeTeam: object, AwayTeam: object, FTR: object, HTR: object, Referee: object, league: object, season: object, data_source: object, season_phase: object
[I 2025-10-15 23:43:16,329] Trial 10 finished with value: inf and parameters: {'n_estimators': 102, 'max_depth': 5, 'learning_rate': 0.013669369478998637, 'num_leaves': 81, 'feature_fraction': 0.7127083616173363, 'bagging_fraction': 0.7523285801473101, 'bagging_freq': 2, 'lambda_l1': 0.5930969962499834, 'lambda_l2': 1.9896506279440598, 'min_data_in_leaf': 5}. Best is trial 0 with value: inf.
2025-10-15 23:43:16,376 - non_major_league_hyperparameter_tuning - WARNING - Error in fold: pandas dtypes must be int, float or bool.
Fields with bad pandas dtypes: Div: object, Date: object, Time: object, HomeTeam: object, AwayTeam: object, FTR: object, HTR: object, Referee: object, league: object, season: object, data_source: object, season_phase: object
2025-10-15 23:43:16,385 - non_major_league_hyperparameter_tuning - WARNING - Error in fold: pandas dtypes must be int, float or bool.
Fields with bad pandas dtypes: Div: object, Date: object, Time: object, HomeTeam: object, AwayTeam: object, FTR: object, HTR: object, Referee: object, league: object, season: object, data_source: object, season_phase: object
2025-10-15 23:43:16,393 - non_major_league_hyperparameter_tuning - WARNING - Error in fold: pandas dtypes must be int, float or bool.
Fields with bad pandas dtypes: Div: object, Date: object, Time: object, HomeTeam: object, AwayTeam: object, FTR: object, HTR: object, Referee: object, league: object, season: object, data_source: object, season_phase: object
[I 2025-10-15 23:43:16,393] Trial 11 finished with value: inf and parameters: {'n_estimators': 102, 'max_depth': 3, 'learning_rate': 0.025710677764321573, 'num_leaves': 25, 'feature_fraction': 0.7097535170246182, 'bagging_fraction': 0.8255517301704465, 'bagging_freq': 4, 'lambda_l1': 0.47916046503378534, 'lambda_l2': 0.036590519499255736, 'min_data_in_leaf': 18}. Best is trial 0 with value: inf.
2025-10-15 23:43:16,443 - non_major_league_hyperparameter_tuning - WARNING - Error in fold: pandas dtypes must be int, float or bool.
Fields with bad pandas dtypes: Div: object, Date: object, Time: object, HomeTeam: object, AwayTeam: object, FTR: object, HTR: object, Referee: object, league: object, season: object, data_source: object, season_phase: object
2025-10-15 23:43:16,449 - non_major_league_hyperparameter_tuning - WARNING - Error in fold: pandas dtypes must be int, float or bool.
Fields with bad pandas dtypes: Div: object, Date: object, Time: object, HomeTeam: object, AwayTeam: object, FTR: object, HTR: object, Referee: object, league: object, season: object, data_source: object, season_phase: object
2025-10-15 23:43:16,456 - non_major_league_hyperparameter_tuning - WARNING - Error in fold: pandas dtypes must be int, float or bool.
Fields with bad pandas dtypes: Div: object, Date: object, Time: object, HomeTeam: object, AwayTeam: object, FTR: object, HTR: object, Referee: object, league: object, season: object, data_source: object, season_phase: object
[I 2025-10-15 23:43:16,457] Trial 12 finished with value: inf and parameters: {'n_estimators': 108, 'max_depth': 4, 'learning_rate': 0.03160257758195466, 'num_leaves': 32, 'feature_fraction': 0.7203609605889151, 'bagging_fraction': 0.7921173153905909, 'bagging_freq': 3, 'lambda_l1': 0.9981293137622176, 'lambda_l2': 1.381729712970764, 'min_data_in_leaf': 50}. Best is trial 0 with value: inf.
2025-10-15 23:43:16,511 - non_major_league_hyperparameter_tuning - WARNING - Error in fold: pandas dtypes must be int, float or bool.
Fields with bad pandas dtypes: Div: object, Date: object, Time: object, HomeTeam: object, AwayTeam: object, FTR: object, HTR: object, Referee: object, league: object, season: object, data_source: object, season_phase: object
2025-10-15 23:43:16,519 - non_major_league_hyperparameter_tuning - WARNING - Error in fold: pandas dtypes must be int, float or bool.
Fields with bad pandas dtypes: Div: object, Date: object, Time: object, HomeTeam: object, AwayTeam: object, FTR: object, HTR: object, Referee: object, league: object, season: object, data_source: object, season_phase: object
2025-10-15 23:43:16,526 - non_major_league_hyperparameter_tuning - WARNING - Error in fold: pandas dtypes must be int, float or bool.
Fields with bad pandas dtypes: Div: object, Date: object, Time: object, HomeTeam: object, AwayTeam: object, FTR: object, HTR: object, Referee: object, league: object, season: object, data_source: object, season_phase: object
[I 2025-10-15 23:43:16,527] Trial 13 finished with value: inf and parameters: {'n_estimators': 50, 'max_depth': 4, 'learning_rate': 0.03380248417573663, 'num_leaves': 71, 'feature_fraction': 0.6040061605487432, 'bagging_fraction': 0.6687930100139299, 'bagging_freq': 6, 'lambda_l1': 0.49692629042952585, 'lambda_l2': 0.03465432197118154, 'min_data_in_leaf': 18}. Best is trial 0 with value: inf.
2025-10-15 23:43:16,583 - non_major_league_hyperparameter_tuning - WARNING - Error in fold: pandas dtypes must be int, float or bool.
Fields with bad pandas dtypes: Div: object, Date: object, Time: object, HomeTeam: object, AwayTeam: object, FTR: object, HTR: object, Referee: object, league: object, season: object, data_source: object, season_phase: object
2025-10-15 23:43:16,591 - non_major_league_hyperparameter_tuning - WARNING - Error in fold: pandas dtypes must be int, float or bool.
Fields with bad pandas dtypes: Div: object, Date: object, Time: object, HomeTeam: object, AwayTeam: object, FTR: object, HTR: object, Referee: object, league: object, season: object, data_source: object, season_phase: object
2025-10-15 23:43:16,598 - non_major_league_hyperparameter_tuning - WARNING - Error in fold: pandas dtypes must be int, float or bool.
Fields with bad pandas dtypes: Div: object, Date: object, Time: object, HomeTeam: object, AwayTeam: object, FTR: object, HTR: object, Referee: object, league: object, season: object, data_source: object, season_phase: object
[I 2025-10-15 23:43:16,598] Trial 14 finished with value: inf and parameters: {'n_estimators': 166, 'max_depth': 7, 'learning_rate': 0.01511527049843631, 'num_leaves': 10, 'feature_fraction': 0.6644493591987602, 'bagging_fraction': 0.8365513579262249, 'bagging_freq': 1, 'lambda_l1': 0.813143981584895, 'lambda_l2': 1.6889361179076183, 'min_data_in_leaf': 11}. Best is trial 0 with value: inf.
2025-10-15 23:43:16,647 - non_major_league_hyperparameter_tuning - WARNING - Error in fold: pandas dtypes must be int, float or bool.
Fields with bad pandas dtypes: Div: object, Date: object, Time: object, HomeTeam: object, AwayTeam: object, FTR: object, HTR: object, Referee: object, league: object, season: object, data_source: object, season_phase: object
2025-10-15 23:43:16,655 - non_major_league_hyperparameter_tuning - WARNING - Error in fold: pandas dtypes must be int, float or bool.
Fields with bad pandas dtypes: Div: object, Date: object, Time: object, HomeTeam: object, AwayTeam: object, FTR: object, HTR: object, Referee: object, league: object, season: object, data_source: object, season_phase: object
2025-10-15 23:43:16,664 - non_major_league_hyperparameter_tuning - WARNING - Error in fold: pandas dtypes must be int, float or bool.
Fields with bad pandas dtypes: Div: object, Date: object, Time: object, HomeTeam: object, AwayTeam: object, FTR: object, HTR: object, Referee: object, league: object, season: object, data_source: object, season_phase: object
[I 2025-10-15 23:43:16,665] Trial 15 finished with value: inf and parameters: {'n_estimators': 81, 'max_depth': 4, 'learning_rate': 0.03897884946623989, 'num_leaves': 33, 'feature_fraction': 0.7621647925535473, 'bagging_fraction': 0.7757411370023688, 'bagging_freq': 3, 'lambda_l1': 0.6347825557802496, 'lambda_l2': 1.236196329648957, 'min_data_in_leaf': 34}. Best is trial 0 with value: inf.
2025-10-15 23:43:16,719 - non_major_league_hyperparameter_tuning - WARNING - Error in fold: pandas dtypes must be int, float or bool.
Fields with bad pandas dtypes: Div: object, Date: object, Time: object, HomeTeam: object, AwayTeam: object, FTR: object, HTR: object, Referee: object, league: object, season: object, data_source: object, season_phase: object
2025-10-15 23:43:16,725 - non_major_league_hyperparameter_tuning - WARNING - Error in fold: pandas dtypes must be int, float or bool.
Fields with bad pandas dtypes: Div: object, Date: object, Time: object, HomeTeam: object, AwayTeam: object, FTR: object, HTR: object, Referee: object, league: object, season: object, data_source: object, season_phase: object
2025-10-15 23:43:16,731 - non_major_league_hyperparameter_tuning - WARNING - Error in fold: pandas dtypes must be int, float or bool.
Fields with bad pandas dtypes: Div: object, Date: object, Time: object, HomeTeam: object, AwayTeam: object, FTR: object, HTR: object, Referee: object, league: object, season: object, data_source: object, season_phase: object
