[I 2025-10-16 03:13:49,329] Trial 3 finished with value: 0.1207605732404528 and parameters: {'n_estimators': 144, 'max_depth': 4, 'learning_rate': 0.010315390800022719, 'num_leaves': 94, 'feature_fraction': 0.7136952465130525, 'bagging_fraction': 0.7737984284976063, 'bagging_freq': 4, 'lambda_l1': 0.035764344498008915, 'lambda_l2': 0.32439866255288474, 'min_data_in_leaf': 23}. Best is trial 0 with value: 0.005255707316067109.
[I 2025-10-16 03:15:44,460] Trial 4 finished with value: 0.041583835879663814 and parameters: {'n_estimators': 196, 'max_depth': 4, 'learning_rate': 0.013507802897830965, 'num_leaves': 93, 'feature_fraction': 0.6448652941336612, 'bagging_fraction': 0.6939751683217479, 'bagging_freq': 3, 'lambda_l1': 0.7555196474030843, 'lambda_l2': 0.8195651949376985, 'min_data_in_leaf': 22}. Best is trial 0 with value: 0.005255707316067109.
[I 2025-10-16 03:17:22,293] Trial 5 finished with value: 0.01283607225760733 and parameters: {'n_estimators': 101, 'max_depth': 3, 'learning_rate': 0.05868967823511035, 'num_leaves': 90, 'feature_fraction': 0.8071227746066739, 'bagging_fraction': 0.6344321431153442, 'bagging_freq': 5, 'lambda_l1': 0.6597421820558139, 'lambda_l2': 1.35564972513741, 'min_data_in_leaf': 47}. Best is trial 0 with value: 0.005255707316067109.
[I 2025-10-16 03:20:09,288] Trial 6 finished with value: 0.005225361494623208 and parameters: {'n_estimators': 174, 'max_depth': 3, 'learning_rate': 0.0835035661238644, 'num_leaves': 29, 'feature_fraction': 0.8243621864288604, 'bagging_fraction': 0.8866241940785893, 'bagging_freq': 5, 'lambda_l1': 0.49570337965491607, 'lambda_l2': 1.0497572196250013, 'min_data_in_leaf': 46}. Best is trial 6 with value: 0.005225361494623208.
[I 2025-10-16 03:23:19,993] Trial 7 finished with value: 0.005257448867452366 and parameters: {'n_estimators': 193, 'max_depth': 6, 'learning_rate': 0.07906410310564363, 'num_leaves': 91, 'feature_fraction': 0.6242466054561457, 'bagging_fraction': 0.7084682983238608, 'bagging_freq': 8, 'lambda_l1': 0.3959478854303089, 'lambda_l2': 0.9436430591826508, 'min_data_in_leaf': 36}. Best is trial 6 with value: 0.005225361494623208.
[I 2025-10-16 03:25:13,591] Trial 8 finished with value: 0.001230685667598266 and parameters: {'n_estimators': 96, 'max_depth': 6, 'learning_rate': 0.07418925830564312, 'num_leaves': 47, 'feature_fraction': 0.7604712576290672, 'bagging_fraction': 0.7976065459314491, 'bagging_freq': 2, 'lambda_l1': 0.01693719268578131, 'lambda_l2': 0.4164647682235423, 'min_data_in_leaf': 9}. Best is trial 8 with value: 0.001230685667598266.
[I 2025-10-16 03:29:02,336] Trial 9 finished with value: 0.014127314506916002 and parameters: {'n_estimators': 158, 'max_depth': 6, 'learning_rate': 0.0658374293839134, 'num_leaves': 71, 'feature_fraction': 0.7096410562333146, 'bagging_fraction': 0.657364431968259, 'bagging_freq': 4, 'lambda_l1': 0.9500767821809094, 'lambda_l2': 1.9409566385627077, 'min_data_in_leaf': 30}. Best is trial 8 with value: 0.001230685667598266.
[I 2025-10-16 03:30:32,550] Trial 10 finished with value: 0.0018931793611192658 and parameters: {'n_estimators': 51, 'max_depth': 8, 'learning_rate': 0.09784281065726716, 'num_leaves': 11, 'feature_fraction': 0.7356376699866808, 'bagging_fraction': 0.9946220047316688, 'bagging_freq': 1, 'lambda_l1': 0.06227173362515491, 'lambda_l2': 0.06881556298428804, 'min_data_in_leaf': 6}. Best is trial 8 with value: 0.001230685667598266.
[I 2025-10-16 03:32:15,075] Trial 11 finished with value: 0.0012055030614217662 and parameters: {'n_estimators': 52, 'max_depth': 8, 'learning_rate': 0.09858987037109233, 'num_leaves': 10, 'feature_fraction': 0.7373165624131035, 'bagging_fraction': 0.9717650030764796, 'bagging_freq': 1, 'lambda_l1': 0.018833963328964393, 'lambda_l2': 0.03511293939761965, 'min_data_in_leaf': 6}. Best is trial 11 with value: 0.0012055030614217662.
[I 2025-10-16 03:34:56,652] Trial 12 finished with value: 0.0019277557785260992 and parameters: {'n_estimators': 112, 'max_depth': 8, 'learning_rate': 0.0970719589735548, 'num_leaves': 65, 'feature_fraction': 0.7652454401159564, 'bagging_fraction': 0.9943902903505778, 'bagging_freq': 2, 'lambda_l1': 0.20593543107072462, 'lambda_l2': 0.027155518427122938, 'min_data_in_leaf': 14}. Best is trial 11 with value: 0.0012055030614217662.
[I 2025-10-16 03:36:35,500] Trial 13 finished with value: 0.027159091277009623 and parameters: {'n_estimators': 55, 'max_depth': 7, 'learning_rate': 0.049038147187515535, 'num_leaves': 18, 'feature_fraction': 0.8911593869578079, 'bagging_fraction': 0.8931485117645255, 'bagging_freq': 2, 'lambda_l1': 0.2199307063273118, 'lambda_l2': 0.40472892662007964, 'min_data_in_leaf': 14}. Best is trial 11 with value: 0.0012055030614217662.
[I 2025-10-16 03:39:01,630] Trial 14 finished with value: 0.042363363744095085 and parameters: {'n_estimators': 84, 'max_depth': 7, 'learning_rate': 0.027459800747033705, 'num_leaves': 54, 'feature_fraction': 0.6776021800427692, 'bagging_fraction': 0.8459724988706416, 'bagging_freq': 7, 'lambda_l1': 0.17956435946049418, 'lambda_l2': 0.2545178142266928, 'min_data_in_leaf': 13}. Best is trial 11 with value: 0.0012055030614217662.
[I 2025-10-16 03:42:24,101] Trial 15 finished with value: 0.000682401765444157 and parameters: {'n_estimators': 118, 'max_depth': 7, 'learning_rate': 0.08928172513553831, 'num_leaves': 52, 'feature_fraction': 0.7682782507889295, 'bagging_fraction': 0.9457468480037903, 'bagging_freq': 1, 'lambda_l1': 0.018931688860702116, 'lambda_l2': 0.5961195809740945, 'min_data_in_leaf': 5}. Best is trial 15 with value: 0.000682401765444157.
INFO:non_major_league_hyperparameter_tuning:lightgbm optimization complete
INFO:non_major_league_hyperparameter_tuning:Best score: 0.0007
INFO:non_major_league_hyperparameter_tuning:Best params: {'n_estimators': 118, 'max_depth': 7, 'learning_rate': 0.08928172513553831, 'num_leaves': 52, 'feature_fraction': 0.7682782507889295, 'bagging_fraction': 0.9457468480037903, 'bagging_freq': 1, 'lambda_l1': 0.018931688860702116, 'lambda_l2': 0.5961195809740945, 'min_data_in_leaf': 5}
INFO:non_major_league_hyperparameter_tuning:Optimizing random_forest (priority: 3)
INFO:non_major_league_hyperparameter_tuning:Optimizing hyperparameters for random_forest
[I 2025-10-16 03:42:24,120] A new study created in memory with name: no-name-dc09d247-2ca1-4966-bf14-fa416fa99b55
[I 2025-10-16 03:42:26,319] Trial 0 finished with value: 0.2559461853027913 and parameters: {'n_estimators': 121, 'max_depth': 10, 'min_samples_split': 18, 'min_samples_leaf': 3, 'max_features': 'log2'}. Best is trial 0 with value: 0.2559461853027913.
[I 2025-10-16 03:42:28,009] Trial 1 finished with value: 0.31186003385896904 and parameters: {'n_estimators': 103, 'max_depth': 8, 'min_samples_split': 19, 'min_samples_leaf': 8, 'max_features': 'log2'}. Best is trial 0 with value: 0.2559461853027913.
[I 2025-10-16 03:42:37,384] Trial 2 finished with value: 2.2204460492503136e-16 and parameters: {'n_estimators': 199, 'max_depth': 9, 'min_samples_split': 14, 'min_samples_leaf': 6, 'max_features': None}. Best is trial 2 with value: 2.2204460492503136e-16.
[I 2025-10-16 03:42:39,774] Trial 3 finished with value: 0.12060618582906422 and parameters: {'n_estimators': 157, 'max_depth': 4, 'min_samples_split': 3, 'min_samples_leaf': 3, 'max_features': 'sqrt'}. Best is trial 2 with value: 2.2204460492503136e-16.
[I 2025-10-16 03:42:45,032] Trial 4 finished with value: 2.2204460492503136e-16 and parameters: {'n_estimators': 114, 'max_depth': 3, 'min_samples_split': 2, 'min_samples_leaf': 4, 'max_features': None}. Best is trial 2 with value: 2.2204460492503136e-16.
[I 2025-10-16 03:42:48,471] Trial 5 finished with value: 0.4849512896102534 and parameters: {'n_estimators': 188, 'max_depth': 3, 'min_samples_split': 16, 'min_samples_leaf': 5, 'max_features': 'log2'}. Best is trial 2 with value: 2.2204460492503136e-16.
[I 2025-10-16 03:42:51,164] Trial 6 finished with value: 0.22871571001588795 and parameters: {'n_estimators': 174, 'max_depth': 14, 'min_samples_split': 2, 'min_samples_leaf': 4, 'max_features': 'log2'}. Best is trial 2 with value: 2.2204460492503136e-16.
[I 2025-10-16 03:42:53,952] Trial 7 finished with value: 2.2204460492503136e-16 and parameters: {'n_estimators': 59, 'max_depth': 5, 'min_samples_split': 9, 'min_samples_leaf': 8, 'max_features': None}. Best is trial 2 with value: 2.2204460492503136e-16.
[I 2025-10-16 03:43:01,919] Trial 8 finished with value: 2.2204460492503136e-16 and parameters: {'n_estimators': 170, 'max_depth': 15, 'min_samples_split': 14, 'min_samples_leaf': 7, 'max_features': None}. Best is trial 2 with value: 2.2204460492503136e-16.
[I 2025-10-16 03:43:03,617] Trial 9 finished with value: 0.1415729368735171 and parameters: {'n_estimators': 86, 'max_depth': 6, 'min_samples_split': 18, 'min_samples_leaf': 10, 'max_features': 'sqrt'}. Best is trial 2 with value: 2.2204460492503136e-16.
[I 2025-10-16 03:43:10,818] Trial 10 finished with value: 2.2204460492503136e-16 and parameters: {'n_estimators': 146, 'max_depth': 11, 'min_samples_split': 10, 'min_samples_leaf': 6, 'max_features': None}. Best is trial 2 with value: 2.2204460492503136e-16.
[I 2025-10-16 03:43:19,994] Trial 11 finished with value: 2.2204460492503136e-16 and parameters: {'n_estimators': 200, 'max_depth': 7, 'min_samples_split': 6, 'min_samples_leaf': 1, 'max_features': None}. Best is trial 2 with value: 2.2204460492503136e-16.
[I 2025-10-16 03:43:25,514] Trial 12 finished with value: 2.2204460492503136e-16 and parameters: {'n_estimators': 133, 'max_depth': 12, 'min_samples_split': 13, 'min_samples_leaf': 1, 'max_features': None}. Best is trial 2 with value: 2.2204460492503136e-16.
[I 2025-10-16 03:43:30,488] Trial 13 finished with value: 2.2204460492503136e-16 and parameters: {'n_estimators': 105, 'max_depth': 9, 'min_samples_split': 7, 'min_samples_leaf': 5, 'max_features': None}. Best is trial 2 with value: 2.2204460492503136e-16.
[I 2025-10-16 03:43:33,451] Trial 14 finished with value: 2.2204460492503136e-16 and parameters: {'n_estimators': 71, 'max_depth': 13, 'min_samples_split': 13, 'min_samples_leaf': 3, 'max_features': None}. Best is trial 2 with value: 2.2204460492503136e-16.
[I 2025-10-16 03:43:37,758] Trial 15 finished with value: 2.2204460492503136e-16 and parameters: {'n_estimators': 117, 'max_depth': 3, 'min_samples_split': 5, 'min_samples_leaf': 6, 'max_features': None}. Best is trial 2 with value: 2.2204460492503136e-16.
[I 2025-10-16 03:43:39,738] Trial 16 finished with value: 0.13252692118254095 and parameters: {'n_estimators': 137, 'max_depth': 6, 'min_samples_split': 11, 'min_samples_leaf': 10, 'max_features': 'sqrt'}. Best is trial 2 with value: 2.2204460492503136e-16.
[I 2025-10-16 03:43:43,601] Trial 17 finished with value: 2.2204460492503136e-16 and parameters: {'n_estimators': 87, 'max_depth': 9, 'min_samples_split': 15, 'min_samples_leaf': 4, 'max_features': None}. Best is trial 2 with value: 2.2204460492503136e-16.
[I 2025-10-16 03:43:50,849] Trial 18 finished with value: 2.2204460492503136e-16 and parameters: {'n_estimators': 159, 'max_depth': 7, 'min_samples_split': 9, 'min_samples_leaf': 8, 'max_features': None}. Best is trial 2 with value: 2.2204460492503136e-16.
[I 2025-10-16 03:43:52,490] Trial 19 finished with value: 0.0494519097746752 and parameters: {'n_estimators': 101, 'max_depth': 11, 'min_samples_split': 4, 'min_samples_leaf': 2, 'max_features': 'sqrt'}. Best is trial 2 with value: 2.2204460492503136e-16.
[I 2025-10-16 03:44:01,916] Trial 20 finished with value: 2.2204460492503136e-16 and parameters: {'n_estimators': 187, 'max_depth': 5, 'min_samples_split': 12, 'min_samples_leaf': 7, 'max_features': None}. Best is trial 2 with value: 2.2204460492503136e-16.
[I 2025-10-16 03:44:05,112] Trial 21 finished with value: 2.2204460492503136e-16 and parameters: {'n_estimators': 66, 'max_depth': 4, 'min_samples_split': 8, 'min_samples_leaf': 9, 'max_features': None}. Best is trial 2 with value: 2.2204460492503136e-16.
[I 2025-10-16 03:44:08,193] Trial 22 finished with value: 2.2204460492503136e-16 and parameters: {'n_estimators': 55, 'max_depth': 5, 'min_samples_split': 16, 'min_samples_leaf': 7, 'max_features': None}. Best is trial 2 with value: 2.2204460492503136e-16.
[I 2025-10-16 03:44:11,846] Trial 23 finished with value: 2.2204460492503136e-16 and parameters: {'n_estimators': 78, 'max_depth': 3, 'min_samples_split': 10, 'min_samples_leaf': 5, 'max_features': None}. Best is trial 2 with value: 2.2204460492503136e-16.
[I 2025-10-16 03:44:14,112] Trial 24 finished with value: 2.2204460492503136e-16 and parameters: {'n_estimators': 50, 'max_depth': 5, 'min_samples_split': 2, 'min_samples_leaf': 8, 'max_features': None}. Best is trial 2 with value: 2.2204460492503136e-16.
[I 2025-10-16 03:44:19,283] Trial 25 finished with value: 2.2204460492503136e-16 and parameters: {'n_estimators': 114, 'max_depth': 7, 'min_samples_split': 7, 'min_samples_leaf': 6, 'max_features': None}. Best is trial 2 with value: 2.2204460492503136e-16.
[I 2025-10-16 03:44:23,326] Trial 26 finished with value: 2.2204460492503136e-16 and parameters: {'n_estimators': 93, 'max_depth': 4, 'min_samples_split': 20, 'min_samples_leaf': 4, 'max_features': None}. Best is trial 2 with value: 2.2204460492503136e-16.
[I 2025-10-16 03:44:29,770] Trial 27 finished with value: 2.2204460492503136e-16 and parameters: {'n_estimators': 148, 'max_depth': 8, 'min_samples_split': 5, 'min_samples_leaf': 9, 'max_features': None}. Best is trial 2 with value: 2.2204460492503136e-16.
[I 2025-10-16 03:44:31,010] Trial 28 finished with value: 0.11773900555490091 and parameters: {'n_estimators': 60, 'max_depth': 6, 'min_samples_split': 11, 'min_samples_leaf': 7, 'max_features': 'sqrt'}. Best is trial 2 with value: 2.2204460492503136e-16.
[I 2025-10-16 03:44:33,048] Trial 29 finished with value: 0.23682589082264519 and parameters: {'n_estimators': 126, 'max_depth': 10, 'min_samples_split': 16, 'min_samples_leaf': 2, 'max_features': 'log2'}. Best is trial 2 with value: 2.2204460492503136e-16.
INFO:non_major_league_hyperparameter_tuning:random_forest optimization complete
INFO:non_major_league_hyperparameter_tuning:Best score: 0.0000
INFO:non_major_league_hyperparameter_tuning:Best params: {'n_estimators': 199, 'max_depth': 9, 'min_samples_split': 14, 'min_samples_leaf': 6, 'max_features': None}
INFO:non_major_league_hyperparameter_tuning:Optimizing logistic_regression (priority: 4)
INFO:non_major_league_hyperparameter_tuning:Optimizing hyperparameters for logistic_regression
[I 2025-10-16 03:44:33,056] A new study created in memory with name: no-name-b522c406-488c-4096-aa7b-8df31e9d510c
[I 2025-10-16 03:44:33,212] Trial 0 finished with value: 0.0016954006516467681 and parameters: {'C': 8.93092299432207, 'max_iter': 546, 'solver': 'lbfgs'}. Best is trial 0 with value: 0.0016954006516467681.
[I 2025-10-16 03:44:33,693] Trial 1 finished with value: 0.04268075442266061 and parameters: {'C': 1.9430930223229497, 'max_iter': 137, 'solver': 'liblinear'}. Best is trial 0 with value: 0.0016954006516467681.
[I 2025-10-16 03:44:33,865] Trial 2 finished with value: 0.0021808460368305544 and parameters: {'C': 6.652982541055794, 'max_iter': 333, 'solver': 'lbfgs'}. Best is trial 0 with value: 0.0016954006516467681.
[I 2025-10-16 03:44:34,003] Trial 3 finished with value: 0.002136910909249388 and parameters: {'C': 6.881871736278448, 'max_iter': 183, 'solver': 'lbfgs'}. Best is trial 0 with value: 0.0016954006516467681.
[I 2025-10-16 03:44:34,164] Trial 4 finished with value: 0.0016921412947448124 and parameters: {'C': 8.952912073789122, 'max_iter': 847, 'solver': 'lbfgs'}. Best is trial 4 with value: 0.0016921412947448124.
[I 2025-10-16 03:44:34,470] Trial 5 finished with value: 0.0025282803525560047 and parameters: {'C': 4.780546177884633, 'max_iter': 917, 'solver': 'lbfgs'}. Best is trial 4 with value: 0.0016921412947448124.
[I 2025-10-16 03:44:34,738] Trial 6 finished with value: 0.0016179492319760179 and parameters: {'C': 9.986000402278544, 'max_iter': 132, 'solver': 'lbfgs'}. Best is trial 6 with value: 0.0016179492319760179.
[I 2025-10-16 03:44:34,982] Trial 7 finished with value: 0.002587998275904014 and parameters: {'C': 4.41343608288962, 'max_iter': 571, 'solver': 'lbfgs'}. Best is trial 6 with value: 0.0016179492319760179.
[I 2025-10-16 03:44:35,379] Trial 8 finished with value: 0.02711715320177555 and parameters: {'C': 5.064422987910327, 'max_iter': 756, 'solver': 'liblinear'}. Best is trial 6 with value: 0.0016179492319760179.
[I 2025-10-16 03:44:35,844] Trial 9 finished with value: 0.019880803521509286 and parameters: {'C': 9.954327541843274, 'max_iter': 990, 'solver': 'liblinear'}. Best is trial 6 with value: 0.0016179492319760179.
[I 2025-10-16 03:44:36,237] Trial 10 finished with value: 0.08966381843260672 and parameters: {'C': 0.41654181573390936, 'max_iter': 363, 'solver': 'liblinear'}. Best is trial 6 with value: 0.0016179492319760179.
[I 2025-10-16 03:44:36,469] Trial 11 finished with value: 0.0017277424919848166 and parameters: {'C': 8.718163916003318, 'max_iter': 758, 'solver': 'lbfgs'}. Best is trial 6 with value: 0.0016179492319760179.
[I 2025-10-16 03:44:36,649] Trial 12 finished with value: 0.00162261157161768 and parameters: {'C': 9.944401188132508, 'max_iter': 627, 'solver': 'lbfgs'}. Best is trial 6 with value: 0.0016179492319760179.
[I 2025-10-16 03:44:36,831] Trial 13 finished with value: 0.0019719013940383092 and parameters: {'C': 7.6865321306244025, 'max_iter': 549, 'solver': 'lbfgs'}. Best is trial 6 with value: 0.0016179492319760179.
[I 2025-10-16 03:44:37,010] Trial 14 finished with value: 0.0016238988708798 and parameters: {'C': 9.93296230657372, 'max_iter': 417, 'solver': 'lbfgs'}. Best is trial 6 with value: 0.0016179492319760179.
[I 2025-10-16 03:44:37,266] Trial 15 finished with value: 0.0020005870210640982 and parameters: {'C': 7.537421220511177, 'max_iter': 681, 'solver': 'lbfgs'}. Best is trial 6 with value: 0.0016179492319760179.
[I 2025-10-16 03:44:37,632] Trial 16 finished with value: 0.003318132940487026 and parameters: {'C': 3.203268188516545, 'max_iter': 276, 'solver': 'lbfgs'}. Best is trial 6 with value: 0.0016179492319760179.
[I 2025-10-16 03:44:37,953] Trial 17 finished with value: 0.002330186378957865 and parameters: {'C': 5.78626487092384, 'max_iter': 445, 'solver': 'lbfgs'}. Best is trial 6 with value: 0.0016179492319760179.
[I 2025-10-16 03:44:38,476] Trial 18 finished with value: 0.02162474736378305 and parameters: {'C': 8.269841820845244, 'max_iter': 659, 'solver': 'liblinear'}. Best is trial 6 with value: 0.0016179492319760179.
[I 2025-10-16 03:44:38,814] Trial 19 finished with value: 0.0016640964137133128 and parameters: {'C': 9.505775161589037, 'max_iter': 246, 'solver': 'lbfgs'}. Best is trial 6 with value: 0.0016179492319760179.
[I 2025-10-16 03:44:39,127] Trial 20 finished with value: 0.00220520806427575 and parameters: {'C': 6.419787860843511, 'max_iter': 466, 'solver': 'lbfgs'}. Best is trial 6 with value: 0.0016179492319760179.
[I 2025-10-16 03:44:39,414] Trial 21 finished with value: 0.0016322896080205927 and parameters: {'C': 9.858895836182542, 'max_iter': 108, 'solver': 'lbfgs'}. Best is trial 6 with value: 0.0016179492319760179.
[I 2025-10-16 03:44:39,644] Trial 22 finished with value: 0.001904922044920895 and parameters: {'C': 8.054437756779983, 'max_iter': 435, 'solver': 'lbfgs'}. Best is trial 6 with value: 0.0016179492319760179.
[I 2025-10-16 03:44:39,854] Trial 23 finished with value: 0.0016205851938755021 and parameters: {'C': 9.962448546429693, 'max_iter': 650, 'solver': 'lbfgs'}. Best is trial 6 with value: 0.0016179492319760179.
[I 2025-10-16 03:44:40,141] Trial 24 finished with value: 0.0017005092518850528 and parameters: {'C': 8.89666389457389, 'max_iter': 628, 'solver': 'lbfgs'}. Best is trial 6 with value: 0.0016179492319760179.
[I 2025-10-16 03:44:40,369] Trial 25 finished with value: 0.00203291495188724 and parameters: {'C': 7.375010960948449, 'max_iter': 813, 'solver': 'lbfgs'}. Best is trial 6 with value: 0.0016179492319760179.
[I 2025-10-16 03:44:40,810] Trial 26 finished with value: 0.020679608174553804 and parameters: {'C': 9.12638546223726, 'max_iter': 614, 'solver': 'liblinear'}. Best is trial 6 with value: 0.0016179492319760179.
[I 2025-10-16 03:44:40,983] Trial 27 finished with value: 0.0018448161080176027 and parameters: {'C': 8.410333558439879, 'max_iter': 722, 'solver': 'lbfgs'}. Best is trial 6 with value: 0.0016179492319760179.
[I 2025-10-16 03:44:41,247] Trial 28 finished with value: 0.003152593736431906 and parameters: {'C': 3.380602016977448, 'max_iter': 504, 'solver': 'lbfgs'}. Best is trial 6 with value: 0.0016179492319760179.
