2025-10-15 23:43:14,478 - phase2_integration - INFO - Output directory: ./pipeline_output/phase2_output
2025-10-15 23:43:14,478 - phase2_integration - INFO - Starting Phase 2 pipeline for E1
2025-10-15 23:43:14,479 - phase2_integration - INFO - Step 1: Loading and preparing data
2025-10-15 23:43:14,479 - phase2_integration - INFO - Loading data from ./pipeline_output/phase1_output/E1_features.csv
2025-10-15 23:43:14,609 - phase2_integration - INFO - Loaded 570 samples with 253 features
2025-10-15 23:43:14,609 - phase2_integration - INFO - Step 2: Model Architecture Design
2025-10-15 23:43:14,609 - phase2_integration - INFO - Designing model architecture
2025-10-15 23:43:14,623 - non_major_league_model_architecture - INFO - Creating base models for non-major leagues
2025-10-15 23:43:14,624 - non_major_league_model_architecture - INFO - Created 4 base models
2025-10-15 23:43:14,624 - non_major_league_model_architecture - INFO - Training base models
2025-10-15 23:43:14,627 - non_major_league_model_architecture - INFO - Calculated class weights: {np.int64(0): np.float64(1.036615532029404), np.int64(1): np.float64(1.176727620508443), np.int64(2): np.float64(0.8484672593300355)}
2025-10-15 23:43:14,627 - non_major_league_model_architecture - INFO - Training xgboost...
2025-10-15 23:43:14,627 - non_major_league_model_architecture - ERROR - Error training xgboost: XGBClassifier.fit() got an unexpected keyword argument 'early_stopping_rounds'
2025-10-15 23:43:14,628 - non_major_league_model_architecture - INFO - Training lightgbm...
2025-10-15 23:43:14,652 - non_major_league_model_architecture - ERROR - Error training lightgbm: pandas dtypes must be int, float or bool.
Fields with bad pandas dtypes: Div: object, Date: object, Time: object, HomeTeam: object, AwayTeam: object, FTR: object, HTR: object, Referee: object, league: object, season: object, data_source: object, season_phase: object
2025-10-15 23:43:14,652 - non_major_league_model_architecture - INFO - Training random_forest...
2025-10-15 23:43:14,664 - non_major_league_model_architecture - ERROR - Error training random_forest: could not convert string to float: 'E1'
2025-10-15 23:43:14,667 - non_major_league_model_architecture - INFO - Training logistic_regression...
2025-10-15 23:43:14,680 - non_major_league_model_architecture - ERROR - Error training logistic_regression: could not convert string to float: 'E1'
2025-10-15 23:43:14,683 - non_major_league_model_architecture - INFO - Creating ensemble model
2025-10-15 23:43:14,683 - non_major_league_model_architecture - WARNING - Not enough successful models for ensemble
2025-10-15 23:43:14,683 - non_major_league_model_architecture - INFO - Training ensemble model
2025-10-15 23:43:14,684 - non_major_league_model_architecture - ERROR - No ensemble model created
2025-10-15 23:43:14,684 - non_major_league_model_architecture - INFO - Calibrating model probabilities
2025-10-15 23:43:14,697 - non_major_league_model_architecture - ERROR - Error calibrating xgboost: DataFrame.dtypes for data must be int, float, bool or category. When categorical type is supplied, the experimental DMatrix parameter`enable_categorical` must be set to `True`.  Invalid columns:Div: object, Date: object, Time: object, HomeTeam: object, AwayTeam: object, FTR: object, HTR: object, Referee: object, league: object, season: object, data_source: object, season_phase: object
2025-10-15 23:43:14,710 - non_major_league_model_architecture - ERROR - Error calibrating lightgbm: pandas dtypes must be int, float or bool.
Fields with bad pandas dtypes: Div: object, Date: object, Time: object, HomeTeam: object, AwayTeam: object, FTR: object, HTR: object, Referee: object, league: object, season: object, data_source: object, season_phase: object
2025-10-15 23:43:14,723 - non_major_league_model_architecture - ERROR - Error calibrating random_forest: could not convert string to float: 'E1'
2025-10-15 23:43:14,738 - non_major_league_model_architecture - ERROR - Error calibrating logistic_regression: could not convert string to float: 'E1'
2025-10-15 23:43:14,740 - non_major_league_model_architecture - INFO - Evaluating models
2025-10-15 23:43:14,740 - non_major_league_model_architecture - ERROR - Error evaluating xgboost: need to call fit or load_model beforehand
2025-10-15 23:43:14,741 - non_major_league_model_architecture - ERROR - Error evaluating lightgbm: Estimator not fitted, call fit before exploiting the model.
2025-10-15 23:43:14,741 - non_major_league_model_architecture - ERROR - Error evaluating random_forest: 'RandomForestClassifier' object has no attribute 'estimators_'
2025-10-15 23:43:14,746 - non_major_league_model_architecture - ERROR - Error evaluating logistic_regression: could not convert string to float: 'E1'
2025-10-15 23:43:14,747 - non_major_league_model_architecture - INFO - Calculating feature importance
2025-10-15 23:43:14,747 - phase2_integration - INFO - Step 3: Transfer Learning Setup
2025-10-15 23:43:14,747 - phase2_integration - INFO - Setting up transfer learning
2025-10-15 23:43:14,748 - phase2_integration - INFO - No source data files provided, skipping transfer learning
2025-10-15 23:43:14,748 - phase2_integration - INFO - Step 4: Hyperparameter Tuning
2025-10-15 23:43:14,748 - phase2_integration - INFO - Optimizing hyperparameters
2025-10-15 23:43:14,748 - non_major_league_hyperparameter_tuning - INFO - Optimizing hyperparameters for all models
2025-10-15 23:43:14,748 - non_major_league_hyperparameter_tuning - INFO - Optimizing xgboost (priority: 1)
2025-10-15 23:43:14,749 - non_major_league_hyperparameter_tuning - INFO - Optimizing hyperparameters for xgboost
[I 2025-10-15 23:43:14,749] A new study created in memory with name: no-name-7f7ff006-554c-4182-bacf-6ab3bd41c581
2025-10-15 23:43:14,758 - non_major_league_hyperparameter_tuning - WARNING - Error in fold: DataFrame.dtypes for data must be int, float, bool or category. When categorical type is supplied, the experimental DMatrix parameter`enable_categorical` must be set to `True`.  Invalid columns:Div: object, Date: object, Time: object, HomeTeam: object, AwayTeam: object, FTR: object, HTR: object, Referee: object, league: object, season: object, data_source: object, season_phase: object
2025-10-15 23:43:14,765 - non_major_league_hyperparameter_tuning - WARNING - Error in fold: DataFrame.dtypes for data must be int, float, bool or category. When categorical type is supplied, the experimental DMatrix parameter`enable_categorical` must be set to `True`.  Invalid columns:Div: object, Date: object, Time: object, HomeTeam: object, AwayTeam: object, FTR: object, HTR: object, Referee: object, league: object, season: object, data_source: object, season_phase: object
2025-10-15 23:43:14,772 - non_major_league_hyperparameter_tuning - WARNING - Error in fold: DataFrame.dtypes for data must be int, float, bool or category. When categorical type is supplied, the experimental DMatrix parameter`enable_categorical` must be set to `True`.  Invalid columns:Div: object, Date: object, Time: object, HomeTeam: object, AwayTeam: object, FTR: object, HTR: object, Referee: object, league: object, season: object, data_source: object, season_phase: object
[I 2025-10-15 23:43:14,772] Trial 0 finished with value: inf and parameters: {'n_estimators': 147, 'max_depth': 6, 'learning_rate': 0.04329224561404604, 'subsample': 0.6252859146052442, 'colsample_bytree': 0.8219908317418846, 'min_child_weight': 10, 'reg_alpha': 0.7638353352557705, 'reg_lambda': 0.5737967482168251}. Best is trial 0 with value: inf.
2025-10-15 23:43:14,780 - non_major_league_hyperparameter_tuning - WARNING - Error in fold: DataFrame.dtypes for data must be int, float, bool or category. When categorical type is supplied, the experimental DMatrix parameter`enable_categorical` must be set to `True`.  Invalid columns:Div: object, Date: object, Time: object, HomeTeam: object, AwayTeam: object, FTR: object, HTR: object, Referee: object, league: object, season: object, data_source: object, season_phase: object
2025-10-15 23:43:14,785 - non_major_league_hyperparameter_tuning - WARNING - Error in fold: DataFrame.dtypes for data must be int, float, bool or category. When categorical type is supplied, the experimental DMatrix parameter`enable_categorical` must be set to `True`.  Invalid columns:Div: object, Date: object, Time: object, HomeTeam: object, AwayTeam: object, FTR: object, HTR: object, Referee: object, league: object, season: object, data_source: object, season_phase: object
2025-10-15 23:43:14,791 - non_major_league_hyperparameter_tuning - WARNING - Error in fold: DataFrame.dtypes for data must be int, float, bool or category. When categorical type is supplied, the experimental DMatrix parameter`enable_categorical` must be set to `True`.  Invalid columns:Div: object, Date: object, Time: object, HomeTeam: object, AwayTeam: object, FTR: object, HTR: object, Referee: object, league: object, season: object, data_source: object, season_phase: object
[I 2025-10-15 23:43:14,791] Trial 1 finished with value: inf and parameters: {'n_estimators': 91, 'max_depth': 6, 'learning_rate': 0.07293912619922387, 'subsample': 0.9434023535985823, 'colsample_bytree': 0.9128888166067676, 'min_child_weight': 8, 'reg_alpha': 0.6150079596661722, 'reg_lambda': 1.9434139462712416}. Best is trial 0 with value: inf.
2025-10-15 23:43:14,799 - non_major_league_hyperparameter_tuning - WARNING - Error in fold: DataFrame.dtypes for data must be int, float, bool or category. When categorical type is supplied, the experimental DMatrix parameter`enable_categorical` must be set to `True`.  Invalid columns:Div: object, Date: object, Time: object, HomeTeam: object, AwayTeam: object, FTR: object, HTR: object, Referee: object, league: object, season: object, data_source: object, season_phase: object
2025-10-15 23:43:14,804 - non_major_league_hyperparameter_tuning - WARNING - Error in fold: DataFrame.dtypes for data must be int, float, bool or category. When categorical type is supplied, the experimental DMatrix parameter`enable_categorical` must be set to `True`.  Invalid columns:Div: object, Date: object, Time: object, HomeTeam: object, AwayTeam: object, FTR: object, HTR: object, Referee: object, league: object, season: object, data_source: object, season_phase: object
2025-10-15 23:43:14,810 - non_major_league_hyperparameter_tuning - WARNING - Error in fold: DataFrame.dtypes for data must be int, float, bool or category. When categorical type is supplied, the experimental DMatrix parameter`enable_categorical` must be set to `True`.  Invalid columns:Div: object, Date: object, Time: object, HomeTeam: object, AwayTeam: object, FTR: object, HTR: object, Referee: object, league: object, season: object, data_source: object, season_phase: object
[I 2025-10-15 23:43:14,810] Trial 2 finished with value: inf and parameters: {'n_estimators': 72, 'max_depth': 4, 'learning_rate': 0.021225302012767733, 'subsample': 0.8468887709947197, 'colsample_bytree': 0.9859228675706444, 'min_child_weight': 6, 'reg_alpha': 0.8906923502094521, 'reg_lambda': 1.9831378594658882}. Best is trial 0 with value: inf.
2025-10-15 23:43:14,818 - non_major_league_hyperparameter_tuning - WARNING - Error in fold: DataFrame.dtypes for data must be int, float, bool or category. When categorical type is supplied, the experimental DMatrix parameter`enable_categorical` must be set to `True`.  Invalid columns:Div: object, Date: object, Time: object, HomeTeam: object, AwayTeam: object, FTR: object, HTR: object, Referee: object, league: object, season: object, data_source: object, season_phase: object
2025-10-15 23:43:14,824 - non_major_league_hyperparameter_tuning - WARNING - Error in fold: DataFrame.dtypes for data must be int, float, bool or category. When categorical type is supplied, the experimental DMatrix parameter`enable_categorical` must be set to `True`.  Invalid columns:Div: object, Date: object, Time: object, HomeTeam: object, AwayTeam: object, FTR: object, HTR: object, Referee: object, league: object, season: object, data_source: object, season_phase: object
2025-10-15 23:43:14,830 - non_major_league_hyperparameter_tuning - WARNING - Error in fold: DataFrame.dtypes for data must be int, float, bool or category. When categorical type is supplied, the experimental DMatrix parameter`enable_categorical` must be set to `True`.  Invalid columns:Div: object, Date: object, Time: object, HomeTeam: object, AwayTeam: object, FTR: object, HTR: object, Referee: object, league: object, season: object, data_source: object, season_phase: object
[I 2025-10-15 23:43:14,831] Trial 3 finished with value: inf and parameters: {'n_estimators': 122, 'max_depth': 6, 'learning_rate': 0.09113721584976965, 'subsample': 0.976690521849288, 'colsample_bytree': 0.7413131211245696, 'min_child_weight': 2, 'reg_alpha': 0.943284558291469, 'reg_lambda': 1.3541800357449603}. Best is trial 0 with value: inf.
2025-10-15 23:43:14,841 - non_major_league_hyperparameter_tuning - WARNING - Error in fold: DataFrame.dtypes for data must be int, float, bool or category. When categorical type is supplied, the experimental DMatrix parameter`enable_categorical` must be set to `True`.  Invalid columns:Div: object, Date: object, Time: object, HomeTeam: object, AwayTeam: object, FTR: object, HTR: object, Referee: object, league: object, season: object, data_source: object, season_phase: object
2025-10-15 23:43:14,848 - non_major_league_hyperparameter_tuning - WARNING - Error in fold: DataFrame.dtypes for data must be int, float, bool or category. When categorical type is supplied, the experimental DMatrix parameter`enable_categorical` must be set to `True`.  Invalid columns:Div: object, Date: object, Time: object, HomeTeam: object, AwayTeam: object, FTR: object, HTR: object, Referee: object, league: object, season: object, data_source: object, season_phase: object
2025-10-15 23:43:14,854 - non_major_league_hyperparameter_tuning - WARNING - Error in fold: DataFrame.dtypes for data must be int, float, bool or category. When categorical type is supplied, the experimental DMatrix parameter`enable_categorical` must be set to `True`.  Invalid columns:Div: object, Date: object, Time: object, HomeTeam: object, AwayTeam: object, FTR: object, HTR: object, Referee: object, league: object, season: object, data_source: object, season_phase: object
[I 2025-10-15 23:43:14,856] Trial 4 finished with value: inf and parameters: {'n_estimators': 105, 'max_depth': 4, 'learning_rate': 0.06945615060210301, 'subsample': 0.8774413429792975, 'colsample_bytree': 0.99362501702112, 'min_child_weight': 9, 'reg_alpha': 0.999132159970294, 'reg_lambda': 1.2141642984006527}. Best is trial 0 with value: inf.
2025-10-15 23:43:14,864 - non_major_league_hyperparameter_tuning - WARNING - Error in fold: DataFrame.dtypes for data must be int, float, bool or category. When categorical type is supplied, the experimental DMatrix parameter`enable_categorical` must be set to `True`.  Invalid columns:Div: object, Date: object, Time: object, HomeTeam: object, AwayTeam: object, FTR: object, HTR: object, Referee: object, league: object, season: object, data_source: object, season_phase: object
2025-10-15 23:43:14,869 - non_major_league_hyperparameter_tuning - WARNING - Error in fold: DataFrame.dtypes for data must be int, float, bool or category. When categorical type is supplied, the experimental DMatrix parameter`enable_categorical` must be set to `True`.  Invalid columns:Div: object, Date: object, Time: object, HomeTeam: object, AwayTeam: object, FTR: object, HTR: object, Referee: object, league: object, season: object, data_source: object, season_phase: object
2025-10-15 23:43:14,874 - non_major_league_hyperparameter_tuning - WARNING - Error in fold: DataFrame.dtypes for data must be int, float, bool or category. When categorical type is supplied, the experimental DMatrix parameter`enable_categorical` must be set to `True`.  Invalid columns:Div: object, Date: object, Time: object, HomeTeam: object, AwayTeam: object, FTR: object, HTR: object, Referee: object, league: object, season: object, data_source: object, season_phase: object
[I 2025-10-15 23:43:14,875] Trial 5 finished with value: inf and parameters: {'n_estimators': 174, 'max_depth': 7, 'learning_rate': 0.05529890292275695, 'subsample': 0.9003820828132725, 'colsample_bytree': 0.880205388456095, 'min_child_weight': 6, 'reg_alpha': 0.28481551150150897, 'reg_lambda': 1.5073726941903378}. Best is trial 0 with value: inf.
2025-10-15 23:43:14,884 - non_major_league_hyperparameter_tuning - WARNING - Error in fold: DataFrame.dtypes for data must be int, float, bool or category. When categorical type is supplied, the experimental DMatrix parameter`enable_categorical` must be set to `True`.  Invalid columns:Div: object, Date: object, Time: object, HomeTeam: object, AwayTeam: object, FTR: object, HTR: object, Referee: object, league: object, season: object, data_source: object, season_phase: object
2025-10-15 23:43:14,891 - non_major_league_hyperparameter_tuning - WARNING - Error in fold: DataFrame.dtypes for data must be int, float, bool or category. When categorical type is supplied, the experimental DMatrix parameter`enable_categorical` must be set to `True`.  Invalid columns:Div: object, Date: object, Time: object, HomeTeam: object, AwayTeam: object, FTR: object, HTR: object, Referee: object, league: object, season: object, data_source: object, season_phase: object
2025-10-15 23:43:14,896 - non_major_league_hyperparameter_tuning - WARNING - Error in fold: DataFrame.dtypes for data must be int, float, bool or category. When categorical type is supplied, the experimental DMatrix parameter`enable_categorical` must be set to `True`.  Invalid columns:Div: object, Date: object, Time: object, HomeTeam: object, AwayTeam: object, FTR: object, HTR: object, Referee: object, league: object, season: object, data_source: object, season_phase: object
[I 2025-10-15 23:43:14,897] Trial 6 finished with value: inf and parameters: {'n_estimators': 193, 'max_depth': 6, 'learning_rate': 0.0595973048375727, 'subsample': 0.8538324164698703, 'colsample_bytree': 0.8635560046083712, 'min_child_weight': 8, 'reg_alpha': 0.21911908495998833, 'reg_lambda': 0.7979476077573016}. Best is trial 0 with value: inf.
2025-10-15 23:43:14,907 - non_major_league_hyperparameter_tuning - WARNING - Error in fold: DataFrame.dtypes for data must be int, float, bool or category. When categorical type is supplied, the experimental DMatrix parameter`enable_categorical` must be set to `True`.  Invalid columns:Div: object, Date: object, Time: object, HomeTeam: object, AwayTeam: object, FTR: object, HTR: object, Referee: object, league: object, season: object, data_source: object, season_phase: object
2025-10-15 23:43:14,913 - non_major_league_hyperparameter_tuning - WARNING - Error in fold: DataFrame.dtypes for data must be int, float, bool or category. When categorical type is supplied, the experimental DMatrix parameter`enable_categorical` must be set to `True`.  Invalid columns:Div: object, Date: object, Time: object, HomeTeam: object, AwayTeam: object, FTR: object, HTR: object, Referee: object, league: object, season: object, data_source: object, season_phase: object
2025-10-15 23:43:14,918 - non_major_league_hyperparameter_tuning - WARNING - Error in fold: DataFrame.dtypes for data must be int, float, bool or category. When categorical type is supplied, the experimental DMatrix parameter`enable_categorical` must be set to `True`.  Invalid columns:Div: object, Date: object, Time: object, HomeTeam: object, AwayTeam: object, FTR: object, HTR: object, Referee: object, league: object, season: object, data_source: object, season_phase: object
[I 2025-10-15 23:43:14,918] Trial 7 finished with value: inf and parameters: {'n_estimators': 86, 'max_depth': 5, 'learning_rate': 0.07402938634533741, 'subsample': 0.906603179551132, 'colsample_bytree': 0.6990666153627213, 'min_child_weight': 7, 'reg_alpha': 0.8131717858954387, 'reg_lambda': 0.33334836326003114}. Best is trial 0 with value: inf.
2025-10-15 23:43:14,927 - non_major_league_hyperparameter_tuning - WARNING - Error in fold: DataFrame.dtypes for data must be int, float, bool or category. When categorical type is supplied, the experimental DMatrix parameter`enable_categorical` must be set to `True`.  Invalid columns:Div: object, Date: object, Time: object, HomeTeam: object, AwayTeam: object, FTR: object, HTR: object, Referee: object, league: object, season: object, data_source: object, season_phase: object
2025-10-15 23:43:14,934 - non_major_league_hyperparameter_tuning - WARNING - Error in fold: DataFrame.dtypes for data must be int, float, bool or category. When categorical type is supplied, the experimental DMatrix parameter`enable_categorical` must be set to `True`.  Invalid columns:Div: object, Date: object, Time: object, HomeTeam: object, AwayTeam: object, FTR: object, HTR: object, Referee: object, league: object, season: object, data_source: object, season_phase: object
2025-10-15 23:43:14,940 - non_major_league_hyperparameter_tuning - WARNING - Error in fold: DataFrame.dtypes for data must be int, float, bool or category. When categorical type is supplied, the experimental DMatrix parameter`enable_categorical` must be set to `True`.  Invalid columns:Div: object, Date: object, Time: object, HomeTeam: object, AwayTeam: object, FTR: object, HTR: object, Referee: object, league: object, season: object, data_source: object, season_phase: object
