[I 2025-10-16 00:08:54,067] Trial 29 finished with value: 0.005206733112645775 and parameters: {'n_estimators': 152, 'max_depth': 7, 'learning_rate': 0.04856963060205468, 'num_leaves': 90, 'feature_fraction': 0.6718785963739953, 'bagging_fraction': 0.9771630890935546, 'bagging_freq': 4, 'lambda_l1': 0.29075337251942707, 'lambda_l2': 1.1042955171545308, 'min_data_in_leaf': 8}. Best is trial 17 with value: 0.00010515328942091435.
2025-10-16 00:08:54,078 - non_major_league_hyperparameter_tuning - INFO - lightgbm optimization complete
2025-10-16 00:08:54,078 - non_major_league_hyperparameter_tuning - INFO - Best score: 0.0001
2025-10-16 00:08:54,079 - non_major_league_hyperparameter_tuning - INFO - Best params: {'n_estimators': 180, 'max_depth': 7, 'learning_rate': 0.044155348585934756, 'num_leaves': 69, 'feature_fraction': 0.6454648841585607, 'bagging_fraction': 0.7671828052679323, 'bagging_freq': 5, 'lambda_l1': 0.0009365388901337052, 'lambda_l2': 0.010781998857585295, 'min_data_in_leaf': 24}
2025-10-16 00:08:54,079 - non_major_league_hyperparameter_tuning - INFO - Optimizing random_forest (priority: 3)
2025-10-16 00:08:54,079 - non_major_league_hyperparameter_tuning - INFO - Optimizing hyperparameters for random_forest
[I 2025-10-16 00:08:54,080] A new study created in memory with name: no-name-9efa7ebe-3db5-42c8-afaf-279c0c2f0082
[I 2025-10-16 00:08:58,206] Trial 0 finished with value: 2.2204460492503136e-16 and parameters: {'n_estimators': 161, 'max_depth': 13, 'min_samples_split': 17, 'min_samples_leaf': 7, 'max_features': None}. Best is trial 0 with value: 2.2204460492503136e-16.
[I 2025-10-16 00:09:02,971] Trial 1 finished with value: 2.2204460492503136e-16 and parameters: {'n_estimators': 183, 'max_depth': 15, 'min_samples_split': 18, 'min_samples_leaf': 5, 'max_features': None}. Best is trial 0 with value: 2.2204460492503136e-16.
[I 2025-10-16 00:09:07,994] Trial 2 finished with value: 2.2204460492503136e-16 and parameters: {'n_estimators': 196, 'max_depth': 12, 'min_samples_split': 14, 'min_samples_leaf': 7, 'max_features': None}. Best is trial 0 with value: 2.2204460492503136e-16.
[I 2025-10-16 00:09:09,833] Trial 3 finished with value: 0.13429888324486164 and parameters: {'n_estimators': 193, 'max_depth': 5, 'min_samples_split': 16, 'min_samples_leaf': 5, 'max_features': 'sqrt'}. Best is trial 0 with value: 2.2204460492503136e-16.
[I 2025-10-16 00:09:11,339] Trial 4 finished with value: 0.4021321469071359 and parameters: {'n_estimators': 172, 'max_depth': 12, 'min_samples_split': 7, 'min_samples_leaf': 9, 'max_features': 'log2'}. Best is trial 0 with value: 2.2204460492503136e-16.
[I 2025-10-16 00:09:12,362] Trial 5 finished with value: 0.3808422488620066 and parameters: {'n_estimators': 107, 'max_depth': 11, 'min_samples_split': 5, 'min_samples_leaf': 8, 'max_features': 'log2'}. Best is trial 0 with value: 2.2204460492503136e-16.
[I 2025-10-16 00:09:13,338] Trial 6 finished with value: 0.30412182835380847 and parameters: {'n_estimators': 102, 'max_depth': 11, 'min_samples_split': 16, 'min_samples_leaf': 2, 'max_features': 'log2'}. Best is trial 0 with value: 2.2204460492503136e-16.
[I 2025-10-16 00:09:13,892] Trial 7 finished with value: 0.19663253273099554 and parameters: {'n_estimators': 51, 'max_depth': 4, 'min_samples_split': 2, 'min_samples_leaf': 7, 'max_features': 'sqrt'}. Best is trial 0 with value: 2.2204460492503136e-16.
[I 2025-10-16 00:09:17,287] Trial 8 finished with value: 2.2204460492503136e-16 and parameters: {'n_estimators': 128, 'max_depth': 7, 'min_samples_split': 7, 'min_samples_leaf': 1, 'max_features': None}. Best is trial 0 with value: 2.2204460492503136e-16.
[I 2025-10-16 00:09:17,937] Trial 9 finished with value: 0.5429745024736589 and parameters: {'n_estimators': 77, 'max_depth': 3, 'min_samples_split': 7, 'min_samples_leaf': 7, 'max_features': 'log2'}. Best is trial 0 with value: 2.2204460492503136e-16.
[I 2025-10-16 00:09:21,786] Trial 10 finished with value: 2.2204460492503136e-16 and parameters: {'n_estimators': 150, 'max_depth': 15, 'min_samples_split': 20, 'min_samples_leaf': 10, 'max_features': None}. Best is trial 0 with value: 2.2204460492503136e-16.
[I 2025-10-16 00:09:25,834] Trial 11 finished with value: 2.2204460492503136e-16 and parameters: {'n_estimators': 157, 'max_depth': 15, 'min_samples_split': 20, 'min_samples_leaf': 4, 'max_features': None}. Best is trial 0 with value: 2.2204460492503136e-16.
[I 2025-10-16 00:09:30,407] Trial 12 finished with value: 2.2204460492503136e-16 and parameters: {'n_estimators': 173, 'max_depth': 14, 'min_samples_split': 13, 'min_samples_leaf': 4, 'max_features': None}. Best is trial 0 with value: 2.2204460492503136e-16.
[I 2025-10-16 00:09:34,078] Trial 13 finished with value: 2.2204460492503136e-16 and parameters: {'n_estimators': 142, 'max_depth': 13, 'min_samples_split': 18, 'min_samples_leaf': 5, 'max_features': None}. Best is trial 0 with value: 2.2204460492503136e-16.
[I 2025-10-16 00:09:38,839] Trial 14 finished with value: 2.2204460492503136e-16 and parameters: {'n_estimators': 173, 'max_depth': 9, 'min_samples_split': 11, 'min_samples_leaf': 3, 'max_features': None}. Best is trial 0 with value: 2.2204460492503136e-16.
[I 2025-10-16 00:09:44,030] Trial 15 finished with value: 2.2204460492503136e-16 and parameters: {'n_estimators': 199, 'max_depth': 9, 'min_samples_split': 17, 'min_samples_leaf': 6, 'max_features': None}. Best is trial 0 with value: 2.2204460492503136e-16.
[I 2025-10-16 00:09:45,246] Trial 16 finished with value: 0.1648821655429885 and parameters: {'n_estimators': 128, 'max_depth': 14, 'min_samples_split': 14, 'min_samples_leaf': 9, 'max_features': 'sqrt'}. Best is trial 0 with value: 2.2204460492503136e-16.
[I 2025-10-16 00:09:49,404] Trial 17 finished with value: 2.2204460492503136e-16 and parameters: {'n_estimators': 161, 'max_depth': 10, 'min_samples_split': 11, 'min_samples_leaf': 6, 'max_features': None}. Best is trial 0 with value: 2.2204460492503136e-16.
[I 2025-10-16 00:09:53,904] Trial 18 finished with value: 2.2204460492503136e-16 and parameters: {'n_estimators': 180, 'max_depth': 7, 'min_samples_split': 18, 'min_samples_leaf': 4, 'max_features': None}. Best is trial 0 with value: 2.2204460492503136e-16.
[I 2025-10-16 00:09:55,262] Trial 19 finished with value: 0.15057132156836703 and parameters: {'n_estimators': 141, 'max_depth': 13, 'min_samples_split': 13, 'min_samples_leaf': 8, 'max_features': 'sqrt'}. Best is trial 0 with value: 2.2204460492503136e-16.
[I 2025-10-16 00:09:58,220] Trial 20 finished with value: 2.2204460492503136e-16 and parameters: {'n_estimators': 114, 'max_depth': 15, 'min_samples_split': 20, 'min_samples_leaf': 3, 'max_features': None}. Best is trial 0 with value: 2.2204460492503136e-16.
[I 2025-10-16 00:10:02,746] Trial 21 finished with value: 2.2204460492503136e-16 and parameters: {'n_estimators': 184, 'max_depth': 13, 'min_samples_split': 15, 'min_samples_leaf': 7, 'max_features': None}. Best is trial 0 with value: 2.2204460492503136e-16.
[I 2025-10-16 00:10:07,373] Trial 22 finished with value: 2.2204460492503136e-16 and parameters: {'n_estimators': 191, 'max_depth': 12, 'min_samples_split': 18, 'min_samples_leaf': 6, 'max_features': None}. Best is trial 0 with value: 2.2204460492503136e-16.
[I 2025-10-16 00:10:12,269] Trial 23 finished with value: 2.2204460492503136e-16 and parameters: {'n_estimators': 199, 'max_depth': 14, 'min_samples_split': 12, 'min_samples_leaf': 8, 'max_features': None}. Best is trial 0 with value: 2.2204460492503136e-16.
[I 2025-10-16 00:10:16,214] Trial 24 finished with value: 2.2204460492503136e-16 and parameters: {'n_estimators': 159, 'max_depth': 12, 'min_samples_split': 15, 'min_samples_leaf': 5, 'max_features': None}. Best is trial 0 with value: 2.2204460492503136e-16.
[I 2025-10-16 00:10:20,610] Trial 25 finished with value: 2.2204460492503136e-16 and parameters: {'n_estimators': 182, 'max_depth': 10, 'min_samples_split': 10, 'min_samples_leaf': 7, 'max_features': None}. Best is trial 0 with value: 2.2204460492503136e-16.
[I 2025-10-16 00:10:24,941] Trial 26 finished with value: 2.2204460492503136e-16 and parameters: {'n_estimators': 166, 'max_depth': 14, 'min_samples_split': 17, 'min_samples_leaf': 9, 'max_features': None}. Best is trial 0 with value: 2.2204460492503136e-16.
[I 2025-10-16 00:10:29,988] Trial 27 finished with value: 2.2204460492503136e-16 and parameters: {'n_estimators': 185, 'max_depth': 11, 'min_samples_split': 14, 'min_samples_leaf': 8, 'max_features': None}. Best is trial 0 with value: 2.2204460492503136e-16.
[I 2025-10-16 00:10:31,683] Trial 28 finished with value: 0.1305989268398498 and parameters: {'n_estimators': 144, 'max_depth': 8, 'min_samples_split': 9, 'min_samples_leaf': 6, 'max_features': 'sqrt'}. Best is trial 0 with value: 2.2204460492503136e-16.
[I 2025-10-16 00:10:33,757] Trial 29 finished with value: 0.33240874649627894 and parameters: {'n_estimators': 192, 'max_depth': 13, 'min_samples_split': 16, 'min_samples_leaf': 5, 'max_features': 'log2'}. Best is trial 0 with value: 2.2204460492503136e-16.
2025-10-16 00:10:33,762 - non_major_league_hyperparameter_tuning - INFO - random_forest optimization complete
2025-10-16 00:10:33,762 - non_major_league_hyperparameter_tuning - INFO - Best score: 0.0000
2025-10-16 00:10:33,763 - non_major_league_hyperparameter_tuning - INFO - Best params: {'n_estimators': 161, 'max_depth': 13, 'min_samples_split': 17, 'min_samples_leaf': 7, 'max_features': None}
2025-10-16 00:10:33,763 - non_major_league_hyperparameter_tuning - INFO - Optimizing logistic_regression (priority: 4)
2025-10-16 00:10:33,763 - non_major_league_hyperparameter_tuning - INFO - Optimizing hyperparameters for logistic_regression
[I 2025-10-16 00:10:33,763] A new study created in memory with name: no-name-9b818a7d-4d1e-40f4-9410-9274802aecf3
[I 2025-10-16 00:10:33,892] Trial 0 finished with value: 0.005235553270251581 and parameters: {'C': 5.143808729610779, 'max_iter': 835, 'solver': 'lbfgs'}. Best is trial 0 with value: 0.005235553270251581.
[I 2025-10-16 00:10:34,122] Trial 1 finished with value: 0.06512780714446537 and parameters: {'C': 2.480008853278814, 'max_iter': 548, 'solver': 'liblinear'}. Best is trial 0 with value: 0.005235553270251581.
[I 2025-10-16 00:10:34,346] Trial 2 finished with value: 0.03988223812895141 and parameters: {'C': 9.1293692243077, 'max_iter': 807, 'solver': 'liblinear'}. Best is trial 0 with value: 0.005235553270251581.
[I 2025-10-16 00:10:34,532] Trial 3 finished with value: 0.09462067237700106 and parameters: {'C': 0.9595960287463519, 'max_iter': 225, 'solver': 'liblinear'}. Best is trial 0 with value: 0.005235553270251581.
[I 2025-10-16 00:10:34,686] Trial 4 finished with value: 0.012666748142145598 and parameters: {'C': 2.136402433056103, 'max_iter': 935, 'solver': 'lbfgs'}. Best is trial 0 with value: 0.005235553270251581.
[I 2025-10-16 00:10:34,795] Trial 5 finished with value: 0.007692469582589278 and parameters: {'C': 3.5688084232509305, 'max_iter': 820, 'solver': 'lbfgs'}. Best is trial 0 with value: 0.005235553270251581.
[I 2025-10-16 00:10:35,013] Trial 6 finished with value: 0.04131629916149258 and parameters: {'C': 8.280122471521945, 'max_iter': 569, 'solver': 'liblinear'}. Best is trial 0 with value: 0.005235553270251581.
[I 2025-10-16 00:10:35,224] Trial 7 finished with value: 0.058150709128641065 and parameters: {'C': 3.324689193802364, 'max_iter': 583, 'solver': 'liblinear'}. Best is trial 0 with value: 0.005235553270251581.
[I 2025-10-16 00:10:35,427] Trial 8 finished with value: 0.061591087073284756 and parameters: {'C': 2.8644442381182467, 'max_iter': 960, 'solver': 'liblinear'}. Best is trial 0 with value: 0.005235553270251581.
[I 2025-10-16 00:10:35,560] Trial 9 finished with value: 0.04085956138326258 and parameters: {'C': 0.24405343745626537, 'max_iter': 640, 'solver': 'lbfgs'}. Best is trial 0 with value: 0.005235553270251581.
[I 2025-10-16 00:10:35,680] Trial 10 finished with value: 0.005177935974271547 and parameters: {'C': 5.2276096219425465, 'max_iter': 311, 'solver': 'lbfgs'}. Best is trial 10 with value: 0.005177935974271547.
[I 2025-10-16 00:10:35,805] Trial 11 finished with value: 0.004519337728699028 and parameters: {'C': 6.225229996945602, 'max_iter': 255, 'solver': 'lbfgs'}. Best is trial 11 with value: 0.004519337728699028.
[I 2025-10-16 00:10:35,919] Trial 12 finished with value: 0.00458235457264812 and parameters: {'C': 6.41020505493264, 'max_iter': 198, 'solver': 'lbfgs'}. Best is trial 11 with value: 0.004519337728699028.
[I 2025-10-16 00:10:36,021] Trial 13 finished with value: 0.004375372816288846 and parameters: {'C': 7.1914916589993, 'max_iter': 144, 'solver': 'lbfgs'}. Best is trial 13 with value: 0.004375372816288846.
[I 2025-10-16 00:10:36,123] Trial 14 finished with value: 0.0043471974282163085 and parameters: {'C': 7.164636564703017, 'max_iter': 392, 'solver': 'lbfgs'}. Best is trial 14 with value: 0.0043471974282163085.
[I 2025-10-16 00:10:36,265] Trial 15 finished with value: 0.0040747770935489125 and parameters: {'C': 7.628251203071717, 'max_iter': 388, 'solver': 'lbfgs'}. Best is trial 15 with value: 0.0040747770935489125.
[I 2025-10-16 00:10:36,399] Trial 16 finished with value: 0.0032925058766698975 and parameters: {'C': 9.990465363338105, 'max_iter': 424, 'solver': 'lbfgs'}. Best is trial 16 with value: 0.0032925058766698975.
[I 2025-10-16 00:10:36,516] Trial 17 finished with value: 0.0034416476760349007 and parameters: {'C': 9.454550518091377, 'max_iter': 439, 'solver': 'lbfgs'}. Best is trial 16 with value: 0.0032925058766698975.
[I 2025-10-16 00:10:36,669] Trial 18 finished with value: 0.0032901862153515617 and parameters: {'C': 9.999554314053057, 'max_iter': 441, 'solver': 'lbfgs'}. Best is trial 18 with value: 0.0032901862153515617.
[I 2025-10-16 00:10:36,819] Trial 19 finished with value: 0.003301701033273871 and parameters: {'C': 9.954614217809924, 'max_iter': 501, 'solver': 'lbfgs'}. Best is trial 18 with value: 0.0032901862153515617.
[I 2025-10-16 00:10:36,941] Trial 20 finished with value: 0.003723924321237821 and parameters: {'C': 8.52954120853013, 'max_iter': 694, 'solver': 'lbfgs'}. Best is trial 18 with value: 0.0032901862153515617.
[I 2025-10-16 00:10:37,059] Trial 21 finished with value: 0.0033467523677555232 and parameters: {'C': 9.783161830221903, 'max_iter': 475, 'solver': 'lbfgs'}. Best is trial 18 with value: 0.0032901862153515617.
[I 2025-10-16 00:10:37,185] Trial 22 finished with value: 0.003305638745030866 and parameters: {'C': 9.939348990192643, 'max_iter': 333, 'solver': 'lbfgs'}. Best is trial 18 with value: 0.0032901862153515617.
[I 2025-10-16 00:10:37,302] Trial 23 finished with value: 0.003727096373939405 and parameters: {'C': 8.521047603556143, 'max_iter': 499, 'solver': 'lbfgs'}. Best is trial 18 with value: 0.0032901862153515617.
[I 2025-10-16 00:10:37,400] Trial 24 finished with value: 0.0035635363644611847 and parameters: {'C': 8.980819043327303, 'max_iter': 671, 'solver': 'lbfgs'}. Best is trial 18 with value: 0.0032901862153515617.
[I 2025-10-16 00:10:37,517] Trial 25 finished with value: 0.003981669030671968 and parameters: {'C': 7.87398577516056, 'max_iter': 411, 'solver': 'lbfgs'}. Best is trial 18 with value: 0.0032901862153515617.
[I 2025-10-16 00:10:37,683] Trial 26 finished with value: 0.003484214698488043 and parameters: {'C': 9.311307558911412, 'max_iter': 505, 'solver': 'lbfgs'}. Best is trial 18 with value: 0.0032901862153515617.
[I 2025-10-16 00:10:37,790] Trial 27 finished with value: 0.0033036826675638072 and parameters: {'C': 9.946925459916065, 'max_iter': 341, 'solver': 'lbfgs'}. Best is trial 18 with value: 0.0032901862153515617.
[I 2025-10-16 00:10:37,959] Trial 28 finished with value: 0.005740026879425527 and parameters: {'C': 4.302191441557449, 'max_iter': 752, 'solver': 'lbfgs'}. Best is trial 18 with value: 0.0032901862153515617.
