[I 2025-10-15 23:43:19,441] Trial 5 finished with value: inf and parameters: {'C': 9.333230031475411, 'max_iter': 797, 'solver': 'lbfgs'}. Best is trial 0 with value: inf.
2025-10-15 23:43:19,449 - non_major_league_hyperparameter_tuning - WARNING - Error in fold: could not convert string to float: 'E1'
2025-10-15 23:43:19,459 - non_major_league_hyperparameter_tuning - WARNING - Error in fold: could not convert string to float: 'E1'
2025-10-15 23:43:19,472 - non_major_league_hyperparameter_tuning - WARNING - Error in fold: could not convert string to float: 'E1'
[I 2025-10-15 23:43:19,475] Trial 6 finished with value: inf and parameters: {'C': 5.030519242198295, 'max_iter': 279, 'solver': 'liblinear'}. Best is trial 0 with value: inf.
2025-10-15 23:43:19,486 - non_major_league_hyperparameter_tuning - WARNING - Error in fold: could not convert string to float: 'E1'
2025-10-15 23:43:19,499 - non_major_league_hyperparameter_tuning - WARNING - Error in fold: could not convert string to float: 'E1'
2025-10-15 23:43:19,514 - non_major_league_hyperparameter_tuning - WARNING - Error in fold: could not convert string to float: 'E1'
[I 2025-10-15 23:43:19,517] Trial 7 finished with value: inf and parameters: {'C': 0.4745509598125238, 'max_iter': 609, 'solver': 'lbfgs'}. Best is trial 0 with value: inf.
2025-10-15 23:43:19,527 - non_major_league_hyperparameter_tuning - WARNING - Error in fold: could not convert string to float: 'E1'
2025-10-15 23:43:19,540 - non_major_league_hyperparameter_tuning - WARNING - Error in fold: could not convert string to float: 'E1'
2025-10-15 23:43:19,554 - non_major_league_hyperparameter_tuning - WARNING - Error in fold: could not convert string to float: 'E1'
[I 2025-10-15 23:43:19,556] Trial 8 finished with value: inf and parameters: {'C': 7.832736615688854, 'max_iter': 624, 'solver': 'lbfgs'}. Best is trial 0 with value: inf.
2025-10-15 23:43:19,567 - non_major_league_hyperparameter_tuning - WARNING - Error in fold: could not convert string to float: 'E1'
2025-10-15 23:43:19,579 - non_major_league_hyperparameter_tuning - WARNING - Error in fold: could not convert string to float: 'E1'
2025-10-15 23:43:19,592 - non_major_league_hyperparameter_tuning - WARNING - Error in fold: could not convert string to float: 'E1'
[I 2025-10-15 23:43:19,595] Trial 9 finished with value: inf and parameters: {'C': 8.858529193499834, 'max_iter': 989, 'solver': 'lbfgs'}. Best is trial 0 with value: inf.
2025-10-15 23:43:19,615 - non_major_league_hyperparameter_tuning - WARNING - Error in fold: could not convert string to float: 'E1'
2025-10-15 23:43:19,626 - non_major_league_hyperparameter_tuning - WARNING - Error in fold: could not convert string to float: 'E1'
2025-10-15 23:43:19,641 - non_major_league_hyperparameter_tuning - WARNING - Error in fold: could not convert string to float: 'E1'
[I 2025-10-15 23:43:19,644] Trial 10 finished with value: inf and parameters: {'C': 6.063353072380708, 'max_iter': 757, 'solver': 'liblinear'}. Best is trial 0 with value: inf.
2025-10-15 23:43:19,664 - non_major_league_hyperparameter_tuning - WARNING - Error in fold: could not convert string to float: 'E1'
2025-10-15 23:43:19,673 - non_major_league_hyperparameter_tuning - WARNING - Error in fold: could not convert string to float: 'E1'
2025-10-15 23:43:19,685 - non_major_league_hyperparameter_tuning - WARNING - Error in fold: could not convert string to float: 'E1'
[I 2025-10-15 23:43:19,688] Trial 11 finished with value: inf and parameters: {'C': 7.006161052570976, 'max_iter': 459, 'solver': 'liblinear'}. Best is trial 0 with value: inf.
2025-10-15 23:43:19,708 - non_major_league_hyperparameter_tuning - WARNING - Error in fold: could not convert string to float: 'E1'
2025-10-15 23:43:19,717 - non_major_league_hyperparameter_tuning - WARNING - Error in fold: could not convert string to float: 'E1'
2025-10-15 23:43:19,734 - non_major_league_hyperparameter_tuning - WARNING - Error in fold: could not convert string to float: 'E1'
[I 2025-10-15 23:43:19,737] Trial 12 finished with value: inf and parameters: {'C': 9.631783145506086, 'max_iter': 452, 'solver': 'liblinear'}. Best is trial 0 with value: inf.
2025-10-15 23:43:19,758 - non_major_league_hyperparameter_tuning - WARNING - Error in fold: could not convert string to float: 'E1'
2025-10-15 23:43:19,770 - non_major_league_hyperparameter_tuning - WARNING - Error in fold: could not convert string to float: 'E1'
2025-10-15 23:43:19,784 - non_major_league_hyperparameter_tuning - WARNING - Error in fold: could not convert string to float: 'E1'
[I 2025-10-15 23:43:19,787] Trial 13 finished with value: inf and parameters: {'C': 7.404166936902891, 'max_iter': 131, 'solver': 'liblinear'}. Best is trial 0 with value: inf.
2025-10-15 23:43:19,806 - non_major_league_hyperparameter_tuning - WARNING - Error in fold: could not convert string to float: 'E1'
2025-10-15 23:43:19,818 - non_major_league_hyperparameter_tuning - WARNING - Error in fold: could not convert string to float: 'E1'
2025-10-15 23:43:19,834 - non_major_league_hyperparameter_tuning - WARNING - Error in fold: could not convert string to float: 'E1'
[I 2025-10-15 23:43:19,837] Trial 14 finished with value: inf and parameters: {'C': 6.089331732041717, 'max_iter': 456, 'solver': 'liblinear'}. Best is trial 0 with value: inf.
2025-10-15 23:43:19,861 - non_major_league_hyperparameter_tuning - WARNING - Error in fold: could not convert string to float: 'E1'
2025-10-15 23:43:19,872 - non_major_league_hyperparameter_tuning - WARNING - Error in fold: could not convert string to float: 'E1'
2025-10-15 23:43:19,887 - non_major_league_hyperparameter_tuning - WARNING - Error in fold: could not convert string to float: 'E1'
[I 2025-10-15 23:43:19,890] Trial 15 finished with value: inf and parameters: {'C': 9.664753365822095, 'max_iter': 734, 'solver': 'liblinear'}. Best is trial 0 with value: inf.
2025-10-15 23:43:19,911 - non_major_league_hyperparameter_tuning - WARNING - Error in fold: could not convert string to float: 'E1'
2025-10-15 23:43:19,924 - non_major_league_hyperparameter_tuning - WARNING - Error in fold: could not convert string to float: 'E1'
2025-10-15 23:43:19,936 - non_major_league_hyperparameter_tuning - WARNING - Error in fold: could not convert string to float: 'E1'
[I 2025-10-15 23:43:19,940] Trial 16 finished with value: inf and parameters: {'C': 8.115091597442982, 'max_iter': 377, 'solver': 'liblinear'}. Best is trial 0 with value: inf.
2025-10-15 23:43:19,959 - non_major_league_hyperparameter_tuning - WARNING - Error in fold: could not convert string to float: 'E1'
2025-10-15 23:43:19,972 - non_major_league_hyperparameter_tuning - WARNING - Error in fold: could not convert string to float: 'E1'
2025-10-15 23:43:19,986 - non_major_league_hyperparameter_tuning - WARNING - Error in fold: could not convert string to float: 'E1'
[I 2025-10-15 23:43:19,988] Trial 17 finished with value: inf and parameters: {'C': 9.94354897971254, 'max_iter': 876, 'solver': 'liblinear'}. Best is trial 0 with value: inf.
2025-10-15 23:43:20,011 - non_major_league_hyperparameter_tuning - WARNING - Error in fold: could not convert string to float: 'E1'
2025-10-15 23:43:20,020 - non_major_league_hyperparameter_tuning - WARNING - Error in fold: could not convert string to float: 'E1'
2025-10-15 23:43:20,035 - non_major_league_hyperparameter_tuning - WARNING - Error in fold: could not convert string to float: 'E1'
[I 2025-10-15 23:43:20,038] Trial 18 finished with value: inf and parameters: {'C': 2.8584313874066063, 'max_iter': 560, 'solver': 'liblinear'}. Best is trial 0 with value: inf.
2025-10-15 23:43:20,056 - non_major_league_hyperparameter_tuning - WARNING - Error in fold: could not convert string to float: 'E1'
2025-10-15 23:43:20,069 - non_major_league_hyperparameter_tuning - WARNING - Error in fold: could not convert string to float: 'E1'
2025-10-15 23:43:20,087 - non_major_league_hyperparameter_tuning - WARNING - Error in fold: could not convert string to float: 'E1'
[I 2025-10-15 23:43:20,090] Trial 19 finished with value: inf and parameters: {'C': 6.478892506208098, 'max_iter': 123, 'solver': 'liblinear'}. Best is trial 0 with value: inf.
2025-10-15 23:43:20,114 - non_major_league_hyperparameter_tuning - WARNING - Error in fold: could not convert string to float: 'E1'
2025-10-15 23:43:20,125 - non_major_league_hyperparameter_tuning - WARNING - Error in fold: could not convert string to float: 'E1'
2025-10-15 23:43:20,142 - non_major_league_hyperparameter_tuning - WARNING - Error in fold: could not convert string to float: 'E1'
[I 2025-10-15 23:43:20,144] Trial 20 finished with value: inf and parameters: {'C': 5.117224217190637, 'max_iter': 696, 'solver': 'liblinear'}. Best is trial 0 with value: inf.
2025-10-15 23:43:20,163 - non_major_league_hyperparameter_tuning - WARNING - Error in fold: could not convert string to float: 'E1'
2025-10-15 23:43:20,174 - non_major_league_hyperparameter_tuning - WARNING - Error in fold: could not convert string to float: 'E1'
2025-10-15 23:43:20,187 - non_major_league_hyperparameter_tuning - WARNING - Error in fold: could not convert string to float: 'E1'
[I 2025-10-15 23:43:20,189] Trial 21 finished with value: inf and parameters: {'C': 3.5000652664385368, 'max_iter': 306, 'solver': 'lbfgs'}. Best is trial 0 with value: inf.
2025-10-15 23:43:20,212 - non_major_league_hyperparameter_tuning - WARNING - Error in fold: could not convert string to float: 'E1'
2025-10-15 23:43:20,226 - non_major_league_hyperparameter_tuning - WARNING - Error in fold: could not convert string to float: 'E1'
2025-10-15 23:43:20,242 - non_major_league_hyperparameter_tuning - WARNING - Error in fold: could not convert string to float: 'E1'
[I 2025-10-15 23:43:20,244] Trial 22 finished with value: inf and parameters: {'C': 3.9941345395300694, 'max_iter': 201, 'solver': 'lbfgs'}. Best is trial 0 with value: inf.
2025-10-15 23:43:20,262 - non_major_league_hyperparameter_tuning - WARNING - Error in fold: could not convert string to float: 'E1'
2025-10-15 23:43:20,274 - non_major_league_hyperparameter_tuning - WARNING - Error in fold: could not convert string to float: 'E1'
2025-10-15 23:43:20,291 - non_major_league_hyperparameter_tuning - WARNING - Error in fold: could not convert string to float: 'E1'
[I 2025-10-15 23:43:20,294] Trial 23 finished with value: inf and parameters: {'C': 1.5079669071288988, 'max_iter': 339, 'solver': 'lbfgs'}. Best is trial 0 with value: inf.
2025-10-15 23:43:20,315 - non_major_league_hyperparameter_tuning - WARNING - Error in fold: could not convert string to float: 'E1'
2025-10-15 23:43:20,325 - non_major_league_hyperparameter_tuning - WARNING - Error in fold: could not convert string to float: 'E1'
2025-10-15 23:43:20,337 - non_major_league_hyperparameter_tuning - WARNING - Error in fold: could not convert string to float: 'E1'
[I 2025-10-15 23:43:20,340] Trial 24 finished with value: inf and parameters: {'C': 3.7745075015490603, 'max_iter': 395, 'solver': 'liblinear'}. Best is trial 0 with value: inf.
2025-10-15 23:43:20,363 - non_major_league_hyperparameter_tuning - WARNING - Error in fold: could not convert string to float: 'E1'
2025-10-15 23:43:20,374 - non_major_league_hyperparameter_tuning - WARNING - Error in fold: could not convert string to float: 'E1'
2025-10-15 23:43:20,389 - non_major_league_hyperparameter_tuning - WARNING - Error in fold: could not convert string to float: 'E1'
[I 2025-10-15 23:43:20,393] Trial 25 finished with value: inf and parameters: {'C': 8.492030268378596, 'max_iter': 508, 'solver': 'liblinear'}. Best is trial 0 with value: inf.
2025-10-15 23:43:20,414 - non_major_league_hyperparameter_tuning - WARNING - Error in fold: could not convert string to float: 'E1'
2025-10-15 23:43:20,427 - non_major_league_hyperparameter_tuning - WARNING - Error in fold: could not convert string to float: 'E1'
2025-10-15 23:43:20,442 - non_major_league_hyperparameter_tuning - WARNING - Error in fold: could not convert string to float: 'E1'
[I 2025-10-15 23:43:20,445] Trial 26 finished with value: inf and parameters: {'C': 4.6211618820207665, 'max_iter': 206, 'solver': 'lbfgs'}. Best is trial 0 with value: inf.
2025-10-15 23:43:20,468 - non_major_league_hyperparameter_tuning - WARNING - Error in fold: could not convert string to float: 'E1'
2025-10-15 23:43:20,479 - non_major_league_hyperparameter_tuning - WARNING - Error in fold: could not convert string to float: 'E1'
2025-10-15 23:43:20,491 - non_major_league_hyperparameter_tuning - WARNING - Error in fold: could not convert string to float: 'E1'
[I 2025-10-15 23:43:20,493] Trial 27 finished with value: inf and parameters: {'C': 1.922978669072445, 'max_iter': 383, 'solver': 'liblinear'}. Best is trial 0 with value: inf.
2025-10-15 23:43:20,514 - non_major_league_hyperparameter_tuning - WARNING - Error in fold: could not convert string to float: 'E1'
2025-10-15 23:43:20,525 - non_major_league_hyperparameter_tuning - WARNING - Error in fold: could not convert string to float: 'E1'
2025-10-15 23:43:20,541 - non_major_league_hyperparameter_tuning - WARNING - Error in fold: could not convert string to float: 'E1'
[I 2025-10-15 23:43:20,545] Trial 28 finished with value: inf and parameters: {'C': 5.6278464273510105, 'max_iter': 641, 'solver': 'lbfgs'}. Best is trial 0 with value: inf.
2025-10-15 23:43:20,565 - non_major_league_hyperparameter_tuning - WARNING - Error in fold: could not convert string to float: 'E1'
2025-10-15 23:43:20,578 - non_major_league_hyperparameter_tuning - WARNING - Error in fold: could not convert string to float: 'E1'
2025-10-15 23:43:20,594 - non_major_league_hyperparameter_tuning - WARNING - Error in fold: could not convert string to float: 'E1'
