[I 2025-10-15 23:43:17,711] Trial 1 finished with value: inf and parameters: {'n_estimators': 180, 'max_depth': 3, 'min_samples_split': 17, 'min_samples_leaf': 1, 'max_features': 'log2'}. Best is trial 0 with value: inf.
2025-10-15 23:43:17,723 - non_major_league_hyperparameter_tuning - WARNING - Error in fold: could not convert string to float: 'E1'
2025-10-15 23:43:17,733 - non_major_league_hyperparameter_tuning - WARNING - Error in fold: could not convert string to float: 'E1'
2025-10-15 23:43:17,747 - non_major_league_hyperparameter_tuning - WARNING - Error in fold: could not convert string to float: 'E1'
[I 2025-10-15 23:43:17,750] Trial 2 finished with value: inf and parameters: {'n_estimators': 146, 'max_depth': 3, 'min_samples_split': 17, 'min_samples_leaf': 3, 'max_features': None}. Best is trial 0 with value: inf.
2025-10-15 23:43:17,760 - non_major_league_hyperparameter_tuning - WARNING - Error in fold: could not convert string to float: 'E1'
2025-10-15 23:43:17,771 - non_major_league_hyperparameter_tuning - WARNING - Error in fold: could not convert string to float: 'E1'
2025-10-15 23:43:17,786 - non_major_league_hyperparameter_tuning - WARNING - Error in fold: could not convert string to float: 'E1'
[I 2025-10-15 23:43:17,789] Trial 3 finished with value: inf and parameters: {'n_estimators': 50, 'max_depth': 8, 'min_samples_split': 2, 'min_samples_leaf': 9, 'max_features': 'sqrt'}. Best is trial 0 with value: inf.
2025-10-15 23:43:17,798 - non_major_league_hyperparameter_tuning - WARNING - Error in fold: could not convert string to float: 'E1'
2025-10-15 23:43:17,809 - non_major_league_hyperparameter_tuning - WARNING - Error in fold: could not convert string to float: 'E1'
2025-10-15 23:43:17,824 - non_major_league_hyperparameter_tuning - WARNING - Error in fold: could not convert string to float: 'E1'
[I 2025-10-15 23:43:17,826] Trial 4 finished with value: inf and parameters: {'n_estimators': 154, 'max_depth': 7, 'min_samples_split': 20, 'min_samples_leaf': 9, 'max_features': 'log2'}. Best is trial 0 with value: inf.
2025-10-15 23:43:17,840 - non_major_league_hyperparameter_tuning - WARNING - Error in fold: could not convert string to float: 'E1'
2025-10-15 23:43:17,852 - non_major_league_hyperparameter_tuning - WARNING - Error in fold: could not convert string to float: 'E1'
2025-10-15 23:43:17,864 - non_major_league_hyperparameter_tuning - WARNING - Error in fold: could not convert string to float: 'E1'
[I 2025-10-15 23:43:17,867] Trial 5 finished with value: inf and parameters: {'n_estimators': 105, 'max_depth': 11, 'min_samples_split': 10, 'min_samples_leaf': 3, 'max_features': 'sqrt'}. Best is trial 0 with value: inf.
2025-10-15 23:43:17,878 - non_major_league_hyperparameter_tuning - WARNING - Error in fold: could not convert string to float: 'E1'
2025-10-15 23:43:17,890 - non_major_league_hyperparameter_tuning - WARNING - Error in fold: could not convert string to float: 'E1'
2025-10-15 23:43:17,903 - non_major_league_hyperparameter_tuning - WARNING - Error in fold: could not convert string to float: 'E1'
[I 2025-10-15 23:43:17,906] Trial 6 finished with value: inf and parameters: {'n_estimators': 102, 'max_depth': 11, 'min_samples_split': 10, 'min_samples_leaf': 9, 'max_features': 'log2'}. Best is trial 0 with value: inf.
2025-10-15 23:43:17,917 - non_major_league_hyperparameter_tuning - WARNING - Error in fold: could not convert string to float: 'E1'
2025-10-15 23:43:17,929 - non_major_league_hyperparameter_tuning - WARNING - Error in fold: could not convert string to float: 'E1'
2025-10-15 23:43:17,942 - non_major_league_hyperparameter_tuning - WARNING - Error in fold: could not convert string to float: 'E1'
[I 2025-10-15 23:43:17,944] Trial 7 finished with value: inf and parameters: {'n_estimators': 102, 'max_depth': 8, 'min_samples_split': 10, 'min_samples_leaf': 4, 'max_features': 'sqrt'}. Best is trial 0 with value: inf.
2025-10-15 23:43:17,954 - non_major_league_hyperparameter_tuning - WARNING - Error in fold: could not convert string to float: 'E1'
2025-10-15 23:43:17,964 - non_major_league_hyperparameter_tuning - WARNING - Error in fold: could not convert string to float: 'E1'
2025-10-15 23:43:17,979 - non_major_league_hyperparameter_tuning - WARNING - Error in fold: could not convert string to float: 'E1'
[I 2025-10-15 23:43:17,981] Trial 8 finished with value: inf and parameters: {'n_estimators': 97, 'max_depth': 6, 'min_samples_split': 18, 'min_samples_leaf': 7, 'max_features': 'log2'}. Best is trial 0 with value: inf.
2025-10-15 23:43:17,993 - non_major_league_hyperparameter_tuning - WARNING - Error in fold: could not convert string to float: 'E1'
2025-10-15 23:43:18,004 - non_major_league_hyperparameter_tuning - WARNING - Error in fold: could not convert string to float: 'E1'
2025-10-15 23:43:18,016 - non_major_league_hyperparameter_tuning - WARNING - Error in fold: could not convert string to float: 'E1'
[I 2025-10-15 23:43:18,020] Trial 9 finished with value: inf and parameters: {'n_estimators': 66, 'max_depth': 10, 'min_samples_split': 17, 'min_samples_leaf': 1, 'max_features': 'log2'}. Best is trial 0 with value: inf.
2025-10-15 23:43:18,051 - non_major_league_hyperparameter_tuning - WARNING - Error in fold: could not convert string to float: 'E1'
2025-10-15 23:43:18,062 - non_major_league_hyperparameter_tuning - WARNING - Error in fold: could not convert string to float: 'E1'
2025-10-15 23:43:18,074 - non_major_league_hyperparameter_tuning - WARNING - Error in fold: could not convert string to float: 'E1'
[I 2025-10-15 23:43:18,077] Trial 10 finished with value: inf and parameters: {'n_estimators': 200, 'max_depth': 15, 'min_samples_split': 5, 'min_samples_leaf': 6, 'max_features': None}. Best is trial 0 with value: inf.
2025-10-15 23:43:18,109 - non_major_league_hyperparameter_tuning - WARNING - Error in fold: could not convert string to float: 'E1'
2025-10-15 23:43:18,121 - non_major_league_hyperparameter_tuning - WARNING - Error in fold: could not convert string to float: 'E1'
2025-10-15 23:43:18,133 - non_major_league_hyperparameter_tuning - WARNING - Error in fold: could not convert string to float: 'E1'
[I 2025-10-15 23:43:18,135] Trial 11 finished with value: inf and parameters: {'n_estimators': 177, 'max_depth': 3, 'min_samples_split': 14, 'min_samples_leaf': 1, 'max_features': None}. Best is trial 0 with value: inf.
2025-10-15 23:43:18,166 - non_major_league_hyperparameter_tuning - WARNING - Error in fold: could not convert string to float: 'E1'
2025-10-15 23:43:18,177 - non_major_league_hyperparameter_tuning - WARNING - Error in fold: could not convert string to float: 'E1'
2025-10-15 23:43:18,191 - non_major_league_hyperparameter_tuning - WARNING - Error in fold: could not convert string to float: 'E1'
[I 2025-10-15 23:43:18,194] Trial 12 finished with value: inf and parameters: {'n_estimators': 136, 'max_depth': 5, 'min_samples_split': 14, 'min_samples_leaf': 1, 'max_features': None}. Best is trial 0 with value: inf.
2025-10-15 23:43:18,219 - non_major_league_hyperparameter_tuning - WARNING - Error in fold: could not convert string to float: 'E1'
2025-10-15 23:43:18,231 - non_major_league_hyperparameter_tuning - WARNING - Error in fold: could not convert string to float: 'E1'
2025-10-15 23:43:18,243 - non_major_league_hyperparameter_tuning - WARNING - Error in fold: could not convert string to float: 'E1'
[I 2025-10-15 23:43:18,245] Trial 13 finished with value: inf and parameters: {'n_estimators': 75, 'max_depth': 5, 'min_samples_split': 14, 'min_samples_leaf': 3, 'max_features': 'log2'}. Best is trial 0 with value: inf.
2025-10-15 23:43:18,272 - non_major_league_hyperparameter_tuning - WARNING - Error in fold: could not convert string to float: 'E1'
2025-10-15 23:43:18,282 - non_major_league_hyperparameter_tuning - WARNING - Error in fold: could not convert string to float: 'E1'
2025-10-15 23:43:18,297 - non_major_league_hyperparameter_tuning - WARNING - Error in fold: could not convert string to float: 'E1'
[I 2025-10-15 23:43:18,299] Trial 14 finished with value: inf and parameters: {'n_estimators': 178, 'max_depth': 3, 'min_samples_split': 20, 'min_samples_leaf': 5, 'max_features': None}. Best is trial 0 with value: inf.
2025-10-15 23:43:18,325 - non_major_league_hyperparameter_tuning - WARNING - Error in fold: could not convert string to float: 'E1'
2025-10-15 23:43:18,337 - non_major_league_hyperparameter_tuning - WARNING - Error in fold: could not convert string to float: 'E1'
2025-10-15 23:43:18,352 - non_major_league_hyperparameter_tuning - WARNING - Error in fold: could not convert string to float: 'E1'
[I 2025-10-15 23:43:18,355] Trial 15 finished with value: inf and parameters: {'n_estimators': 118, 'max_depth': 5, 'min_samples_split': 16, 'min_samples_leaf': 2, 'max_features': 'log2'}. Best is trial 0 with value: inf.
2025-10-15 23:43:18,388 - non_major_league_hyperparameter_tuning - WARNING - Error in fold: could not convert string to float: 'E1'
2025-10-15 23:43:18,401 - non_major_league_hyperparameter_tuning - WARNING - Error in fold: could not convert string to float: 'E1'
2025-10-15 23:43:18,418 - non_major_league_hyperparameter_tuning - WARNING - Error in fold: could not convert string to float: 'E1'
[I 2025-10-15 23:43:18,421] Trial 16 finished with value: inf and parameters: {'n_estimators': 168, 'max_depth': 13, 'min_samples_split': 12, 'min_samples_leaf': 2, 'max_features': None}. Best is trial 0 with value: inf.
2025-10-15 23:43:18,448 - non_major_league_hyperparameter_tuning - WARNING - Error in fold: could not convert string to float: 'E1'
2025-10-15 23:43:18,460 - non_major_league_hyperparameter_tuning - WARNING - Error in fold: could not convert string to float: 'E1'
2025-10-15 23:43:18,475 - non_major_league_hyperparameter_tuning - WARNING - Error in fold: could not convert string to float: 'E1'
[I 2025-10-15 23:43:18,478] Trial 17 finished with value: inf and parameters: {'n_estimators': 196, 'max_depth': 4, 'min_samples_split': 20, 'min_samples_leaf': 5, 'max_features': 'log2'}. Best is trial 0 with value: inf.
2025-10-15 23:43:18,510 - non_major_league_hyperparameter_tuning - WARNING - Error in fold: could not convert string to float: 'E1'
2025-10-15 23:43:18,523 - non_major_league_hyperparameter_tuning - WARNING - Error in fold: could not convert string to float: 'E1'
2025-10-15 23:43:18,537 - non_major_league_hyperparameter_tuning - WARNING - Error in fold: could not convert string to float: 'E1'
[I 2025-10-15 23:43:18,540] Trial 18 finished with value: inf and parameters: {'n_estimators': 124, 'max_depth': 7, 'min_samples_split': 7, 'min_samples_leaf': 7, 'max_features': None}. Best is trial 0 with value: inf.
2025-10-15 23:43:18,575 - non_major_league_hyperparameter_tuning - WARNING - Error in fold: could not convert string to float: 'E1'
2025-10-15 23:43:18,588 - non_major_league_hyperparameter_tuning - WARNING - Error in fold: could not convert string to float: 'E1'
2025-10-15 23:43:18,602 - non_major_league_hyperparameter_tuning - WARNING - Error in fold: could not convert string to float: 'E1'
[I 2025-10-15 23:43:18,604] Trial 19 finished with value: inf and parameters: {'n_estimators': 80, 'max_depth': 6, 'min_samples_split': 18, 'min_samples_leaf': 2, 'max_features': 'sqrt'}. Best is trial 0 with value: inf.
2025-10-15 23:43:18,643 - non_major_league_hyperparameter_tuning - WARNING - Error in fold: could not convert string to float: 'E1'
2025-10-15 23:43:18,658 - non_major_league_hyperparameter_tuning - WARNING - Error in fold: could not convert string to float: 'E1'
2025-10-15 23:43:18,672 - non_major_league_hyperparameter_tuning - WARNING - Error in fold: could not convert string to float: 'E1'
[I 2025-10-15 23:43:18,676] Trial 20 finished with value: inf and parameters: {'n_estimators': 159, 'max_depth': 4, 'min_samples_split': 15, 'min_samples_leaf': 4, 'max_features': None}. Best is trial 0 with value: inf.
2025-10-15 23:43:18,709 - non_major_league_hyperparameter_tuning - WARNING - Error in fold: could not convert string to float: 'E1'
2025-10-15 23:43:18,721 - non_major_league_hyperparameter_tuning - WARNING - Error in fold: could not convert string to float: 'E1'
2025-10-15 23:43:18,734 - non_major_league_hyperparameter_tuning - WARNING - Error in fold: could not convert string to float: 'E1'
[I 2025-10-15 23:43:18,738] Trial 21 finished with value: inf and parameters: {'n_estimators': 141, 'max_depth': 3, 'min_samples_split': 18, 'min_samples_leaf': 3, 'max_features': None}. Best is trial 0 with value: inf.
2025-10-15 23:43:18,767 - non_major_league_hyperparameter_tuning - WARNING - Error in fold: could not convert string to float: 'E1'
2025-10-15 23:43:18,779 - non_major_league_hyperparameter_tuning - WARNING - Error in fold: could not convert string to float: 'E1'
2025-10-15 23:43:18,791 - non_major_league_hyperparameter_tuning - WARNING - Error in fold: could not convert string to float: 'E1'
[I 2025-10-15 23:43:18,794] Trial 22 finished with value: inf and parameters: {'n_estimators': 147, 'max_depth': 4, 'min_samples_split': 12, 'min_samples_leaf': 2, 'max_features': None}. Best is trial 0 with value: inf.
2025-10-15 23:43:18,823 - non_major_league_hyperparameter_tuning - WARNING - Error in fold: could not convert string to float: 'E1'
2025-10-15 23:43:18,834 - non_major_league_hyperparameter_tuning - WARNING - Error in fold: could not convert string to float: 'E1'
2025-10-15 23:43:18,850 - non_major_league_hyperparameter_tuning - WARNING - Error in fold: could not convert string to float: 'E1'
[I 2025-10-15 23:43:18,853] Trial 23 finished with value: inf and parameters: {'n_estimators': 184, 'max_depth': 3, 'min_samples_split': 16, 'min_samples_leaf': 4, 'max_features': None}. Best is trial 0 with value: inf.
2025-10-15 23:43:18,885 - non_major_league_hyperparameter_tuning - WARNING - Error in fold: could not convert string to float: 'E1'
2025-10-15 23:43:18,895 - non_major_league_hyperparameter_tuning - WARNING - Error in fold: could not convert string to float: 'E1'
2025-10-15 23:43:18,909 - non_major_league_hyperparameter_tuning - WARNING - Error in fold: could not convert string to float: 'E1'
[I 2025-10-15 23:43:18,913] Trial 24 finished with value: inf and parameters: {'n_estimators': 131, 'max_depth': 6, 'min_samples_split': 19, 'min_samples_leaf': 1, 'max_features': None}. Best is trial 0 with value: inf.
2025-10-15 23:43:18,946 - non_major_league_hyperparameter_tuning - WARNING - Error in fold: could not convert string to float: 'E1'
2025-10-15 23:43:18,957 - non_major_league_hyperparameter_tuning - WARNING - Error in fold: could not convert string to float: 'E1'
2025-10-15 23:43:18,972 - non_major_league_hyperparameter_tuning - WARNING - Error in fold: could not convert string to float: 'E1'
[I 2025-10-15 23:43:18,975] Trial 25 finished with value: inf and parameters: {'n_estimators': 163, 'max_depth': 4, 'min_samples_split': 16, 'min_samples_leaf': 3, 'max_features': 'log2'}. Best is trial 0 with value: inf.
2025-10-15 23:43:19,004 - non_major_league_hyperparameter_tuning - WARNING - Error in fold: could not convert string to float: 'E1'
2025-10-15 23:43:19,016 - non_major_league_hyperparameter_tuning - WARNING - Error in fold: could not convert string to float: 'E1'
2025-10-15 23:43:19,028 - non_major_league_hyperparameter_tuning - WARNING - Error in fold: could not convert string to float: 'E1'
[I 2025-10-15 23:43:19,031] Trial 26 finished with value: inf and parameters: {'n_estimators': 115, 'max_depth': 5, 'min_samples_split': 17, 'min_samples_leaf': 2, 'max_features': None}. Best is trial 0 with value: inf.
2025-10-15 23:43:19,061 - non_major_league_hyperparameter_tuning - WARNING - Error in fold: could not convert string to float: 'E1'
2025-10-15 23:43:19,074 - non_major_league_hyperparameter_tuning - WARNING - Error in fold: could not convert string to float: 'E1'
2025-10-15 23:43:19,087 - non_major_league_hyperparameter_tuning - WARNING - Error in fold: could not convert string to float: 'E1'
[I 2025-10-15 23:43:19,090] Trial 27 finished with value: inf and parameters: {'n_estimators': 85, 'max_depth': 3, 'min_samples_split': 13, 'min_samples_leaf': 1, 'max_features': None}. Best is trial 0 with value: inf.
2025-10-15 23:43:19,122 - non_major_league_hyperparameter_tuning - WARNING - Error in fold: could not convert string to float: 'E1'
2025-10-15 23:43:19,133 - non_major_league_hyperparameter_tuning - WARNING - Error in fold: could not convert string to float: 'E1'
2025-10-15 23:43:19,148 - non_major_league_hyperparameter_tuning - WARNING - Error in fold: could not convert string to float: 'E1'
[I 2025-10-15 23:43:19,151] Trial 28 finished with value: inf and parameters: {'n_estimators': 189, 'max_depth': 9, 'min_samples_split': 19, 'min_samples_leaf': 4, 'max_features': 'sqrt'}. Best is trial 0 with value: inf.
2025-10-15 23:43:19,179 - non_major_league_hyperparameter_tuning - WARNING - Error in fold: could not convert string to float: 'E1'
2025-10-15 23:43:19,188 - non_major_league_hyperparameter_tuning - WARNING - Error in fold: could not convert string to float: 'E1'
2025-10-15 23:43:19,203 - non_major_league_hyperparameter_tuning - WARNING - Error in fold: could not convert string to float: 'E1'
[I 2025-10-15 23:43:19,205] Trial 29 finished with value: inf and parameters: {'n_estimators': 50, 'max_depth': 7, 'min_samples_split': 2, 'min_samples_leaf': 10, 'max_features': 'log2'}. Best is trial 0 with value: inf.
2025-10-15 23:43:19,209 - non_major_league_hyperparameter_tuning - INFO - random_forest optimization complete
2025-10-15 23:43:19,210 - non_major_league_hyperparameter_tuning - INFO - Best score: inf
2025-10-15 23:43:19,210 - non_major_league_hyperparameter_tuning - INFO - Best params: {'n_estimators': 80, 'max_depth': 5, 'min_samples_split': 19, 'min_samples_leaf': 2, 'max_features': None}
2025-10-15 23:43:19,210 - non_major_league_hyperparameter_tuning - INFO - Optimizing logistic_regression (priority: 4)
2025-10-15 23:43:19,211 - non_major_league_hyperparameter_tuning - INFO - Optimizing hyperparameters for logistic_regression
[I 2025-10-15 23:43:19,211] A new study created in memory with name: no-name-3604fbcd-e489-441c-a134-d5e64dddcf2d
2025-10-15 23:43:19,222 - non_major_league_hyperparameter_tuning - WARNING - Error in fold: could not convert string to float: 'E1'
2025-10-15 23:43:19,233 - non_major_league_hyperparameter_tuning - WARNING - Error in fold: could not convert string to float: 'E1'
2025-10-15 23:43:19,246 - non_major_league_hyperparameter_tuning - WARNING - Error in fold: could not convert string to float: 'E1'
[I 2025-10-15 23:43:19,250] Trial 0 finished with value: inf and parameters: {'C': 9.083269121888906, 'max_iter': 960, 'solver': 'liblinear'}. Best is trial 0 with value: inf.
2025-10-15 23:43:19,259 - non_major_league_hyperparameter_tuning - WARNING - Error in fold: could not convert string to float: 'E1'
2025-10-15 23:43:19,268 - non_major_league_hyperparameter_tuning - WARNING - Error in fold: could not convert string to float: 'E1'
2025-10-15 23:43:19,281 - non_major_league_hyperparameter_tuning - WARNING - Error in fold: could not convert string to float: 'E1'
[I 2025-10-15 23:43:19,284] Trial 1 finished with value: inf and parameters: {'C': 9.338091853170619, 'max_iter': 394, 'solver': 'liblinear'}. Best is trial 0 with value: inf.
2025-10-15 23:43:19,293 - non_major_league_hyperparameter_tuning - WARNING - Error in fold: could not convert string to float: 'E1'
2025-10-15 23:43:19,303 - non_major_league_hyperparameter_tuning - WARNING - Error in fold: could not convert string to float: 'E1'
2025-10-15 23:43:19,318 - non_major_league_hyperparameter_tuning - WARNING - Error in fold: could not convert string to float: 'E1'
[I 2025-10-15 23:43:19,320] Trial 2 finished with value: inf and parameters: {'C': 3.7795534073075503, 'max_iter': 297, 'solver': 'lbfgs'}. Best is trial 0 with value: inf.
2025-10-15 23:43:19,328 - non_major_league_hyperparameter_tuning - WARNING - Error in fold: could not convert string to float: 'E1'
2025-10-15 23:43:19,340 - non_major_league_hyperparameter_tuning - WARNING - Error in fold: could not convert string to float: 'E1'
2025-10-15 23:43:19,355 - non_major_league_hyperparameter_tuning - WARNING - Error in fold: could not convert string to float: 'E1'
[I 2025-10-15 23:43:19,359] Trial 3 finished with value: inf and parameters: {'C': 2.599585549084891, 'max_iter': 253, 'solver': 'lbfgs'}. Best is trial 0 with value: inf.
2025-10-15 23:43:19,371 - non_major_league_hyperparameter_tuning - WARNING - Error in fold: could not convert string to float: 'E1'
2025-10-15 23:43:19,384 - non_major_league_hyperparameter_tuning - WARNING - Error in fold: could not convert string to float: 'E1'
2025-10-15 23:43:19,397 - non_major_league_hyperparameter_tuning - WARNING - Error in fold: could not convert string to float: 'E1'
[I 2025-10-15 23:43:19,400] Trial 4 finished with value: inf and parameters: {'C': 8.682477334695985, 'max_iter': 921, 'solver': 'lbfgs'}. Best is trial 0 with value: inf.
2025-10-15 23:43:19,410 - non_major_league_hyperparameter_tuning - WARNING - Error in fold: could not convert string to float: 'E1'
2025-10-15 23:43:19,422 - non_major_league_hyperparameter_tuning - WARNING - Error in fold: could not convert string to float: 'E1'
2025-10-15 23:43:19,437 - non_major_league_hyperparameter_tuning - WARNING - Error in fold: could not convert string to float: 'E1'
