2025-10-15 23:49:09,296 - phase2_integration - INFO - Output directory: ./pipeline_output/phase2_output
2025-10-15 23:49:09,296 - phase2_integration - INFO - Starting Phase 2 pipeline for E1
2025-10-15 23:49:09,296 - phase2_integration - INFO - Step 1: Loading and preparing data
2025-10-15 23:49:09,297 - phase2_integration - INFO - Loading data from ./pipeline_output/phase1_output/E1_features.csv
2025-10-15 23:49:09,371 - phase2_integration - INFO - Loaded 570 rows with 254 columns
2025-10-15 23:49:09,376 - phase2_integration - INFO - Selected 241 numerical features from 254 total columns
2025-10-15 23:49:09,376 - phase2_integration - INFO - Excluded columns: ['target', 'FTR', 'HTR', 'Date', 'Time', 'HomeTeam', 'AwayTeam', 'Referee', 'Div', 'league', 'season', 'data_source', 'season_phase']
2025-10-15 23:49:09,381 - phase2_integration - INFO - Final dataset: 570 samples with 241 features
2025-10-15 23:49:09,382 - phase2_integration - INFO - Target distribution: {2: 236, 0: 180, 1: 154}
2025-10-15 23:49:09,383 - phase2_integration - INFO - Step 2: Model Architecture Design
2025-10-15 23:49:09,383 - phase2_integration - INFO - Designing model architecture
2025-10-15 23:49:09,392 - non_major_league_model_architecture - INFO - Creating base models for non-major leagues
2025-10-15 23:49:09,392 - non_major_league_model_architecture - INFO - Created 4 base models
2025-10-15 23:49:09,392 - non_major_league_model_architecture - INFO - Training base models
2025-10-15 23:49:09,396 - non_major_league_model_architecture - INFO - Calculated class weights: {np.int64(0): np.float64(1.036615532029404), np.int64(1): np.float64(1.176727620508443), np.int64(2): np.float64(0.8484672593300355)}
2025-10-15 23:49:09,397 - non_major_league_model_architecture - INFO - Training xgboost...
2025-10-15 23:49:09,398 - non_major_league_model_architecture - ERROR - Error training xgboost: XGBClassifier.fit() got an unexpected keyword argument 'early_stopping_rounds'
2025-10-15 23:49:09,398 - non_major_league_model_architecture - INFO - Training lightgbm...
2025-10-15 23:49:28,294 - non_major_league_model_architecture - INFO - lightgbm - Train Acc: 1.0000, Val Acc: 1.0000
2025-10-15 23:49:28,294 - non_major_league_model_architecture - INFO - Training random_forest...
2025-10-15 23:49:28,798 - non_major_league_model_architecture - INFO - random_forest - Train Acc: 1.0000, Val Acc: 1.0000
2025-10-15 23:49:28,798 - non_major_league_model_architecture - INFO - Training logistic_regression...
2025-10-15 23:49:28,903 - non_major_league_model_architecture - INFO - logistic_regression - Train Acc: 1.0000, Val Acc: 1.0000
2025-10-15 23:49:28,903 - non_major_league_model_architecture - INFO - Creating ensemble model
2025-10-15 23:49:28,903 - non_major_league_model_architecture - INFO - Training ensemble model
2025-10-15 23:49:37,932 - non_major_league_model_architecture - INFO - Ensemble training complete
2025-10-15 23:49:37,932 - non_major_league_model_architecture - INFO - Calibrating model probabilities
2025-10-15 23:49:37,972 - non_major_league_model_architecture - ERROR - Error calibrating xgboost: feature_names must be string, and may not contain [, ] or <
2025-10-15 23:50:16,886 - non_major_league_model_architecture - INFO - Calibrated lightgbm
2025-10-15 23:50:18,113 - non_major_league_model_architecture - INFO - Calibrated random_forest
2025-10-15 23:50:18,300 - non_major_league_model_architecture - INFO - Calibrated logistic_regression
2025-10-15 23:51:10,064 - non_major_league_model_architecture - INFO - Calibrated ensemble model
2025-10-15 23:51:10,065 - non_major_league_model_architecture - INFO - Evaluating models
2025-10-15 23:51:10,065 - non_major_league_model_architecture - ERROR - Error evaluating xgboost: need to call fit or load_model beforehand
2025-10-15 23:51:10,593 - non_major_league_model_architecture - INFO - Calculating feature importance
2025-10-15 23:51:10,617 - phase2_integration - INFO - Step 3: Transfer Learning Setup
2025-10-15 23:51:10,617 - phase2_integration - INFO - Setting up transfer learning
2025-10-15 23:51:10,617 - phase2_integration - INFO - No source data files provided, skipping transfer learning
2025-10-15 23:51:10,617 - phase2_integration - INFO - Step 4: Hyperparameter Tuning
2025-10-15 23:51:10,618 - phase2_integration - INFO - Optimizing hyperparameters
2025-10-15 23:51:10,618 - non_major_league_hyperparameter_tuning - INFO - Optimizing hyperparameters for all models
2025-10-15 23:51:10,618 - non_major_league_hyperparameter_tuning - INFO - Optimizing xgboost (priority: 1)
2025-10-15 23:51:10,618 - non_major_league_hyperparameter_tuning - INFO - Optimizing hyperparameters for xgboost
[I 2025-10-15 23:51:10,619] A new study created in memory with name: no-name-8a2e30b6-a78d-45f8-933c-5ba2049e976f
2025-10-15 23:51:10,659 - non_major_league_hyperparameter_tuning - WARNING - Error in fold: feature_names must be string, and may not contain [, ] or <
2025-10-15 23:51:10,696 - non_major_league_hyperparameter_tuning - WARNING - Error in fold: feature_names must be string, and may not contain [, ] or <
2025-10-15 23:51:10,726 - non_major_league_hyperparameter_tuning - WARNING - Error in fold: feature_names must be string, and may not contain [, ] or <
[I 2025-10-15 23:51:10,726] Trial 0 finished with value: inf and parameters: {'n_estimators': 70, 'max_depth': 7, 'learning_rate': 0.0633962790098781, 'subsample': 0.9600453213426712, 'colsample_bytree': 0.6815642249743875, 'min_child_weight': 1, 'reg_alpha': 0.4212723787372108, 'reg_lambda': 1.0430989234542152}. Best is trial 0 with value: inf.
2025-10-15 23:51:10,758 - non_major_league_hyperparameter_tuning - WARNING - Error in fold: feature_names must be string, and may not contain [, ] or <
2025-10-15 23:51:10,791 - non_major_league_hyperparameter_tuning - WARNING - Error in fold: feature_names must be string, and may not contain [, ] or <
2025-10-15 23:51:10,826 - non_major_league_hyperparameter_tuning - WARNING - Error in fold: feature_names must be string, and may not contain [, ] or <
[I 2025-10-15 23:51:10,827] Trial 1 finished with value: inf and parameters: {'n_estimators': 189, 'max_depth': 8, 'learning_rate': 0.08862251091399682, 'subsample': 0.8470849243090344, 'colsample_bytree': 0.6968012248774401, 'min_child_weight': 4, 'reg_alpha': 0.14281122635561871, 'reg_lambda': 1.4278409670408885}. Best is trial 0 with value: inf.
2025-10-15 23:51:10,861 - non_major_league_hyperparameter_tuning - WARNING - Error in fold: feature_names must be string, and may not contain [, ] or <
2025-10-15 23:51:10,894 - non_major_league_hyperparameter_tuning - WARNING - Error in fold: feature_names must be string, and may not contain [, ] or <
2025-10-15 23:51:10,923 - non_major_league_hyperparameter_tuning - WARNING - Error in fold: feature_names must be string, and may not contain [, ] or <
[I 2025-10-15 23:51:10,924] Trial 2 finished with value: inf and parameters: {'n_estimators': 98, 'max_depth': 6, 'learning_rate': 0.0549176708330313, 'subsample': 0.7480903728268827, 'colsample_bytree': 0.8539945277141541, 'min_child_weight': 10, 'reg_alpha': 0.9001123525883602, 'reg_lambda': 0.7905238061809665}. Best is trial 0 with value: inf.
2025-10-15 23:51:10,958 - non_major_league_hyperparameter_tuning - WARNING - Error in fold: feature_names must be string, and may not contain [, ] or <
2025-10-15 23:51:10,991 - non_major_league_hyperparameter_tuning - WARNING - Error in fold: feature_names must be string, and may not contain [, ] or <
2025-10-15 23:51:11,022 - non_major_league_hyperparameter_tuning - WARNING - Error in fold: feature_names must be string, and may not contain [, ] or <
[I 2025-10-15 23:51:11,022] Trial 3 finished with value: inf and parameters: {'n_estimators': 61, 'max_depth': 7, 'learning_rate': 0.03354604008372969, 'subsample': 0.621771527780655, 'colsample_bytree': 0.9783125125219081, 'min_child_weight': 1, 'reg_alpha': 0.15483275761622795, 'reg_lambda': 1.6375237300233125}. Best is trial 0 with value: inf.
2025-10-15 23:51:11,056 - non_major_league_hyperparameter_tuning - WARNING - Error in fold: feature_names must be string, and may not contain [, ] or <
2025-10-15 23:51:11,089 - non_major_league_hyperparameter_tuning - WARNING - Error in fold: feature_names must be string, and may not contain [, ] or <
2025-10-15 23:51:11,125 - non_major_league_hyperparameter_tuning - WARNING - Error in fold: feature_names must be string, and may not contain [, ] or <
[I 2025-10-15 23:51:11,126] Trial 4 finished with value: inf and parameters: {'n_estimators': 136, 'max_depth': 3, 'learning_rate': 0.059955718638013585, 'subsample': 0.6191349018209424, 'colsample_bytree': 0.6511821223583678, 'min_child_weight': 10, 'reg_alpha': 0.1571588134967694, 'reg_lambda': 0.40979095110700126}. Best is trial 0 with value: inf.
2025-10-15 23:51:11,155 - non_major_league_hyperparameter_tuning - WARNING - Error in fold: feature_names must be string, and may not contain [, ] or <
2025-10-15 23:51:11,188 - non_major_league_hyperparameter_tuning - WARNING - Error in fold: feature_names must be string, and may not contain [, ] or <
2025-10-15 23:51:11,221 - non_major_league_hyperparameter_tuning - WARNING - Error in fold: feature_names must be string, and may not contain [, ] or <
[I 2025-10-15 23:51:11,222] Trial 5 finished with value: inf and parameters: {'n_estimators': 61, 'max_depth': 6, 'learning_rate': 0.06298344232843686, 'subsample': 0.8552765546230239, 'colsample_bytree': 0.8162247262120618, 'min_child_weight': 3, 'reg_alpha': 0.4814185415642628, 'reg_lambda': 0.3029503031047247}. Best is trial 0 with value: inf.
2025-10-15 23:51:11,259 - non_major_league_hyperparameter_tuning - WARNING - Error in fold: feature_names must be string, and may not contain [, ] or <
2025-10-15 23:51:11,291 - non_major_league_hyperparameter_tuning - WARNING - Error in fold: feature_names must be string, and may not contain [, ] or <
2025-10-15 23:51:11,324 - non_major_league_hyperparameter_tuning - WARNING - Error in fold: feature_names must be string, and may not contain [, ] or <
[I 2025-10-15 23:51:11,325] Trial 6 finished with value: inf and parameters: {'n_estimators': 144, 'max_depth': 3, 'learning_rate': 0.08115404948608844, 'subsample': 0.9751478970757703, 'colsample_bytree': 0.9266351295774163, 'min_child_weight': 8, 'reg_alpha': 0.8091005120189539, 'reg_lambda': 1.4931502771240452}. Best is trial 0 with value: inf.
2025-10-15 23:51:11,364 - non_major_league_hyperparameter_tuning - WARNING - Error in fold: feature_names must be string, and may not contain [, ] or <
2025-10-15 23:51:11,398 - non_major_league_hyperparameter_tuning - WARNING - Error in fold: feature_names must be string, and may not contain [, ] or <
2025-10-15 23:51:11,429 - non_major_league_hyperparameter_tuning - WARNING - Error in fold: feature_names must be string, and may not contain [, ] or <
[I 2025-10-15 23:51:11,430] Trial 7 finished with value: inf and parameters: {'n_estimators': 188, 'max_depth': 3, 'learning_rate': 0.07092111767694664, 'subsample': 0.9063521152827204, 'colsample_bytree': 0.6420169775363079, 'min_child_weight': 7, 'reg_alpha': 0.31924877491217407, 'reg_lambda': 0.1428762542450177}. Best is trial 0 with value: inf.
2025-10-15 23:51:11,457 - non_major_league_hyperparameter_tuning - WARNING - Error in fold: feature_names must be string, and may not contain [, ] or <
2025-10-15 23:51:11,480 - non_major_league_hyperparameter_tuning - WARNING - Error in fold: feature_names must be string, and may not contain [, ] or <
2025-10-15 23:51:11,503 - non_major_league_hyperparameter_tuning - WARNING - Error in fold: feature_names must be string, and may not contain [, ] or <
[I 2025-10-15 23:51:11,503] Trial 8 finished with value: inf and parameters: {'n_estimators': 167, 'max_depth': 6, 'learning_rate': 0.0961372443889236, 'subsample': 0.871376103327227, 'colsample_bytree': 0.9481685033925964, 'min_child_weight': 6, 'reg_alpha': 0.4699548884490067, 'reg_lambda': 0.41793930046034067}. Best is trial 0 with value: inf.
2025-10-15 23:51:11,526 - non_major_league_hyperparameter_tuning - WARNING - Error in fold: feature_names must be string, and may not contain [, ] or <
2025-10-15 23:51:11,560 - non_major_league_hyperparameter_tuning - WARNING - Error in fold: feature_names must be string, and may not contain [, ] or <
2025-10-15 23:51:11,598 - non_major_league_hyperparameter_tuning - WARNING - Error in fold: feature_names must be string, and may not contain [, ] or <
[I 2025-10-15 23:51:11,598] Trial 9 finished with value: inf and parameters: {'n_estimators': 70, 'max_depth': 8, 'learning_rate': 0.07939084318183524, 'subsample': 0.9192881059851256, 'colsample_bytree': 0.6444521896149273, 'min_child_weight': 7, 'reg_alpha': 0.09047493586754041, 'reg_lambda': 1.2601799278626233}. Best is trial 0 with value: inf.
2025-10-15 23:51:11,677 - non_major_league_hyperparameter_tuning - WARNING - Error in fold: feature_names must be string, and may not contain [, ] or <
2025-10-15 23:51:11,715 - non_major_league_hyperparameter_tuning - WARNING - Error in fold: feature_names must be string, and may not contain [, ] or <
2025-10-15 23:51:11,750 - non_major_league_hyperparameter_tuning - WARNING - Error in fold: feature_names must be string, and may not contain [, ] or <
[I 2025-10-15 23:51:11,751] Trial 10 finished with value: inf and parameters: {'n_estimators': 100, 'max_depth': 5, 'learning_rate': 0.010327795978679707, 'subsample': 0.7543652573373202, 'colsample_bytree': 0.7275237746656733, 'min_child_weight': 1, 'reg_alpha': 0.6828305051865149, 'reg_lambda': 0.868120999105604}. Best is trial 0 with value: inf.
2025-10-15 23:51:11,810 - non_major_league_hyperparameter_tuning - WARNING - Error in fold: feature_names must be string, and may not contain [, ] or <
2025-10-15 23:51:11,835 - non_major_league_hyperparameter_tuning - WARNING - Error in fold: feature_names must be string, and may not contain [, ] or <
2025-10-15 23:51:11,861 - non_major_league_hyperparameter_tuning - WARNING - Error in fold: feature_names must be string, and may not contain [, ] or <
[I 2025-10-15 23:51:11,862] Trial 11 finished with value: inf and parameters: {'n_estimators': 195, 'max_depth': 8, 'learning_rate': 0.09924894528042821, 'subsample': 0.9659629175624309, 'colsample_bytree': 0.7312843374077185, 'min_child_weight': 4, 'reg_alpha': 0.3185712049922465, 'reg_lambda': 1.9360660587715763}. Best is trial 0 with value: inf.
2025-10-15 23:51:11,922 - non_major_league_hyperparameter_tuning - WARNING - Error in fold: feature_names must be string, and may not contain [, ] or <
2025-10-15 23:51:11,953 - non_major_league_hyperparameter_tuning - WARNING - Error in fold: feature_names must be string, and may not contain [, ] or <
2025-10-15 23:51:11,980 - non_major_league_hyperparameter_tuning - WARNING - Error in fold: feature_names must be string, and may not contain [, ] or <
[I 2025-10-15 23:51:11,980] Trial 12 finished with value: inf and parameters: {'n_estimators': 114, 'max_depth': 7, 'learning_rate': 0.042157199276931234, 'subsample': 0.8195883994948343, 'colsample_bytree': 0.7233983047849785, 'min_child_weight': 3, 'reg_alpha': 0.2953663069869972, 'reg_lambda': 1.1548126540963148}. Best is trial 0 with value: inf.
2025-10-15 23:51:12,046 - non_major_league_hyperparameter_tuning - WARNING - Error in fold: feature_names must be string, and may not contain [, ] or <
2025-10-15 23:51:12,073 - non_major_league_hyperparameter_tuning - WARNING - Error in fold: feature_names must be string, and may not contain [, ] or <
2025-10-15 23:51:12,104 - non_major_league_hyperparameter_tuning - WARNING - Error in fold: feature_names must be string, and may not contain [, ] or <
[I 2025-10-15 23:51:12,105] Trial 13 finished with value: inf and parameters: {'n_estimators': 169, 'max_depth': 8, 'learning_rate': 0.08516566554489999, 'subsample': 0.7547704695878757, 'colsample_bytree': 0.6970324579101883, 'min_child_weight': 4, 'reg_alpha': 0.02128001151167974, 'reg_lambda': 1.4503320562627984}. Best is trial 0 with value: inf.
2025-10-15 23:51:12,172 - non_major_league_hyperparameter_tuning - WARNING - Error in fold: feature_names must be string, and may not contain [, ] or <
2025-10-15 23:51:12,199 - non_major_league_hyperparameter_tuning - WARNING - Error in fold: feature_names must be string, and may not contain [, ] or <
2025-10-15 23:51:12,227 - non_major_league_hyperparameter_tuning - WARNING - Error in fold: feature_names must be string, and may not contain [, ] or <
[I 2025-10-15 23:51:12,228] Trial 14 finished with value: inf and parameters: {'n_estimators': 83, 'max_depth': 7, 'learning_rate': 0.04579144476009064, 'subsample': 0.9858183083609425, 'colsample_bytree': 0.7998448133768203, 'min_child_weight': 2, 'reg_alpha': 0.5358744164700386, 'reg_lambda': 0.716000177685163}. Best is trial 0 with value: inf.
2025-10-15 23:51:12,285 - non_major_league_hyperparameter_tuning - WARNING - Error in fold: feature_names must be string, and may not contain [, ] or <
2025-10-15 23:51:12,314 - non_major_league_hyperparameter_tuning - WARNING - Error in fold: feature_names must be string, and may not contain [, ] or <
2025-10-15 23:51:12,344 - non_major_league_hyperparameter_tuning - WARNING - Error in fold: feature_names must be string, and may not contain [, ] or <
[I 2025-10-15 23:51:12,344] Trial 15 finished with value: inf and parameters: {'n_estimators': 156, 'max_depth': 5, 'learning_rate': 0.07131749544462176, 'subsample': 0.919010748729887, 'colsample_bytree': 0.7833996139428557, 'min_child_weight': 5, 'reg_alpha': 0.6514720511447187, 'reg_lambda': 1.855327637230869}. Best is trial 0 with value: inf.
2025-10-15 23:51:12,404 - non_major_league_hyperparameter_tuning - WARNING - Error in fold: feature_names must be string, and may not contain [, ] or <
2025-10-15 23:51:12,432 - non_major_league_hyperparameter_tuning - WARNING - Error in fold: feature_names must be string, and may not contain [, ] or <
2025-10-15 23:51:12,458 - non_major_league_hyperparameter_tuning - WARNING - Error in fold: feature_names must be string, and may not contain [, ] or <
[I 2025-10-15 23:51:12,459] Trial 16 finished with value: inf and parameters: {'n_estimators': 121, 'max_depth': 7, 'learning_rate': 0.08992327039852618, 'subsample': 0.6898545433746133, 'colsample_bytree': 0.6804592168456983, 'min_child_weight': 2, 'reg_alpha': 0.21511042105060782, 'reg_lambda': 1.1065474218393414}. Best is trial 0 with value: inf.
2025-10-15 23:51:12,519 - non_major_league_hyperparameter_tuning - WARNING - Error in fold: feature_names must be string, and may not contain [, ] or <
2025-10-15 23:51:12,547 - non_major_league_hyperparameter_tuning - WARNING - Error in fold: feature_names must be string, and may not contain [, ] or <
2025-10-15 23:51:12,574 - non_major_league_hyperparameter_tuning - WARNING - Error in fold: feature_names must be string, and may not contain [, ] or <
[I 2025-10-15 23:51:12,574] Trial 17 finished with value: inf and parameters: {'n_estimators': 85, 'max_depth': 8, 'learning_rate': 0.02417383772641806, 'subsample': 0.8099259791391286, 'colsample_bytree': 0.6125080433173034, 'min_child_weight': 5, 'reg_alpha': 0.43989426553413175, 'reg_lambda': 1.3229704247215477}. Best is trial 0 with value: inf.
2025-10-15 23:51:12,648 - non_major_league_hyperparameter_tuning - WARNING - Error in fold: feature_names must be string, and may not contain [, ] or <
2025-10-15 23:51:12,681 - non_major_league_hyperparameter_tuning - WARNING - Error in fold: feature_names must be string, and may not contain [, ] or <
2025-10-15 23:51:12,714 - non_major_league_hyperparameter_tuning - WARNING - Error in fold: feature_names must be string, and may not contain [, ] or <
[I 2025-10-15 23:51:12,715] Trial 18 finished with value: inf and parameters: {'n_estimators': 51, 'max_depth': 4, 'learning_rate': 0.07158712286452386, 'subsample': 0.8651160654977036, 'colsample_bytree': 0.750832689594042, 'min_child_weight': 3, 'reg_alpha': 0.002880797491156384, 'reg_lambda': 1.6813717364241665}. Best is trial 0 with value: inf.
2025-10-15 23:51:12,783 - non_major_league_hyperparameter_tuning - WARNING - Error in fold: feature_names must be string, and may not contain [, ] or <
2025-10-15 23:51:12,813 - non_major_league_hyperparameter_tuning - WARNING - Error in fold: feature_names must be string, and may not contain [, ] or <
2025-10-15 23:51:12,950 - non_major_league_hyperparameter_tuning - WARNING - Error in fold: feature_names must be string, and may not contain [, ] or <
[I 2025-10-15 23:51:12,950] Trial 19 finished with value: inf and parameters: {'n_estimators': 181, 'max_depth': 7, 'learning_rate': 0.04879759492888102, 'subsample': 0.9344425597497905, 'colsample_bytree': 0.6821936769840753, 'min_child_weight': 1, 'reg_alpha': 0.6130032159908263, 'reg_lambda': 0.9326830683211806}. Best is trial 0 with value: inf.
2025-10-15 23:51:13,027 - non_major_league_hyperparameter_tuning - WARNING - Error in fold: feature_names must be string, and may not contain [, ] or <
2025-10-15 23:51:13,064 - non_major_league_hyperparameter_tuning - WARNING - Error in fold: feature_names must be string, and may not contain [, ] or <
2025-10-15 23:51:13,105 - non_major_league_hyperparameter_tuning - WARNING - Error in fold: feature_names must be string, and may not contain [, ] or <
