[I 2025-10-15 23:43:16,732] Trial 16 finished with value: inf and parameters: {'n_estimators': 82, 'max_depth': 7, 'learning_rate': 0.07102840702514795, 'num_leaves': 84, 'feature_fraction': 0.6645467814965715, 'bagging_fraction': 0.8833930478859312, 'bagging_freq': 5, 'lambda_l1': 0.36606619226618536, 'lambda_l2': 0.794537188859937, 'min_data_in_leaf': 21}. Best is trial 0 with value: inf.
2025-10-15 23:43:16,777 - non_major_league_hyperparameter_tuning - WARNING - Error in fold: pandas dtypes must be int, float or bool.
Fields with bad pandas dtypes: Div: object, Date: object, Time: object, HomeTeam: object, AwayTeam: object, FTR: object, HTR: object, Referee: object, league: object, season: object, data_source: object, season_phase: object
2025-10-15 23:43:16,784 - non_major_league_hyperparameter_tuning - WARNING - Error in fold: pandas dtypes must be int, float or bool.
Fields with bad pandas dtypes: Div: object, Date: object, Time: object, HomeTeam: object, AwayTeam: object, FTR: object, HTR: object, Referee: object, league: object, season: object, data_source: object, season_phase: object
2025-10-15 23:43:16,792 - non_major_league_hyperparameter_tuning - WARNING - Error in fold: pandas dtypes must be int, float or bool.
Fields with bad pandas dtypes: Div: object, Date: object, Time: object, HomeTeam: object, AwayTeam: object, FTR: object, HTR: object, Referee: object, league: object, season: object, data_source: object, season_phase: object
[I 2025-10-15 23:43:16,793] Trial 17 finished with value: inf and parameters: {'n_estimators': 117, 'max_depth': 5, 'learning_rate': 0.09257092291415284, 'num_leaves': 42, 'feature_fraction': 0.7536121665335398, 'bagging_fraction': 0.608926300725694, 'bagging_freq': 3, 'lambda_l1': 0.8829510851469983, 'lambda_l2': 0.2904581488665182, 'min_data_in_leaf': 6}. Best is trial 0 with value: inf.
2025-10-15 23:43:16,842 - non_major_league_hyperparameter_tuning - WARNING - Error in fold: pandas dtypes must be int, float or bool.
Fields with bad pandas dtypes: Div: object, Date: object, Time: object, HomeTeam: object, AwayTeam: object, FTR: object, HTR: object, Referee: object, league: object, season: object, data_source: object, season_phase: object
2025-10-15 23:43:16,851 - non_major_league_hyperparameter_tuning - WARNING - Error in fold: pandas dtypes must be int, float or bool.
Fields with bad pandas dtypes: Div: object, Date: object, Time: object, HomeTeam: object, AwayTeam: object, FTR: object, HTR: object, Referee: object, league: object, season: object, data_source: object, season_phase: object
2025-10-15 23:43:16,859 - non_major_league_hyperparameter_tuning - WARNING - Error in fold: pandas dtypes must be int, float or bool.
Fields with bad pandas dtypes: Div: object, Date: object, Time: object, HomeTeam: object, AwayTeam: object, FTR: object, HTR: object, Referee: object, league: object, season: object, data_source: object, season_phase: object
[I 2025-10-15 23:43:16,860] Trial 18 finished with value: inf and parameters: {'n_estimators': 134, 'max_depth': 6, 'learning_rate': 0.04149801900028717, 'num_leaves': 23, 'feature_fraction': 0.6421929115867403, 'bagging_fraction': 0.671954885459553, 'bagging_freq': 6, 'lambda_l1': 0.6286242717596481, 'lambda_l2': 1.203145073195835, 'min_data_in_leaf': 14}. Best is trial 0 with value: inf.
2025-10-15 23:43:16,905 - non_major_league_hyperparameter_tuning - WARNING - Error in fold: pandas dtypes must be int, float or bool.
Fields with bad pandas dtypes: Div: object, Date: object, Time: object, HomeTeam: object, AwayTeam: object, FTR: object, HTR: object, Referee: object, league: object, season: object, data_source: object, season_phase: object
2025-10-15 23:43:16,913 - non_major_league_hyperparameter_tuning - WARNING - Error in fold: pandas dtypes must be int, float or bool.
Fields with bad pandas dtypes: Div: object, Date: object, Time: object, HomeTeam: object, AwayTeam: object, FTR: object, HTR: object, Referee: object, league: object, season: object, data_source: object, season_phase: object
2025-10-15 23:43:16,920 - non_major_league_hyperparameter_tuning - WARNING - Error in fold: pandas dtypes must be int, float or bool.
Fields with bad pandas dtypes: Div: object, Date: object, Time: object, HomeTeam: object, AwayTeam: object, FTR: object, HTR: object, Referee: object, league: object, season: object, data_source: object, season_phase: object
[I 2025-10-15 23:43:16,921] Trial 19 finished with value: inf and parameters: {'n_estimators': 169, 'max_depth': 4, 'learning_rate': 0.023458700802973197, 'num_leaves': 67, 'feature_fraction': 0.692723478360084, 'bagging_fraction': 0.8377653367224561, 'bagging_freq': 4, 'lambda_l1': 0.4161838621625735, 'lambda_l2': 1.711808112325705, 'min_data_in_leaf': 33}. Best is trial 0 with value: inf.
2025-10-15 23:43:16,970 - non_major_league_hyperparameter_tuning - WARNING - Error in fold: pandas dtypes must be int, float or bool.
Fields with bad pandas dtypes: Div: object, Date: object, Time: object, HomeTeam: object, AwayTeam: object, FTR: object, HTR: object, Referee: object, league: object, season: object, data_source: object, season_phase: object
2025-10-15 23:43:16,977 - non_major_league_hyperparameter_tuning - WARNING - Error in fold: pandas dtypes must be int, float or bool.
Fields with bad pandas dtypes: Div: object, Date: object, Time: object, HomeTeam: object, AwayTeam: object, FTR: object, HTR: object, Referee: object, league: object, season: object, data_source: object, season_phase: object
2025-10-15 23:43:16,985 - non_major_league_hyperparameter_tuning - WARNING - Error in fold: pandas dtypes must be int, float or bool.
Fields with bad pandas dtypes: Div: object, Date: object, Time: object, HomeTeam: object, AwayTeam: object, FTR: object, HTR: object, Referee: object, league: object, season: object, data_source: object, season_phase: object
[I 2025-10-15 23:43:16,986] Trial 20 finished with value: inf and parameters: {'n_estimators': 70, 'max_depth': 7, 'learning_rate': 0.06547764293575345, 'num_leaves': 37, 'feature_fraction': 0.7631882298718825, 'bagging_fraction': 0.7241514257899981, 'bagging_freq': 2, 'lambda_l1': 0.23187124235286044, 'lambda_l2': 0.2537273669903206, 'min_data_in_leaf': 21}. Best is trial 0 with value: inf.
2025-10-15 23:43:17,044 - non_major_league_hyperparameter_tuning - WARNING - Error in fold: pandas dtypes must be int, float or bool.
Fields with bad pandas dtypes: Div: object, Date: object, Time: object, HomeTeam: object, AwayTeam: object, FTR: object, HTR: object, Referee: object, league: object, season: object, data_source: object, season_phase: object
2025-10-15 23:43:17,051 - non_major_league_hyperparameter_tuning - WARNING - Error in fold: pandas dtypes must be int, float or bool.
Fields with bad pandas dtypes: Div: object, Date: object, Time: object, HomeTeam: object, AwayTeam: object, FTR: object, HTR: object, Referee: object, league: object, season: object, data_source: object, season_phase: object
2025-10-15 23:43:17,058 - non_major_league_hyperparameter_tuning - WARNING - Error in fold: pandas dtypes must be int, float or bool.
Fields with bad pandas dtypes: Div: object, Date: object, Time: object, HomeTeam: object, AwayTeam: object, FTR: object, HTR: object, Referee: object, league: object, season: object, data_source: object, season_phase: object
[I 2025-10-15 23:43:17,059] Trial 21 finished with value: inf and parameters: {'n_estimators': 60, 'max_depth': 6, 'learning_rate': 0.09870981055786397, 'num_leaves': 50, 'feature_fraction': 0.9408949387558857, 'bagging_fraction': 0.6171397434651228, 'bagging_freq': 1, 'lambda_l1': 0.79663182738431, 'lambda_l2': 0.3693363415497811, 'min_data_in_leaf': 16}. Best is trial 0 with value: inf.
2025-10-15 23:43:17,108 - non_major_league_hyperparameter_tuning - WARNING - Error in fold: pandas dtypes must be int, float or bool.
Fields with bad pandas dtypes: Div: object, Date: object, Time: object, HomeTeam: object, AwayTeam: object, FTR: object, HTR: object, Referee: object, league: object, season: object, data_source: object, season_phase: object
2025-10-15 23:43:17,118 - non_major_league_hyperparameter_tuning - WARNING - Error in fold: pandas dtypes must be int, float or bool.
Fields with bad pandas dtypes: Div: object, Date: object, Time: object, HomeTeam: object, AwayTeam: object, FTR: object, HTR: object, Referee: object, league: object, season: object, data_source: object, season_phase: object
2025-10-15 23:43:17,125 - non_major_league_hyperparameter_tuning - WARNING - Error in fold: pandas dtypes must be int, float or bool.
Fields with bad pandas dtypes: Div: object, Date: object, Time: object, HomeTeam: object, AwayTeam: object, FTR: object, HTR: object, Referee: object, league: object, season: object, data_source: object, season_phase: object
[I 2025-10-15 23:43:17,126] Trial 22 finished with value: inf and parameters: {'n_estimators': 94, 'max_depth': 6, 'learning_rate': 0.08020164854642028, 'num_leaves': 21, 'feature_fraction': 0.9861955494106338, 'bagging_fraction': 0.6014697360992212, 'bagging_freq': 1, 'lambda_l1': 0.694431020395764, 'lambda_l2': 0.5752788111484475, 'min_data_in_leaf': 21}. Best is trial 0 with value: inf.
2025-10-15 23:43:17,181 - non_major_league_hyperparameter_tuning - WARNING - Error in fold: pandas dtypes must be int, float or bool.
Fields with bad pandas dtypes: Div: object, Date: object, Time: object, HomeTeam: object, AwayTeam: object, FTR: object, HTR: object, Referee: object, league: object, season: object, data_source: object, season_phase: object
2025-10-15 23:43:17,189 - non_major_league_hyperparameter_tuning - WARNING - Error in fold: pandas dtypes must be int, float or bool.
Fields with bad pandas dtypes: Div: object, Date: object, Time: object, HomeTeam: object, AwayTeam: object, FTR: object, HTR: object, Referee: object, league: object, season: object, data_source: object, season_phase: object
2025-10-15 23:43:17,198 - non_major_league_hyperparameter_tuning - WARNING - Error in fold: pandas dtypes must be int, float or bool.
Fields with bad pandas dtypes: Div: object, Date: object, Time: object, HomeTeam: object, AwayTeam: object, FTR: object, HTR: object, Referee: object, league: object, season: object, data_source: object, season_phase: object
[I 2025-10-15 23:43:17,199] Trial 23 finished with value: inf and parameters: {'n_estimators': 72, 'max_depth': 5, 'learning_rate': 0.04368089912880442, 'num_leaves': 49, 'feature_fraction': 0.9276167601305891, 'bagging_fraction': 0.6462514075304703, 'bagging_freq': 2, 'lambda_l1': 0.8560917727580328, 'lambda_l2': 0.1407299537884693, 'min_data_in_leaf': 9}. Best is trial 0 with value: inf.
2025-10-15 23:43:17,256 - non_major_league_hyperparameter_tuning - WARNING - Error in fold: pandas dtypes must be int, float or bool.
Fields with bad pandas dtypes: Div: object, Date: object, Time: object, HomeTeam: object, AwayTeam: object, FTR: object, HTR: object, Referee: object, league: object, season: object, data_source: object, season_phase: object
2025-10-15 23:43:17,263 - non_major_league_hyperparameter_tuning - WARNING - Error in fold: pandas dtypes must be int, float or bool.
Fields with bad pandas dtypes: Div: object, Date: object, Time: object, HomeTeam: object, AwayTeam: object, FTR: object, HTR: object, Referee: object, league: object, season: object, data_source: object, season_phase: object
2025-10-15 23:43:17,271 - non_major_league_hyperparameter_tuning - WARNING - Error in fold: pandas dtypes must be int, float or bool.
Fields with bad pandas dtypes: Div: object, Date: object, Time: object, HomeTeam: object, AwayTeam: object, FTR: object, HTR: object, Referee: object, league: object, season: object, data_source: object, season_phase: object
[I 2025-10-15 23:43:17,272] Trial 24 finished with value: inf and parameters: {'n_estimators': 51, 'max_depth': 7, 'learning_rate': 0.08792466728653403, 'num_leaves': 78, 'feature_fraction': 0.9947363709752507, 'bagging_fraction': 0.6952633746772378, 'bagging_freq': 3, 'lambda_l1': 0.5650551696194782, 'lambda_l2': 0.6609425544805116, 'min_data_in_leaf': 14}. Best is trial 0 with value: inf.
2025-10-15 23:43:17,334 - non_major_league_hyperparameter_tuning - WARNING - Error in fold: pandas dtypes must be int, float or bool.
Fields with bad pandas dtypes: Div: object, Date: object, Time: object, HomeTeam: object, AwayTeam: object, FTR: object, HTR: object, Referee: object, league: object, season: object, data_source: object, season_phase: object
2025-10-15 23:43:17,345 - non_major_league_hyperparameter_tuning - WARNING - Error in fold: pandas dtypes must be int, float or bool.
Fields with bad pandas dtypes: Div: object, Date: object, Time: object, HomeTeam: object, AwayTeam: object, FTR: object, HTR: object, Referee: object, league: object, season: object, data_source: object, season_phase: object
2025-10-15 23:43:17,357 - non_major_league_hyperparameter_tuning - WARNING - Error in fold: pandas dtypes must be int, float or bool.
Fields with bad pandas dtypes: Div: object, Date: object, Time: object, HomeTeam: object, AwayTeam: object, FTR: object, HTR: object, Referee: object, league: object, season: object, data_source: object, season_phase: object
[I 2025-10-15 23:43:17,358] Trial 25 finished with value: inf and parameters: {'n_estimators': 115, 'max_depth': 6, 'learning_rate': 0.06132545838995712, 'num_leaves': 61, 'feature_fraction': 0.6300714075409519, 'bagging_fraction': 0.6359565331873406, 'bagging_freq': 1, 'lambda_l1': 0.9074894685059349, 'lambda_l2': 0.42816741685534243, 'min_data_in_leaf': 30}. Best is trial 0 with value: inf.
2025-10-15 23:43:17,418 - non_major_league_hyperparameter_tuning - WARNING - Error in fold: pandas dtypes must be int, float or bool.
Fields with bad pandas dtypes: Div: object, Date: object, Time: object, HomeTeam: object, AwayTeam: object, FTR: object, HTR: object, Referee: object, league: object, season: object, data_source: object, season_phase: object
2025-10-15 23:43:17,424 - non_major_league_hyperparameter_tuning - WARNING - Error in fold: pandas dtypes must be int, float or bool.
Fields with bad pandas dtypes: Div: object, Date: object, Time: object, HomeTeam: object, AwayTeam: object, FTR: object, HTR: object, Referee: object, league: object, season: object, data_source: object, season_phase: object
2025-10-15 23:43:17,430 - non_major_league_hyperparameter_tuning - WARNING - Error in fold: pandas dtypes must be int, float or bool.
Fields with bad pandas dtypes: Div: object, Date: object, Time: object, HomeTeam: object, AwayTeam: object, FTR: object, HTR: object, Referee: object, league: object, season: object, data_source: object, season_phase: object
[I 2025-10-15 23:43:17,431] Trial 26 finished with value: inf and parameters: {'n_estimators': 86, 'max_depth': 3, 'learning_rate': 0.022597462779448213, 'num_leaves': 98, 'feature_fraction': 0.747341764517134, 'bagging_fraction': 0.7461278397208119, 'bagging_freq': 4, 'lambda_l1': 0.7246535433401253, 'lambda_l2': 1.1155329170871504, 'min_data_in_leaf': 18}. Best is trial 0 with value: inf.
2025-10-15 23:43:17,480 - non_major_league_hyperparameter_tuning - WARNING - Error in fold: pandas dtypes must be int, float or bool.
Fields with bad pandas dtypes: Div: object, Date: object, Time: object, HomeTeam: object, AwayTeam: object, FTR: object, HTR: object, Referee: object, league: object, season: object, data_source: object, season_phase: object
2025-10-15 23:43:17,485 - non_major_league_hyperparameter_tuning - WARNING - Error in fold: pandas dtypes must be int, float or bool.
Fields with bad pandas dtypes: Div: object, Date: object, Time: object, HomeTeam: object, AwayTeam: object, FTR: object, HTR: object, Referee: object, league: object, season: object, data_source: object, season_phase: object
2025-10-15 23:43:17,491 - non_major_league_hyperparameter_tuning - WARNING - Error in fold: pandas dtypes must be int, float or bool.
Fields with bad pandas dtypes: Div: object, Date: object, Time: object, HomeTeam: object, AwayTeam: object, FTR: object, HTR: object, Referee: object, league: object, season: object, data_source: object, season_phase: object
[I 2025-10-15 23:43:17,492] Trial 27 finished with value: inf and parameters: {'n_estimators': 68, 'max_depth': 5, 'learning_rate': 0.03397972258478201, 'num_leaves': 44, 'feature_fraction': 0.8376982568694904, 'bagging_fraction': 0.6923764318404506, 'bagging_freq': 2, 'lambda_l1': 0.021118877761903854, 'lambda_l2': 0.2046278895709055, 'min_data_in_leaf': 23}. Best is trial 0 with value: inf.
2025-10-15 23:43:17,538 - non_major_league_hyperparameter_tuning - WARNING - Error in fold: pandas dtypes must be int, float or bool.
Fields with bad pandas dtypes: Div: object, Date: object, Time: object, HomeTeam: object, AwayTeam: object, FTR: object, HTR: object, Referee: object, league: object, season: object, data_source: object, season_phase: object
2025-10-15 23:43:17,545 - non_major_league_hyperparameter_tuning - WARNING - Error in fold: pandas dtypes must be int, float or bool.
Fields with bad pandas dtypes: Div: object, Date: object, Time: object, HomeTeam: object, AwayTeam: object, FTR: object, HTR: object, Referee: object, league: object, season: object, data_source: object, season_phase: object
2025-10-15 23:43:17,551 - non_major_league_hyperparameter_tuning - WARNING - Error in fold: pandas dtypes must be int, float or bool.
Fields with bad pandas dtypes: Div: object, Date: object, Time: object, HomeTeam: object, AwayTeam: object, FTR: object, HTR: object, Referee: object, league: object, season: object, data_source: object, season_phase: object
[I 2025-10-15 23:43:17,551] Trial 28 finished with value: inf and parameters: {'n_estimators': 94, 'max_depth': 7, 'learning_rate': 0.04578316928510169, 'num_leaves': 17, 'feature_fraction': 0.6817708332786868, 'bagging_fraction': 0.7645156172323688, 'bagging_freq': 3, 'lambda_l1': 0.4303324224238566, 'lambda_l2': 0.443120591315866, 'min_data_in_leaf': 9}. Best is trial 0 with value: inf.
2025-10-15 23:43:17,604 - non_major_league_hyperparameter_tuning - WARNING - Error in fold: pandas dtypes must be int, float or bool.
Fields with bad pandas dtypes: Div: object, Date: object, Time: object, HomeTeam: object, AwayTeam: object, FTR: object, HTR: object, Referee: object, league: object, season: object, data_source: object, season_phase: object
2025-10-15 23:43:17,612 - non_major_league_hyperparameter_tuning - WARNING - Error in fold: pandas dtypes must be int, float or bool.
Fields with bad pandas dtypes: Div: object, Date: object, Time: object, HomeTeam: object, AwayTeam: object, FTR: object, HTR: object, Referee: object, league: object, season: object, data_source: object, season_phase: object
2025-10-15 23:43:17,620 - non_major_league_hyperparameter_tuning - WARNING - Error in fold: pandas dtypes must be int, float or bool.
Fields with bad pandas dtypes: Div: object, Date: object, Time: object, HomeTeam: object, AwayTeam: object, FTR: object, HTR: object, Referee: object, league: object, season: object, data_source: object, season_phase: object
[I 2025-10-15 23:43:17,621] Trial 29 finished with value: inf and parameters: {'n_estimators': 158, 'max_depth': 6, 'learning_rate': 0.05808093229806453, 'num_leaves': 29, 'feature_fraction': 0.6320996263814779, 'bagging_fraction': 0.8538418680841097, 'bagging_freq': 7, 'lambda_l1': 0.7634444381628196, 'lambda_l2': 0.7819147823812367, 'min_data_in_leaf': 30}. Best is trial 0 with value: inf.
2025-10-15 23:43:17,629 - non_major_league_hyperparameter_tuning - INFO - lightgbm optimization complete
2025-10-15 23:43:17,629 - non_major_league_hyperparameter_tuning - INFO - Best score: inf
2025-10-15 23:43:17,630 - non_major_league_hyperparameter_tuning - INFO - Best params: {'n_estimators': 122, 'max_depth': 7, 'learning_rate': 0.03071760070595622, 'num_leaves': 57, 'feature_fraction': 0.7039271427999032, 'bagging_fraction': 0.6774972221358695, 'bagging_freq': 2, 'lambda_l1': 0.7696001860298304, 'lambda_l2': 1.6987715199118822, 'min_data_in_leaf': 11}
2025-10-15 23:43:17,630 - non_major_league_hyperparameter_tuning - INFO - Optimizing random_forest (priority: 3)
2025-10-15 23:43:17,630 - non_major_league_hyperparameter_tuning - INFO - Optimizing hyperparameters for random_forest
[I 2025-10-15 23:43:17,630] A new study created in memory with name: no-name-4338f58c-a84b-45a6-8e09-950330e514e9
2025-10-15 23:43:17,641 - non_major_league_hyperparameter_tuning - WARNING - Error in fold: could not convert string to float: 'E1'
2025-10-15 23:43:17,653 - non_major_league_hyperparameter_tuning - WARNING - Error in fold: could not convert string to float: 'E1'
2025-10-15 23:43:17,670 - non_major_league_hyperparameter_tuning - WARNING - Error in fold: could not convert string to float: 'E1'
[I 2025-10-15 23:43:17,672] Trial 0 finished with value: inf and parameters: {'n_estimators': 80, 'max_depth': 5, 'min_samples_split': 19, 'min_samples_leaf': 2, 'max_features': None}. Best is trial 0 with value: inf.
2025-10-15 23:43:17,684 - non_major_league_hyperparameter_tuning - WARNING - Error in fold: could not convert string to float: 'E1'
2025-10-15 23:43:17,694 - non_major_league_hyperparameter_tuning - WARNING - Error in fold: could not convert string to float: 'E1'
2025-10-15 23:43:17,708 - non_major_league_hyperparameter_tuning - WARNING - Error in fold: could not convert string to float: 'E1'
