[I 2025-10-16 03:12:19,349] Trial 2 finished with value: inf and parameters: {'n_estimators': 114, 'max_depth': 8, 'learning_rate': 0.06627939792599293, 'subsample': 0.8345441009388177, 'colsample_bytree': 0.6461476231031507, 'min_child_weight': 10, 'reg_alpha': 0.737576537072654, 'reg_lambda': 0.3396817729221697}. Best is trial 0 with value: inf.
WARNING:non_major_league_hyperparameter_tuning:Error in fold: feature_names must be string, and may not contain [, ] or <
WARNING:non_major_league_hyperparameter_tuning:Error in fold: feature_names must be string, and may not contain [, ] or <
WARNING:non_major_league_hyperparameter_tuning:Error in fold: feature_names must be string, and may not contain [, ] or <
[I 2025-10-16 03:12:19,432] Trial 3 finished with value: inf and parameters: {'n_estimators': 126, 'max_depth': 7, 'learning_rate': 0.08291265142357905, 'subsample': 0.9157588984205596, 'colsample_bytree': 0.6091069306492377, 'min_child_weight': 8, 'reg_alpha': 0.7220788048961769, 'reg_lambda': 0.0001858869757420667}. Best is trial 0 with value: inf.
WARNING:non_major_league_hyperparameter_tuning:Error in fold: feature_names must be string, and may not contain [, ] or <
WARNING:non_major_league_hyperparameter_tuning:Error in fold: feature_names must be string, and may not contain [, ] or <
WARNING:non_major_league_hyperparameter_tuning:Error in fold: feature_names must be string, and may not contain [, ] or <
[I 2025-10-16 03:12:19,512] Trial 4 finished with value: inf and parameters: {'n_estimators': 80, 'max_depth': 7, 'learning_rate': 0.07313632290112139, 'subsample': 0.7622825996214135, 'colsample_bytree': 0.648125730913674, 'min_child_weight': 4, 'reg_alpha': 0.0337269656057132, 'reg_lambda': 1.7522317643271368}. Best is trial 0 with value: inf.
WARNING:non_major_league_hyperparameter_tuning:Error in fold: feature_names must be string, and may not contain [, ] or <
WARNING:non_major_league_hyperparameter_tuning:Error in fold: feature_names must be string, and may not contain [, ] or <
WARNING:non_major_league_hyperparameter_tuning:Error in fold: feature_names must be string, and may not contain [, ] or <
[I 2025-10-16 03:12:19,611] Trial 5 finished with value: inf and parameters: {'n_estimators': 145, 'max_depth': 3, 'learning_rate': 0.0315807310569574, 'subsample': 0.8121209690497897, 'colsample_bytree': 0.9973778437777638, 'min_child_weight': 3, 'reg_alpha': 0.9539887409763504, 'reg_lambda': 1.4982883713164163}. Best is trial 0 with value: inf.
WARNING:non_major_league_hyperparameter_tuning:Error in fold: feature_names must be string, and may not contain [, ] or <
WARNING:non_major_league_hyperparameter_tuning:Error in fold: feature_names must be string, and may not contain [, ] or <
WARNING:non_major_league_hyperparameter_tuning:Error in fold: feature_names must be string, and may not contain [, ] or <
[I 2025-10-16 03:12:19,826] Trial 6 finished with value: inf and parameters: {'n_estimators': 127, 'max_depth': 6, 'learning_rate': 0.08939736127209064, 'subsample': 0.8731606621866783, 'colsample_bytree': 0.8224516601143936, 'min_child_weight': 7, 'reg_alpha': 0.06956774191219495, 'reg_lambda': 0.021128661817651384}. Best is trial 0 with value: inf.
WARNING:non_major_league_hyperparameter_tuning:Error in fold: feature_names must be string, and may not contain [, ] or <
WARNING:non_major_league_hyperparameter_tuning:Error in fold: feature_names must be string, and may not contain [, ] or <
WARNING:non_major_league_hyperparameter_tuning:Error in fold: feature_names must be string, and may not contain [, ] or <
[I 2025-10-16 03:12:19,886] Trial 7 finished with value: inf and parameters: {'n_estimators': 68, 'max_depth': 8, 'learning_rate': 0.021850523747480123, 'subsample': 0.7108674860060008, 'colsample_bytree': 0.7915743115843304, 'min_child_weight': 5, 'reg_alpha': 0.40150515051845703, 'reg_lambda': 1.555089834827996}. Best is trial 0 with value: inf.
WARNING:non_major_league_hyperparameter_tuning:Error in fold: feature_names must be string, and may not contain [, ] or <
WARNING:non_major_league_hyperparameter_tuning:Error in fold: feature_names must be string, and may not contain [, ] or <
WARNING:non_major_league_hyperparameter_tuning:Error in fold: feature_names must be string, and may not contain [, ] or <
[I 2025-10-16 03:12:19,965] Trial 8 finished with value: inf and parameters: {'n_estimators': 171, 'max_depth': 7, 'learning_rate': 0.07710888402732331, 'subsample': 0.6024581951799288, 'colsample_bytree': 0.6595413855679116, 'min_child_weight': 4, 'reg_alpha': 0.03382103757392607, 'reg_lambda': 1.7312512894351704}. Best is trial 0 with value: inf.
WARNING:non_major_league_hyperparameter_tuning:Error in fold: feature_names must be string, and may not contain [, ] or <
WARNING:non_major_league_hyperparameter_tuning:Error in fold: feature_names must be string, and may not contain [, ] or <
WARNING:non_major_league_hyperparameter_tuning:Error in fold: feature_names must be string, and may not contain [, ] or <
[I 2025-10-16 03:12:20,044] Trial 9 finished with value: inf and parameters: {'n_estimators': 166, 'max_depth': 4, 'learning_rate': 0.07422868401838427, 'subsample': 0.9736752583431567, 'colsample_bytree': 0.8608638348918317, 'min_child_weight': 1, 'reg_alpha': 0.5356279135715399, 'reg_lambda': 1.1161259344839676}. Best is trial 0 with value: inf.
WARNING:non_major_league_hyperparameter_tuning:Error in fold: feature_names must be string, and may not contain [, ] or <
WARNING:non_major_league_hyperparameter_tuning:Error in fold: feature_names must be string, and may not contain [, ] or <
WARNING:non_major_league_hyperparameter_tuning:Error in fold: feature_names must be string, and may not contain [, ] or <
[I 2025-10-16 03:12:20,167] Trial 10 finished with value: inf and parameters: {'n_estimators': 200, 'max_depth': 5, 'learning_rate': 0.0459965241055764, 'subsample': 0.659594032790104, 'colsample_bytree': 0.7336778317345242, 'min_child_weight': 10, 'reg_alpha': 0.2594115960354316, 'reg_lambda': 0.5999883271337139}. Best is trial 0 with value: inf.
WARNING:non_major_league_hyperparameter_tuning:Error in fold: feature_names must be string, and may not contain [, ] or <
WARNING:non_major_league_hyperparameter_tuning:Error in fold: feature_names must be string, and may not contain [, ] or <
WARNING:non_major_league_hyperparameter_tuning:Error in fold: feature_names must be string, and may not contain [, ] or <
[I 2025-10-16 03:12:20,279] Trial 11 finished with value: inf and parameters: {'n_estimators': 92, 'max_depth': 4, 'learning_rate': 0.09728118983668739, 'subsample': 0.7518527519907738, 'colsample_bytree': 0.8885375371625718, 'min_child_weight': 8, 'reg_alpha': 0.5400934282535294, 'reg_lambda': 0.9427666725857096}. Best is trial 0 with value: inf.
WARNING:non_major_league_hyperparameter_tuning:Error in fold: feature_names must be string, and may not contain [, ] or <
WARNING:non_major_league_hyperparameter_tuning:Error in fold: feature_names must be string, and may not contain [, ] or <
WARNING:non_major_league_hyperparameter_tuning:Error in fold: feature_names must be string, and may not contain [, ] or <
[I 2025-10-16 03:12:20,388] Trial 12 finished with value: inf and parameters: {'n_estimators': 102, 'max_depth': 5, 'learning_rate': 0.0561534950468269, 'subsample': 0.7116847838261529, 'colsample_bytree': 0.741410434570722, 'min_child_weight': 7, 'reg_alpha': 0.3241848901936954, 'reg_lambda': 0.849820170649675}. Best is trial 0 with value: inf.
WARNING:non_major_league_hyperparameter_tuning:Error in fold: feature_names must be string, and may not contain [, ] or <
WARNING:non_major_league_hyperparameter_tuning:Error in fold: feature_names must be string, and may not contain [, ] or <
WARNING:non_major_league_hyperparameter_tuning:Error in fold: feature_names must be string, and may not contain [, ] or <
[I 2025-10-16 03:12:20,507] Trial 13 finished with value: inf and parameters: {'n_estimators': 53, 'max_depth': 3, 'learning_rate': 0.09458950980148972, 'subsample': 0.7715188388652394, 'colsample_bytree': 0.9309474936302932, 'min_child_weight': 9, 'reg_alpha': 0.6720121270491748, 'reg_lambda': 0.41144569866839686}. Best is trial 0 with value: inf.
WARNING:non_major_league_hyperparameter_tuning:Error in fold: feature_names must be string, and may not contain [, ] or <
WARNING:non_major_league_hyperparameter_tuning:Error in fold: feature_names must be string, and may not contain [, ] or <
WARNING:non_major_league_hyperparameter_tuning:Error in fold: feature_names must be string, and may not contain [, ] or <
[I 2025-10-16 03:12:20,641] Trial 14 finished with value: inf and parameters: {'n_estimators': 146, 'max_depth': 4, 'learning_rate': 0.058852432816154765, 'subsample': 0.6896851829479147, 'colsample_bytree': 0.7517328429439674, 'min_child_weight': 6, 'reg_alpha': 0.9467628121778171, 'reg_lambda': 1.2187820321879321}. Best is trial 0 with value: inf.
WARNING:non_major_league_hyperparameter_tuning:Error in fold: feature_names must be string, and may not contain [, ] or <
WARNING:non_major_league_hyperparameter_tuning:Error in fold: feature_names must be string, and may not contain [, ] or <
WARNING:non_major_league_hyperparameter_tuning:Error in fold: feature_names must be string, and may not contain [, ] or <
[I 2025-10-16 03:12:20,771] Trial 15 finished with value: inf and parameters: {'n_estimators': 147, 'max_depth': 6, 'learning_rate': 0.08668079251485258, 'subsample': 0.8460397120136254, 'colsample_bytree': 0.7042210642312414, 'min_child_weight': 9, 'reg_alpha': 0.1942726165135456, 'reg_lambda': 1.9868052341627511}. Best is trial 0 with value: inf.
WARNING:non_major_league_hyperparameter_tuning:Error in fold: feature_names must be string, and may not contain [, ] or <
WARNING:non_major_league_hyperparameter_tuning:Error in fold: feature_names must be string, and may not contain [, ] or <
WARNING:non_major_league_hyperparameter_tuning:Error in fold: feature_names must be string, and may not contain [, ] or <
[I 2025-10-16 03:12:20,915] Trial 16 finished with value: inf and parameters: {'n_estimators': 104, 'max_depth': 5, 'learning_rate': 0.04349941389858287, 'subsample': 0.6505683968995412, 'colsample_bytree': 0.7990622723668617, 'min_child_weight': 6, 'reg_alpha': 0.44170491624162783, 'reg_lambda': 0.6926548873991807}. Best is trial 0 with value: inf.
WARNING:non_major_league_hyperparameter_tuning:Error in fold: feature_names must be string, and may not contain [, ] or <
WARNING:non_major_league_hyperparameter_tuning:Error in fold: feature_names must be string, and may not contain [, ] or <
WARNING:non_major_league_hyperparameter_tuning:Error in fold: feature_names must be string, and may not contain [, ] or <
[I 2025-10-16 03:12:21,044] Trial 17 finished with value: inf and parameters: {'n_estimators': 167, 'max_depth': 6, 'learning_rate': 0.09957380089737802, 'subsample': 0.8911040903153991, 'colsample_bytree': 0.8430289645872099, 'min_child_weight': 8, 'reg_alpha': 0.6159788618569101, 'reg_lambda': 0.24054184380654897}. Best is trial 0 with value: inf.
WARNING:non_major_league_hyperparameter_tuning:Error in fold: feature_names must be string, and may not contain [, ] or <
WARNING:non_major_league_hyperparameter_tuning:Error in fold: feature_names must be string, and may not contain [, ] or <
WARNING:non_major_league_hyperparameter_tuning:Error in fold: feature_names must be string, and may not contain [, ] or <
[I 2025-10-16 03:12:21,171] Trial 18 finished with value: inf and parameters: {'n_estimators': 130, 'max_depth': 4, 'learning_rate': 0.0644281632125985, 'subsample': 0.8022509487031053, 'colsample_bytree': 0.6960884601964497, 'min_child_weight': 10, 'reg_alpha': 0.8345995399738, 'reg_lambda': 1.2081705191286254}. Best is trial 0 with value: inf.
WARNING:non_major_league_hyperparameter_tuning:Error in fold: feature_names must be string, and may not contain [, ] or <
WARNING:non_major_league_hyperparameter_tuning:Error in fold: feature_names must be string, and may not contain [, ] or <
WARNING:non_major_league_hyperparameter_tuning:Error in fold: feature_names must be string, and may not contain [, ] or <
[I 2025-10-16 03:12:21,301] Trial 19 finished with value: inf and parameters: {'n_estimators': 86, 'max_depth': 8, 'learning_rate': 0.04828735258497677, 'subsample': 0.7395906429968717, 'colsample_bytree': 0.9186503177521236, 'min_child_weight': 2, 'reg_alpha': 0.3993015645434088, 'reg_lambda': 0.5912956198551711}. Best is trial 0 with value: inf.
WARNING:non_major_league_hyperparameter_tuning:Error in fold: feature_names must be string, and may not contain [, ] or <
WARNING:non_major_league_hyperparameter_tuning:Error in fold: feature_names must be string, and may not contain [, ] or <
WARNING:non_major_league_hyperparameter_tuning:Error in fold: feature_names must be string, and may not contain [, ] or <
[I 2025-10-16 03:12:21,412] Trial 20 finished with value: inf and parameters: {'n_estimators': 188, 'max_depth': 3, 'learning_rate': 0.013307112525914544, 'subsample': 0.9883639863366378, 'colsample_bytree': 0.7774121147333518, 'min_child_weight': 7, 'reg_alpha': 0.17472712709601945, 'reg_lambda': 0.21248899745655753}. Best is trial 0 with value: inf.
WARNING:non_major_league_hyperparameter_tuning:Error in fold: feature_names must be string, and may not contain [, ] or <
WARNING:non_major_league_hyperparameter_tuning:Error in fold: feature_names must be string, and may not contain [, ] or <
WARNING:non_major_league_hyperparameter_tuning:Error in fold: feature_names must be string, and may not contain [, ] or <
[I 2025-10-16 03:12:21,545] Trial 21 finished with value: inf and parameters: {'n_estimators': 112, 'max_depth': 8, 'learning_rate': 0.06560408393330393, 'subsample': 0.8293819720835532, 'colsample_bytree': 0.6095779096963401, 'min_child_weight': 10, 'reg_alpha': 0.8153703692970842, 'reg_lambda': 0.375240139316075}. Best is trial 0 with value: inf.
WARNING:non_major_league_hyperparameter_tuning:Error in fold: feature_names must be string, and may not contain [, ] or <
WARNING:non_major_league_hyperparameter_tuning:Error in fold: feature_names must be string, and may not contain [, ] or <
WARNING:non_major_league_hyperparameter_tuning:Error in fold: feature_names must be string, and may not contain [, ] or <
[I 2025-10-16 03:12:21,689] Trial 22 finished with value: inf and parameters: {'n_estimators': 115, 'max_depth': 7, 'learning_rate': 0.08076467507974086, 'subsample': 0.7854481856696123, 'colsample_bytree': 0.6722999822865732, 'min_child_weight': 9, 'reg_alpha': 0.7777350272165933, 'reg_lambda': 0.19415075925312808}. Best is trial 0 with value: inf.
WARNING:non_major_league_hyperparameter_tuning:Error in fold: feature_names must be string, and may not contain [, ] or <
WARNING:non_major_league_hyperparameter_tuning:Error in fold: feature_names must be string, and may not contain [, ] or <
WARNING:non_major_league_hyperparameter_tuning:Error in fold: feature_names must be string, and may not contain [, ] or <
[I 2025-10-16 03:12:21,819] Trial 23 finished with value: inf and parameters: {'n_estimators': 139, 'max_depth': 8, 'learning_rate': 0.0692367930285201, 'subsample': 0.8514782221619642, 'colsample_bytree': 0.7050356124720045, 'min_child_weight': 10, 'reg_alpha': 0.5966941841329565, 'reg_lambda': 0.4998005442413562}. Best is trial 0 with value: inf.
WARNING:non_major_league_hyperparameter_tuning:Error in fold: feature_names must be string, and may not contain [, ] or <
WARNING:non_major_league_hyperparameter_tuning:Error in fold: feature_names must be string, and may not contain [, ] or <
WARNING:non_major_league_hyperparameter_tuning:Error in fold: feature_names must be string, and may not contain [, ] or <
[I 2025-10-16 03:12:21,952] Trial 24 finished with value: inf and parameters: {'n_estimators': 113, 'max_depth': 8, 'learning_rate': 0.08887055417153793, 'subsample': 0.941942749167025, 'colsample_bytree': 0.6400664698685748, 'min_child_weight': 9, 'reg_alpha': 0.48733872690501784, 'reg_lambda': 0.8111652077489326}. Best is trial 0 with value: inf.
WARNING:non_major_league_hyperparameter_tuning:Error in fold: feature_names must be string, and may not contain [, ] or <
WARNING:non_major_league_hyperparameter_tuning:Error in fold: feature_names must be string, and may not contain [, ] or <
WARNING:non_major_league_hyperparameter_tuning:Error in fold: feature_names must be string, and may not contain [, ] or <
[I 2025-10-16 03:12:22,078] Trial 25 finished with value: inf and parameters: {'n_estimators': 97, 'max_depth': 7, 'learning_rate': 0.0823088142769861, 'subsample': 0.7197354547543993, 'colsample_bytree': 0.7704168453919419, 'min_child_weight': 8, 'reg_alpha': 0.6514239844860107, 'reg_lambda': 0.36319647855465587}. Best is trial 0 with value: inf.
WARNING:non_major_league_hyperparameter_tuning:Error in fold: feature_names must be string, and may not contain [, ] or <
WARNING:non_major_league_hyperparameter_tuning:Error in fold: feature_names must be string, and may not contain [, ] or <
WARNING:non_major_league_hyperparameter_tuning:Error in fold: feature_names must be string, and may not contain [, ] or <
[I 2025-10-16 03:12:22,198] Trial 26 finished with value: inf and parameters: {'n_estimators': 155, 'max_depth': 6, 'learning_rate': 0.09205585109471817, 'subsample': 0.7962624869093726, 'colsample_bytree': 0.7171589253447462, 'min_child_weight': 5, 'reg_alpha': 0.715497326133499, 'reg_lambda': 0.1426634419663065}. Best is trial 0 with value: inf.
WARNING:non_major_league_hyperparameter_tuning:Error in fold: feature_names must be string, and may not contain [, ] or <
WARNING:non_major_league_hyperparameter_tuning:Error in fold: feature_names must be string, and may not contain [, ] or <
WARNING:non_major_league_hyperparameter_tuning:Error in fold: feature_names must be string, and may not contain [, ] or <
[I 2025-10-16 03:12:22,327] Trial 27 finished with value: inf and parameters: {'n_estimators': 134, 'max_depth': 8, 'learning_rate': 0.06533681395734166, 'subsample': 0.6730191911919947, 'colsample_bytree': 0.6784374906899833, 'min_child_weight': 9, 'reg_alpha': 0.3199491022205784, 'reg_lambda': 1.3405078539877247}. Best is trial 0 with value: inf.
WARNING:non_major_league_hyperparameter_tuning:Error in fold: feature_names must be string, and may not contain [, ] or <
WARNING:non_major_league_hyperparameter_tuning:Error in fold: feature_names must be string, and may not contain [, ] or <
WARNING:non_major_league_hyperparameter_tuning:Error in fold: feature_names must be string, and may not contain [, ] or <
[I 2025-10-16 03:12:22,447] Trial 28 finished with value: inf and parameters: {'n_estimators': 116, 'max_depth': 5, 'learning_rate': 0.07543741407912298, 'subsample': 0.8294328795370745, 'colsample_bytree': 0.8216889244494788, 'min_child_weight': 10, 'reg_alpha': 0.8678960131936801, 'reg_lambda': 1.0079665774600455}. Best is trial 0 with value: inf.
WARNING:non_major_league_hyperparameter_tuning:Error in fold: feature_names must be string, and may not contain [, ] or <
WARNING:non_major_league_hyperparameter_tuning:Error in fold: feature_names must be string, and may not contain [, ] or <
WARNING:non_major_league_hyperparameter_tuning:Error in fold: feature_names must be string, and may not contain [, ] or <
[I 2025-10-16 03:12:22,572] Trial 29 finished with value: inf and parameters: {'n_estimators': 74, 'max_depth': 7, 'learning_rate': 0.0845102007530153, 'subsample': 0.9081545740195496, 'colsample_bytree': 0.6167347676198455, 'min_child_weight': 7, 'reg_alpha': 0.7490941020728207, 'reg_lambda': 0.10163870068551303}. Best is trial 0 with value: inf.
INFO:non_major_league_hyperparameter_tuning:xgboost optimization complete
INFO:non_major_league_hyperparameter_tuning:Best score: inf
INFO:non_major_league_hyperparameter_tuning:Best params: {'n_estimators': 131, 'max_depth': 8, 'learning_rate': 0.08413881881596441, 'subsample': 0.7395493468588952, 'colsample_bytree': 0.7191007533994392, 'min_child_weight': 10, 'reg_alpha': 0.5834683392635529, 'reg_lambda': 0.15295673036141544}
INFO:non_major_league_hyperparameter_tuning:Optimizing lightgbm (priority: 2)
INFO:non_major_league_hyperparameter_tuning:Optimizing hyperparameters for lightgbm
[I 2025-10-16 03:12:22,583] A new study created in memory with name: no-name-57e4e6fb-64ee-44d0-acb8-f89e91ef5765
[I 2025-10-16 03:12:29,817] Trial 0 finished with value: 0.005255707316067109 and parameters: {'n_estimators': 71, 'max_depth': 3, 'learning_rate': 0.08280556096696129, 'num_leaves': 41, 'feature_fraction': 0.9325718311369571, 'bagging_fraction': 0.8142081374666492, 'bagging_freq': 4, 'lambda_l1': 0.3421253470096748, 'lambda_l2': 0.5285445933979729, 'min_data_in_leaf': 32}. Best is trial 0 with value: 0.005255707316067109.
[I 2025-10-16 03:12:42,205] Trial 1 finished with value: 0.006691289436165701 and parameters: {'n_estimators': 90, 'max_depth': 6, 'learning_rate': 0.06877826031313576, 'num_leaves': 29, 'feature_fraction': 0.8325965054351161, 'bagging_fraction': 0.7976545958809005, 'bagging_freq': 6, 'lambda_l1': 0.4427761008346812, 'lambda_l2': 0.8205916032028695, 'min_data_in_leaf': 33}. Best is trial 0 with value: 0.005255707316067109.
[I 2025-10-16 03:13:11,066] Trial 2 finished with value: 0.008841063196975668 and parameters: {'n_estimators': 144, 'max_depth': 5, 'learning_rate': 0.042523851148160104, 'num_leaves': 39, 'feature_fraction': 0.9958874770793484, 'bagging_fraction': 0.8924861898490499, 'bagging_freq': 1, 'lambda_l1': 0.5893614595105555, 'lambda_l2': 1.760639687810566, 'min_data_in_leaf': 8}. Best is trial 0 with value: 0.005255707316067109.
