[I 2025-10-16 03:44:41,443] Trial 29 finished with value: 0.001701634573871193 and parameters: {'C': 9.199462710322925, 'max_iter': 537, 'solver': 'lbfgs'}. Best is trial 6 with value: 0.0016179492319760179.
INFO:non_major_league_hyperparameter_tuning:logistic_regression optimization complete
INFO:non_major_league_hyperparameter_tuning:Best score: 0.0016
INFO:non_major_league_hyperparameter_tuning:Best params: {'C': 9.986000402278544, 'max_iter': 132, 'solver': 'lbfgs'}
INFO:non_major_league_hyperparameter_tuning:Validating optimized hyperparameters
INFO:non_major_league_hyperparameter_tuning:Hyperparameter validation: FAILED
INFO:non_major_league_hyperparameter_tuning:Comparing optimized models
INFO:non_major_league_hyperparameter_tuning:Best model: random_forest
INFO:non_major_league_hyperparameter_tuning:Best score: 0.0000
INFO:non_major_league_hyperparameter_tuning:Evaluating optimized models
INFO:non_major_league_hyperparameter_tuning:Creating optimized models
INFO:non_major_league_hyperparameter_tuning:Created optimized xgboost model
INFO:non_major_league_hyperparameter_tuning:Created optimized lightgbm model
INFO:non_major_league_hyperparameter_tuning:Created optimized random_forest model
INFO:non_major_league_hyperparameter_tuning:Created optimized logistic_regression model
ERROR:non_major_league_hyperparameter_tuning:Error evaluating xgboost: feature_names must be string, and may not contain [, ] or <
INFO:non_major_league_hyperparameter_tuning:Calculating hyperparameter importance
ERROR:non_major_league_hyperparameter_tuning:Error calculating importance for xgboost: tuple index out of range
INFO:phase2_integration:Step 5: Ensemble Modeling
INFO:phase2_integration:Creating ensemble model
INFO:non_major_league_ensemble:Creating base models with conservative parameters
INFO:non_major_league_ensemble:Created 4 base models
INFO:non_major_league_ensemble:Training base models with conservative validation
INFO:non_major_league_ensemble:Training xgboost...
ERROR:non_major_league_ensemble:Error training xgboost: XGBClassifier.fit() got an unexpected keyword argument 'early_stopping_rounds'
INFO:non_major_league_ensemble:Training lightgbm...
INFO:non_major_league_ensemble:lightgbm - Val Acc: 1.0000, Val LogLoss: 0.0078
INFO:non_major_league_ensemble:Training random_forest...
INFO:non_major_league_ensemble:random_forest - Val Acc: 1.0000, Val LogLoss: 0.0445
INFO:non_major_league_ensemble:Training logistic_regression...
INFO:non_major_league_ensemble:logistic_regression - Val Acc: 1.0000, Val LogLoss: 0.0260
INFO:non_major_league_ensemble:Creating conservative ensemble
INFO:non_major_league_ensemble:Created ensemble with 3 models
INFO:non_major_league_ensemble:Model weights: {'lightgbm': 0.5869346080551697, 'random_forest': 0.2469021203535055, 'logistic_regression': 0.16616327159132474}
INFO:non_major_league_ensemble:Training ensemble model
INFO:non_major_league_ensemble:Ensemble - Val Acc: 1.0000, Val LogLoss: 0.0196
INFO:non_major_league_ensemble:Calibrating model probabilities
ERROR:non_major_league_ensemble:Error calibrating xgboost: feature_names must be string, and may not contain [, ] or <
INFO:non_major_league_ensemble:Calibrated lightgbm
INFO:non_major_league_ensemble:Calibrated random_forest
INFO:non_major_league_ensemble:Calibrated logistic_regression
ERROR:non_major_league_ensemble:Error calibrating ensemble: The 'estimator' parameter of CalibratedClassifierCV must be an object implementing 'fit' and 'predict_proba', an object implementing 'fit' and 'decision_function' or None. Got <non_major_league_ensemble.NonMajorLeagueEnsemble.calibrate_models.<locals>.EnsembleWrapper object at 0x7f446d049be0> instead.
INFO:non_major_league_ensemble:Cross-validating ensemble
INFO:non_major_league_ensemble:Cross-validation fold 1/3
INFO:non_major_league_ensemble:Training base models with conservative validation
INFO:non_major_league_ensemble:Training xgboost...
ERROR:non_major_league_ensemble:Error training xgboost: XGBClassifier.fit() got an unexpected keyword argument 'early_stopping_rounds'
INFO:non_major_league_ensemble:Training lightgbm...
INFO:non_major_league_ensemble:lightgbm - Val Acc: 1.0000, Val LogLoss: 0.0203
INFO:non_major_league_ensemble:Training random_forest...
INFO:non_major_league_ensemble:random_forest - Val Acc: 1.0000, Val LogLoss: 0.1920
INFO:non_major_league_ensemble:Training logistic_regression...
INFO:non_major_league_ensemble:logistic_regression - Val Acc: 1.0000, Val LogLoss: 0.1070
INFO:non_major_league_ensemble:Creating conservative ensemble
INFO:non_major_league_ensemble:Created ensemble with 3 models
INFO:non_major_league_ensemble:Model weights: {'lightgbm': 0.6007410410462872, 'random_forest': 0.23512993861947257, 'logistic_regression': 0.16412902033424023}
INFO:non_major_league_ensemble:Fold 1 - Acc: 1.0000, LogLoss: 0.0711
INFO:non_major_league_ensemble:Cross-validation fold 2/3
INFO:non_major_league_ensemble:Training base models with conservative validation
INFO:non_major_league_ensemble:Training xgboost...
ERROR:non_major_league_ensemble:Error training xgboost: XGBClassifier.fit() got an unexpected keyword argument 'early_stopping_rounds'
INFO:non_major_league_ensemble:Training lightgbm...
INFO:non_major_league_ensemble:lightgbm - Val Acc: 1.0000, Val LogLoss: 0.0120
INFO:non_major_league_ensemble:Training random_forest...
INFO:non_major_league_ensemble:random_forest - Val Acc: 1.0000, Val LogLoss: 0.0939
INFO:non_major_league_ensemble:Training logistic_regression...
INFO:non_major_league_ensemble:logistic_regression - Val Acc: 1.0000, Val LogLoss: 0.0493
INFO:non_major_league_ensemble:Creating conservative ensemble
INFO:non_major_league_ensemble:Created ensemble with 3 models
INFO:non_major_league_ensemble:Model weights: {'lightgbm': 0.5912690433194034, 'random_forest': 0.24296410103989924, 'logistic_regression': 0.1657668556406974}
INFO:non_major_league_ensemble:Fold 2 - Acc: 1.0000, LogLoss: 0.0370
INFO:non_major_league_ensemble:Cross-validation fold 3/3
INFO:non_major_league_ensemble:Training base models with conservative validation
INFO:non_major_league_ensemble:Training xgboost...
ERROR:non_major_league_ensemble:Error training xgboost: XGBClassifier.fit() got an unexpected keyword argument 'early_stopping_rounds'
INFO:non_major_league_ensemble:Training lightgbm...
INFO:non_major_league_ensemble:lightgbm - Val Acc: 1.0000, Val LogLoss: 0.0093
INFO:non_major_league_ensemble:Training random_forest...
INFO:non_major_league_ensemble:random_forest - Val Acc: 1.0000, Val LogLoss: 0.0708
INFO:non_major_league_ensemble:Training logistic_regression...
INFO:non_major_league_ensemble:logistic_regression - Val Acc: 1.0000, Val LogLoss: 0.0358
INFO:non_major_league_ensemble:Creating conservative ensemble
INFO:non_major_league_ensemble:Created ensemble with 3 models
INFO:non_major_league_ensemble:Model weights: {'lightgbm': 0.5891854006193264, 'random_forest': 0.24471627803548435, 'logistic_regression': 0.1660983213451892}
INFO:non_major_league_ensemble:Fold 3 - Acc: 1.0000, LogLoss: 0.0281
INFO:non_major_league_ensemble:CV Summary - Mean Acc: 1.0000 ¬± 0.0000
INFO:non_major_league_ensemble:CV Summary - Mean LogLoss: 0.0454 ¬± 0.0185
INFO:non_major_league_ensemble:Evaluating ensemble performance
INFO:non_major_league_ensemble:Ensemble Evaluation - Acc: 1.0000, LogLoss: 0.0272
INFO:non_major_league_ensemble:Mean Confidence: 0.9732
INFO:non_major_league_ensemble:Making predictions with confidence filtering
INFO:non_major_league_ensemble:High confidence predictions: 154/154
INFO:non_major_league_ensemble:Calculating ensemble feature importance
INFO:non_major_league_ensemble:Estimating prediction uncertainty
INFO:non_major_league_ensemble:Uncertainty estimation complete
INFO:phase2_integration:Step 6: Model Validation
INFO:phase2_integration:Validating models
INFO:non_major_league_model_validation:Performing comprehensive model validation
INFO:non_major_league_model_validation:Performing time series cross-validation
INFO:non_major_league_model_validation:Time series CV fold 1/3
INFO:non_major_league_model_validation:Fold 1 - Val Acc: 1.0000, Overfitting: 0.0000
INFO:non_major_league_model_validation:Time series CV fold 2/3
INFO:non_major_league_model_validation:Fold 2 - Val Acc: 1.0000, Overfitting: 0.0000
INFO:non_major_league_model_validation:Time series CV fold 3/3
INFO:non_major_league_model_validation:Fold 3 - Val Acc: 1.0000, Overfitting: 0.0000
INFO:non_major_league_model_validation:Time series CV complete: 3 successful folds
INFO:non_major_league_model_validation:Performing walk-forward validation
INFO:non_major_league_model_validation:Walk-forward CV fold 1/3
INFO:non_major_league_model_validation:Fold 1 - Val Acc: 1.0000
INFO:non_major_league_model_validation:Walk-forward CV fold 2/3
INFO:non_major_league_model_validation:Fold 2 - Val Acc: 1.0000
INFO:non_major_league_model_validation:Walk-forward CV fold 3/3
INFO:non_major_league_model_validation:Fold 3 - Val Acc: 1.0000
INFO:non_major_league_model_validation:Walk-forward CV complete: 3 successful folds
INFO:non_major_league_model_validation:Performing bootstrap validation
INFO:non_major_league_model_validation:Bootstrap 1/50
INFO:non_major_league_model_validation:Bootstrap 2/50
INFO:non_major_league_model_validation:Bootstrap 3/50
INFO:non_major_league_model_validation:Bootstrap 4/50
INFO:non_major_league_model_validation:Bootstrap 5/50
INFO:non_major_league_model_validation:Bootstrap 6/50
INFO:non_major_league_model_validation:Bootstrap 7/50
INFO:non_major_league_model_validation:Bootstrap 8/50
INFO:non_major_league_model_validation:Bootstrap 9/50
INFO:non_major_league_model_validation:Bootstrap 10/50
INFO:non_major_league_model_validation:Bootstrap 11/50
INFO:non_major_league_model_validation:Bootstrap 12/50
INFO:non_major_league_model_validation:Bootstrap 13/50
INFO:non_major_league_model_validation:Bootstrap 14/50
INFO:non_major_league_model_validation:Bootstrap 15/50
INFO:non_major_league_model_validation:Bootstrap 16/50
INFO:non_major_league_model_validation:Bootstrap 17/50
INFO:non_major_league_model_validation:Bootstrap 18/50
INFO:non_major_league_model_validation:Bootstrap 19/50
INFO:non_major_league_model_validation:Bootstrap 20/50
INFO:non_major_league_model_validation:Bootstrap 21/50
INFO:non_major_league_model_validation:Bootstrap 22/50
INFO:non_major_league_model_validation:Bootstrap 23/50
INFO:non_major_league_model_validation:Bootstrap 24/50
INFO:non_major_league_model_validation:Bootstrap 25/50
INFO:non_major_league_model_validation:Bootstrap 26/50
INFO:non_major_league_model_validation:Bootstrap 27/50
INFO:non_major_league_model_validation:Bootstrap 28/50
INFO:non_major_league_model_validation:Bootstrap 29/50
INFO:non_major_league_model_validation:Bootstrap 30/50
INFO:non_major_league_model_validation:Bootstrap 31/50
INFO:non_major_league_model_validation:Bootstrap 32/50
INFO:non_major_league_model_validation:Bootstrap 33/50
INFO:non_major_league_model_validation:Bootstrap 34/50
INFO:non_major_league_model_validation:Bootstrap 35/50
INFO:non_major_league_model_validation:Bootstrap 36/50
INFO:non_major_league_model_validation:Bootstrap 37/50
INFO:non_major_league_model_validation:Bootstrap 38/50
INFO:non_major_league_model_validation:Bootstrap 39/50
INFO:non_major_league_model_validation:Bootstrap 40/50
INFO:non_major_league_model_validation:Bootstrap 41/50
INFO:non_major_league_model_validation:Bootstrap 42/50
INFO:non_major_league_model_validation:Bootstrap 43/50
INFO:non_major_league_model_validation:Bootstrap 44/50
INFO:non_major_league_model_validation:Bootstrap 45/50
INFO:non_major_league_model_validation:Bootstrap 46/50
INFO:non_major_league_model_validation:Bootstrap 47/50
INFO:non_major_league_model_validation:Bootstrap 48/50
INFO:non_major_league_model_validation:Bootstrap 49/50
INFO:non_major_league_model_validation:Bootstrap 50/50
INFO:non_major_league_model_validation:Bootstrap validation complete: 50 successful bootstraps
INFO:non_major_league_model_validation:Validating model calibration
INFO:non_major_league_model_validation:Model calibration validation complete
INFO:non_major_league_model_validation:Detecting overfitting
INFO:non_major_league_model_validation:Overfitting detection: NOT DETECTED
INFO:non_major_league_model_validation:Analyzing model stability
INFO:non_major_league_model_validation:Stability analysis: STABLE
INFO:non_major_league_model_validation:Comprehensive validation complete
INFO:phase2_integration:Step 7: Final Integration
INFO:phase2_integration:Integrating Phase 2 results
INFO:phase2_integration:Step 8: Saving Results
INFO:phase2_integration:Saving results for E1
INFO:non_major_league_model_architecture:Saving models to ./models/E1_model_architecture.pkl
INFO:non_major_league_model_architecture:Models saved successfully
INFO:non_major_league_ensemble:Saving ensemble to ./models/E1_ensemble.pkl
INFO:non_major_league_ensemble:Ensemble saved successfully
INFO:non_major_league_hyperparameter_tuning:Saving hyperparameter tuning results to ./models/E1_hyperparameter_tuning.pkl
INFO:non_major_league_hyperparameter_tuning:Hyperparameter tuning results saved successfully
INFO:non_major_league_model_validation:Saving validation results to ./models/E1_validation_results.pkl
INFO:non_major_league_model_validation:Validation results saved successfully
INFO:phase2_integration:Phase 2 results saved successfully
INFO:phase2_integration:Phase 2 pipeline completed successfully
INFO:master_pipeline:Phase 2 completed successfully in 2906.76 seconds
INFO:__main__:‚úÖ Phase 2 completed
INFO:__main__:
üìà STEP 5: Phase 3 - Backtesting
INFO:master_pipeline:================================================================================
INFO:master_pipeline:STARTING PHASE 3: BACKTESTING & STRATEGY VALIDATION
INFO:master_pipeline:================================================================================
INFO:phase3_integration:Output directory: ./results
ERROR:master_pipeline:Phase 3 failed: Phase3Integration.run_phase3_pipeline() got an unexpected keyword argument 'feature_data_path'
ERROR:__main__:‚ùå Workflow failed: Phase3Integration.run_phase3_pipeline() got an unexpected keyword argument 'feature_data_path'
ERROR:__main__:Traceback (most recent call last):
  File "/home/kali/Non-major-leagues/run_complete_workflow.py", line 124, in run_complete_workflow
    phase3_result = self.master_pipeline.run_phase3()
  File "/home/kali/Non-major-leagues/master_pipeline.py", line 400, in run_phase3
    result = phase3.run_phase3_pipeline(
        feature_data_path=str(Path(self.config['pipeline']['output_dir']) / 'phase1_output' / 'processed_features.parquet'),
    ...<2 lines>...
        config=self.config
    )
TypeError: Phase3Integration.run_phase3_pipeline() got an unexpected keyword argument 'feature_data_path'

Training until validation scores don't improve for 50 rounds
Did not meet early stopping. Best iteration is:
[200]	valid_0's multi_logloss: 0.00129826
Training until validation scores don't improve for 30 rounds
Did not meet early stopping. Best iteration is:
[150]	valid_0's multi_logloss: 0.00777226
Training until validation scores don't improve for 30 rounds
Did not meet early stopping. Best iteration is:
[150]	valid_0's multi_logloss: 0.0203282
Training until validation scores don't improve for 30 rounds
Did not meet early stopping. Best iteration is:
[150]	valid_0's multi_logloss: 0.012021
Training until validation scores don't improve for 30 rounds
Did not meet early stopping. Best iteration is:
[150]	valid_0's multi_logloss: 0.00933801
Traceback (most recent call last):
  File "/home/kali/Non-major-leagues/run_complete_workflow.py", line 484, in <module>
    main()
    ~~~~^^
  File "/home/kali/Non-major-leagues/run_complete_workflow.py", line 469, in main
    results = orchestrator.run_complete_workflow(
        league=args.league,
        crawler_file=args.crawler_file,
        skip_training=args.skip_training
    )
  File "/home/kali/Non-major-leagues/run_complete_workflow.py", line 124, in run_complete_workflow
    phase3_result = self.master_pipeline.run_phase3()
  File "/home/kali/Non-major-leagues/master_pipeline.py", line 400, in run_phase3
    result = phase3.run_phase3_pipeline(
        feature_data_path=str(Path(self.config['pipeline']['output_dir']) / 'phase1_output' / 'processed_features.parquet'),
    ...<2 lines>...
        config=self.config
    )
TypeError: Phase3Integration.run_phase3_pipeline() got an unexpected keyword argument 'feature_data_path'
