[I 2025-10-16 00:10:38,090] Trial 29 finished with value: 0.0045661547931478775 and parameters: {'C': 6.135964760844749, 'max_iter': 615, 'solver': 'lbfgs'}. Best is trial 18 with value: 0.0032901862153515617.
2025-10-16 00:10:38,094 - non_major_league_hyperparameter_tuning - INFO - logistic_regression optimization complete
2025-10-16 00:10:38,094 - non_major_league_hyperparameter_tuning - INFO - Best score: 0.0033
2025-10-16 00:10:38,095 - non_major_league_hyperparameter_tuning - INFO - Best params: {'C': 9.999554314053057, 'max_iter': 441, 'solver': 'lbfgs'}
2025-10-16 00:10:38,095 - non_major_league_hyperparameter_tuning - INFO - Validating optimized hyperparameters
2025-10-16 00:10:38,095 - non_major_league_hyperparameter_tuning - INFO - Hyperparameter validation: FAILED
2025-10-16 00:10:38,095 - non_major_league_hyperparameter_tuning - INFO - Comparing optimized models
2025-10-16 00:10:38,095 - non_major_league_hyperparameter_tuning - INFO - Best model: random_forest
2025-10-16 00:10:38,095 - non_major_league_hyperparameter_tuning - INFO - Best score: 0.0000
2025-10-16 00:10:38,096 - non_major_league_hyperparameter_tuning - INFO - Evaluating optimized models
2025-10-16 00:10:38,096 - non_major_league_hyperparameter_tuning - INFO - Creating optimized models
2025-10-16 00:10:38,096 - non_major_league_hyperparameter_tuning - INFO - Created optimized xgboost model
2025-10-16 00:10:38,096 - non_major_league_hyperparameter_tuning - INFO - Created optimized lightgbm model
2025-10-16 00:10:38,097 - non_major_league_hyperparameter_tuning - INFO - Created optimized random_forest model
2025-10-16 00:10:38,097 - non_major_league_hyperparameter_tuning - INFO - Created optimized logistic_regression model
2025-10-16 00:10:38,122 - non_major_league_hyperparameter_tuning - ERROR - Error evaluating xgboost: feature_names must be string, and may not contain [, ] or <
2025-10-16 00:11:35,460 - non_major_league_hyperparameter_tuning - INFO - Calculating hyperparameter importance
2025-10-16 00:11:35,466 - non_major_league_hyperparameter_tuning - ERROR - Error calculating importance for xgboost: tuple index out of range
2025-10-16 00:11:37,263 - phase2_integration - INFO - Step 5: Ensemble Modeling
2025-10-16 00:11:37,263 - phase2_integration - INFO - Creating ensemble model
2025-10-16 00:11:37,269 - non_major_league_ensemble - INFO - Creating base models with conservative parameters
2025-10-16 00:11:37,270 - non_major_league_ensemble - INFO - Created 4 base models
2025-10-16 00:11:37,271 - non_major_league_ensemble - INFO - Training base models with conservative validation
2025-10-16 00:11:37,271 - non_major_league_ensemble - INFO - Training xgboost...
2025-10-16 00:11:37,271 - non_major_league_ensemble - ERROR - Error training xgboost: XGBClassifier.fit() got an unexpected keyword argument 'early_stopping_rounds'
2025-10-16 00:11:37,271 - non_major_league_ensemble - INFO - Training lightgbm...
2025-10-16 00:11:55,211 - non_major_league_ensemble - INFO - lightgbm - Val Acc: 1.0000, Val LogLoss: 0.0093
2025-10-16 00:11:55,211 - non_major_league_ensemble - INFO - Training random_forest...
2025-10-16 00:11:55,654 - non_major_league_ensemble - INFO - random_forest - Val Acc: 1.0000, Val LogLoss: 0.0581
2025-10-16 00:11:55,654 - non_major_league_ensemble - INFO - Training logistic_regression...
2025-10-16 00:11:55,726 - non_major_league_ensemble - INFO - logistic_regression - Val Acc: 1.0000, Val LogLoss: 0.0333
2025-10-16 00:11:55,726 - non_major_league_ensemble - INFO - Creating conservative ensemble
2025-10-16 00:11:55,726 - non_major_league_ensemble - INFO - Created ensemble with 3 models
2025-10-16 00:11:55,726 - non_major_league_ensemble - INFO - Model weights: {'lightgbm': 0.5881154594030743, 'random_forest': 0.24587456303055302, 'logistic_regression': 0.16600997756637276}
2025-10-16 00:11:55,727 - non_major_league_ensemble - INFO - Training ensemble model
2025-10-16 00:11:55,755 - non_major_league_ensemble - INFO - Ensemble - Val Acc: 1.0000, Val LogLoss: 0.0247
2025-10-16 00:11:55,756 - non_major_league_ensemble - INFO - Calibrating model probabilities
2025-10-16 00:11:55,791 - non_major_league_ensemble - ERROR - Error calibrating xgboost: feature_names must be string, and may not contain [, ] or <
2025-10-16 00:12:42,758 - non_major_league_ensemble - INFO - Calibrated lightgbm
2025-10-16 00:12:43,931 - non_major_league_ensemble - INFO - Calibrated random_forest
2025-10-16 00:12:44,127 - non_major_league_ensemble - INFO - Calibrated logistic_regression
2025-10-16 00:12:44,128 - non_major_league_ensemble - ERROR - Error calibrating ensemble: The 'estimator' parameter of CalibratedClassifierCV must be an object implementing 'fit' and 'predict_proba', an object implementing 'fit' and 'decision_function' or None. Got <non_major_league_ensemble.NonMajorLeagueEnsemble.calibrate_models.<locals>.EnsembleWrapper object at 0x7f1718cb7380> instead.
2025-10-16 00:12:44,128 - non_major_league_ensemble - INFO - Cross-validating ensemble
2025-10-16 00:12:44,128 - non_major_league_ensemble - INFO - Cross-validation fold 1/3
2025-10-16 00:12:44,130 - non_major_league_ensemble - INFO - Training base models with conservative validation
2025-10-16 00:12:44,130 - non_major_league_ensemble - INFO - Training xgboost...
2025-10-16 00:12:44,130 - non_major_league_ensemble - WARNING - Insufficient training samples for xgboost: 91
2025-10-16 00:12:44,130 - non_major_league_ensemble - INFO - Training lightgbm...
2025-10-16 00:12:44,130 - non_major_league_ensemble - WARNING - Insufficient training samples for lightgbm: 91
2025-10-16 00:12:44,131 - non_major_league_ensemble - INFO - Training random_forest...
2025-10-16 00:12:44,131 - non_major_league_ensemble - WARNING - Insufficient training samples for random_forest: 91
2025-10-16 00:12:44,131 - non_major_league_ensemble - INFO - Training logistic_regression...
2025-10-16 00:12:44,131 - non_major_league_ensemble - WARNING - Insufficient training samples for logistic_regression: 91
2025-10-16 00:12:44,131 - non_major_league_ensemble - INFO - Creating conservative ensemble
2025-10-16 00:12:44,131 - non_major_league_ensemble - ERROR - Not enough successful models for ensemble
2025-10-16 00:12:44,132 - non_major_league_ensemble - INFO - Cross-validation fold 2/3
2025-10-16 00:12:44,134 - non_major_league_ensemble - INFO - Training base models with conservative validation
2025-10-16 00:12:44,135 - non_major_league_ensemble - INFO - Training xgboost...
2025-10-16 00:12:44,135 - non_major_league_ensemble - ERROR - Error training xgboost: XGBClassifier.fit() got an unexpected keyword argument 'early_stopping_rounds'
2025-10-16 00:12:44,135 - non_major_league_ensemble - INFO - Training lightgbm...
2025-10-16 00:13:02,067 - non_major_league_ensemble - INFO - lightgbm - Val Acc: 1.0000, Val LogLoss: 0.0148
2025-10-16 00:13:02,068 - non_major_league_ensemble - INFO - Training random_forest...
2025-10-16 00:13:02,480 - non_major_league_ensemble - INFO - random_forest - Val Acc: 1.0000, Val LogLoss: 0.1425
2025-10-16 00:13:02,480 - non_major_league_ensemble - INFO - Training logistic_regression...
2025-10-16 00:13:02,543 - non_major_league_ensemble - INFO - logistic_regression - Val Acc: 1.0000, Val LogLoss: 0.0653
2025-10-16 00:13:02,543 - non_major_league_ensemble - INFO - Creating conservative ensemble
2025-10-16 00:13:02,543 - non_major_league_ensemble - INFO - Created ensemble with 3 models
2025-10-16 00:13:02,544 - non_major_league_ensemble - INFO - Model weights: {'lightgbm': 0.5954277995252192, 'random_forest': 0.23877776940881115, 'logistic_regression': 0.16579443106596964}
2025-10-16 00:13:02,574 - non_major_league_ensemble - INFO - Fold 2 - Acc: 1.0000, LogLoss: 0.0515
2025-10-16 00:13:02,575 - non_major_league_ensemble - INFO - Cross-validation fold 3/3
2025-10-16 00:13:02,576 - non_major_league_ensemble - INFO - Training base models with conservative validation
2025-10-16 00:13:02,577 - non_major_league_ensemble - INFO - Training xgboost...
2025-10-16 00:13:02,577 - non_major_league_ensemble - ERROR - Error training xgboost: XGBClassifier.fit() got an unexpected keyword argument 'early_stopping_rounds'
2025-10-16 00:13:02,577 - non_major_league_ensemble - INFO - Training lightgbm...
2025-10-16 00:13:23,367 - non_major_league_ensemble - INFO - lightgbm - Val Acc: 1.0000, Val LogLoss: 0.0117
2025-10-16 00:13:23,367 - non_major_league_ensemble - INFO - Training random_forest...
2025-10-16 00:13:23,757 - non_major_league_ensemble - INFO - random_forest - Val Acc: 1.0000, Val LogLoss: 0.0860
2025-10-16 00:13:23,758 - non_major_league_ensemble - INFO - Training logistic_regression...
2025-10-16 00:13:23,813 - non_major_league_ensemble - INFO - logistic_regression - Val Acc: 1.0000, Val LogLoss: 0.0459
2025-10-16 00:13:23,813 - non_major_league_ensemble - INFO - Creating conservative ensemble
2025-10-16 00:13:23,814 - non_major_league_ensemble - INFO - Created ensemble with 3 models
2025-10-16 00:13:23,814 - non_major_league_ensemble - INFO - Model weights: {'lightgbm': 0.5905529180527449, 'random_forest': 0.24362771123631874, 'logistic_regression': 0.16581937071093636}
2025-10-16 00:13:23,843 - non_major_league_ensemble - INFO - Fold 3 - Acc: 1.0000, LogLoss: 0.0346
2025-10-16 00:13:23,843 - non_major_league_ensemble - INFO - CV Summary - Mean Acc: 1.0000 ± 0.0000
2025-10-16 00:13:23,843 - non_major_league_ensemble - INFO - CV Summary - Mean LogLoss: 0.0431 ± 0.0085
2025-10-16 00:13:23,844 - non_major_league_ensemble - INFO - Evaluating ensemble performance
2025-10-16 00:13:23,893 - non_major_league_ensemble - INFO - Ensemble Evaluation - Acc: 1.0000, LogLoss: 0.0361
2025-10-16 00:13:23,893 - non_major_league_ensemble - INFO - Mean Confidence: 0.9647
2025-10-16 00:13:23,893 - non_major_league_ensemble - INFO - Making predictions with confidence filtering
2025-10-16 00:13:23,920 - non_major_league_ensemble - INFO - High confidence predictions: 114/114
2025-10-16 00:13:23,920 - non_major_league_ensemble - INFO - Calculating ensemble feature importance
2025-10-16 00:13:23,942 - non_major_league_ensemble - INFO - Estimating prediction uncertainty
2025-10-16 00:13:25,219 - non_major_league_ensemble - INFO - Uncertainty estimation complete
2025-10-16 00:13:25,220 - phase2_integration - INFO - Step 6: Model Validation
2025-10-16 00:13:25,220 - phase2_integration - INFO - Validating models
2025-10-16 00:13:25,220 - non_major_league_model_validation - INFO - Performing comprehensive model validation
2025-10-16 00:13:25,220 - non_major_league_model_validation - INFO - Performing time series cross-validation
2025-10-16 00:13:25,220 - non_major_league_model_validation - INFO - Time series CV fold 1/3
2025-10-16 00:13:25,636 - non_major_league_model_validation - INFO - Fold 1 - Val Acc: 1.0000, Overfitting: 0.0000
2025-10-16 00:13:25,636 - non_major_league_model_validation - INFO - Time series CV fold 2/3
2025-10-16 00:13:26,094 - non_major_league_model_validation - INFO - Fold 2 - Val Acc: 1.0000, Overfitting: 0.0000
2025-10-16 00:13:26,094 - non_major_league_model_validation - INFO - Time series CV fold 3/3
2025-10-16 00:13:26,561 - non_major_league_model_validation - INFO - Fold 3 - Val Acc: 1.0000, Overfitting: 0.0000
2025-10-16 00:13:26,562 - non_major_league_model_validation - INFO - Time series CV complete: 3 successful folds
2025-10-16 00:13:26,562 - non_major_league_model_validation - INFO - Performing walk-forward validation
2025-10-16 00:13:26,563 - non_major_league_model_validation - INFO - Walk-forward CV fold 1/3
2025-10-16 00:13:26,878 - non_major_league_model_validation - INFO - Fold 1 - Val Acc: 1.0000
2025-10-16 00:13:26,878 - non_major_league_model_validation - INFO - Walk-forward CV fold 2/3
2025-10-16 00:13:27,252 - non_major_league_model_validation - INFO - Fold 2 - Val Acc: 1.0000
2025-10-16 00:13:27,252 - non_major_league_model_validation - INFO - Walk-forward CV fold 3/3
2025-10-16 00:13:27,661 - non_major_league_model_validation - INFO - Fold 3 - Val Acc: 1.0000
2025-10-16 00:13:27,662 - non_major_league_model_validation - INFO - Walk-forward CV complete: 3 successful folds
2025-10-16 00:13:27,662 - non_major_league_model_validation - INFO - Performing bootstrap validation
2025-10-16 00:13:27,662 - non_major_league_model_validation - INFO - Bootstrap 1/50
2025-10-16 00:13:28,134 - non_major_league_model_validation - INFO - Bootstrap 2/50
2025-10-16 00:13:28,582 - non_major_league_model_validation - INFO - Bootstrap 3/50
2025-10-16 00:13:29,006 - non_major_league_model_validation - INFO - Bootstrap 4/50
2025-10-16 00:13:29,441 - non_major_league_model_validation - INFO - Bootstrap 5/50
2025-10-16 00:13:29,879 - non_major_league_model_validation - INFO - Bootstrap 6/50
2025-10-16 00:13:30,301 - non_major_league_model_validation - INFO - Bootstrap 7/50
2025-10-16 00:13:30,728 - non_major_league_model_validation - INFO - Bootstrap 8/50
2025-10-16 00:13:31,159 - non_major_league_model_validation - INFO - Bootstrap 9/50
2025-10-16 00:13:31,641 - non_major_league_model_validation - INFO - Bootstrap 10/50
2025-10-16 00:13:32,081 - non_major_league_model_validation - INFO - Bootstrap 11/50
2025-10-16 00:13:32,517 - non_major_league_model_validation - INFO - Bootstrap 12/50
2025-10-16 00:13:32,930 - non_major_league_model_validation - INFO - Bootstrap 13/50
2025-10-16 00:13:33,349 - non_major_league_model_validation - INFO - Bootstrap 14/50
2025-10-16 00:13:33,791 - non_major_league_model_validation - INFO - Bootstrap 15/50
2025-10-16 00:13:34,221 - non_major_league_model_validation - INFO - Bootstrap 16/50
2025-10-16 00:13:34,652 - non_major_league_model_validation - INFO - Bootstrap 17/50
2025-10-16 00:13:35,074 - non_major_league_model_validation - INFO - Bootstrap 18/50
2025-10-16 00:13:35,538 - non_major_league_model_validation - INFO - Bootstrap 19/50
2025-10-16 00:13:35,971 - non_major_league_model_validation - INFO - Bootstrap 20/50
2025-10-16 00:13:36,395 - non_major_league_model_validation - INFO - Bootstrap 21/50
2025-10-16 00:13:36,824 - non_major_league_model_validation - INFO - Bootstrap 22/50
2025-10-16 00:13:37,257 - non_major_league_model_validation - INFO - Bootstrap 23/50
2025-10-16 00:13:37,682 - non_major_league_model_validation - INFO - Bootstrap 24/50
2025-10-16 00:13:38,105 - non_major_league_model_validation - INFO - Bootstrap 25/50
2025-10-16 00:13:38,532 - non_major_league_model_validation - INFO - Bootstrap 26/50
2025-10-16 00:13:38,946 - non_major_league_model_validation - INFO - Bootstrap 27/50
2025-10-16 00:13:39,401 - non_major_league_model_validation - INFO - Bootstrap 28/50
2025-10-16 00:13:39,824 - non_major_league_model_validation - INFO - Bootstrap 29/50
2025-10-16 00:13:40,245 - non_major_league_model_validation - INFO - Bootstrap 30/50
2025-10-16 00:13:40,694 - non_major_league_model_validation - INFO - Bootstrap 31/50
2025-10-16 00:13:41,110 - non_major_league_model_validation - INFO - Bootstrap 32/50
2025-10-16 00:13:41,582 - non_major_league_model_validation - INFO - Bootstrap 33/50
2025-10-16 00:13:42,026 - non_major_league_model_validation - INFO - Bootstrap 34/50
2025-10-16 00:13:42,483 - non_major_league_model_validation - INFO - Bootstrap 35/50
2025-10-16 00:13:42,948 - non_major_league_model_validation - INFO - Bootstrap 36/50
2025-10-16 00:13:43,395 - non_major_league_model_validation - INFO - Bootstrap 37/50
2025-10-16 00:13:43,849 - non_major_league_model_validation - INFO - Bootstrap 38/50
2025-10-16 00:13:44,289 - non_major_league_model_validation - INFO - Bootstrap 39/50
2025-10-16 00:13:44,733 - non_major_league_model_validation - INFO - Bootstrap 40/50
2025-10-16 00:13:45,171 - non_major_league_model_validation - INFO - Bootstrap 41/50
2025-10-16 00:13:45,617 - non_major_league_model_validation - INFO - Bootstrap 42/50
2025-10-16 00:13:46,044 - non_major_league_model_validation - INFO - Bootstrap 43/50
2025-10-16 00:13:46,493 - non_major_league_model_validation - INFO - Bootstrap 44/50
2025-10-16 00:13:46,943 - non_major_league_model_validation - INFO - Bootstrap 45/50
2025-10-16 00:13:47,364 - non_major_league_model_validation - INFO - Bootstrap 46/50
2025-10-16 00:13:47,810 - non_major_league_model_validation - INFO - Bootstrap 47/50
2025-10-16 00:13:48,253 - non_major_league_model_validation - INFO - Bootstrap 48/50
2025-10-16 00:13:48,701 - non_major_league_model_validation - INFO - Bootstrap 49/50
2025-10-16 00:13:49,138 - non_major_league_model_validation - INFO - Bootstrap 50/50
2025-10-16 00:13:49,604 - non_major_league_model_validation - INFO - Bootstrap validation complete: 50 successful bootstraps
2025-10-16 00:13:49,604 - non_major_league_model_validation - INFO - Validating model calibration
2025-10-16 00:13:51,234 - non_major_league_model_validation - INFO - Model calibration validation complete
2025-10-16 00:13:51,235 - non_major_league_model_validation - INFO - Detecting overfitting
2025-10-16 00:13:51,236 - non_major_league_model_validation - INFO - Overfitting detection: NOT DETECTED
2025-10-16 00:13:51,236 - non_major_league_model_validation - INFO - Analyzing model stability
2025-10-16 00:13:51,236 - non_major_league_model_validation - INFO - Stability analysis: STABLE
2025-10-16 00:13:51,236 - non_major_league_model_validation - INFO - Comprehensive validation complete
2025-10-16 00:13:51,237 - phase2_integration - INFO - Step 7: Final Integration
2025-10-16 00:13:51,237 - phase2_integration - INFO - Integrating Phase 2 results
2025-10-16 00:13:51,237 - phase2_integration - INFO - Step 8: Saving Results
2025-10-16 00:13:51,237 - phase2_integration - INFO - Saving results for E1
2025-10-16 00:13:51,237 - non_major_league_model_architecture - INFO - Saving models to ./pipeline_output/phase2_output/E1_model_architecture.pkl
2025-10-16 00:13:51,945 - non_major_league_model_architecture - INFO - Models saved successfully
2025-10-16 00:13:51,945 - non_major_league_ensemble - INFO - Saving ensemble to ./pipeline_output/phase2_output/E1_ensemble.pkl
2025-10-16 00:13:52,275 - non_major_league_ensemble - INFO - Ensemble saved successfully
2025-10-16 00:13:52,276 - non_major_league_hyperparameter_tuning - INFO - Saving hyperparameter tuning results to ./pipeline_output/phase2_output/E1_hyperparameter_tuning.pkl
2025-10-16 00:13:52,338 - non_major_league_hyperparameter_tuning - INFO - Hyperparameter tuning results saved successfully
2025-10-16 00:13:52,339 - non_major_league_model_validation - INFO - Saving validation results to ./pipeline_output/phase2_output/E1_validation_results.pkl
2025-10-16 00:13:52,343 - non_major_league_model_validation - INFO - Validation results saved successfully
2025-10-16 00:13:52,541 - phase2_integration - INFO - Phase 2 results saved successfully
2025-10-16 00:13:52,541 - phase2_integration - INFO - Phase 2 pipeline completed successfully
================================================================================
PHASE 2: MODEL TRAINING & VALIDATION (FIXED)
================================================================================

Training models for E1 with proper feature selection...

Training until validation scores don't improve for 50 rounds
Did not meet early stopping. Best iteration is:
[200]	valid_0's multi_logloss: 0.00168535
Training until validation scores don't improve for 30 rounds
Did not meet early stopping. Best iteration is:
[150]	valid_0's multi_logloss: 0.00929715
Training until validation scores don't improve for 30 rounds
Did not meet early stopping. Best iteration is:
[150]	valid_0's multi_logloss: 0.0148474
Training until validation scores don't improve for 30 rounds
Did not meet early stopping. Best iteration is:
[150]	valid_0's multi_logloss: 0.0116566

================================================================================
✅ PHASE 2 COMPLETE
================================================================================

📊 Results Summary:
  • Models trained: 0
  • Best model: N/A
  • Best accuracy: 0.0000
  • Features used: 241
  • Training samples: 570
  • Output: ./pipeline_output/phase2_output
================================================================================
