[I 2025-10-15 23:43:20,597] Trial 29 finished with value: inf and parameters: {'C': 2.814287812210959, 'max_iter': 227, 'solver': 'lbfgs'}. Best is trial 0 with value: inf.
2025-10-15 23:43:20,602 - non_major_league_hyperparameter_tuning - INFO - logistic_regression optimization complete
2025-10-15 23:43:20,602 - non_major_league_hyperparameter_tuning - INFO - Best score: inf
2025-10-15 23:43:20,603 - non_major_league_hyperparameter_tuning - INFO - Best params: {'C': 9.083269121888906, 'max_iter': 960, 'solver': 'liblinear'}
2025-10-15 23:43:20,603 - non_major_league_hyperparameter_tuning - INFO - Validating optimized hyperparameters
2025-10-15 23:43:20,603 - non_major_league_hyperparameter_tuning - INFO - Hyperparameter validation: FAILED
2025-10-15 23:43:20,603 - non_major_league_hyperparameter_tuning - INFO - Comparing optimized models
2025-10-15 23:43:20,603 - non_major_league_hyperparameter_tuning - INFO - Best model: None
2025-10-15 23:43:20,604 - non_major_league_hyperparameter_tuning - INFO - Best score: inf
2025-10-15 23:43:20,604 - non_major_league_hyperparameter_tuning - INFO - Evaluating optimized models
2025-10-15 23:43:20,604 - non_major_league_hyperparameter_tuning - INFO - Creating optimized models
2025-10-15 23:43:20,604 - non_major_league_hyperparameter_tuning - INFO - Created optimized xgboost model
2025-10-15 23:43:20,605 - non_major_league_hyperparameter_tuning - INFO - Created optimized lightgbm model
2025-10-15 23:43:20,605 - non_major_league_hyperparameter_tuning - INFO - Created optimized random_forest model
2025-10-15 23:43:20,605 - non_major_league_hyperparameter_tuning - INFO - Created optimized logistic_regression model
2025-10-15 23:43:20,613 - non_major_league_hyperparameter_tuning - ERROR - Error evaluating xgboost: DataFrame.dtypes for data must be int, float, bool or category. When categorical type is supplied, the experimental DMatrix parameter`enable_categorical` must be set to `True`.  Invalid columns:Div: object, Date: object, Time: object, HomeTeam: object, AwayTeam: object, FTR: object, HTR: object, Referee: object, league: object, season: object, data_source: object, season_phase: object
2025-10-15 23:43:20,621 - non_major_league_hyperparameter_tuning - ERROR - Error evaluating lightgbm: pandas dtypes must be int, float or bool.
Fields with bad pandas dtypes: Div: object, Date: object, Time: object, HomeTeam: object, AwayTeam: object, FTR: object, HTR: object, Referee: object, league: object, season: object, data_source: object, season_phase: object
2025-10-15 23:43:20,630 - non_major_league_hyperparameter_tuning - ERROR - Error evaluating random_forest: could not convert string to float: 'E1'
2025-10-15 23:43:20,641 - non_major_league_hyperparameter_tuning - ERROR - Error evaluating logistic_regression: could not convert string to float: 'E1'
2025-10-15 23:43:20,642 - non_major_league_hyperparameter_tuning - INFO - Calculating hyperparameter importance
2025-10-15 23:43:20,649 - non_major_league_hyperparameter_tuning - ERROR - Error calculating importance for xgboost: tuple index out of range
2025-10-15 23:43:20,650 - non_major_league_hyperparameter_tuning - ERROR - Error calculating importance for lightgbm: tuple index out of range
2025-10-15 23:43:20,652 - non_major_league_hyperparameter_tuning - ERROR - Error calculating importance for random_forest: tuple index out of range
2025-10-15 23:43:20,653 - non_major_league_hyperparameter_tuning - ERROR - Error calculating importance for logistic_regression: tuple index out of range
2025-10-15 23:43:20,653 - phase2_integration - INFO - Step 5: Ensemble Modeling
2025-10-15 23:43:20,653 - phase2_integration - INFO - Creating ensemble model
2025-10-15 23:43:20,660 - non_major_league_ensemble - INFO - Creating base models with conservative parameters
2025-10-15 23:43:20,660 - non_major_league_ensemble - INFO - Created 4 base models
2025-10-15 23:43:20,661 - non_major_league_ensemble - INFO - Training base models with conservative validation
2025-10-15 23:43:20,661 - non_major_league_ensemble - INFO - Training xgboost...
2025-10-15 23:43:20,661 - non_major_league_ensemble - ERROR - Error training xgboost: XGBClassifier.fit() got an unexpected keyword argument 'early_stopping_rounds'
2025-10-15 23:43:20,661 - non_major_league_ensemble - INFO - Training lightgbm...
2025-10-15 23:43:20,668 - non_major_league_ensemble - ERROR - Error training lightgbm: pandas dtypes must be int, float or bool.
Fields with bad pandas dtypes: Div: object, Date: object, Time: object, HomeTeam: object, AwayTeam: object, FTR: object, HTR: object, Referee: object, league: object, season: object, data_source: object, season_phase: object
2025-10-15 23:43:20,668 - non_major_league_ensemble - INFO - Training random_forest...
2025-10-15 23:43:20,679 - non_major_league_ensemble - ERROR - Error training random_forest: could not convert string to float: 'E1'
2025-10-15 23:43:20,682 - non_major_league_ensemble - INFO - Training logistic_regression...
2025-10-15 23:43:20,692 - non_major_league_ensemble - ERROR - Error training logistic_regression: could not convert string to float: 'E1'
2025-10-15 23:43:20,694 - non_major_league_ensemble - INFO - Creating conservative ensemble
2025-10-15 23:43:20,694 - non_major_league_ensemble - ERROR - Not enough successful models for ensemble
2025-10-15 23:43:20,694 - non_major_league_ensemble - INFO - Training ensemble model
2025-10-15 23:43:20,694 - non_major_league_ensemble - ERROR - No ensemble model created
2025-10-15 23:43:20,694 - non_major_league_ensemble - INFO - Calibrating model probabilities
2025-10-15 23:43:20,706 - non_major_league_ensemble - ERROR - Error calibrating xgboost: DataFrame.dtypes for data must be int, float, bool or category. When categorical type is supplied, the experimental DMatrix parameter`enable_categorical` must be set to `True`.  Invalid columns:Div: object, Date: object, Time: object, HomeTeam: object, AwayTeam: object, FTR: object, HTR: object, Referee: object, league: object, season: object, data_source: object, season_phase: object
2025-10-15 23:43:20,721 - non_major_league_ensemble - ERROR - Error calibrating lightgbm: pandas dtypes must be int, float or bool.
Fields with bad pandas dtypes: Div: object, Date: object, Time: object, HomeTeam: object, AwayTeam: object, FTR: object, HTR: object, Referee: object, league: object, season: object, data_source: object, season_phase: object
2025-10-15 23:43:20,735 - non_major_league_ensemble - ERROR - Error calibrating random_forest: could not convert string to float: 'E1'
2025-10-15 23:43:20,751 - non_major_league_ensemble - ERROR - Error calibrating logistic_regression: could not convert string to float: 'E1'
2025-10-15 23:43:20,753 - non_major_league_ensemble - INFO - Cross-validating ensemble
2025-10-15 23:43:20,754 - non_major_league_ensemble - INFO - Cross-validation fold 1/3
2025-10-15 23:43:20,757 - non_major_league_ensemble - INFO - Training base models with conservative validation
2025-10-15 23:43:20,757 - non_major_league_ensemble - INFO - Training xgboost...
2025-10-15 23:43:20,757 - non_major_league_ensemble - WARNING - Insufficient training samples for xgboost: 91
2025-10-15 23:43:20,757 - non_major_league_ensemble - INFO - Training lightgbm...
2025-10-15 23:43:20,758 - non_major_league_ensemble - WARNING - Insufficient training samples for lightgbm: 91
2025-10-15 23:43:20,758 - non_major_league_ensemble - INFO - Training random_forest...
2025-10-15 23:43:20,758 - non_major_league_ensemble - WARNING - Insufficient training samples for random_forest: 91
2025-10-15 23:43:20,758 - non_major_league_ensemble - INFO - Training logistic_regression...
2025-10-15 23:43:20,758 - non_major_league_ensemble - WARNING - Insufficient training samples for logistic_regression: 91
2025-10-15 23:43:20,758 - non_major_league_ensemble - INFO - Creating conservative ensemble
2025-10-15 23:43:20,758 - non_major_league_ensemble - ERROR - Not enough successful models for ensemble
2025-10-15 23:43:20,759 - non_major_league_ensemble - INFO - Cross-validation fold 2/3
2025-10-15 23:43:20,760 - non_major_league_ensemble - INFO - Training base models with conservative validation
2025-10-15 23:43:20,761 - non_major_league_ensemble - INFO - Training xgboost...
2025-10-15 23:43:20,761 - non_major_league_ensemble - ERROR - Error training xgboost: XGBClassifier.fit() got an unexpected keyword argument 'early_stopping_rounds'
2025-10-15 23:43:20,761 - non_major_league_ensemble - INFO - Training lightgbm...
2025-10-15 23:43:20,768 - non_major_league_ensemble - ERROR - Error training lightgbm: pandas dtypes must be int, float or bool.
Fields with bad pandas dtypes: Div: object, Date: object, Time: object, HomeTeam: object, AwayTeam: object, FTR: object, HTR: object, Referee: object, league: object, season: object, data_source: object, season_phase: object
2025-10-15 23:43:20,768 - non_major_league_ensemble - INFO - Training random_forest...
2025-10-15 23:43:20,775 - non_major_league_ensemble - ERROR - Error training random_forest: could not convert string to float: 'E1'
2025-10-15 23:43:20,777 - non_major_league_ensemble - INFO - Training logistic_regression...
2025-10-15 23:43:20,784 - non_major_league_ensemble - ERROR - Error training logistic_regression: could not convert string to float: 'E1'
2025-10-15 23:43:20,785 - non_major_league_ensemble - INFO - Creating conservative ensemble
2025-10-15 23:43:20,785 - non_major_league_ensemble - ERROR - Not enough successful models for ensemble
2025-10-15 23:43:20,785 - non_major_league_ensemble - INFO - Cross-validation fold 3/3
2025-10-15 23:43:20,787 - non_major_league_ensemble - INFO - Training base models with conservative validation
2025-10-15 23:43:20,787 - non_major_league_ensemble - INFO - Training xgboost...
2025-10-15 23:43:20,788 - non_major_league_ensemble - ERROR - Error training xgboost: XGBClassifier.fit() got an unexpected keyword argument 'early_stopping_rounds'
2025-10-15 23:43:20,788 - non_major_league_ensemble - INFO - Training lightgbm...
2025-10-15 23:43:20,793 - non_major_league_ensemble - ERROR - Error training lightgbm: pandas dtypes must be int, float or bool.
Fields with bad pandas dtypes: Div: object, Date: object, Time: object, HomeTeam: object, AwayTeam: object, FTR: object, HTR: object, Referee: object, league: object, season: object, data_source: object, season_phase: object
2025-10-15 23:43:20,794 - non_major_league_ensemble - INFO - Training random_forest...
2025-10-15 23:43:20,803 - non_major_league_ensemble - ERROR - Error training random_forest: could not convert string to float: 'E1'
2025-10-15 23:43:20,805 - non_major_league_ensemble - INFO - Training logistic_regression...
2025-10-15 23:43:20,813 - non_major_league_ensemble - ERROR - Error training logistic_regression: could not convert string to float: 'E1'
2025-10-15 23:43:20,814 - non_major_league_ensemble - INFO - Creating conservative ensemble
2025-10-15 23:43:20,815 - non_major_league_ensemble - ERROR - Not enough successful models for ensemble
2025-10-15 23:43:20,815 - non_major_league_ensemble - ERROR - No successful cross-validation folds
2025-10-15 23:43:20,815 - non_major_league_ensemble - INFO - Evaluating ensemble performance
2025-10-15 23:43:20,815 - non_major_league_ensemble - ERROR - No ensemble model to evaluate
2025-10-15 23:43:20,815 - non_major_league_ensemble - INFO - Making predictions with confidence filtering
2025-10-15 23:43:20,815 - non_major_league_ensemble - ERROR - No ensemble model for prediction
2025-10-15 23:43:20,815 - non_major_league_ensemble - INFO - Calculating ensemble feature importance
2025-10-15 23:43:20,816 - non_major_league_ensemble - INFO - Estimating prediction uncertainty
2025-10-15 23:43:20,816 - non_major_league_ensemble - ERROR - No ensemble model for uncertainty estimation
2025-10-15 23:43:20,816 - phase2_integration - INFO - Step 6: Model Validation
2025-10-15 23:43:20,816 - phase2_integration - INFO - Validating models
2025-10-15 23:43:20,816 - non_major_league_model_validation - INFO - Performing comprehensive model validation
2025-10-15 23:43:20,816 - non_major_league_model_validation - INFO - Performing time series cross-validation
2025-10-15 23:43:20,817 - non_major_league_model_validation - INFO - Time series CV fold 1/3
2025-10-15 23:43:20,827 - non_major_league_model_validation - ERROR - Error in fold 1: could not convert string to float: 'E1'
2025-10-15 23:43:20,828 - non_major_league_model_validation - INFO - Time series CV fold 2/3
2025-10-15 23:43:20,842 - non_major_league_model_validation - ERROR - Error in fold 2: could not convert string to float: 'E1'
2025-10-15 23:43:20,844 - non_major_league_model_validation - INFO - Time series CV fold 3/3
2025-10-15 23:43:20,859 - non_major_league_model_validation - ERROR - Error in fold 3: could not convert string to float: 'E1'
2025-10-15 23:43:20,861 - non_major_league_model_validation - INFO - Time series CV complete: 0 successful folds
2025-10-15 23:43:20,861 - non_major_league_model_validation - INFO - Performing walk-forward validation
2025-10-15 23:43:20,861 - non_major_league_model_validation - INFO - Walk-forward CV fold 1/3
2025-10-15 23:43:20,869 - non_major_league_model_validation - ERROR - Error in fold 1: could not convert string to float: 'E1'
2025-10-15 23:43:20,871 - non_major_league_model_validation - INFO - Walk-forward CV fold 2/3
2025-10-15 23:43:20,881 - non_major_league_model_validation - ERROR - Error in fold 2: could not convert string to float: 'E1'
2025-10-15 23:43:20,883 - non_major_league_model_validation - INFO - Walk-forward CV fold 3/3
2025-10-15 23:43:20,894 - non_major_league_model_validation - ERROR - Error in fold 3: could not convert string to float: 'E1'
2025-10-15 23:43:20,897 - non_major_league_model_validation - INFO - Walk-forward CV complete: 0 successful folds
2025-10-15 23:43:20,897 - non_major_league_model_validation - INFO - Performing bootstrap validation
2025-10-15 23:43:20,897 - non_major_league_model_validation - INFO - Bootstrap 1/50
2025-10-15 23:43:20,909 - non_major_league_model_validation - ERROR - Error in bootstrap 1: could not convert string to float: 'E1'
2025-10-15 23:43:20,912 - non_major_league_model_validation - INFO - Bootstrap 2/50
2025-10-15 23:43:20,927 - non_major_league_model_validation - ERROR - Error in bootstrap 2: could not convert string to float: 'E1'
2025-10-15 23:43:20,929 - non_major_league_model_validation - INFO - Bootstrap 3/50
2025-10-15 23:43:20,943 - non_major_league_model_validation - ERROR - Error in bootstrap 3: could not convert string to float: 'E1'
2025-10-15 23:43:20,947 - non_major_league_model_validation - INFO - Bootstrap 4/50
2025-10-15 23:43:20,959 - non_major_league_model_validation - ERROR - Error in bootstrap 4: could not convert string to float: 'E1'
2025-10-15 23:43:20,961 - non_major_league_model_validation - INFO - Bootstrap 5/50
2025-10-15 23:43:20,973 - non_major_league_model_validation - ERROR - Error in bootstrap 5: could not convert string to float: 'E1'
2025-10-15 23:43:20,976 - non_major_league_model_validation - INFO - Bootstrap 6/50
2025-10-15 23:43:20,993 - non_major_league_model_validation - ERROR - Error in bootstrap 6: could not convert string to float: 'E1'
2025-10-15 23:43:20,995 - non_major_league_model_validation - INFO - Bootstrap 7/50
2025-10-15 23:43:21,007 - non_major_league_model_validation - ERROR - Error in bootstrap 7: could not convert string to float: 'E1'
2025-10-15 23:43:21,010 - non_major_league_model_validation - INFO - Bootstrap 8/50
2025-10-15 23:43:21,025 - non_major_league_model_validation - ERROR - Error in bootstrap 8: could not convert string to float: 'E1'
2025-10-15 23:43:21,027 - non_major_league_model_validation - INFO - Bootstrap 9/50
2025-10-15 23:43:21,040 - non_major_league_model_validation - ERROR - Error in bootstrap 9: could not convert string to float: 'E1'
2025-10-15 23:43:21,044 - non_major_league_model_validation - INFO - Bootstrap 10/50
2025-10-15 23:43:21,056 - non_major_league_model_validation - ERROR - Error in bootstrap 10: could not convert string to float: 'E1'
2025-10-15 23:43:21,058 - non_major_league_model_validation - INFO - Bootstrap 11/50
2025-10-15 23:43:21,072 - non_major_league_model_validation - ERROR - Error in bootstrap 11: could not convert string to float: 'E1'
2025-10-15 23:43:21,074 - non_major_league_model_validation - INFO - Bootstrap 12/50
2025-10-15 23:43:21,087 - non_major_league_model_validation - ERROR - Error in bootstrap 12: could not convert string to float: 'E1'
2025-10-15 23:43:21,090 - non_major_league_model_validation - INFO - Bootstrap 13/50
2025-10-15 23:43:21,106 - non_major_league_model_validation - ERROR - Error in bootstrap 13: could not convert string to float: 'E1'
2025-10-15 23:43:21,110 - non_major_league_model_validation - INFO - Bootstrap 14/50
2025-10-15 23:43:21,124 - non_major_league_model_validation - ERROR - Error in bootstrap 14: could not convert string to float: 'E1'
2025-10-15 23:43:21,127 - non_major_league_model_validation - INFO - Bootstrap 15/50
2025-10-15 23:43:21,142 - non_major_league_model_validation - ERROR - Error in bootstrap 15: could not convert string to float: 'E1'
2025-10-15 23:43:21,145 - non_major_league_model_validation - INFO - Bootstrap 16/50
2025-10-15 23:43:21,158 - non_major_league_model_validation - ERROR - Error in bootstrap 16: could not convert string to float: 'E1'
2025-10-15 23:43:21,161 - non_major_league_model_validation - INFO - Bootstrap 17/50
2025-10-15 23:43:21,177 - non_major_league_model_validation - ERROR - Error in bootstrap 17: could not convert string to float: 'E1'
2025-10-15 23:43:21,179 - non_major_league_model_validation - INFO - Bootstrap 18/50
2025-10-15 23:43:21,192 - non_major_league_model_validation - ERROR - Error in bootstrap 18: could not convert string to float: 'E1'
2025-10-15 23:43:21,194 - non_major_league_model_validation - INFO - Bootstrap 19/50
2025-10-15 23:43:21,207 - non_major_league_model_validation - ERROR - Error in bootstrap 19: could not convert string to float: 'E1'
2025-10-15 23:43:21,211 - non_major_league_model_validation - INFO - Bootstrap 20/50
2025-10-15 23:43:21,228 - non_major_league_model_validation - ERROR - Error in bootstrap 20: could not convert string to float: 'E1'
2025-10-15 23:43:21,231 - non_major_league_model_validation - INFO - Bootstrap 21/50
2025-10-15 23:43:21,246 - non_major_league_model_validation - ERROR - Error in bootstrap 21: could not convert string to float: 'E1'
2025-10-15 23:43:21,249 - non_major_league_model_validation - INFO - Bootstrap 22/50
2025-10-15 23:43:21,265 - non_major_league_model_validation - ERROR - Error in bootstrap 22: could not convert string to float: 'E1'
2025-10-15 23:43:21,269 - non_major_league_model_validation - INFO - Bootstrap 23/50
2025-10-15 23:43:21,283 - non_major_league_model_validation - ERROR - Error in bootstrap 23: could not convert string to float: 'E1'
2025-10-15 23:43:21,286 - non_major_league_model_validation - INFO - Bootstrap 24/50
2025-10-15 23:43:21,299 - non_major_league_model_validation - ERROR - Error in bootstrap 24: could not convert string to float: 'E1'
2025-10-15 23:43:21,302 - non_major_league_model_validation - INFO - Bootstrap 25/50
2025-10-15 23:43:21,315 - non_major_league_model_validation - ERROR - Error in bootstrap 25: could not convert string to float: 'E1'
2025-10-15 23:43:21,318 - non_major_league_model_validation - INFO - Bootstrap 26/50
2025-10-15 23:43:21,330 - non_major_league_model_validation - ERROR - Error in bootstrap 26: could not convert string to float: 'E1'
2025-10-15 23:43:21,332 - non_major_league_model_validation - INFO - Bootstrap 27/50
2025-10-15 23:43:21,345 - non_major_league_model_validation - ERROR - Error in bootstrap 27: could not convert string to float: 'E1'
2025-10-15 23:43:21,348 - non_major_league_model_validation - INFO - Bootstrap 28/50
2025-10-15 23:43:21,361 - non_major_league_model_validation - ERROR - Error in bootstrap 28: could not convert string to float: 'E1'
2025-10-15 23:43:21,364 - non_major_league_model_validation - INFO - Bootstrap 29/50
2025-10-15 23:43:21,376 - non_major_league_model_validation - ERROR - Error in bootstrap 29: could not convert string to float: 'E1'
2025-10-15 23:43:21,379 - non_major_league_model_validation - INFO - Bootstrap 30/50
2025-10-15 23:43:21,390 - non_major_league_model_validation - ERROR - Error in bootstrap 30: could not convert string to float: 'E1'
2025-10-15 23:43:21,393 - non_major_league_model_validation - INFO - Bootstrap 31/50
2025-10-15 23:43:21,403 - non_major_league_model_validation - ERROR - Error in bootstrap 31: could not convert string to float: 'E1'
2025-10-15 23:43:21,406 - non_major_league_model_validation - INFO - Bootstrap 32/50
2025-10-15 23:43:21,420 - non_major_league_model_validation - ERROR - Error in bootstrap 32: could not convert string to float: 'E1'
2025-10-15 23:43:21,422 - non_major_league_model_validation - INFO - Bootstrap 33/50
2025-10-15 23:43:21,435 - non_major_league_model_validation - ERROR - Error in bootstrap 33: could not convert string to float: 'E1'
2025-10-15 23:43:21,438 - non_major_league_model_validation - INFO - Bootstrap 34/50
2025-10-15 23:43:21,454 - non_major_league_model_validation - ERROR - Error in bootstrap 34: could not convert string to float: 'E1'
2025-10-15 23:43:21,457 - non_major_league_model_validation - INFO - Bootstrap 35/50
2025-10-15 23:43:21,469 - non_major_league_model_validation - ERROR - Error in bootstrap 35: could not convert string to float: 'E1'
2025-10-15 23:43:21,471 - non_major_league_model_validation - INFO - Bootstrap 36/50
2025-10-15 23:43:21,486 - non_major_league_model_validation - ERROR - Error in bootstrap 36: could not convert string to float: 'E1'
2025-10-15 23:43:21,489 - non_major_league_model_validation - INFO - Bootstrap 37/50
2025-10-15 23:43:21,503 - non_major_league_model_validation - ERROR - Error in bootstrap 37: could not convert string to float: 'E1'
20