[I 2025-10-16 21:37:28,118] Trial 5 finished with value: 0.009692271284843129 and parameters: {'n_estimators': 195, 'max_depth': 4, 'learning_rate': 0.05115482532350367, 'subsample': 0.9066616083395329, 'colsample_bytree': 0.6585030299991145, 'min_child_weight': 1, 'reg_alpha': 0.8900046343133844, 'reg_lambda': 0.7298424025031411}. Best is trial 5 with value: 0.009692271284843129.
[I 2025-10-16 21:38:17,152] Trial 6 finished with value: 0.023734372960054262 and parameters: {'n_estimators': 84, 'max_depth': 7, 'learning_rate': 0.059946194562551715, 'subsample': 0.7834461192741382, 'colsample_bytree': 0.6099437403048152, 'min_child_weight': 4, 'reg_alpha': 0.17095055880305388, 'reg_lambda': 1.7390153230621581}. Best is trial 5 with value: 0.009692271284843129.
[I 2025-10-16 21:38:46,959] Trial 7 finished with value: 0.07334689717255731 and parameters: {'n_estimators': 67, 'max_depth': 3, 'learning_rate': 0.09944189392367418, 'subsample': 0.6597746352395791, 'colsample_bytree': 0.6340293737738981, 'min_child_weight': 10, 'reg_alpha': 0.12308157509771533, 'reg_lambda': 0.01768428538708533}. Best is trial 5 with value: 0.009692271284843129.
[I 2025-10-16 21:39:46,353] Trial 8 finished with value: 0.11023891777327734 and parameters: {'n_estimators': 86, 'max_depth': 4, 'learning_rate': 0.02574494362706884, 'subsample': 0.6582065531634248, 'colsample_bytree': 0.6712872978100473, 'min_child_weight': 3, 'reg_alpha': 0.3691534397247941, 'reg_lambda': 1.3693624052096738}. Best is trial 5 with value: 0.009692271284843129.
[I 2025-10-16 21:40:47,410] Trial 9 finished with value: 0.0814404720922158 and parameters: {'n_estimators': 85, 'max_depth': 8, 'learning_rate': 0.030464613850916214, 'subsample': 0.8641261954758528, 'colsample_bytree': 0.8561394032656997, 'min_child_weight': 5, 'reg_alpha': 0.831481083203775, 'reg_lambda': 1.5485847745059125}. Best is trial 5 with value: 0.009692271284843129.
[I 2025-10-16 21:42:18,233] Trial 10 finished with value: 0.03888228284964588 and parameters: {'n_estimators': 192, 'max_depth': 3, 'learning_rate': 0.07952580917795146, 'subsample': 0.8283929271604703, 'colsample_bytree': 0.8106463882813402, 'min_child_weight': 7, 'reg_alpha': 0.6249949443648737, 'reg_lambda': 0.7120557272465332}. Best is trial 5 with value: 0.009692271284843129.
[I 2025-10-16 21:43:31,984] Trial 11 finished with value: 0.009262182602201498 and parameters: {'n_estimators': 142, 'max_depth': 6, 'learning_rate': 0.06173955220229781, 'subsample': 0.7667477276324002, 'colsample_bytree': 0.6119966222605361, 'min_child_weight': 1, 'reg_alpha': 0.5774204248811438, 'reg_lambda': 1.9432266113384034}. Best is trial 11 with value: 0.009262182602201498.
[I 2025-10-16 21:44:46,245] Trial 12 finished with value: 0.012310134051443813 and parameters: {'n_estimators': 159, 'max_depth': 5, 'learning_rate': 0.06259756094192782, 'subsample': 0.7784643832496565, 'colsample_bytree': 0.6844805367381507, 'min_child_weight': 1, 'reg_alpha': 0.9855003107982403, 'reg_lambda': 0.8275325908364404}. Best is trial 11 with value: 0.009262182602201498.
[I 2025-10-16 21:46:07,720] Trial 13 finished with value: 0.24117255768057322 and parameters: {'n_estimators': 138, 'max_depth': 6, 'learning_rate': 0.01007571115065889, 'subsample': 0.9041022759421056, 'colsample_bytree': 0.6111015092628083, 'min_child_weight': 1, 'reg_alpha': 0.6217776778326255, 'reg_lambda': 1.979602848954665}. Best is trial 11 with value: 0.009262182602201498.
[I 2025-10-16 21:47:51,221] Trial 14 finished with value: 0.0065641647980704204 and parameters: {'n_estimators': 163, 'max_depth': 4, 'learning_rate': 0.08123625713013675, 'subsample': 0.8201478352318444, 'colsample_bytree': 0.7245905578886103, 'min_child_weight': 1, 'reg_alpha': 0.5560980908217743, 'reg_lambda': 1.0893264303796417}. Best is trial 14 with value: 0.0065641647980704204.
[I 2025-10-16 21:48:33,664] Trial 15 finished with value: 0.044221790714640836 and parameters: {'n_estimators': 128, 'max_depth': 5, 'learning_rate': 0.0899747548434358, 'subsample': 0.7285807328551632, 'colsample_bytree': 0.7277754484773966, 'min_child_weight': 7, 'reg_alpha': 0.5468961459086973, 'reg_lambda': 1.1846176128118788}. Best is trial 14 with value: 0.0065641647980704204.
[I 2025-10-16 21:49:09,027] Trial 16 finished with value: 0.018122193084639245 and parameters: {'n_estimators': 160, 'max_depth': 6, 'learning_rate': 0.07441310233193386, 'subsample': 0.7458821380062486, 'colsample_bytree': 0.8031885301040426, 'min_child_weight': 3, 'reg_alpha': 0.7152963561600041, 'reg_lambda': 1.9833168052331096}. Best is trial 14 with value: 0.0065641647980704204.
[I 2025-10-16 21:49:17,649] Trial 17 finished with value: 0.039357698043230194 and parameters: {'n_estimators': 154, 'max_depth': 7, 'learning_rate': 0.08845040471307562, 'subsample': 0.8241895845249949, 'colsample_bytree': 0.7076340503928158, 'min_child_weight': 7, 'reg_alpha': 0.4121027690431912, 'reg_lambda': 0.994895758598755}. Best is trial 14 with value: 0.0065641647980704204.
[I 2025-10-16 21:49:36,401] Trial 18 finished with value: 0.011252301191147208 and parameters: {'n_estimators': 110, 'max_depth': 4, 'learning_rate': 0.0670831824255458, 'subsample': 0.8103036735247513, 'colsample_bytree': 0.7697774675771119, 'min_child_weight': 2, 'reg_alpha': 0.5119359948652648, 'reg_lambda': 0.44150152840872814}. Best is trial 14 with value: 0.0065641647980704204.
[I 2025-10-16 21:50:04,200] Trial 19 finished with value: 0.015886389127113595 and parameters: {'n_estimators': 174, 'max_depth': 3, 'learning_rate': 0.08323135700355366, 'subsample': 0.8587939889166578, 'colsample_bytree': 0.8593056378874517, 'min_child_weight': 3, 'reg_alpha': 0.6965349773378678, 'reg_lambda': 1.7262344345681435}. Best is trial 14 with value: 0.0065641647980704204.
[I 2025-10-16 21:50:22,758] Trial 20 finished with value: 0.04106640467864673 and parameters: {'n_estimators': 131, 'max_depth': 5, 'learning_rate': 0.09980224557200466, 'subsample': 0.6692440693643302, 'colsample_bytree': 0.6458051078568526, 'min_child_weight': 6, 'reg_alpha': 0.42952449085277206, 'reg_lambda': 1.0964633983649954}. Best is trial 14 with value: 0.0065641647980704204.
[I 2025-10-16 21:50:53,906] Trial 21 finished with value: 0.010236398263135013 and parameters: {'n_estimators': 199, 'max_depth': 4, 'learning_rate': 0.05186654375485718, 'subsample': 0.915647876484957, 'colsample_bytree': 0.6649003352264039, 'min_child_weight': 1, 'reg_alpha': 0.9656846157700953, 'reg_lambda': 0.4248732701586925}. Best is trial 14 with value: 0.0065641647980704204.
[I 2025-10-16 21:51:19,827] Trial 22 finished with value: 0.00959946938486175 and parameters: {'n_estimators': 172, 'max_depth': 4, 'learning_rate': 0.04345524611419359, 'subsample': 0.9999920051912081, 'colsample_bytree': 0.600322481120179, 'min_child_weight': 1, 'reg_alpha': 0.8306139501575878, 'reg_lambda': 0.9057644349336955}. Best is trial 14 with value: 0.0065641647980704204.
[I 2025-10-16 21:51:47,579] Trial 23 finished with value: 0.011145879028243011 and parameters: {'n_estimators': 144, 'max_depth': 6, 'learning_rate': 0.042455925369637756, 'subsample': 0.9988759999379502, 'colsample_bytree': 0.6215911542348673, 'min_child_weight': 2, 'reg_alpha': 0.737811710117775, 'reg_lambda': 0.9781910384149887}. Best is trial 14 with value: 0.0065641647980704204.
[I 2025-10-16 21:52:18,213] Trial 24 finished with value: 0.007528444283577177 and parameters: {'n_estimators': 175, 'max_depth': 5, 'learning_rate': 0.058397557540142385, 'subsample': 0.7557689247199653, 'colsample_bytree': 0.6880408217928637, 'min_child_weight': 1, 'reg_alpha': 0.5803273462848924, 'reg_lambda': 0.5498795925733674}. Best is trial 14 with value: 0.0065641647980704204.
[I 2025-10-16 21:52:54,872] Trial 25 finished with value: 0.018304523113290436 and parameters: {'n_estimators': 115, 'max_depth': 5, 'learning_rate': 0.05973760749796689, 'subsample': 0.7496357241675607, 'colsample_bytree': 0.6973423576211184, 'min_child_weight': 3, 'reg_alpha': 0.6120054167694471, 'reg_lambda': 0.4535417158529975}. Best is trial 14 with value: 0.0065641647980704204.
[I 2025-10-16 21:53:54,891] Trial 26 finished with value: 0.012580564637408363 and parameters: {'n_estimators': 173, 'max_depth': 6, 'learning_rate': 0.06865791802311995, 'subsample': 0.697498366378885, 'colsample_bytree': 0.7751826301195891, 'min_child_weight': 2, 'reg_alpha': 0.45756994679755325, 'reg_lambda': 0.5669195930045213}. Best is trial 14 with value: 0.0065641647980704204.
[I 2025-10-16 21:54:35,633] Trial 27 finished with value: 0.023338416779487035 and parameters: {'n_estimators': 149, 'max_depth': 5, 'learning_rate': 0.07866944481875968, 'subsample': 0.7708694494793531, 'colsample_bytree': 0.7102302112549141, 'min_child_weight': 4, 'reg_alpha': 0.553419742857658, 'reg_lambda': 0.19966826065892573}. Best is trial 14 with value: 0.0065641647980704204.
[I 2025-10-16 21:55:48,069] Trial 28 finished with value: 0.005547336806435612 and parameters: {'n_estimators': 164, 'max_depth': 7, 'learning_rate': 0.057851896276800215, 'subsample': 0.8488952224751771, 'colsample_bytree': 0.7585587844283056, 'min_child_weight': 1, 'reg_alpha': 0.29582606665907113, 'reg_lambda': 1.7924190920469671}. Best is trial 28 with value: 0.005547336806435612.
[I 2025-10-16 21:56:51,588] Trial 29 finished with value: 0.01053193556251536 and parameters: {'n_estimators': 166, 'max_depth': 7, 'learning_rate': 0.055241238689165494, 'subsample': 0.8602953649640392, 'colsample_bytree': 0.7671695731459944, 'min_child_weight': 2, 'reg_alpha': 0.30273957273866975, 'reg_lambda': 0.2680918996384942}. Best is trial 28 with value: 0.005547336806435612.
INFO:non_major_league_hyperparameter_tuning:xgboost optimization complete
INFO:non_major_league_hyperparameter_tuning:Best score: 0.0055
INFO:non_major_league_hyperparameter_tuning:Best params: {'n_estimators': 164, 'max_depth': 7, 'learning_rate': 0.057851896276800215, 'subsample': 0.8488952224751771, 'colsample_bytree': 0.7585587844283056, 'min_child_weight': 1, 'reg_alpha': 0.29582606665907113, 'reg_lambda': 1.7924190920469671}
INFO:non_major_league_hyperparameter_tuning:Optimizing lightgbm (priority: 2)
INFO:non_major_league_hyperparameter_tuning:Optimizing hyperparameters for lightgbm
[I 2025-10-16 21:56:51,594] A new study created in memory with name: no-name-ff1e7ad1-0261-42ad-8972-062066ca9458
[I 2025-10-16 21:57:39,853] Trial 0 finished with value: 0.019483896939623224 and parameters: {'n_estimators': 199, 'max_depth': 8, 'learning_rate': 0.016352710946272372, 'num_leaves': 97, 'feature_fraction': 0.9640332896743942, 'bagging_fraction': 0.9914598793078117, 'bagging_freq': 10, 'lambda_l1': 0.7582436911261368, 'lambda_l2': 0.3321048492447376, 'min_data_in_leaf': 16}. Best is trial 0 with value: 0.019483896939623224.
[I 2025-10-16 21:58:04,936] Trial 1 finished with value: 0.008247260803587826 and parameters: {'n_estimators': 186, 'max_depth': 7, 'learning_rate': 0.05024494781805807, 'num_leaves': 27, 'feature_fraction': 0.8421842536280094, 'bagging_fraction': 0.9673081978774121, 'bagging_freq': 5, 'lambda_l1': 0.8395250526850373, 'lambda_l2': 0.7701082440842428, 'min_data_in_leaf': 45}. Best is trial 1 with value: 0.008247260803587826.
[I 2025-10-16 21:58:25,138] Trial 2 finished with value: 0.15798503929808258 and parameters: {'n_estimators': 69, 'max_depth': 4, 'learning_rate': 0.019906985081743406, 'num_leaves': 34, 'feature_fraction': 0.676677837149364, 'bagging_fraction': 0.834738717506732, 'bagging_freq': 4, 'lambda_l1': 0.682811691256981, 'lambda_l2': 1.5757651838536835, 'min_data_in_leaf': 14}. Best is trial 1 with value: 0.008247260803587826.
[I 2025-10-16 21:58:56,262] Trial 3 finished with value: 0.009541383103136743 and parameters: {'n_estimators': 158, 'max_depth': 3, 'learning_rate': 0.09728092569671723, 'num_leaves': 24, 'feature_fraction': 0.889018171896957, 'bagging_fraction': 0.8995046759983875, 'bagging_freq': 1, 'lambda_l1': 0.9192785728158107, 'lambda_l2': 1.715852258435817, 'min_data_in_leaf': 6}. Best is trial 1 with value: 0.008247260803587826.
[I 2025-10-16 21:59:27,350] Trial 4 finished with value: 0.00803252801955324 and parameters: {'n_estimators': 144, 'max_depth': 5, 'learning_rate': 0.06800032302819309, 'num_leaves': 50, 'feature_fraction': 0.9384033857192643, 'bagging_fraction': 0.9210405645168153, 'bagging_freq': 1, 'lambda_l1': 0.7474165089544533, 'lambda_l2': 1.7941371095556768, 'min_data_in_leaf': 41}. Best is trial 4 with value: 0.00803252801955324.
[I 2025-10-16 21:59:41,995] Trial 5 finished with value: 0.029085114271939497 and parameters: {'n_estimators': 88, 'max_depth': 4, 'learning_rate': 0.03067107444683185, 'num_leaves': 53, 'feature_fraction': 0.9206960483513628, 'bagging_fraction': 0.9484153823186632, 'bagging_freq': 5, 'lambda_l1': 0.4903868405014207, 'lambda_l2': 0.307842921910382, 'min_data_in_leaf': 31}. Best is trial 4 with value: 0.00803252801955324.
[I 2025-10-16 21:59:49,257] Trial 6 finished with value: 0.2602233749987211 and parameters: {'n_estimators': 53, 'max_depth': 4, 'learning_rate': 0.017861734653626275, 'num_leaves': 49, 'feature_fraction': 0.8112806211752915, 'bagging_fraction': 0.8281271547730211, 'bagging_freq': 2, 'lambda_l1': 0.848582178098131, 'lambda_l2': 0.41361171479073744, 'min_data_in_leaf': 48}. Best is trial 4 with value: 0.00803252801955324.
[I 2025-10-16 22:00:02,198] Trial 7 finished with value: 0.009625891808294262 and parameters: {'n_estimators': 100, 'max_depth': 7, 'learning_rate': 0.04567850192569975, 'num_leaves': 77, 'feature_fraction': 0.9255740166426953, 'bagging_fraction': 0.6984813281270095, 'bagging_freq': 8, 'lambda_l1': 0.2362434946023524, 'lambda_l2': 1.050506406966039, 'min_data_in_leaf': 47}. Best is trial 4 with value: 0.00803252801955324.
[I 2025-10-16 22:00:20,510] Trial 8 finished with value: 0.008428216731663262 and parameters: {'n_estimators': 97, 'max_depth': 6, 'learning_rate': 0.09550730392071013, 'num_leaves': 83, 'feature_fraction': 0.6174677984188142, 'bagging_fraction': 0.8987555139498262, 'bagging_freq': 5, 'lambda_l1': 0.8027916386148101, 'lambda_l2': 0.16553598016058402, 'min_data_in_leaf': 29}. Best is trial 4 with value: 0.00803252801955324.
[I 2025-10-16 22:00:40,950] Trial 9 finished with value: 0.009125896164161743 and parameters: {'n_estimators': 91, 'max_depth': 6, 'learning_rate': 0.08789510450927979, 'num_leaves': 37, 'feature_fraction': 0.7575762224454579, 'bagging_fraction': 0.7761031265624188, 'bagging_freq': 6, 'lambda_l1': 0.7378714742896172, 'lambda_l2': 0.2013636409937294, 'min_data_in_leaf': 37}. Best is trial 4 with value: 0.00803252801955324.
[I 2025-10-16 22:01:10,369] Trial 10 finished with value: 0.0019574487799442577 and parameters: {'n_estimators': 139, 'max_depth': 5, 'learning_rate': 0.07215984018920658, 'num_leaves': 10, 'feature_fraction': 0.9848089805656994, 'bagging_fraction': 0.6061625845442468, 'bagging_freq': 3, 'lambda_l1': 0.002709471828515664, 'lambda_l2': 1.385722600516019, 'min_data_in_leaf': 38}. Best is trial 10 with value: 0.0019574487799442577.
[I 2025-10-16 22:01:44,514] Trial 11 finished with value: 0.0020401808325030634 and parameters: {'n_estimators': 137, 'max_depth': 5, 'learning_rate': 0.07136360802030373, 'num_leaves': 13, 'feature_fraction': 0.9942787392515332, 'bagging_fraction': 0.6060983107259755, 'bagging_freq': 2, 'lambda_l1': 0.00916620980317695, 'lambda_l2': 1.3398657378059493, 'min_data_in_leaf': 38}. Best is trial 10 with value: 0.0019574487799442577.
[I 2025-10-16 22:02:13,043] Trial 12 finished with value: 0.002258967304281073 and parameters: {'n_estimators': 130, 'max_depth': 5, 'learning_rate': 0.07091920174031371, 'num_leaves': 11, 'feature_fraction': 0.9800589410929714, 'bagging_fraction': 0.6041321723057471, 'bagging_freq': 3, 'lambda_l1': 0.0163872118328205, 'lambda_l2': 1.2977417547623087, 'min_data_in_leaf': 35}. Best is trial 10 with value: 0.0019574487799442577.
[I 2025-10-16 22:02:55,155] Trial 13 finished with value: 0.0015364842042959181 and parameters: {'n_estimators': 155, 'max_depth': 5, 'learning_rate': 0.07272518083323869, 'num_leaves': 11, 'feature_fraction': 0.98753597130142, 'bagging_fraction': 0.6085203507907333, 'bagging_freq': 3, 'lambda_l1': 0.00034830379716861357, 'lambda_l2': 1.304587947449738, 'min_data_in_leaf': 27}. Best is trial 13 with value: 0.0015364842042959181.
[I 2025-10-16 22:03:30,258] Trial 14 finished with value: 0.003269783294888981 and parameters: {'n_estimators': 164, 'max_depth': 3, 'learning_rate': 0.06170121563912664, 'num_leaves': 11, 'feature_fraction': 0.8762775848234571, 'bagging_fraction': 0.6676522448902887, 'bagging_freq': 3, 'lambda_l1': 0.20177109956114703, 'lambda_l2': 0.8655335726513843, 'min_data_in_leaf': 22}. Best is trial 13 with value: 0.0015364842042959181.
[I 2025-10-16 22:03:53,756] Trial 15 finished with value: 0.004596724505500271 and parameters: {'n_estimators': 114, 'max_depth': 6, 'learning_rate': 0.07989184126479687, 'num_leaves': 66, 'feature_fraction': 0.7687741610443901, 'bagging_fraction': 0.6839056356455706, 'bagging_freq': 7, 'lambda_l1': 0.19092493117799547, 'lambda_l2': 1.9520169843004407, 'min_data_in_leaf': 25}. Best is trial 13 with value: 0.0015364842042959181.
[I 2025-10-16 22:04:19,298] Trial 16 finished with value: 0.00430147724966854 and parameters: {'n_estimators': 168, 'max_depth': 4, 'learning_rate': 0.08141165121512398, 'num_leaves': 21, 'feature_fraction': 0.9970011554546419, 'bagging_fraction': 0.742855605072027, 'bagging_freq': 3, 'lambda_l1': 0.32799250329967256, 'lambda_l2': 1.3318943892088362, 'min_data_in_leaf': 20}. Best is trial 13 with value: 0.0015364842042959181.
[I 2025-10-16 22:04:36,688] Trial 17 finished with value: 0.006869886127768505 and parameters: {'n_estimators': 120, 'max_depth': 7, 'learning_rate': 0.04293461978945015, 'num_leaves': 40, 'feature_fraction': 0.7057093556133465, 'bagging_fraction': 0.6472479340865422, 'bagging_freq': 4, 'lambda_l1': 0.1031004762883453, 'lambda_l2': 1.119389259239233, 'min_data_in_leaf': 31}. Best is trial 13 with value: 0.0015364842042959181.
[I 2025-10-16 22:04:39,557] Trial 18 finished with value: 0.006085729129826012 and parameters: {'n_estimators': 146, 'max_depth': 5, 'learning_rate': 0.05939531055538254, 'num_leaves': 20, 'feature_fraction': 0.8724216838987907, 'bagging_fraction': 0.7384192784963877, 'bagging_freq': 2, 'lambda_l1': 0.40308445741980337, 'lambda_l2': 1.5571594915735405, 'min_data_in_leaf': 42}. Best is trial 13 with value: 0.0015364842042959181.
[I 2025-10-16 22:04:42,933] Trial 19 finished with value: 0.0017608368083360168 and parameters: {'n_estimators': 178, 'max_depth': 6, 'learning_rate': 0.08033878809730217, 'num_leaves': 65, 'feature_fraction': 0.9464974716365082, 'bagging_fraction': 0.6407198293035674, 'bagging_freq': 4, 'lambda_l1': 0.11013193796058138, 'lambda_l2': 0.677738260084718, 'min_data_in_leaf': 34}. Best is trial 13 with value: 0.0015364842042959181.
[I 2025-10-16 22:04:46,825] Trial 20 finished with value: 0.008600985919126973 and parameters: {'n_estimators': 178, 'max_depth': 8, 'learning_rate': 0.08434832728723213, 'num_leaves': 65, 'feature_fraction': 0.8356122702850595, 'bagging_fraction': 0.641278985928032, 'bagging_freq': 7, 'lambda_l1': 0.6090644468280445, 'lambda_l2': 0.7245398112004695, 'min_data_in_leaf': 25}. Best is trial 13 with value: 0.0015364842042959181.
[I 2025-10-16 22:04:49,803] Trial 21 finished with value: 0.0017398708785677003 and parameters: {'n_estimators': 152, 'max_depth': 6, 'learning_rate': 0.0748721514008004, 'num_leaves': 66, 'feature_fraction': 0.9518283211853964, 'bagging_fraction': 0.6009567167502106, 'bagging_freq': 4, 'lambda_l1': 0.09118588501992077, 'lambda_l2': 0.5806782315021108, 'min_data_in_leaf': 34}. Best is trial 13 with value: 0.0015364842042959181.
[I 2025-10-16 22:04:51,387] Trial 22 finished with value: 0.0014458578171181594 and parameters: {'n_estimators': 154, 'max_depth': 6, 'learning_rate': 0.09125441493149962, 'num_leaves': 62, 'feature_fraction': 0.9440040913715334, 'bagging_fraction': 0.7037553678442445, 'bagging_freq': 4, 'lambda_l1': 0.0988184277709364, 'lambda_l2': 0.5799164301036048, 'min_data_in_leaf': 32}. Best is trial 22 with value: 0.0014458578171181594.
[I 2025-10-16 22:04:52,913] Trial 23 finished with value: 0.0014263396283144757 and parameters: {'n_estimators': 153, 'max_depth': 7, 'learning_rate': 0.08941832689318531, 'num_leaves': 75, 'feature_fraction': 0.9135624477336423, 'bagging_fraction': 0.7234890251287415, 'bagging_freq': 6, 'lambda_l1': 0.10225074635561138, 'lambda_l2': 0.5182432636311218, 'min_data_in_leaf': 27}. Best is trial 23 with value: 0.0014263396283144757.
[I 2025-10-16 22:04:55,398] Trial 24 finished with value: 0.003610012178889899 and parameters: {'n_estimators': 168, 'max_depth': 7, 'learning_rate': 0.09390190467907929, 'num_leaves': 78, 'feature_fraction': 0.9061829954853311, 'bagging_fraction': 0.7200380035355731, 'bagging_freq': 6, 'lambda_l1': 0.28267762917672146, 'lambda_l2': 0.5371838314903735, 'min_data_in_leaf': 27}. Best is trial 23 with value: 0.0014263396283144757.
[I 2025-10-16 22:04:56,547] Trial 25 finished with value: 0.0019234297502873463 and parameters: {'n_estimators': 155, 'max_depth': 8, 'learning_rate': 0.08807702854443582, 'num_leaves': 89, 'feature_fraction': 0.8547901296765232, 'bagging_fraction': 0.7811213437737642, 'bagging_freq': 7, 'lambda_l1': 0.1413237736291713, 'lambda_l2': 0.9674173639875057, 'min_data_in_leaf': 20}. Best is trial 23 with value: 0.0014263396283144757.
[I 2025-10-16 22:04:58,915] Trial 26 finished with value: 0.005144172550207946 and parameters: {'n_estimators': 124, 'max_depth': 7, 'learning_rate': 0.09074941148978183, 'num_leaves': 74, 'feature_fraction': 0.9069193432484648, 'bagging_fraction': 0.7097540979594499, 'bagging_freq': 9, 'lambda_l1': 0.38267057716373426, 'lambda_l2': 0.45257514355463435, 'min_data_in_leaf': 14}. Best is trial 23 with value: 0.0014263396283144757.
