[I 2025-10-16 05:13:55,026] Trial 29 finished with value: 0.0020053307434965105 and parameters: {'C': 7.54825714143097, 'max_iter': 619, 'solver': 'lbfgs'}. Best is trial 13 with value: 0.0018706311535826913.
INFO:non_major_league_hyperparameter_tuning:logistic_regression optimization complete
INFO:non_major_league_hyperparameter_tuning:Best score: 0.0019
INFO:non_major_league_hyperparameter_tuning:Best params: {'C': 8.252656353230911, 'max_iter': 457, 'solver': 'lbfgs'}
INFO:non_major_league_hyperparameter_tuning:Validating optimized hyperparameters
INFO:non_major_league_hyperparameter_tuning:Hyperparameter validation: PASSED
INFO:non_major_league_hyperparameter_tuning:Comparing optimized models
INFO:non_major_league_hyperparameter_tuning:Best model: random_forest
INFO:non_major_league_hyperparameter_tuning:Best score: 0.0000
INFO:non_major_league_hyperparameter_tuning:Evaluating optimized models
INFO:non_major_league_hyperparameter_tuning:Creating optimized models
INFO:non_major_league_hyperparameter_tuning:Created optimized xgboost model
INFO:non_major_league_hyperparameter_tuning:Created optimized lightgbm model
INFO:non_major_league_hyperparameter_tuning:Created optimized random_forest model
INFO:non_major_league_hyperparameter_tuning:Created optimized logistic_regression model
INFO:non_major_league_hyperparameter_tuning:Calculating hyperparameter importance
INFO:phase2_integration:Step 5: Ensemble Modeling
INFO:phase2_integration:Creating ensemble model
INFO:non_major_league_ensemble:Creating base models with conservative parameters
INFO:non_major_league_ensemble:Created 4 base models
INFO:non_major_league_ensemble:Training base models with conservative validation
INFO:non_major_league_ensemble:Training xgboost...
INFO:non_major_league_ensemble:xgboost - Val Acc: 1.0000, Val LogLoss: 0.0195
INFO:non_major_league_ensemble:Training lightgbm...
Training until validation scores don't improve for 30 rounds
Did not meet early stopping. Best iteration is:
[150]	valid_0's multi_logloss: 0.00785181
INFO:non_major_league_ensemble:lightgbm - Val Acc: 1.0000, Val LogLoss: 0.0079
INFO:non_major_league_ensemble:Training random_forest...
INFO:non_major_league_ensemble:random_forest - Val Acc: 1.0000, Val LogLoss: 0.0521
INFO:non_major_league_ensemble:Training logistic_regression...
INFO:non_major_league_ensemble:logistic_regression - Val Acc: 1.0000, Val LogLoss: 0.0289
INFO:non_major_league_ensemble:Creating conservative ensemble
INFO:non_major_league_ensemble:Created ensemble with 4 models
INFO:non_major_league_ensemble:Model weights: {'xgboost': 0.4003513200707174, 'lightgbm': 0.3523697165788718, 'random_forest': 0.14766497268929604, 'logistic_regression': 0.09961399066111475}
INFO:non_major_league_ensemble:Training ensemble model
INFO:non_major_league_ensemble:Ensemble - Val Acc: 1.0000, Val LogLoss: 0.0209
INFO:non_major_league_ensemble:Calibrating model probabilities
INFO:non_major_league_ensemble:Calibrated xgboost
INFO:non_major_league_ensemble:Calibrated lightgbm
INFO:non_major_league_ensemble:Calibrated random_forest
INFO:non_major_league_ensemble:Calibrated logistic_regression
ERROR:non_major_league_ensemble:Error calibrating ensemble: The 'estimator' parameter of CalibratedClassifierCV must be an object implementing 'fit' and 'predict_proba', an object implementing 'fit' and 'decision_function' or None. Got <non_major_league_ensemble.NonMajorLeagueEnsemble.calibrate_models.<locals>.EnsembleWrapper object at 0x7fe76d429a90> instead.
INFO:non_major_league_ensemble:Cross-validating ensemble
INFO:non_major_league_ensemble:Cross-validation fold 1/3
INFO:non_major_league_ensemble:Training base models with conservative validation
INFO:non_major_league_ensemble:Training xgboost...
INFO:non_major_league_ensemble:xgboost - Val Acc: 1.0000, Val LogLoss: 0.0777
INFO:non_major_league_ensemble:Training lightgbm...
Training until validation scores don't improve for 30 rounds
Did not meet early stopping. Best iteration is:
[150]	valid_0's multi_logloss: 0.0209091
INFO:non_major_league_ensemble:lightgbm - Val Acc: 1.0000, Val LogLoss: 0.0209
INFO:non_major_league_ensemble:Training random_forest...
INFO:non_major_league_ensemble:random_forest - Val Acc: 1.0000, Val LogLoss: 0.2023
INFO:non_major_league_ensemble:Training logistic_regression...
INFO:non_major_league_ensemble:logistic_regression - Val Acc: 1.0000, Val LogLoss: 0.1181
INFO:non_major_league_ensemble:Creating conservative ensemble
INFO:non_major_league_ensemble:Created ensemble with 4 models
INFO:non_major_league_ensemble:Model weights: {'xgboost': 0.4005931451117126, 'lightgbm': 0.36087932232139086, 'random_forest': 0.14048500209764386, 'logistic_regression': 0.09804253046925272}
INFO:non_major_league_ensemble:Fold 1 - Acc: 1.0000, LogLoss: 0.0757
INFO:non_major_league_ensemble:Cross-validation fold 2/3
INFO:non_major_league_ensemble:Training base models with conservative validation
INFO:non_major_league_ensemble:Training xgboost...
INFO:non_major_league_ensemble:xgboost - Val Acc: 1.0000, Val LogLoss: 0.0377
INFO:non_major_league_ensemble:Training lightgbm...
Training until validation scores don't improve for 30 rounds
Did not meet early stopping. Best iteration is:
[150]	valid_0's multi_logloss: 0.0122809
INFO:non_major_league_ensemble:lightgbm - Val Acc: 1.0000, Val LogLoss: 0.0123
INFO:non_major_league_ensemble:Training random_forest...
INFO:non_major_league_ensemble:random_forest - Val Acc: 1.0000, Val LogLoss: 0.1126
INFO:non_major_league_ensemble:Training logistic_regression...
INFO:non_major_league_ensemble:logistic_regression - Val Acc: 1.0000, Val LogLoss: 0.0599
INFO:non_major_league_ensemble:Creating conservative ensemble
INFO:non_major_league_ensemble:Created ensemble with 4 models
INFO:non_major_league_ensemble:Model weights: {'xgboost': 0.4009302919523357, 'lightgbm': 0.355360077632814, 'random_forest': 0.14461134398902528, 'logistic_regression': 0.09909828642582488}
INFO:non_major_league_ensemble:Fold 2 - Acc: 1.0000, LogLoss: 0.0405
INFO:non_major_league_ensemble:Cross-validation fold 3/3
INFO:non_major_league_ensemble:Training base models with conservative validation
INFO:non_major_league_ensemble:Training xgboost...
INFO:non_major_league_ensemble:xgboost - Val Acc: 1.0000, Val LogLoss: 0.0255
INFO:non_major_league_ensemble:Training lightgbm...
Training until validation scores don't improve for 30 rounds
Did not meet early stopping. Best iteration is:
[150]	valid_0's multi_logloss: 0.00932726
INFO:non_major_league_ensemble:lightgbm - Val Acc: 1.0000, Val LogLoss: 0.0093
INFO:non_major_league_ensemble:Training random_forest...
INFO:non_major_league_ensemble:random_forest - Val Acc: 1.0000, Val LogLoss: 0.0716
INFO:non_major_league_ensemble:Training logistic_regression...
INFO:non_major_league_ensemble:logistic_regression - Val Acc: 1.0000, Val LogLoss: 0.0350
INFO:non_major_league_ensemble:Creating conservative ensemble
INFO:non_major_league_ensemble:Created ensemble with 4 models
INFO:non_major_league_ensemble:Model weights: {'xgboost': 0.40044253588455253, 'lightgbm': 0.35326403229502334, 'random_forest': 0.1466646829007119, 'logistic_regression': 0.09962874891971212}
INFO:non_major_league_ensemble:Fold 3 - Acc: 1.0000, LogLoss: 0.0270
INFO:non_major_league_ensemble:CV Summary - Mean Acc: 1.0000 ¬± 0.0000
INFO:non_major_league_ensemble:CV Summary - Mean LogLoss: 0.0478 ¬± 0.0205
INFO:non_major_league_ensemble:Evaluating ensemble performance
INFO:non_major_league_ensemble:Ensemble Evaluation - Acc: 1.0000, LogLoss: 0.0278
INFO:non_major_league_ensemble:Mean Confidence: 0.9727
INFO:non_major_league_ensemble:Making predictions with confidence filtering
INFO:non_major_league_ensemble:High confidence predictions: 154/154
INFO:non_major_league_ensemble:Calculating ensemble feature importance
INFO:non_major_league_ensemble:Estimating prediction uncertainty
INFO:non_major_league_ensemble:Uncertainty estimation complete
INFO:phase2_integration:Step 6: Model Validation
INFO:phase2_integration:Validating models
INFO:non_major_league_model_validation:Performing comprehensive model validation
INFO:non_major_league_model_validation:Performing time series cross-validation
INFO:non_major_league_model_validation:Time series CV fold 1/3
INFO:non_major_league_model_validation:Fold 1 - Val Acc: 1.0000, Overfitting: 0.0000
INFO:non_major_league_model_validation:Time series CV fold 2/3
INFO:non_major_league_model_validation:Fold 2 - Val Acc: 1.0000, Overfitting: 0.0000
INFO:non_major_league_model_validation:Time series CV fold 3/3
INFO:non_major_league_model_validation:Fold 3 - Val Acc: 1.0000, Overfitting: 0.0000
INFO:non_major_league_model_validation:Time series CV complete: 3 successful folds
INFO:non_major_league_model_validation:Performing walk-forward validation
INFO:non_major_league_model_validation:Walk-forward CV fold 1/3
INFO:non_major_league_model_validation:Fold 1 - Val Acc: 1.0000
INFO:non_major_league_model_validation:Walk-forward CV fold 2/3
INFO:non_major_league_model_validation:Fold 2 - Val Acc: 1.0000
INFO:non_major_league_model_validation:Walk-forward CV fold 3/3
INFO:non_major_league_model_validation:Fold 3 - Val Acc: 1.0000
INFO:non_major_league_model_validation:Walk-forward CV complete: 3 successful folds
INFO:non_major_league_model_validation:Performing bootstrap validation
INFO:non_major_league_model_validation:Bootstrap 1/50
INFO:non_major_league_model_validation:Bootstrap 2/50
INFO:non_major_league_model_validation:Bootstrap 3/50
INFO:non_major_league_model_validation:Bootstrap 4/50
INFO:non_major_league_model_validation:Bootstrap 5/50
INFO:non_major_league_model_validation:Bootstrap 6/50
INFO:non_major_league_model_validation:Bootstrap 7/50
INFO:non_major_league_model_validation:Bootstrap 8/50
INFO:non_major_league_model_validation:Bootstrap 9/50
INFO:non_major_league_model_validation:Bootstrap 10/50
INFO:non_major_league_model_validation:Bootstrap 11/50
INFO:non_major_league_model_validation:Bootstrap 12/50
INFO:non_major_league_model_validation:Bootstrap 13/50
INFO:non_major_league_model_validation:Bootstrap 14/50
INFO:non_major_league_model_validation:Bootstrap 15/50
INFO:non_major_league_model_validation:Bootstrap 16/50
INFO:non_major_league_model_validation:Bootstrap 17/50
INFO:non_major_league_model_validation:Bootstrap 18/50
INFO:non_major_league_model_validation:Bootstrap 19/50
INFO:non_major_league_model_validation:Bootstrap 20/50
INFO:non_major_league_model_validation:Bootstrap 21/50
INFO:non_major_league_model_validation:Bootstrap 22/50
INFO:non_major_league_model_validation:Bootstrap 23/50
INFO:non_major_league_model_validation:Bootstrap 24/50
INFO:non_major_league_model_validation:Bootstrap 25/50
INFO:non_major_league_model_validation:Bootstrap 26/50
INFO:non_major_league_model_validation:Bootstrap 27/50
INFO:non_major_league_model_validation:Bootstrap 28/50
INFO:non_major_league_model_validation:Bootstrap 29/50
INFO:non_major_league_model_validation:Bootstrap 30/50
INFO:non_major_league_model_validation:Bootstrap 31/50
INFO:non_major_league_model_validation:Bootstrap 32/50
INFO:non_major_league_model_validation:Bootstrap 33/50
INFO:non_major_league_model_validation:Bootstrap 34/50
INFO:non_major_league_model_validation:Bootstrap 35/50
INFO:non_major_league_model_validation:Bootstrap 36/50
INFO:non_major_league_model_validation:Bootstrap 37/50
INFO:non_major_league_model_validation:Bootstrap 38/50
INFO:non_major_league_model_validation:Bootstrap 39/50
INFO:non_major_league_model_validation:Bootstrap 40/50
INFO:non_major_league_model_validation:Bootstrap 41/50
INFO:non_major_league_model_validation:Bootstrap 42/50
INFO:non_major_league_model_validation:Bootstrap 43/50
INFO:non_major_league_model_validation:Bootstrap 44/50
INFO:non_major_league_model_validation:Bootstrap 45/50
INFO:non_major_league_model_validation:Bootstrap 46/50
INFO:non_major_league_model_validation:Bootstrap 47/50
INFO:non_major_league_model_validation:Bootstrap 48/50
INFO:non_major_league_model_validation:Bootstrap 49/50
INFO:non_major_league_model_validation:Bootstrap 50/50
INFO:non_major_league_model_validation:Bootstrap validation complete: 50 successful bootstraps
INFO:non_major_league_model_validation:Validating model calibration
INFO:non_major_league_model_validation:Model calibration validation complete
INFO:non_major_league_model_validation:Detecting overfitting
INFO:non_major_league_model_validation:Overfitting detection: NOT DETECTED
INFO:non_major_league_model_validation:Analyzing model stability
INFO:non_major_league_model_validation:Stability analysis: STABLE
INFO:non_major_league_model_validation:Comprehensive validation complete
INFO:phase2_integration:Step 7: Final Integration
INFO:phase2_integration:Integrating Phase 2 results
INFO:phase2_integration:Step 8: Saving Results
INFO:phase2_integration:Saving results for E1
INFO:non_major_league_model_architecture:Saving models to ./models/E1_model_architecture.pkl
INFO:non_major_league_model_architecture:Models saved successfully
INFO:non_major_league_ensemble:Saving ensemble to ./models/E1_ensemble.pkl
INFO:non_major_league_ensemble:Ensemble saved successfully
INFO:non_major_league_hyperparameter_tuning:Saving hyperparameter tuning results to ./models/E1_hyperparameter_tuning.pkl
INFO:non_major_league_hyperparameter_tuning:Hyperparameter tuning results saved successfully
INFO:non_major_league_model_validation:Saving validation results to ./models/E1_validation_results.pkl
INFO:non_major_league_model_validation:Validation results saved successfully
INFO:phase2_integration:Phase 2 results saved successfully
INFO:phase2_integration:Phase 2 pipeline completed successfully
INFO:master_pipeline:Phase 2 completed successfully in 5087.37 seconds
INFO:__main__:‚úÖ Phase 2 completed
INFO:__main__:
üìà STEP 5: Phase 3 - Backtesting
INFO:master_pipeline:================================================================================
INFO:master_pipeline:STARTING PHASE 3: BACKTESTING & STRATEGY VALIDATION
INFO:master_pipeline:================================================================================
INFO:phase3_integration:Output directory: ./results
ERROR:master_pipeline:Phase 3 failed: Phase3Integration.run_phase3_pipeline() got an unexpected keyword argument 'feature_data_path'
ERROR:__main__:‚ùå Workflow failed: Phase3Integration.run_phase3_pipeline() got an unexpected keyword argument 'feature_data_path'
ERROR:__main__:Traceback (most recent call last):
  File "/home/kali/Non-major-leagues/run_complete_workflow.py", line 124, in run_complete_workflow
    phase3_result = self.master_pipeline.run_phase3()
  File "/home/kali/Non-major-leagues/master_pipeline.py", line 400, in run_phase3
    result = phase3.run_phase3_pipeline(
        feature_data_path=str(Path(self.config['pipeline']['output_dir']) / 'phase1_output' / 'processed_features.parquet'),
    ...<2 lines>...
        config=self.config
    )
TypeError: Phase3Integration.run_phase3_pipeline() got an unexpected keyword argument 'feature_data_path'

Traceback (most recent call last):
  File "/home/kali/Non-major-leagues/run_complete_workflow.py", line 484, in <module>
    main()
    ~~~~^^
  File "/home/kali/Non-major-leagues/run_complete_workflow.py", line 469, in main
    results = orchestrator.run_complete_workflow(
        league=args.league,
        crawler_file=args.crawler_file,
        skip_training=args.skip_training
    )
  File "/home/kali/Non-major-leagues/run_complete_workflow.py", line 124, in run_complete_workflow
    phase3_result = self.master_pipeline.run_phase3()
  File "/home/kali/Non-major-leagues/master_pipeline.py", line 400, in run_phase3
    result = phase3.run_phase3_pipeline(
        feature_data_path=str(Path(self.config['pipeline']['output_dir']) / 'phase1_output' / 'processed_features.parquet'),
    ...<2 lines>...
        config=self.config
    )
TypeError: Phase3Integration.run_phase3_pipeline() got an unexpected keyword argument 'feature_data_path'
