INFO:master_pipeline:Master Pipeline initialized
INFO:master_pipeline:Configuration loaded from config.yaml
INFO:api_data_manager:Loaded configuration from config.yaml
INFO:api_data_manager:Loaded 32 environment variables
INFO:api_data_manager:Initialized data source: football_data
INFO:api_data_manager:Initialized data source: odds_api
INFO:api_data_manager:Initialized data source: api_football
INFO:api_data_manager:Initialized data source: rapidapi_football
INFO:api_data_manager:Initialized data source: sportsdata_io
INFO:api_data_manager:Initialized data source: betfair_exchange
INFO:api_data_manager:Initialized data source: openweathermap
INFO:api_data_manager:Initialized data source: newsapi
INFO:api_data_manager:Initialized data source: twitter_api
INFO:api_data_manager:Initialized data source: pinnacle
WARNING:api_data_manager:Skipping football_api_com - no valid API key found
INFO:api_data_manager:Initialized data source: livescore
WARNING:api_data_manager:Skipping football_api_net - no valid API key found
WARNING:api_data_manager:Skipping fifa_data - no valid API key found
WARNING:api_data_manager:Skipping smarkets - no valid API key found
INFO:api_data_manager:Initialized APIDataManager with 11 data sources
INFO:crawler_to_pipeline_bridge:Loaded configuration from config.yaml
INFO:crawler_to_pipeline_bridge:Initialized Crawler-Pipeline Bridge
INFO:__main__:‚úÖ Complete Workflow Orchestrator initialized
INFO:__main__:================================================================================
INFO:__main__:COMPLETE WORKFLOW - ALL MARKETS PREDICTION
INFO:__main__:================================================================================
INFO:__main__:
üì• STEP 1: Loading Crawler Data
INFO:crawler_to_pipeline_bridge:Loaded 31 matches from crawler
INFO:__main__:‚úÖ Loaded 31 upcoming matches
INFO:__main__:
üåê STEP 2: Fetching API Data
INFO:__main__:  Fetching team statistics...
WARNING:__main__:  ‚ö†Ô∏è Team stats fetch failed: 'HomeTeam'
INFO:__main__:  Fetching odds (all markets)...
WARNING:__main__:  Could not fetch odds for match: 'APIDataManager' object has no attribute 'get_match_odds'
WARNING:__main__:  Could not fetch odds for match: 'APIDataManager' object has no attribute 'get_match_odds'
WARNING:__main__:  Could not fetch odds for match: 'APIDataManager' object has no attribute 'get_match_odds'
WARNING:__main__:  Could not fetch odds for match: 'APIDataManager' object has no attribute 'get_match_odds'
WARNING:__main__:  Could not fetch odds for match: 'APIDataManager' object has no attribute 'get_match_odds'
WARNING:__main__:  Could not fetch odds for match: 'APIDataManager' object has no attribute 'get_match_odds'
WARNING:__main__:  Could not fetch odds for match: 'APIDataManager' object has no attribute 'get_match_odds'
WARNING:__main__:  Could not fetch odds for match: 'APIDataManager' object has no attribute 'get_match_odds'
WARNING:__main__:  Could not fetch odds for match: 'APIDataManager' object has no attribute 'get_match_odds'
WARNING:__main__:  Could not fetch odds for match: 'APIDataManager' object has no attribute 'get_match_odds'
WARNING:__main__:  Could not fetch odds for match: 'APIDataManager' object has no attribute 'get_match_odds'
WARNING:__main__:  Could not fetch odds for match: 'APIDataManager' object has no attribute 'get_match_odds'
WARNING:__main__:  Could not fetch odds for match: 'APIDataManager' object has no attribute 'get_match_odds'
WARNING:__main__:  Could not fetch odds for match: 'APIDataManager' object has no attribute 'get_match_odds'
WARNING:__main__:  Could not fetch odds for match: 'APIDataManager' object has no attribute 'get_match_odds'
WARNING:__main__:  Could not fetch odds for match: 'APIDataManager' object has no attribute 'get_match_odds'
WARNING:__main__:  Could not fetch odds for match: 'APIDataManager' object has no attribute 'get_match_odds'
WARNING:__main__:  Could not fetch odds for match: 'APIDataManager' object has no attribute 'get_match_odds'
WARNING:__main__:  Could not fetch odds for match: 'APIDataManager' object has no attribute 'get_match_odds'
WARNING:__main__:  Could not fetch odds for match: 'APIDataManager' object has no attribute 'get_match_odds'
WARNING:__main__:  Could not fetch odds for match: 'APIDataManager' object has no attribute 'get_match_odds'
WARNING:__main__:  Could not fetch odds for match: 'APIDataManager' object has no attribute 'get_match_odds'
WARNING:__main__:  Could not fetch odds for match: 'APIDataManager' object has no attribute 'get_match_odds'
WARNING:__main__:  Could not fetch odds for match: 'APIDataManager' object has no attribute 'get_match_odds'
WARNING:__main__:  Could not fetch odds for match: 'APIDataManager' object has no attribute 'get_match_odds'
WARNING:__main__:  Could not fetch odds for match: 'APIDataManager' object has no attribute 'get_match_odds'
WARNING:__main__:  Could not fetch odds for match: 'APIDataManager' object has no attribute 'get_match_odds'
WARNING:__main__:  Could not fetch odds for match: 'APIDataManager' object has no attribute 'get_match_odds'
WARNING:__main__:  Could not fetch odds for match: 'APIDataManager' object has no attribute 'get_match_odds'
WARNING:__main__:  Could not fetch odds for match: 'APIDataManager' object has no attribute 'get_match_odds'
WARNING:__main__:  Could not fetch odds for match: 'APIDataManager' object has no attribute 'get_match_odds'
INFO:__main__:  ‚ö†Ô∏è Generating dummy odds for testing...
WARNING:__main__:  ‚ö†Ô∏è Odds fetch failed: 'HomeTeam'
INFO:__main__:  ‚úÖ Using existing historical data: pipeline_output/phase1_output/E1_features.csv
INFO:__main__:‚úÖ API data fetched successfully
INFO:__main__:
üìä STEP 3: Phase 1 - Feature Engineering
INFO:master_pipeline:================================================================================
INFO:master_pipeline:STARTING PHASE 1: DATA COLLECTION & PREPROCESSING
INFO:master_pipeline:================================================================================
INFO:phase1_integration:Output directory: ./data
INFO:phase1_integration:Starting Phase 1 pipeline for E1, seasons: ['2324', '2223', '2122']
INFO:phase1_integration:Step 1: Data Collection
INFO:phase1_integration:Collecting data for E1, seasons: ['2324', '2223', '2122']
INFO:non_major_league_data_collector:Collecting historical data for E1, seasons: ['2324', '2223', '2122']
ERROR:non_major_league_data_collector:Error collecting from football-data.co.uk: HTTPSConnectionPool(host='www.football-data.co.uk', port=443): Max retries exceeded with url: /mmz4281/2324/E1.csv (Caused by NewConnectionError('<urllib3.connection.HTTPSConnection object at 0x7ffb299ee900>: Failed to establish a new connection: [Errno 111] Connection refused'))
WARNING:non_major_league_data_collector:No data found for E1 2324
ERROR:non_major_league_data_collector:Error collecting from football-data.co.uk: HTTPSConnectionPool(host='www.football-data.co.uk', port=443): Max retries exceeded with url: /mmz4281/2223/E1.csv (Caused by NewConnectionError('<urllib3.connection.HTTPSConnection object at 0x7ffb29986e90>: Failed to establish a new connection: [Errno 111] Connection refused'))
WARNING:non_major_league_data_collector:No data found for E1 2223
ERROR:non_major_league_data_collector:Error collecting from football-data.co.uk: HTTPSConnectionPool(host='www.football-data.co.uk', port=443): Max retries exceeded with url: /mmz4281/2122/E1.csv (Caused by NewConnectionError('<urllib3.connection.HTTPSConnection object at 0x7ffb29987610>: Failed to establish a new connection: [Errno 111] Connection refused'))
WARNING:non_major_league_data_collector:No data found for E1 2122
ERROR:non_major_league_data_collector:No historical data collected for E1
WARNING:phase1_integration:No historical data collected
ERROR:phase1_integration:No data collected, stopping pipeline
INFO:master_pipeline:Phase 1 completed successfully in 11.59 seconds
INFO:__main__:‚úÖ Phase 1 completed
INFO:__main__:
ü§ñ STEP 4: Phase 2 - Model Training (All Markets)
INFO:master_pipeline:================================================================================
INFO:master_pipeline:STARTING PHASE 2: MODEL DEVELOPMENT & VALIDATION
INFO:master_pipeline:================================================================================
INFO:phase2_integration:Output directory: ./models
INFO:phase2_integration:Starting Phase 2 pipeline for E1
INFO:phase2_integration:Step 1: Loading and preparing data
INFO:phase2_integration:Loading data from ./data/E1_features.csv
INFO:phase2_integration:Loaded 767 rows with 254 columns
INFO:phase2_integration:Selected 241 numerical features from 254 total columns
INFO:phase2_integration:Excluded columns: ['target', 'FTR', 'HTR', 'Date', 'Time', 'HomeTeam', 'AwayTeam', 'Referee', 'Div', 'league', 'season', 'data_source', 'season_phase']
INFO:phase2_integration:Sanitized 241 feature names for XGBoost compatibility
INFO:phase2_integration:Final dataset: 767 samples with 241 features
INFO:phase2_integration:Target distribution: {2: 325, 0: 238, 1: 204}
INFO:phase2_integration:Step 2: Model Architecture Design
INFO:phase2_integration:Designing model architecture
INFO:non_major_league_model_architecture:Creating base models for non-major leagues
INFO:non_major_league_model_architecture:Created 4 base models
INFO:non_major_league_model_architecture:Training base models
INFO:non_major_league_model_architecture:Calculated class weights: {np.int64(0): np.float64(1.0705004470672759), np.int64(1): np.float64(1.1577871724547892), np.int64(2): np.float64(0.8370583370546805)}
INFO:non_major_league_model_architecture:Training xgboost...
INFO:non_major_league_model_architecture:xgboost - Train Acc: 1.0000, Val Acc: 1.0000
INFO:non_major_league_model_architecture:Training lightgbm...
Training until validation scores don't improve for 50 rounds
Did not meet early stopping. Best iteration is:
[200]	valid_0's multi_logloss: 0.00128423
INFO:non_major_league_model_architecture:lightgbm - Train Acc: 1.0000, Val Acc: 1.0000
INFO:non_major_league_model_architecture:Training random_forest...
INFO:non_major_league_model_architecture:random_forest - Train Acc: 1.0000, Val Acc: 1.0000
INFO:non_major_league_model_architecture:Training logistic_regression...
INFO:non_major_league_model_architecture:logistic_regression - Train Acc: 1.0000, Val Acc: 1.0000
INFO:non_major_league_model_architecture:Creating ensemble model
INFO:non_major_league_model_architecture:Training ensemble model
INFO:non_major_league_model_architecture:Ensemble training complete
INFO:non_major_league_model_architecture:Calibrating model probabilities
INFO:non_major_league_model_architecture:Calibrated xgboost
INFO:non_major_league_model_architecture:Calibrated lightgbm
INFO:non_major_league_model_architecture:Calibrated random_forest
INFO:non_major_league_model_architecture:Calibrated logistic_regression
INFO:non_major_league_model_architecture:Calibrated ensemble model
INFO:non_major_league_model_architecture:Evaluating models
INFO:non_major_league_model_architecture:Calculating feature importance
INFO:phase2_integration:Step 3: Transfer Learning Setup
INFO:phase2_integration:Setting up transfer learning
INFO:phase2_integration:No source data files provided, skipping transfer learning
INFO:phase2_integration:Step 4: Hyperparameter Tuning
INFO:phase2_integration:Optimizing hyperparameters
INFO:non_major_league_hyperparameter_tuning:Optimizing hyperparameters for all models
INFO:non_major_league_hyperparameter_tuning:Optimizing xgboost (priority: 1)
INFO:non_major_league_hyperparameter_tuning:Optimizing hyperparameters for xgboost
[I 2025-10-16 23:03:09,336] A new study created in memory with name: no-name-b92f6f5e-dc21-42af-8c31-cc3c3ac29b3a
[I 2025-10-16 23:03:28,862] Trial 0 finished with value: 0.060899501456117076 and parameters: {'n_estimators': 89, 'max_depth': 5, 'learning_rate': 0.04748109850431103, 'subsample': 0.8017356131677724, 'colsample_bytree': 0.8512247921134903, 'min_child_weight': 10, 'reg_alpha': 0.03247481189676937, 'reg_lambda': 1.4797087307496444}. Best is trial 0 with value: 0.060899501456117076.
[I 2025-10-16 23:04:00,600] Trial 1 finished with value: 0.02735774722563876 and parameters: {'n_estimators': 143, 'max_depth': 6, 'learning_rate': 0.04346389152933026, 'subsample': 0.6555189685535393, 'colsample_bytree': 0.934270263847488, 'min_child_weight': 4, 'reg_alpha': 0.26912713828663415, 'reg_lambda': 1.6337476168370673}. Best is trial 1 with value: 0.02735774722563876.
[I 2025-10-16 23:04:34,384] Trial 2 finished with value: 0.029497161754491238 and parameters: {'n_estimators': 133, 'max_depth': 3, 'learning_rate': 0.054191184392409504, 'subsample': 0.960577662113459, 'colsample_bytree': 0.9907356774184976, 'min_child_weight': 6, 'reg_alpha': 0.6071804228153729, 'reg_lambda': 1.772623000948037}. Best is trial 1 with value: 0.02735774722563876.
[I 2025-10-16 23:05:00,124] Trial 3 finished with value: 0.026064948778235886 and parameters: {'n_estimators': 120, 'max_depth': 8, 'learning_rate': 0.0784274951549526, 'subsample': 0.8846128279194194, 'colsample_bytree': 0.8648740344963617, 'min_child_weight': 5, 'reg_alpha': 0.059224957821965796, 'reg_lambda': 1.776355813250216}. Best is trial 3 with value: 0.026064948778235886.
[I 2025-10-16 23:05:22,381] Trial 4 finished with value: 0.029055655590785396 and parameters: {'n_estimators': 105, 'max_depth': 7, 'learning_rate': 0.08018594193012209, 'subsample': 0.989059620504847, 'colsample_bytree': 0.6844336566705211, 'min_child_weight': 6, 'reg_alpha': 0.3504593813749669, 'reg_lambda': 0.3073819055469931}. Best is trial 3 with value: 0.026064948778235886.
[I 2025-10-16 23:05:44,845] Trial 5 finished with value: 0.050744878071325 and parameters: {'n_estimators': 100, 'max_depth': 7, 'learning_rate': 0.07742002456537321, 'subsample': 0.638715021149197, 'colsample_bytree': 0.63534641579695, 'min_child_weight': 7, 'reg_alpha': 0.27240161025483056, 'reg_lambda': 1.030057789246158}. Best is trial 3 with value: 0.026064948778235886.
[I 2025-10-16 23:06:37,535] Trial 6 finished with value: 0.014557220418273883 and parameters: {'n_estimators': 166, 'max_depth': 3, 'learning_rate': 0.04281540219573804, 'subsample': 0.965048063043144, 'colsample_bytree': 0.8470513102113981, 'min_child_weight': 3, 'reg_alpha': 0.7010357491018964, 'reg_lambda': 0.6515008019643511}. Best is trial 6 with value: 0.014557220418273883.
[I 2025-10-16 23:07:00,356] Trial 7 finished with value: 0.07227727006231698 and parameters: {'n_estimators': 72, 'max_depth': 5, 'learning_rate': 0.03765684497717218, 'subsample': 0.6656579998105704, 'colsample_bytree': 0.6087593643974925, 'min_child_weight': 5, 'reg_alpha': 0.4404193354965882, 'reg_lambda': 1.1090462117167579}. Best is trial 6 with value: 0.014557220418273883.
[I 2025-10-16 23:07:12,832] Trial 8 finished with value: 0.05179425800782777 and parameters: {'n_estimators': 82, 'max_depth': 7, 'learning_rate': 0.057961276990439854, 'subsample': 0.8325504682416385, 'colsample_bytree': 0.8366097977299513, 'min_child_weight': 9, 'reg_alpha': 0.5763113461400631, 'reg_lambda': 1.9056491427787499}. Best is trial 6 with value: 0.014557220418273883.
[I 2025-10-16 23:07:15,442] Trial 9 finished with value: 0.04562790857949503 and parameters: {'n_estimators': 84, 'max_depth': 3, 'learning_rate': 0.09734406644403042, 'subsample': 0.8344548247871106, 'colsample_bytree': 0.6396570063083252, 'min_child_weight': 8, 'reg_alpha': 0.6623198932109776, 'reg_lambda': 1.4664898883448156}. Best is trial 6 with value: 0.014557220418273883.
[I 2025-10-16 23:07:22,542] Trial 10 finished with value: 0.03944303154012379 and parameters: {'n_estimators': 196, 'max_depth': 4, 'learning_rate': 0.01801717076134795, 'subsample': 0.728678184953075, 'colsample_bytree': 0.7428451777490092, 'min_child_weight': 1, 'reg_alpha': 0.9825983563718643, 'reg_lambda': 0.29812088533439707}. Best is trial 6 with value: 0.014557220418273883.
[I 2025-10-16 23:07:26,663] Trial 11 finished with value: 0.015140037385169202 and parameters: {'n_estimators': 167, 'max_depth': 8, 'learning_rate': 0.07223271237508058, 'subsample': 0.9190290703231251, 'colsample_bytree': 0.8908547779977419, 'min_child_weight': 3, 'reg_alpha': 0.8272541400106868, 'reg_lambda': 0.6572899774983556}. Best is trial 6 with value: 0.014557220418273883.
[I 2025-10-16 23:07:31,733] Trial 12 finished with value: 0.02707677599159096 and parameters: {'n_estimators': 172, 'max_depth': 8, 'learning_rate': 0.02313316300185342, 'subsample': 0.9264234965569754, 'colsample_bytree': 0.912408004058807, 'min_child_weight': 2, 'reg_alpha': 0.8525596604291126, 'reg_lambda': 0.6370081431505451}. Best is trial 6 with value: 0.014557220418273883.
[I 2025-10-16 23:07:34,888] Trial 13 finished with value: 0.015443038599940664 and parameters: {'n_estimators': 164, 'max_depth': 4, 'learning_rate': 0.06369556758079815, 'subsample': 0.9011804705936531, 'colsample_bytree': 0.7831547514717357, 'min_child_weight': 3, 'reg_alpha': 0.7709840456451262, 'reg_lambda': 0.6678867481756181}. Best is trial 6 with value: 0.014557220418273883.
[I 2025-10-16 23:07:40,168] Trial 14 finished with value: 0.014387983876067613 and parameters: {'n_estimators': 199, 'max_depth': 6, 'learning_rate': 0.03140628641766245, 'subsample': 0.9855396106509791, 'colsample_bytree': 0.909557177143694, 'min_child_weight': 3, 'reg_alpha': 0.8083096909769085, 'reg_lambda': 0.6711072152650139}. Best is trial 14 with value: 0.014387983876067613.
[I 2025-10-16 23:08:31,070] Trial 15 finished with value: 0.011637367859235576 and parameters: {'n_estimators': 197, 'max_depth': 6, 'learning_rate': 0.030094902684733728, 'subsample': 0.9951517182535141, 'colsample_bytree': 0.9731574397601719, 'min_child_weight': 1, 'reg_alpha': 0.9643922662433911, 'reg_lambda': 0.11972225341035914}. Best is trial 15 with value: 0.011637367859235576.
[I 2025-10-16 23:10:07,086] Trial 16 finished with value: 0.011325824626251299 and parameters: {'n_estimators': 197, 'max_depth': 6, 'learning_rate': 0.031028821523224514, 'subsample': 0.9968393046558416, 'colsample_bytree': 0.9779449874895008, 'min_child_weight': 1, 'reg_alpha': 0.9939338816407707, 'reg_lambda': 0.008172522534865334}. Best is trial 16 with value: 0.011325824626251299.
[I 2025-10-16 23:10:33,549] Trial 17 finished with value: 0.440936811254113 and parameters: {'n_estimators': 53, 'max_depth': 6, 'learning_rate': 0.014481262337410511, 'subsample': 0.8615796657050114, 'colsample_bytree': 0.9842113543717814, 'min_child_weight': 1, 'reg_alpha': 0.978228704259041, 'reg_lambda': 0.05494670121048435}. Best is trial 16 with value: 0.011325824626251299.
[I 2025-10-16 23:12:02,876] Trial 18 finished with value: 0.01805958451115164 and parameters: {'n_estimators': 180, 'max_depth': 5, 'learning_rate': 0.02772227439964005, 'subsample': 0.707593799830062, 'colsample_bytree': 0.9504399089701774, 'min_child_weight': 1, 'reg_alpha': 0.9139129669120902, 'reg_lambda': 0.006802246914464924}. Best is trial 16 with value: 0.011325824626251299.
[I 2025-10-16 23:13:03,529] Trial 19 finished with value: 0.16825351181157086 and parameters: {'n_estimators': 149, 'max_depth': 6, 'learning_rate': 0.011363232036680295, 'subsample': 0.7653658159417842, 'colsample_bytree': 0.9609743515734681, 'min_child_weight': 2, 'reg_alpha': 0.5110398716227169, 'reg_lambda': 0.24785760387863295}. Best is trial 16 with value: 0.011325824626251299.
[I 2025-10-16 23:14:26,240] Trial 20 finished with value: 0.019193689935722593 and parameters: {'n_estimators': 190, 'max_depth': 7, 'learning_rate': 0.024721249847655665, 'subsample': 0.9437119925704304, 'colsample_bytree': 0.7675835147789074, 'min_child_weight': 2, 'reg_alpha': 0.9968295839744183, 'reg_lambda': 0.43196708945000417}. Best is trial 16 with value: 0.011325824626251299.
[I 2025-10-16 23:15:23,594] Trial 21 finished with value: 0.010736416310539598 and parameters: {'n_estimators': 196, 'max_depth': 6, 'learning_rate': 0.03369277700427581, 'subsample': 0.983568654615167, 'colsample_bytree': 0.912568999506022, 'min_child_weight': 1, 'reg_alpha': 0.8647238214618197, 'reg_lambda': 0.8508062286297544}. Best is trial 21 with value: 0.010736416310539598.
[I 2025-10-16 23:16:03,157] Trial 22 finished with value: 0.01141016862179668 and parameters: {'n_estimators': 184, 'max_depth': 6, 'learning_rate': 0.03576535839916093, 'subsample': 0.9998548369316662, 'colsample_bytree': 0.9969717989071878, 'min_child_weight': 1, 'reg_alpha': 0.8997273853473075, 'reg_lambda': 1.198918976299475}. Best is trial 21 with value: 0.010736416310539598.
[I 2025-10-16 23:16:46,366] Trial 23 finished with value: 0.01023306955660576 and parameters: {'n_estimators': 182, 'max_depth': 5, 'learning_rate': 0.03822754945608633, 'subsample': 0.9489588389616428, 'colsample_bytree': 0.9948184317827552, 'min_child_weight': 2, 'reg_alpha': 0.7311119726517566, 'reg_lambda': 1.1780281152900898}. Best is trial 23 with value: 0.01023306955660576.
[I 2025-10-16 23:17:25,673] Trial 24 finished with value: 0.019894120885591483 and parameters: {'n_estimators': 155, 'max_depth': 4, 'learning_rate': 0.03781278635708831, 'subsample': 0.9390264437082929, 'colsample_bytree': 0.9342259625288845, 'min_child_weight': 4, 'reg_alpha': 0.7329609490419866, 'reg_lambda': 0.8717804191954663}. Best is trial 23 with value: 0.01023306955660576.
[I 2025-10-16 23:18:17,017] Trial 25 finished with value: 0.010708638026932721 and parameters: {'n_estimators': 180, 'max_depth': 5, 'learning_rate': 0.05186494453559734, 'subsample': 0.8803965919392099, 'colsample_bytree': 0.9122417920902592, 'min_child_weight': 2, 'reg_alpha': 0.8873556164495295, 'reg_lambda': 1.279121721045433}. Best is trial 23 with value: 0.01023306955660576.
