[I 2025-10-16 22:06:08,527] Trial 29 finished with value: 0.003232258043236692 and parameters: {'C': 3.8372835930947673, 'max_iter': 347, 'solver': 'lbfgs'}. Best is trial 12 with value: 0.0020155290870005342.
INFO:non_major_league_hyperparameter_tuning:logistic_regression optimization complete
INFO:non_major_league_hyperparameter_tuning:Best score: 0.0020
INFO:non_major_league_hyperparameter_tuning:Best params: {'C': 9.9869737181758, 'max_iter': 624, 'solver': 'lbfgs'}
INFO:non_major_league_hyperparameter_tuning:Validating optimized hyperparameters
INFO:non_major_league_hyperparameter_tuning:Hyperparameter validation: PASSED
INFO:non_major_league_hyperparameter_tuning:Comparing optimized models
INFO:non_major_league_hyperparameter_tuning:Best model: random_forest
INFO:non_major_league_hyperparameter_tuning:Best score: 0.0000
INFO:non_major_league_hyperparameter_tuning:Evaluating optimized models
INFO:non_major_league_hyperparameter_tuning:Creating optimized models
INFO:non_major_league_hyperparameter_tuning:Created optimized xgboost model
INFO:non_major_league_hyperparameter_tuning:Created optimized lightgbm model
INFO:non_major_league_hyperparameter_tuning:Created optimized random_forest model
INFO:non_major_league_hyperparameter_tuning:Created optimized logistic_regression model
INFO:non_major_league_hyperparameter_tuning:Calculating hyperparameter importance
INFO:phase2_integration:Step 5: Ensemble Modeling
INFO:phase2_integration:Creating ensemble model
INFO:non_major_league_ensemble:Creating base models with conservative parameters
INFO:non_major_league_ensemble:Created 4 base models
INFO:non_major_league_ensemble:Training base models with conservative validation
INFO:non_major_league_ensemble:Training xgboost...
INFO:non_major_league_ensemble:xgboost - Val Acc: 1.0000, Val LogLoss: 0.0190
INFO:non_major_league_ensemble:Training lightgbm...
Training until validation scores don't improve for 30 rounds
Did not meet early stopping. Best iteration is:
[150]	valid_0's multi_logloss: 0.00772959
INFO:non_major_league_ensemble:lightgbm - Val Acc: 1.0000, Val LogLoss: 0.0077
INFO:non_major_league_ensemble:Training random_forest...
INFO:non_major_league_ensemble:random_forest - Val Acc: 1.0000, Val LogLoss: 0.0463
INFO:non_major_league_ensemble:Training logistic_regression...
INFO:non_major_league_ensemble:logistic_regression - Val Acc: 1.0000, Val LogLoss: 0.0265
INFO:non_major_league_ensemble:Creating conservative ensemble
INFO:non_major_league_ensemble:Created ensemble with 4 models
INFO:non_major_league_ensemble:Model weights: {'xgboost': 0.4001754372983308, 'lightgbm': 0.3521543981896826, 'random_forest': 0.14800154084236178, 'logistic_regression': 0.09966862366962478}
INFO:non_major_league_ensemble:Training ensemble model
INFO:non_major_league_ensemble:Ensemble - Val Acc: 1.0000, Val LogLoss: 0.0196
INFO:non_major_league_ensemble:Calibrating model probabilities
INFO:non_major_league_ensemble:Calibrated xgboost
INFO:non_major_league_ensemble:Calibrated lightgbm
INFO:non_major_league_ensemble:Calibrated random_forest
INFO:non_major_league_ensemble:Calibrated logistic_regression
ERROR:non_major_league_ensemble:Error calibrating ensemble: The 'estimator' parameter of CalibratedClassifierCV must be an object implementing 'fit' and 'predict_proba', an object implementing 'fit' and 'decision_function' or None. Got <non_major_league_ensemble.NonMajorLeagueEnsemble.calibrate_models.<locals>.EnsembleWrapper object at 0x7fba69c1da90> instead.
INFO:non_major_league_ensemble:Cross-validating ensemble
INFO:non_major_league_ensemble:Cross-validation fold 1/3
INFO:non_major_league_ensemble:Training base models with conservative validation
INFO:non_major_league_ensemble:Training xgboost...
INFO:non_major_league_ensemble:xgboost - Val Acc: 1.0000, Val LogLoss: 0.0782
INFO:non_major_league_ensemble:Training lightgbm...
Training until validation scores don't improve for 30 rounds
Did not meet early stopping. Best iteration is:
[150]	valid_0's multi_logloss: 0.0205198
INFO:non_major_league_ensemble:lightgbm - Val Acc: 1.0000, Val LogLoss: 0.0205
INFO:non_major_league_ensemble:Training random_forest...
INFO:non_major_league_ensemble:random_forest - Val Acc: 1.0000, Val LogLoss: 0.2089
INFO:non_major_league_ensemble:Training logistic_regression...
INFO:non_major_league_ensemble:logistic_regression - Val Acc: 1.0000, Val LogLoss: 0.1272
INFO:non_major_league_ensemble:Creating conservative ensemble
INFO:non_major_league_ensemble:Created ensemble with 4 models
INFO:non_major_league_ensemble:Model weights: {'xgboost': 0.40089981922316914, 'lightgbm': 0.36131663505152317, 'random_forest': 0.14011306061104517, 'logistic_regression': 0.0976704851142626}
INFO:non_major_league_ensemble:Fold 1 - Acc: 1.0000, LogLoss: 0.0772
INFO:non_major_league_ensemble:Cross-validation fold 2/3
INFO:non_major_league_ensemble:Training base models with conservative validation
INFO:non_major_league_ensemble:Training xgboost...
INFO:non_major_league_ensemble:xgboost - Val Acc: 1.0000, Val LogLoss: 0.0383
INFO:non_major_league_ensemble:Training lightgbm...
Training until validation scores don't improve for 30 rounds
Did not meet early stopping. Best iteration is:
[150]	valid_0's multi_logloss: 0.0122501
INFO:non_major_league_ensemble:lightgbm - Val Acc: 1.0000, Val LogLoss: 0.0123
INFO:non_major_league_ensemble:Training random_forest...
INFO:non_major_league_ensemble:random_forest - Val Acc: 1.0000, Val LogLoss: 0.0896
INFO:non_major_league_ensemble:Training logistic_regression...
INFO:non_major_league_ensemble:logistic_regression - Val Acc: 1.0000, Val LogLoss: 0.0544
INFO:non_major_league_ensemble:Creating conservative ensemble
INFO:non_major_league_ensemble:Created ensemble with 4 models
INFO:non_major_league_ensemble:Model weights: {'xgboost': 0.4000386990961013, 'lightgbm': 0.35468407869256435, 'random_forest': 0.1460899493348922, 'logistic_regression': 0.09918727287644212}
INFO:non_major_league_ensemble:Fold 2 - Acc: 1.0000, LogLoss: 0.0375
INFO:non_major_league_ensemble:Cross-validation fold 3/3
INFO:non_major_league_ensemble:Training base models with conservative validation
INFO:non_major_league_ensemble:Training xgboost...
INFO:non_major_league_ensemble:xgboost - Val Acc: 1.0000, Val LogLoss: 0.0259
INFO:non_major_league_ensemble:Training lightgbm...
Training until validation scores don't improve for 30 rounds
Did not meet early stopping. Best iteration is:
[150]	valid_0's multi_logloss: 0.00925354
INFO:non_major_league_ensemble:lightgbm - Val Acc: 1.0000, Val LogLoss: 0.0093
INFO:non_major_league_ensemble:Training random_forest...
INFO:non_major_league_ensemble:random_forest - Val Acc: 1.0000, Val LogLoss: 0.0580
INFO:non_major_league_ensemble:Training logistic_regression...
INFO:non_major_league_ensemble:logistic_regression - Val Acc: 1.0000, Val LogLoss: 0.0359
INFO:non_major_league_ensemble:Creating conservative ensemble
INFO:non_major_league_ensemble:Created ensemble with 4 models
INFO:non_major_league_ensemble:Model weights: {'xgboost': 0.39999541800813954, 'lightgbm': 0.352952990231923, 'random_forest': 0.14756013968577755, 'logistic_regression': 0.09949145207415994}
INFO:non_major_league_ensemble:Fold 3 - Acc: 1.0000, LogLoss: 0.0255
INFO:non_major_league_ensemble:CV Summary - Mean Acc: 1.0000 ¬± 0.0000
INFO:non_major_league_ensemble:CV Summary - Mean LogLoss: 0.0467 ¬± 0.0221
INFO:non_major_league_ensemble:Evaluating ensemble performance
INFO:non_major_league_ensemble:Ensemble Evaluation - Acc: 1.0000, LogLoss: 0.0243
INFO:non_major_league_ensemble:Mean Confidence: 0.9760
INFO:non_major_league_ensemble:Making predictions with confidence filtering
INFO:non_major_league_ensemble:High confidence predictions: 154/154
INFO:non_major_league_ensemble:Calculating ensemble feature importance
INFO:non_major_league_ensemble:Estimating prediction uncertainty
INFO:non_major_league_ensemble:Uncertainty estimation complete
INFO:phase2_integration:Step 6: Model Validation
INFO:phase2_integration:Validating models
INFO:non_major_league_model_validation:Performing comprehensive model validation
INFO:non_major_league_model_validation:Performing time series cross-validation
INFO:non_major_league_model_validation:Time series CV fold 1/3
INFO:non_major_league_model_validation:Fold 1 - Val Acc: 1.0000, Overfitting: 0.0000
INFO:non_major_league_model_validation:Time series CV fold 2/3
INFO:non_major_league_model_validation:Fold 2 - Val Acc: 1.0000, Overfitting: 0.0000
INFO:non_major_league_model_validation:Time series CV fold 3/3
INFO:non_major_league_model_validation:Fold 3 - Val Acc: 1.0000, Overfitting: 0.0000
INFO:non_major_league_model_validation:Time series CV complete: 3 successful folds
INFO:non_major_league_model_validation:Performing walk-forward validation
INFO:non_major_league_model_validation:Walk-forward CV fold 1/3
INFO:non_major_league_model_validation:Fold 1 - Val Acc: 1.0000
INFO:non_major_league_model_validation:Walk-forward CV fold 2/3
INFO:non_major_league_model_validation:Fold 2 - Val Acc: 1.0000
INFO:non_major_league_model_validation:Walk-forward CV fold 3/3
INFO:non_major_league_model_validation:Fold 3 - Val Acc: 1.0000
INFO:non_major_league_model_validation:Walk-forward CV complete: 3 successful folds
INFO:non_major_league_model_validation:Performing bootstrap validation
INFO:non_major_league_model_validation:Bootstrap 1/50
INFO:non_major_league_model_validation:Bootstrap 2/50
INFO:non_major_league_model_validation:Bootstrap 3/50
INFO:non_major_league_model_validation:Bootstrap 4/50
INFO:non_major_league_model_validation:Bootstrap 5/50
INFO:non_major_league_model_validation:Bootstrap 6/50
INFO:non_major_league_model_validation:Bootstrap 7/50
INFO:non_major_league_model_validation:Bootstrap 8/50
INFO:non_major_league_model_validation:Bootstrap 9/50
INFO:non_major_league_model_validation:Bootstrap 10/50
INFO:non_major_league_model_validation:Bootstrap 11/50
INFO:non_major_league_model_validation:Bootstrap 12/50
INFO:non_major_league_model_validation:Bootstrap 13/50
INFO:non_major_league_model_validation:Bootstrap 14/50
INFO:non_major_league_model_validation:Bootstrap 15/50
INFO:non_major_league_model_validation:Bootstrap 16/50
INFO:non_major_league_model_validation:Bootstrap 17/50
INFO:non_major_league_model_validation:Bootstrap 18/50
INFO:non_major_league_model_validation:Bootstrap 19/50
INFO:non_major_league_model_validation:Bootstrap 20/50
INFO:non_major_league_model_validation:Bootstrap 21/50
INFO:non_major_league_model_validation:Bootstrap 22/50
INFO:non_major_league_model_validation:Bootstrap 23/50
INFO:non_major_league_model_validation:Bootstrap 24/50
INFO:non_major_league_model_validation:Bootstrap 25/50
INFO:non_major_league_model_validation:Bootstrap 26/50
INFO:non_major_league_model_validation:Bootstrap 27/50
INFO:non_major_league_model_validation:Bootstrap 28/50
INFO:non_major_league_model_validation:Bootstrap 29/50
INFO:non_major_league_model_validation:Bootstrap 30/50
INFO:non_major_league_model_validation:Bootstrap 31/50
INFO:non_major_league_model_validation:Bootstrap 32/50
INFO:non_major_league_model_validation:Bootstrap 33/50
INFO:non_major_league_model_validation:Bootstrap 34/50
INFO:non_major_league_model_validation:Bootstrap 35/50
INFO:non_major_league_model_validation:Bootstrap 36/50
INFO:non_major_league_model_validation:Bootstrap 37/50
INFO:non_major_league_model_validation:Bootstrap 38/50
INFO:non_major_league_model_validation:Bootstrap 39/50
INFO:non_major_league_model_validation:Bootstrap 40/50
INFO:non_major_league_model_validation:Bootstrap 41/50
INFO:non_major_league_model_validation:Bootstrap 42/50
INFO:non_major_league_model_validation:Bootstrap 43/50
INFO:non_major_league_model_validation:Bootstrap 44/50
INFO:non_major_league_model_validation:Bootstrap 45/50
INFO:non_major_league_model_validation:Bootstrap 46/50
INFO:non_major_league_model_validation:Bootstrap 47/50
INFO:non_major_league_model_validation:Bootstrap 48/50
INFO:non_major_league_model_validation:Bootstrap 49/50
INFO:non_major_league_model_validation:Bootstrap 50/50
INFO:non_major_league_model_validation:Bootstrap validation complete: 50 successful bootstraps
INFO:non_major_league_model_validation:Validating model calibration
INFO:non_major_league_model_validation:Model calibration validation complete
INFO:non_major_league_model_validation:Detecting overfitting
INFO:non_major_league_model_validation:Overfitting detection: NOT DETECTED
INFO:non_major_league_model_validation:Analyzing model stability
INFO:non_major_league_model_validation:Stability analysis: STABLE
INFO:non_major_league_model_validation:Comprehensive validation complete
INFO:phase2_integration:Step 7: Final Integration
INFO:phase2_integration:Integrating Phase 2 results
INFO:phase2_integration:Step 8: Saving Results
INFO:phase2_integration:Saving results for E1
INFO:non_major_league_model_architecture:Saving models to ./models/E1_model_architecture.pkl
INFO:non_major_league_model_architecture:Models saved successfully
INFO:non_major_league_ensemble:Saving ensemble to ./models/E1_ensemble.pkl
INFO:non_major_league_ensemble:Ensemble saved successfully
INFO:non_major_league_hyperparameter_tuning:Saving hyperparameter tuning results to ./models/E1_hyperparameter_tuning.pkl
INFO:non_major_league_hyperparameter_tuning:Hyperparameter tuning results saved successfully
INFO:non_major_league_model_validation:Saving validation results to ./models/E1_validation_results.pkl
INFO:non_major_league_model_validation:Validation results saved successfully
INFO:phase2_integration:Phase 2 results saved successfully
INFO:phase2_integration:Phase 2 pipeline completed successfully
INFO:master_pipeline:Phase 2 completed successfully in 2632.24 seconds
INFO:__main__:‚úÖ Phase 2 completed
INFO:__main__:
üìà STEP 5: Phase 3 - Backtesting
INFO:master_pipeline:================================================================================
INFO:master_pipeline:STARTING PHASE 3: BACKTESTING & STRATEGY VALIDATION
INFO:master_pipeline:================================================================================
INFO:phase3_integration:Output directory: ./results
INFO:phase3_integration:Starting Phase 3 pipeline for E1
INFO:phase3_integration:Step 1: Loading and preparing data
INFO:phase3_integration:Loading data from ./data/E1_features.csv
INFO:phase3_integration:Loaded 767 records with 259 features
INFO:phase3_integration:Step 2: Comprehensive Backtesting
INFO:phase3_integration:Running comprehensive backtesting
INFO:non_major_league_backtesting:Running walk-forward backtesting
INFO:non_major_league_backtesting:Preparing backtest data
INFO:non_major_league_backtesting:Prepared 767 records for backtesting
INFO:non_major_league_backtesting:Bet 1: loss, Profit: -1.00, Capital: 999.00
INFO:non_major_league_backtesting:Bet 2: loss, Profit: -1.00, Capital: 998.00
INFO:non_major_league_backtesting:Bet 3: win, Profit: 1.57, Capital: 999.57
INFO:non_major_league_backtesting:Bet 4: win, Profit: 3.29, Capital: 1002.86
INFO:non_major_league_backtesting:Bet 5: loss, Profit: -1.00, Capital: 1001.86
INFO:non_major_league_backtesting:Bet 6: win, Profit: 2.98, Capital: 1004.84
INFO:non_major_league_backtesting:Bet 7: loss, Profit: -1.00, Capital: 1003.84
INFO:non_major_league_backtesting:Bet 8: loss, Profit: -1.00, Capital: 1002.84
INFO:non_major_league_backtesting:Bet 9: loss, Profit: -1.00, Capital: 1001.84
INFO:non_major_league_backtesting:Bet 10: win, Profit: 1.91, Capital: 1003.75
INFO:non_major_league_backtesting:Bet 11: loss, Profit: -1.00, Capital: 1002.75
INFO:non_major_league_backtesting:Bet 12: loss, Profit: -1.00, Capital: 1001.75
INFO:non_major_league_backtesting:Bet 13: loss, Profit: -1.00, Capital: 1000.75
INFO:non_major_league_backtesting:Bet 14: loss, Profit: -1.00, Capital: 999.75
INFO:non_major_league_backtesting:Bet 15: loss, Profit: -1.00, Capital: 998.75
INFO:non_major_league_backtesting:Bet 16: loss, Profit: -1.00, Capital: 997.75
INFO:non_major_league_backtesting:Bet 17: loss, Profit: -1.00, Capital: 996.75
INFO:non_major_league_backtesting:Bet 18: loss, Profit: -1.00, Capital: 995.75
INFO:non_major_league_backtesting:Bet 19: loss, Profit: -1.00, Capital: 994.75
INFO:non_major_league_backtesting:Bet 20: win, Profit: 1.90, Capital: 996.64
INFO:non_major_league_backtesting:Bet 21: win, Profit: 0.95, Capital: 997.59
INFO:non_major_league_backtesting:Bet 22: loss, Profit: -1.00, Capital: 996.59
INFO:non_major_league_backtesting:Bet 23: loss, Profit: -1.00, Capital: 995.59
INFO:non_major_league_backtesting:Bet 24: loss, Profit: -1.00, Capital: 994.59
INFO:non_major_league_backtesting:Bet 25: loss, Profit: -1.00, Capital: 993.59
INFO:non_major_league_backtesting:Bet 26: loss, Profit: -1.00, Capital: 992.59
INFO:non_major_league_backtesting:Bet 27: loss, Profit: -1.00, Capital: 991.59
INFO:non_major_league_backtesting:Bet 28: win, Profit: 3.57, Capital: 995.16
INFO:non_major_league_backtesting:Bet 29: win, Profit: 2.67, Capital: 997.83
INFO:non_major_league_backtesting:Bet 30: loss, Profit: -1.00, Capital: 996.83
INFO:non_major_league_backtesting:Bet 31: loss, Profit: -1.00, Capital: 995.83
INFO:non_major_league_backtesting:Bet 32: loss, Profit: -1.00, Capital: 994.83
INFO:non_major_league_backtesting:Bet 33: loss, Profit: -1.00, Capital: 993.83
INFO:non_major_league_backtesting:Bet 34: loss, Profit: -1.00, Capital: 992.83
INFO:non_major_league_backtesting:Bet 35: loss, Profit: -1.00, Capital: 991.83
INFO:non_major_league_backtesting:Bet 36: loss, Profit: -1.00, Capital: 990.83
INFO:non_major_league_backtesting:Bet 37: loss, Profit: -1.00, Capital: 989.83
INFO:non_major_league_backtesting:Bet 38: win, Profit: 3.92, Capital: 993.75
INFO:non_major_league_backtesting:Bet 39: loss, Profit: -1.00, Capital: 992.75
INFO:non_major_league_backtesting:Bet 40: win, Profit: 1.89, Capital: 994.65
INFO:non_major_league_backtesting:Bet 41: loss, Profit: -1.00, Capital: 993.65
INFO:non_major_league_backtesting:Bet 42: loss, Profit: -1.00, Capital: 992.65
INFO:non_major_league_backtesting:Bet 43: loss, Profit: -1.00, Capital: 991.65
INFO:non_major_league_backtesting:Bet 44: loss, Profit: -1.00, Capital: 990.65
INFO:non_major_league_backtesting:Bet 45: loss, Profit: -1.00, Capital: 989.65
INFO:non_major_league_backtesting:Bet 46: win, Profit: 1.58, Capital: 991.22
INFO:non_major_league_backtesting:Bet 47: win, Profit: 1.87, Capital: 993.10
INFO:non_major_league_backtesting:Bet 48: loss, Profit: -1.00, Capital: 992.10
INFO:non_major_league_backtesting:Bet 49: loss, Profit: -1.00, Capital: 991.10
INFO:non_major_league_backtesting:Bet 50: loss, Profit: -1.00, Capital: 990.10
INFO:non_major_league_backtesting:Bet 51: loss, Profit: -1.00, Capital: 989.10
INFO:non_major_league_backtesting:Bet 52: win, Profit: 1.19, Capital: 990.29
INFO:non_major_league_backtesting:Bet 53: win, Profit: 2.32, Capital: 992.61
INFO:non_major_league_backtesting:Bet 54: win, Profit: 1.45, Capital: 994.05
INFO:non_major_league_backtesting:Bet 55: loss, Profit: -1.00, Capital: 993.05
INFO:non_major_league_backtesting:Bet 56: loss, Profit: -1.00, Capital: 992.05
INFO:non_major_league_backtesting:Bet 57: win, Profit: 1.20, Capital: 993.25
INFO:non_major_league_backtesting:Bet 58: loss, Profit: -1.00, Capital: 992.25
INFO:non_major_league_backtesting:Bet 59: loss, Profit: -1.00, Capital: 991.25
INFO:non_major_league_backtesting:Bet 60: win, Profit: 1.54, Capital: 992.79
INFO:non_major_league_backtesting:Bet 61: loss, Profit: -1.00, Capital: 991.79
INFO:non_major_league_backtesting:Bet 62: win, Profit: 0.59, Capital: 992.37
INFO:non_major_league_backtesting:Bet 63: loss, Profit: -1.00, Capital: 991.37
INFO:non_major_league_backtesting:Bet 64: win, Profit: 2.53, Capital: 993.91
INFO:non_major_league_backtesting:Bet 65: loss, Profit: -1.00, Capital: 992.91
INFO:non_major_league_backtesting:Bet 66: loss, Profit: -1.00, Capital: 991.91
INFO:non_major_league_backtesting:Bet 67: loss, Profit: -1.00, Capital: 990.91
INFO:non_major_league_backtesting:Bet 68: loss, Profit: -1.00, Capital: 989.91
INFO:non_major_league_backtesting:Bet 69: loss, Profit: -1.00, Capital: 988.91
INFO:non_major_league_backtesting:Bet 70: loss, Profit: -1.00, Capital: 987.91
INFO:non_major_league_backtesting:Bet 71: loss, Profit: -1.00, Capital: 986.91
INFO:non_major_league_backtesting:Bet 72: win, Profit: 2.19, Capital: 989.09
INFO:non_major_league_backtesting:Bet 73: loss, Profit: -1.00, Capital: 988.09
INFO:non_major_league_backtesting:Bet 74: win, Profit: 1.65, Capital: 989.74
INFO:non_major_league_backtesting:Bet 75: loss, Profit: -1.00, Capital: 988.74
INFO:non_major_league_backtesting:Bet 76: loss, Profit: -1.00, Capital: 987.74
INFO:non_major_league_backtesting:Bet 77: loss, Profit: -1.00, Capital: 986.74
INFO:non_major_league_backtesting:Bet 78: win, Profit: 1.48, Capital: 988.23
INFO:non_major_league_backtesting:Bet 79: loss, Profit: -1.00, Capital: 987.23
INFO:non_major_league_backtesting:Bet 80: win, Profit: 2.75, Capital: 989.98
INFO:non_major_league_backtesting:Bet 81: loss, Profit: -1.00, Capital: 988.98
INFO:non_major_league_backtesting:Bet 82: loss, Profit: -1.00, Capital: 987.98
INFO:non_major_league_backtesting:Bet 83: loss, Profit: -1.00, Capital: 986.98
INFO:non_major_league_backtesting:Bet 84: loss, Profit: -1.00, Capital: 985.98
INFO:non_major_league_backtesting:Bet 85: loss, Profit: -1.00, Capital: 984.98
INFO:non_major_league_backtesting:Bet 86: loss, Profit: -1.00, Capital: 983.98
INFO:non_major_league_backtesting:Bet 87: win, Profit: 3.08, Capital: 987.06
INFO:non_major_league_backtesting:Bet 88: loss, Profit: -1.00, Capital: 986.06
INFO:non_major_league_backtesting:Bet 89: loss, Profit: -1.00, Capital: 985.06
INFO:non_major_league_backtesting:Bet 90: win, Profit: 2.96, Capital: 988.02
INFO:non_major_league_backtesting:Bet 91: loss, Profit: -1.00, Capital: 987.02
INFO:non_major_league_backtesting:Bet 92: win, Profit: 2.92, Capital: 989.94
INFO:non_major_league_backtesting:Bet 93: loss, Profit: -1.00, Capital: 988.94
INFO:non_major_lea