[I 2025-10-16 04:19:21,050] Trial 5 finished with value: 0.030893423645164213 and parameters: {'n_estimators': 101, 'max_depth': 5, 'learning_rate': 0.06120257645336779, 'subsample': 0.7470136050869909, 'colsample_bytree': 0.8114964012793562, 'min_child_weight': 5, 'reg_alpha': 0.8963331549934491, 'reg_lambda': 0.7780268439893527}. Best is trial 1 with value: 0.011869290767484114.
[I 2025-10-16 04:20:41,039] Trial 6 finished with value: 0.0570369220639573 and parameters: {'n_estimators': 199, 'max_depth': 4, 'learning_rate': 0.07311040455102422, 'subsample': 0.6364166920869784, 'colsample_bytree': 0.9239921200938717, 'min_child_weight': 8, 'reg_alpha': 0.7741661626930646, 'reg_lambda': 1.7839006862813815}. Best is trial 1 with value: 0.011869290767484114.
[I 2025-10-16 04:21:55,933] Trial 7 finished with value: 0.015484754203877418 and parameters: {'n_estimators': 147, 'max_depth': 6, 'learning_rate': 0.07718066396731768, 'subsample': 0.8623138543844354, 'colsample_bytree': 0.8509971936786487, 'min_child_weight': 3, 'reg_alpha': 0.14394710611175532, 'reg_lambda': 0.7784467831330488}. Best is trial 1 with value: 0.011869290767484114.
[I 2025-10-16 04:23:01,980] Trial 8 finished with value: 0.030375805789076737 and parameters: {'n_estimators': 134, 'max_depth': 8, 'learning_rate': 0.09616344861618699, 'subsample': 0.7635739298573474, 'colsample_bytree': 0.6260047303648557, 'min_child_weight': 5, 'reg_alpha': 0.7285552030328791, 'reg_lambda': 1.2702493709322877}. Best is trial 1 with value: 0.011869290767484114.
[I 2025-10-16 04:25:10,634] Trial 9 finished with value: 0.11857801664307056 and parameters: {'n_estimators': 187, 'max_depth': 4, 'learning_rate': 0.011382665959029304, 'subsample': 0.688472548742933, 'colsample_bytree': 0.6062469549128747, 'min_child_weight': 4, 'reg_alpha': 0.6220478003590704, 'reg_lambda': 0.8356503282877987}. Best is trial 1 with value: 0.011869290767484114.
[I 2025-10-16 04:25:50,249] Trial 10 finished with value: 0.10789501440276554 and parameters: {'n_estimators': 56, 'max_depth': 7, 'learning_rate': 0.03798831489827631, 'subsample': 0.6001199665492237, 'colsample_bytree': 0.9729638484575113, 'min_child_weight': 1, 'reg_alpha': 0.31620129556279464, 'reg_lambda': 0.19009901972734877}. Best is trial 1 with value: 0.011869290767484114.
[I 2025-10-16 04:26:29,078] Trial 11 finished with value: 0.005273387294557217 and parameters: {'n_estimators': 81, 'max_depth': 6, 'learning_rate': 0.0995949014906953, 'subsample': 0.8616252194472536, 'colsample_bytree': 0.8269060908766852, 'min_child_weight': 1, 'reg_alpha': 0.002488334011142679, 'reg_lambda': 1.2980968708671097}. Best is trial 11 with value: 0.005273387294557217.
[I 2025-10-16 04:27:12,130] Trial 12 finished with value: 0.005362017370982976 and parameters: {'n_estimators': 81, 'max_depth': 7, 'learning_rate': 0.0994784941424601, 'subsample': 0.8480388913777857, 'colsample_bytree': 0.7375850101042217, 'min_child_weight': 1, 'reg_alpha': 0.002304330999552866, 'reg_lambda': 1.3191900313381228}. Best is trial 11 with value: 0.005273387294557217.
[I 2025-10-16 04:27:49,864] Trial 13 finished with value: 0.056778019026768704 and parameters: {'n_estimators': 92, 'max_depth': 7, 'learning_rate': 0.09054587658527194, 'subsample': 0.8607175681542497, 'colsample_bytree': 0.7285746419581253, 'min_child_weight': 10, 'reg_alpha': 0.3419864298838884, 'reg_lambda': 1.3608399121427222}. Best is trial 11 with value: 0.005273387294557217.
[I 2025-10-16 04:28:52,518] Trial 14 finished with value: 0.00681149220673979 and parameters: {'n_estimators': 103, 'max_depth': 6, 'learning_rate': 0.05607929908610919, 'subsample': 0.9948931909614832, 'colsample_bytree': 0.7115345773012454, 'min_child_weight': 1, 'reg_alpha': 0.010837958093574174, 'reg_lambda': 1.3328835644443777}. Best is trial 11 with value: 0.005273387294557217.
[I 2025-10-16 04:29:26,662] Trial 15 finished with value: 0.10820838361380257 and parameters: {'n_estimators': 50, 'max_depth': 5, 'learning_rate': 0.043612526431186814, 'subsample': 0.9162755403041772, 'colsample_bytree': 0.7099417484601986, 'min_child_weight': 1, 'reg_alpha': 0.27919093628524544, 'reg_lambda': 1.5712922376241882}. Best is trial 11 with value: 0.005273387294557217.
[I 2025-10-16 04:30:01,787] Trial 16 finished with value: 0.016489359894561448 and parameters: {'n_estimators': 79, 'max_depth': 3, 'learning_rate': 0.08707615553962343, 'subsample': 0.8293457783713646, 'colsample_bytree': 0.803027004187543, 'min_child_weight': 3, 'reg_alpha': 0.17761882818975838, 'reg_lambda': 1.111670616791524}. Best is trial 11 with value: 0.005273387294557217.
[I 2025-10-16 04:31:15,825] Trial 17 finished with value: 0.01104828278163931 and parameters: {'n_estimators': 115, 'max_depth': 7, 'learning_rate': 0.07043872649434449, 'subsample': 0.8273479237129414, 'colsample_bytree': 0.7546295792898335, 'min_child_weight': 2, 'reg_alpha': 0.45661201103384497, 'reg_lambda': 1.5759151068511228}. Best is trial 11 with value: 0.005273387294557217.
[I 2025-10-16 04:32:09,237] Trial 18 finished with value: 0.013915523789917826 and parameters: {'n_estimators': 76, 'max_depth': 8, 'learning_rate': 0.0654553654561376, 'subsample': 0.9261965350919769, 'colsample_bytree': 0.6725443892640273, 'min_child_weight': 2, 'reg_alpha': 0.42687814165540633, 'reg_lambda': 1.0818691198802461}. Best is trial 11 with value: 0.005273387294557217.
[I 2025-10-16 04:32:48,939] Trial 19 finished with value: 0.0613366178431708 and parameters: {'n_estimators': 64, 'max_depth': 6, 'learning_rate': 0.043978614574503326, 'subsample': 0.8081962473673073, 'colsample_bytree': 0.8440516726848825, 'min_child_weight': 4, 'reg_alpha': 0.08293466364195491, 'reg_lambda': 1.6848462510810684}. Best is trial 11 with value: 0.005273387294557217.
[I 2025-10-16 04:33:38,571] Trial 20 finished with value: 0.05523893192203303 and parameters: {'n_estimators': 94, 'max_depth': 5, 'learning_rate': 0.09971697674912096, 'subsample': 0.8698587576240452, 'colsample_bytree': 0.8487019351429257, 'min_child_weight': 10, 'reg_alpha': 0.22198409209165948, 'reg_lambda': 1.960754941503391}. Best is trial 11 with value: 0.005273387294557217.
[I 2025-10-16 04:34:57,746] Trial 21 finished with value: 0.005906088521451581 and parameters: {'n_estimators': 113, 'max_depth': 6, 'learning_rate': 0.05435533301281592, 'subsample': 0.9990636975053301, 'colsample_bytree': 0.6860422881234024, 'min_child_weight': 1, 'reg_alpha': 0.020394014893660113, 'reg_lambda': 1.3500516742525377}. Best is trial 11 with value: 0.005273387294557217.
[I 2025-10-16 04:36:19,866] Trial 22 finished with value: 0.028858870488227346 and parameters: {'n_estimators': 115, 'max_depth': 7, 'learning_rate': 0.03186383535836686, 'subsample': 0.9980021530681942, 'colsample_bytree': 0.6723862668742767, 'min_child_weight': 1, 'reg_alpha': 0.05605524647759269, 'reg_lambda': 1.4855122679306558}. Best is trial 11 with value: 0.005273387294557217.
[I 2025-10-16 04:37:29,757] Trial 23 finished with value: 0.010536777577803696 and parameters: {'n_estimators': 114, 'max_depth': 6, 'learning_rate': 0.04877735822256051, 'subsample': 0.9521386927810689, 'colsample_bytree': 0.6751111713958583, 'min_child_weight': 2, 'reg_alpha': 0.21976968964938004, 'reg_lambda': 1.150728689240287}. Best is trial 11 with value: 0.005273387294557217.
[I 2025-10-16 04:38:27,141] Trial 24 finished with value: 0.0052697575835118455 and parameters: {'n_estimators': 84, 'max_depth': 5, 'learning_rate': 0.08711757132013863, 'subsample': 0.8928432538933548, 'colsample_bytree': 0.7554143050388417, 'min_child_weight': 1, 'reg_alpha': 0.0930671327265733, 'reg_lambda': 1.4304459770974103}. Best is trial 24 with value: 0.0052697575835118455.
[I 2025-10-16 04:39:08,755] Trial 25 finished with value: 0.02057520051067625 and parameters: {'n_estimators': 86, 'max_depth': 5, 'learning_rate': 0.08828724421110717, 'subsample': 0.9084826683681615, 'colsample_bytree': 0.7712615566746828, 'min_child_weight': 4, 'reg_alpha': 0.09555117206405946, 'reg_lambda': 0.9675952938791867}. Best is trial 24 with value: 0.0052697575835118455.
[I 2025-10-16 04:39:47,866] Trial 26 finished with value: 0.011336169518945003 and parameters: {'n_estimators': 66, 'max_depth': 3, 'learning_rate': 0.09218415174574073, 'subsample': 0.840625247653681, 'colsample_bytree': 0.8183088329611227, 'min_child_weight': 2, 'reg_alpha': 0.3956277293524988, 'reg_lambda': 1.4868380336989788}. Best is trial 24 with value: 0.0052697575835118455.
[I 2025-10-16 04:40:30,091] Trial 27 finished with value: 0.017498811849152536 and parameters: {'n_estimators': 66, 'max_depth': 5, 'learning_rate': 0.0800590074987945, 'subsample': 0.791265698228929, 'colsample_bytree': 0.7466744700715175, 'min_child_weight': 3, 'reg_alpha': 0.242172588136999, 'reg_lambda': 1.1968924926766946}. Best is trial 24 with value: 0.0052697575835118455.
[I 2025-10-16 04:41:26,235] Trial 28 finished with value: 0.005269756674577339 and parameters: {'n_estimators': 84, 'max_depth': 7, 'learning_rate': 0.08441505692293354, 'subsample': 0.8906075704966405, 'colsample_bytree': 0.8705883372895993, 'min_child_weight': 1, 'reg_alpha': 0.16530665855070928, 'reg_lambda': 1.011113204855314}. Best is trial 28 with value: 0.005269756674577339.
INFO:non_major_league_hyperparameter_tuning:xgboost optimization complete
INFO:non_major_league_hyperparameter_tuning:Best score: 0.0053
INFO:non_major_league_hyperparameter_tuning:Best params: {'n_estimators': 84, 'max_depth': 7, 'learning_rate': 0.08441505692293354, 'subsample': 0.8906075704966405, 'colsample_bytree': 0.8705883372895993, 'min_child_weight': 1, 'reg_alpha': 0.16530665855070928, 'reg_lambda': 1.011113204855314}
INFO:non_major_league_hyperparameter_tuning:Optimizing lightgbm (priority: 2)
INFO:non_major_league_hyperparameter_tuning:Optimizing hyperparameters for lightgbm
[I 2025-10-16 04:41:26,243] A new study created in memory with name: no-name-26b0b3eb-23a0-444d-9a0d-20d4da37c782
[I 2025-10-16 04:42:21,446] Trial 0 finished with value: 0.007809420380043058 and parameters: {'n_estimators': 179, 'max_depth': 5, 'learning_rate': 0.08234766349142886, 'num_leaves': 26, 'feature_fraction': 0.9574055909621785, 'bagging_fraction': 0.8085092838907679, 'bagging_freq': 7, 'lambda_l1': 0.6869219667911798, 'lambda_l2': 0.8840034517824233, 'min_data_in_leaf': 21}. Best is trial 0 with value: 0.007809420380043058.
[I 2025-10-16 04:42:58,370] Trial 1 finished with value: 0.019495698128494606 and parameters: {'n_estimators': 91, 'max_depth': 7, 'learning_rate': 0.035864492560913785, 'num_leaves': 47, 'feature_fraction': 0.8870128977225271, 'bagging_fraction': 0.9657410348849602, 'bagging_freq': 8, 'lambda_l1': 0.580964343801047, 'lambda_l2': 0.6544704020140544, 'min_data_in_leaf': 15}. Best is trial 0 with value: 0.007809420380043058.
[I 2025-10-16 04:43:45,834] Trial 2 finished with value: 0.007110881485516776 and parameters: {'n_estimators': 150, 'max_depth': 7, 'learning_rate': 0.037501494416731625, 'num_leaves': 70, 'feature_fraction': 0.6571085986396089, 'bagging_fraction': 0.7985142228380948, 'bagging_freq': 4, 'lambda_l1': 0.22882650985096453, 'lambda_l2': 1.4934060924962627, 'min_data_in_leaf': 28}. Best is trial 2 with value: 0.007110881485516776.
[I 2025-10-16 04:45:22,891] Trial 3 finished with value: 0.0008347850075579121 and parameters: {'n_estimators': 200, 'max_depth': 6, 'learning_rate': 0.07427108331687533, 'num_leaves': 64, 'feature_fraction': 0.8817471117280931, 'bagging_fraction': 0.9074855034253767, 'bagging_freq': 8, 'lambda_l1': 0.04322934157990732, 'lambda_l2': 1.0167218036753425, 'min_data_in_leaf': 7}. Best is trial 3 with value: 0.0008347850075579121.
[I 2025-10-16 04:46:43,714] Trial 4 finished with value: 0.0007817027026609456 and parameters: {'n_estimators': 130, 'max_depth': 8, 'learning_rate': 0.0799214094818689, 'num_leaves': 41, 'feature_fraction': 0.8333621150515709, 'bagging_fraction': 0.9302634363825183, 'bagging_freq': 1, 'lambda_l1': 0.07049464919292203, 'lambda_l2': 0.18136906613249248, 'min_data_in_leaf': 14}. Best is trial 4 with value: 0.0007817027026609456.
[I 2025-10-16 04:47:58,433] Trial 5 finished with value: 0.006911330234068535 and parameters: {'n_estimators': 133, 'max_depth': 3, 'learning_rate': 0.0944530250729392, 'num_leaves': 89, 'feature_fraction': 0.7789147925745111, 'bagging_fraction': 0.756725585136357, 'bagging_freq': 9, 'lambda_l1': 0.518491052866478, 'lambda_l2': 1.5305667092784614, 'min_data_in_leaf': 11}. Best is trial 4 with value: 0.0007817027026609456.
[I 2025-10-16 04:49:08,987] Trial 6 finished with value: 0.010690655052837679 and parameters: {'n_estimators': 106, 'max_depth': 8, 'learning_rate': 0.05917494206406488, 'num_leaves': 40, 'feature_fraction': 0.6126946884251745, 'bagging_fraction': 0.874892921530364, 'bagging_freq': 9, 'lambda_l1': 0.8067892177040247, 'lambda_l2': 1.2274349003630434, 'min_data_in_leaf': 20}. Best is trial 4 with value: 0.0007817027026609456.
[I 2025-10-16 04:50:08,834] Trial 7 finished with value: 0.012493397248408181 and parameters: {'n_estimators': 142, 'max_depth': 6, 'learning_rate': 0.06670763839581233, 'num_leaves': 12, 'feature_fraction': 0.718968764746248, 'bagging_fraction': 0.6657060961742183, 'bagging_freq': 9, 'lambda_l1': 0.8006142311095491, 'lambda_l2': 1.7914480486995028, 'min_data_in_leaf': 23}. Best is trial 4 with value: 0.0007817027026609456.
[I 2025-10-16 04:51:37,771] Trial 8 finished with value: 0.0054688532373438625 and parameters: {'n_estimators': 196, 'max_depth': 7, 'learning_rate': 0.06781476251988446, 'num_leaves': 24, 'feature_fraction': 0.7479722632324126, 'bagging_fraction': 0.7059079371181735, 'bagging_freq': 6, 'lambda_l1': 0.37755220886584306, 'lambda_l2': 1.7034348487446391, 'min_data_in_leaf': 17}. Best is trial 4 with value: 0.0007817027026609456.
[I 2025-10-16 04:52:22,425] Trial 9 finished with value: 0.031154167000201016 and parameters: {'n_estimators': 78, 'max_depth': 3, 'learning_rate': 0.04220643261969435, 'num_leaves': 32, 'feature_fraction': 0.7298105754561427, 'bagging_fraction': 0.6702615488651152, 'bagging_freq': 6, 'lambda_l1': 0.6915849810468545, 'lambda_l2': 1.7645418744364922, 'min_data_in_leaf': 18}. Best is trial 4 with value: 0.0007817027026609456.
[I 2025-10-16 04:52:53,035] Trial 10 finished with value: 0.42377475222292027 and parameters: {'n_estimators': 56, 'max_depth': 8, 'learning_rate': 0.010332165495507667, 'num_leaves': 91, 'feature_fraction': 0.8510706572843401, 'bagging_fraction': 0.9892889977565744, 'bagging_freq': 1, 'lambda_l1': 0.014185481723163168, 'lambda_l2': 0.0018610385907048, 'min_data_in_leaf': 40}. Best is trial 4 with value: 0.0007817027026609456.
[I 2025-10-16 04:54:22,329] Trial 11 finished with value: 0.00027002920971125956 and parameters: {'n_estimators': 168, 'max_depth': 5, 'learning_rate': 0.0858008935544337, 'num_leaves': 64, 'feature_fraction': 0.8754298329697978, 'bagging_fraction': 0.9074760851469835, 'bagging_freq': 1, 'lambda_l1': 0.003332707790443701, 'lambda_l2': 0.4074229926557874, 'min_data_in_leaf': 5}. Best is trial 11 with value: 0.00027002920971125956.
[I 2025-10-16 04:55:17,833] Trial 12 finished with value: 0.0023133176060039897 and parameters: {'n_estimators': 164, 'max_depth': 5, 'learning_rate': 0.09873902007458069, 'num_leaves': 58, 'feature_fraction': 0.9798013664995427, 'bagging_fraction': 0.8898243941662448, 'bagging_freq': 1, 'lambda_l1': 0.22434353433127485, 'lambda_l2': 0.18541392150482505, 'min_data_in_leaf': 5}. Best is trial 11 with value: 0.00027002920971125956.
[I 2025-10-16 04:56:32,453] Trial 13 finished with value: 0.0017989673226061062 and parameters: {'n_estimators': 126, 'max_depth': 4, 'learning_rate': 0.08839763394714525, 'num_leaves': 74, 'feature_fraction': 0.8287636088172764, 'bagging_fraction': 0.9345453649975783, 'bagging_freq': 3, 'lambda_l1': 0.17106701295576282, 'lambda_l2': 0.3974029130513367, 'min_data_in_leaf': 32}. Best is trial 11 with value: 0.00027002920971125956.
[I 2025-10-16 04:57:54,070] Trial 14 finished with value: 0.010823988513774169 and parameters: {'n_estimators': 166, 'max_depth': 4, 'learning_rate': 0.0803338903686848, 'num_leaves': 50, 'feature_fraction': 0.9239817132744168, 'bagging_fraction': 0.8295182138928962, 'bagging_freq': 3, 'lambda_l1': 0.9841145302130907, 'lambda_l2': 0.45973581245336503, 'min_data_in_leaf': 49}. Best is trial 11 with value: 0.00027002920971125956.
[I 2025-10-16 04:58:50,204] Trial 15 finished with value: 0.004975967518145272 and parameters: {'n_estimators': 108, 'max_depth': 5, 'learning_rate': 0.05292112775947079, 'num_leaves': 81, 'feature_fraction': 0.8106277302512371, 'bagging_fraction': 0.8557799964900827, 'bagging_freq': 2, 'lambda_l1': 0.3631186078839496, 'lambda_l2': 0.2590984731899889, 'min_data_in_leaf': 11}. Best is trial 11 with value: 0.00027002920971125956.
[I 2025-10-16 05:00:16,954] Trial 16 finished with value: 0.0013600670978336957 and parameters: {'n_estimators': 154, 'max_depth': 4, 'learning_rate': 0.08540939102282998, 'num_leaves': 39, 'feature_fraction': 0.9111376666196221, 'bagging_fraction': 0.9394586510229727, 'bagging_freq': 4, 'lambda_l1': 0.11927810029586378, 'lambda_l2': 0.7348474650566882, 'min_data_in_leaf': 11}. Best is trial 11 with value: 0.00027002920971125956.
[I 2025-10-16 05:01:20,754] Trial 17 finished with value: 0.0031298231676180122 and parameters: {'n_estimators': 178, 'max_depth': 6, 'learning_rate': 0.07485637725577568, 'num_leaves': 100, 'feature_fraction': 0.8545986931524824, 'bagging_fraction': 0.9994491440957416, 'bagging_freq': 1, 'lambda_l1': 0.3339053192330017, 'lambda_l2': 0.005312789051807265, 'min_data_in_leaf': 34}. Best is trial 11 with value: 0.00027002920971125956.
[I 2025-10-16 05:02:07,217] Trial 18 finished with value: 0.0024505424072783044 and parameters: {'n_estimators': 117, 'max_depth': 8, 'learning_rate': 0.0535117954169858, 'num_leaves': 58, 'feature_fraction': 0.9457279165610455, 'bagging_fraction': 0.6079216816828402, 'bagging_freq': 4, 'lambda_l1': 0.010670620467958171, 'lambda_l2': 0.5705173957123106, 'min_data_in_leaf': 8}. Best is trial 11 with value: 0.00027002920971125956.
[I 2025-10-16 05:03:18,226] Trial 19 finished with value: 0.0013022413250224924 and parameters: {'n_estimators': 138, 'max_depth': 7, 'learning_rate': 0.0922436726006427, 'num_leaves': 10, 'feature_fraction': 0.7875682615946137, 'bagging_fraction': 0.9235211122495217, 'bagging_freq': 2, 'lambda_l1': 0.12323413124733902, 'lambda_l2': 0.3072637369563641, 'min_data_in_leaf': 25}. Best is trial 11 with value: 0.00027002920971125956.
[I 2025-10-16 05:04:50,566] Trial 20 finished with value: 0.019134471466511958 and parameters: {'n_estimators': 171, 'max_depth': 6, 'learning_rate': 0.02007814653203866, 'num_leaves': 44, 'feature_fraction': 0.6895326156409218, 'bagging_fraction': 0.7667148172723841, 'bagging_freq': 2, 'lambda_l1': 0.3047468810988001, 'lambda_l2': 1.0727070423469345, 'min_data_in_leaf': 14}. Best is trial 11 with value: 0.00027002920971125956.
[I 2025-10-16 05:06:08,341] Trial 21 finished with value: 0.001058173789216369 and parameters: {'n_estimators': 197, 'max_depth': 6, 'learning_rate': 0.074646615971502, 'num_leaves': 66, 'feature_fraction': 0.8816598543753198, 'bagging_fraction': 0.901521969919141, 'bagging_freq': 10, 'lambda_l1': 0.06226908043186716, 'lambda_l2': 1.1606160668661487, 'min_data_in_leaf': 6}. Best is trial 11 with value: 0.00027002920971125956.
[I 2025-10-16 05:07:43,572] Trial 22 finished with value: 0.0011673295782317946 and parameters: {'n_estimators': 191, 'max_depth': 5, 'learning_rate': 0.06930278553628157, 'num_leaves': 63, 'feature_fraction': 0.8755052914879681, 'bagging_fraction': 0.9569832956873671, 'bagging_freq': 5, 'lambda_l1': 0.09752491437463734, 'lambda_l2': 0.7939476330930705, 'min_data_in_leaf': 5}. Best is trial 11 with value: 0.00027002920971125956.
[I 2025-10-16 05:09:14,661] Trial 23 finished with value: 0.002428584357589555 and parameters: {'n_estimators': 182, 'max_depth': 4, 'learning_rate': 0.0773098205910937, 'num_leaves': 78, 'feature_fraction': 0.998703386669172, 'bagging_fraction': 0.8423261160197849, 'bagging_freq': 7, 'lambda_l1': 0.20994351028346064, 'lambda_l2': 0.8872530053596017, 'min_data_in_leaf': 10}. Best is trial 11 with value: 0.00027002920971125956.
[I 2025-10-16 05:10:42,160] Trial 24 finished with value: 0.0016169411062724954 and parameters: {'n_estimators': 157, 'max_depth': 7, 'learning_rate': 0.059492486511836085, 'num_leaves': 51, 'feature_fraction': 0.8274245269607491, 'bagging_fraction': 0.8923682862461052, 'bagging_freq': 3, 'lambda_l1': 0.011416896720445206, 'lambda_l2': 1.3487480455654857, 'min_data_in_leaf': 14}. Best is trial 11 with value: 0.00027002920971125956.
[I 2025-10-16 05:11:57,766] Trial 25 finished with value: 0.002841049336375169 and parameters: {'n_estimators': 188, 'max_depth': 8, 'learning_rate': 0.08769802225739703, 'num_leaves': 65, 'feature_fraction': 0.9090501440133303, 'bagging_fraction': 0.866428978660233, 'bagging_freq': 7, 'lambda_l1': 0.2643382986423628, 'lambda_l2': 0.5255586324487936, 'min_data_in_leaf': 8}. Best is trial 11 with value: 0.00027002920971125956.
INFO:non_major_league_hyperparameter_tuning:lightgbm optimization complete
INFO:non_major_league_hyperparameter_tuning:Best score: 0.0003
INFO:non_major_league_hyperparameter_tuning:Best params: {'n_estimators': 168, 'max_depth': 5, 'learning_rate': 0.0858008935544337, 'num_leaves': 64, 'feature_fraction': 0.8754298329697978, 'bagging_fraction': 0.9074760851469835, 'bagging_freq': 1, 'lambda_l1': 0.003332707790443701, 'lambda_l2': 0.4074229926557874, 'min_data_in_leaf': 5}
INFO:non_major_league_hyperparameter_tuning:Optimizing random_forest (priority: 3)
INFO:non_major_league_hyperparameter_tuning:Optimizing hyperparameters for random_forest
[I 2025-10-16 05:11:57,773] A new study created in memory with name: no-name-a9a1ebe7-b899-4b6c-a5a1-41c9e10d5a95
