[I 2025-10-16 05:11:59,619] Trial 0 finished with value: 0.4730717472058759 and parameters: {'n_estimators': 199, 'max_depth': 3, 'min_samples_split': 18, 'min_samples_leaf': 4, 'max_features': 'log2'}. Best is trial 0 with value: 0.4730717472058759.
[I 2025-10-16 05:12:02,722] Trial 1 finished with value: 2.2204460492503136e-16 and parameters: {'n_estimators': 100, 'max_depth': 9, 'min_samples_split': 15, 'min_samples_leaf': 8, 'max_features': None}. Best is trial 1 with value: 2.2204460492503136e-16.
[I 2025-10-16 05:12:07,141] Trial 2 finished with value: 2.2204460492503136e-16 and parameters: {'n_estimators': 143, 'max_depth': 7, 'min_samples_split': 15, 'min_samples_leaf': 6, 'max_features': None}. Best is trial 1 with value: 2.2204460492503136e-16.
[I 2025-10-16 05:12:12,744] Trial 3 finished with value: 2.2204460492503136e-16 and parameters: {'n_estimators': 175, 'max_depth': 4, 'min_samples_split': 17, 'min_samples_leaf': 4, 'max_features': None}. Best is trial 1 with value: 2.2204460492503136e-16.
[I 2025-10-16 05:12:17,621] Trial 4 finished with value: 2.2204460492503136e-16 and parameters: {'n_estimators': 144, 'max_depth': 11, 'min_samples_split': 7, 'min_samples_leaf': 4, 'max_features': None}. Best is trial 1 with value: 2.2204460492503136e-16.
[I 2025-10-16 05:12:19,631] Trial 5 finished with value: 2.2204460492503136e-16 and parameters: {'n_estimators': 60, 'max_depth': 6, 'min_samples_split': 5, 'min_samples_leaf': 10, 'max_features': None}. Best is trial 1 with value: 2.2204460492503136e-16.
[I 2025-10-16 05:12:20,867] Trial 6 finished with value: 0.30421988400964445 and parameters: {'n_estimators': 93, 'max_depth': 10, 'min_samples_split': 11, 'min_samples_leaf': 8, 'max_features': 'log2'}. Best is trial 1 with value: 2.2204460492503136e-16.
[I 2025-10-16 05:12:22,291] Trial 7 finished with value: 0.08288342463468776 and parameters: {'n_estimators': 98, 'max_depth': 7, 'min_samples_split': 3, 'min_samples_leaf': 5, 'max_features': 'sqrt'}. Best is trial 1 with value: 2.2204460492503136e-16.
[I 2025-10-16 05:12:24,991] Trial 8 finished with value: 0.05108048984900262 and parameters: {'n_estimators': 190, 'max_depth': 15, 'min_samples_split': 6, 'min_samples_leaf': 2, 'max_features': 'sqrt'}. Best is trial 1 with value: 2.2204460492503136e-16.
[I 2025-10-16 05:12:30,224] Trial 9 finished with value: 2.2204460492503136e-16 and parameters: {'n_estimators': 134, 'max_depth': 3, 'min_samples_split': 10, 'min_samples_leaf': 4, 'max_features': None}. Best is trial 1 with value: 2.2204460492503136e-16.
[I 2025-10-16 05:12:31,133] Trial 10 finished with value: 0.36891692323932523 and parameters: {'n_estimators': 52, 'max_depth': 13, 'min_samples_split': 14, 'min_samples_leaf': 10, 'max_features': 'log2'}. Best is trial 1 with value: 2.2204460492503136e-16.
[I 2025-10-16 05:12:35,075] Trial 11 finished with value: 2.2204460492503136e-16 and parameters: {'n_estimators': 111, 'max_depth': 8, 'min_samples_split': 15, 'min_samples_leaf': 7, 'max_features': None}. Best is trial 1 with value: 2.2204460492503136e-16.
[I 2025-10-16 05:12:40,715] Trial 12 finished with value: 2.2204460492503136e-16 and parameters: {'n_estimators': 156, 'max_depth': 6, 'min_samples_split': 20, 'min_samples_leaf': 7, 'max_features': None}. Best is trial 1 with value: 2.2204460492503136e-16.
[I 2025-10-16 05:12:43,516] Trial 13 finished with value: 2.2204460492503136e-16 and parameters: {'n_estimators': 78, 'max_depth': 9, 'min_samples_split': 13, 'min_samples_leaf': 8, 'max_features': None}. Best is trial 1 with value: 2.2204460492503136e-16.
[I 2025-10-16 05:12:47,968] Trial 14 finished with value: 2.2204460492503136e-16 and parameters: {'n_estimators': 122, 'max_depth': 12, 'min_samples_split': 16, 'min_samples_leaf': 6, 'max_features': None}. Best is trial 1 with value: 2.2204460492503136e-16.
[I 2025-10-16 05:12:50,520] Trial 15 finished with value: 0.05058580438284793 and parameters: {'n_estimators': 155, 'max_depth': 9, 'min_samples_split': 9, 'min_samples_leaf': 1, 'max_features': 'sqrt'}. Best is trial 1 with value: 2.2204460492503136e-16.
[I 2025-10-16 05:12:54,693] Trial 16 finished with value: 2.2204460492503136e-16 and parameters: {'n_estimators': 113, 'max_depth': 5, 'min_samples_split': 13, 'min_samples_leaf': 9, 'max_features': None}. Best is trial 1 with value: 2.2204460492503136e-16.
[I 2025-10-16 05:12:57,963] Trial 17 finished with value: 2.2204460492503136e-16 and parameters: {'n_estimators': 79, 'max_depth': 8, 'min_samples_split': 20, 'min_samples_leaf': 6, 'max_features': None}. Best is trial 1 with value: 2.2204460492503136e-16.
[I 2025-10-16 05:12:59,794] Trial 18 finished with value: 0.30903388924270564 and parameters: {'n_estimators': 135, 'max_depth': 11, 'min_samples_split': 18, 'min_samples_leaf': 8, 'max_features': 'log2'}. Best is trial 1 with value: 2.2204460492503136e-16.
[I 2025-10-16 05:13:02,001] Trial 19 finished with value: 0.10193500632525716 and parameters: {'n_estimators': 160, 'max_depth': 7, 'min_samples_split': 12, 'min_samples_leaf': 7, 'max_features': 'sqrt'}. Best is trial 1 with value: 2.2204460492503136e-16.
[I 2025-10-16 05:13:05,208] Trial 20 finished with value: 2.2204460492503136e-16 and parameters: {'n_estimators': 91, 'max_depth': 14, 'min_samples_split': 15, 'min_samples_leaf': 9, 'max_features': None}. Best is trial 1 with value: 2.2204460492503136e-16.
[I 2025-10-16 05:13:11,387] Trial 21 finished with value: 2.2204460492503136e-16 and parameters: {'n_estimators': 176, 'max_depth': 4, 'min_samples_split': 17, 'min_samples_leaf': 3, 'max_features': None}. Best is trial 1 with value: 2.2204460492503136e-16.
[I 2025-10-16 05:13:17,417] Trial 22 finished with value: 2.2204460492503136e-16 and parameters: {'n_estimators': 170, 'max_depth': 5, 'min_samples_split': 18, 'min_samples_leaf': 5, 'max_features': None}. Best is trial 1 with value: 2.2204460492503136e-16.
[I 2025-10-16 05:13:23,902] Trial 23 finished with value: 2.2204460492503136e-16 and parameters: {'n_estimators': 184, 'max_depth': 5, 'min_samples_split': 16, 'min_samples_leaf': 3, 'max_features': None}. Best is trial 1 with value: 2.2204460492503136e-16.
[I 2025-10-16 05:13:29,529] Trial 24 finished with value: 2.2204460492503136e-16 and parameters: {'n_estimators': 146, 'max_depth': 7, 'min_samples_split': 14, 'min_samples_leaf': 6, 'max_features': None}. Best is trial 1 with value: 2.2204460492503136e-16.
[I 2025-10-16 05:13:34,132] Trial 25 finished with value: 2.2204460492503136e-16 and parameters: {'n_estimators': 121, 'max_depth': 9, 'min_samples_split': 19, 'min_samples_leaf': 5, 'max_features': None}. Best is trial 1 with value: 2.2204460492503136e-16.
[I 2025-10-16 05:13:40,353] Trial 26 finished with value: 2.2204460492503136e-16 and parameters: {'n_estimators': 169, 'max_depth': 4, 'min_samples_split': 16, 'min_samples_leaf': 3, 'max_features': None}. Best is trial 1 with value: 2.2204460492503136e-16.
[I 2025-10-16 05:13:44,110] Trial 27 finished with value: 2.2204460492503136e-16 and parameters: {'n_estimators': 106, 'max_depth': 10, 'min_samples_split': 12, 'min_samples_leaf': 7, 'max_features': None}. Best is trial 1 with value: 2.2204460492503136e-16.
[I 2025-10-16 05:13:46,106] Trial 28 finished with value: 0.31788631538557505 and parameters: {'n_estimators': 133, 'max_depth': 8, 'min_samples_split': 9, 'min_samples_leaf': 9, 'max_features': 'log2'}. Best is trial 1 with value: 2.2204460492503136e-16.
[I 2025-10-16 05:13:49,019] Trial 29 finished with value: 0.23580614295457805 and parameters: {'n_estimators': 200, 'max_depth': 3, 'min_samples_split': 18, 'min_samples_leaf': 4, 'max_features': 'sqrt'}. Best is trial 1 with value: 2.2204460492503136e-16.
INFO:non_major_league_hyperparameter_tuning:random_forest optimization complete
INFO:non_major_league_hyperparameter_tuning:Best score: 0.0000
INFO:non_major_league_hyperparameter_tuning:Best params: {'n_estimators': 100, 'max_depth': 9, 'min_samples_split': 15, 'min_samples_leaf': 8, 'max_features': None}
INFO:non_major_league_hyperparameter_tuning:Optimizing logistic_regression (priority: 4)
INFO:non_major_league_hyperparameter_tuning:Optimizing hyperparameters for logistic_regression
[I 2025-10-16 05:13:49,026] A new study created in memory with name: no-name-d272eb72-c0e8-4ce9-bab7-d1c58aee32da
[I 2025-10-16 05:13:49,203] Trial 0 finished with value: 0.001965534777930812 and parameters: {'C': 7.739308291366375, 'max_iter': 721, 'solver': 'lbfgs'}. Best is trial 0 with value: 0.001965534777930812.
[I 2025-10-16 05:13:49,381] Trial 1 finished with value: 0.0023973120902533395 and parameters: {'C': 5.826067931751618, 'max_iter': 922, 'solver': 'lbfgs'}. Best is trial 0 with value: 0.001965534777930812.
[I 2025-10-16 05:13:49,743] Trial 2 finished with value: 0.03357515535338972 and parameters: {'C': 3.136703932211419, 'max_iter': 148, 'solver': 'liblinear'}. Best is trial 0 with value: 0.001965534777930812.
[I 2025-10-16 05:13:49,976] Trial 3 finished with value: 0.005183178935752981 and parameters: {'C': 1.7684654014607446, 'max_iter': 632, 'solver': 'lbfgs'}. Best is trial 0 with value: 0.001965534777930812.
[I 2025-10-16 05:13:50,193] Trial 4 finished with value: 0.003358370025586393 and parameters: {'C': 3.184034273919957, 'max_iter': 690, 'solver': 'lbfgs'}. Best is trial 0 with value: 0.001965534777930812.
[I 2025-10-16 05:13:50,543] Trial 5 finished with value: 0.030412439524055302 and parameters: {'C': 3.8590692918276233, 'max_iter': 562, 'solver': 'liblinear'}. Best is trial 0 with value: 0.001965534777930812.
[I 2025-10-16 05:13:50,893] Trial 6 finished with value: 0.030766356635947626 and parameters: {'C': 3.765995655332485, 'max_iter': 253, 'solver': 'liblinear'}. Best is trial 0 with value: 0.001965534777930812.
[I 2025-10-16 05:13:51,296] Trial 7 finished with value: 0.019635668395444207 and parameters: {'C': 9.790533552409682, 'max_iter': 376, 'solver': 'liblinear'}. Best is trial 0 with value: 0.001965534777930812.
[I 2025-10-16 05:13:51,475] Trial 8 finished with value: 0.00833341641022671 and parameters: {'C': 0.9421358422367517, 'max_iter': 632, 'solver': 'lbfgs'}. Best is trial 0 with value: 0.001965534777930812.
[I 2025-10-16 05:13:51,833] Trial 9 finished with value: 0.02030480685662168 and parameters: {'C': 9.101468018853916, 'max_iter': 940, 'solver': 'liblinear'}. Best is trial 0 with value: 0.001965534777930812.
[I 2025-10-16 05:13:51,985] Trial 10 finished with value: 0.0021778883049769137 and parameters: {'C': 6.916444002743161, 'max_iter': 798, 'solver': 'lbfgs'}. Best is trial 0 with value: 0.001965534777930812.
[I 2025-10-16 05:13:52,149] Trial 11 finished with value: 0.0021444765695641994 and parameters: {'C': 7.070368106111868, 'max_iter': 790, 'solver': 'lbfgs'}. Best is trial 0 with value: 0.001965534777930812.
[I 2025-10-16 05:13:52,289] Trial 12 finished with value: 0.0020186338596076565 and parameters: {'C': 7.486352976431942, 'max_iter': 801, 'solver': 'lbfgs'}. Best is trial 0 with value: 0.001965534777930812.
[I 2025-10-16 05:13:52,475] Trial 13 finished with value: 0.0018706311535826913 and parameters: {'C': 8.252656353230911, 'max_iter': 457, 'solver': 'lbfgs'}. Best is trial 13 with value: 0.0018706311535826913.
[I 2025-10-16 05:13:52,664] Trial 14 finished with value: 0.0018727162811402562 and parameters: {'C': 8.239815694317342, 'max_iter': 435, 'solver': 'lbfgs'}. Best is trial 13 with value: 0.0018706311535826913.
[I 2025-10-16 05:13:52,838] Trial 15 finished with value: 0.002025530246353947 and parameters: {'C': 8.71737034506461, 'max_iter': 411, 'solver': 'lbfgs'}. Best is trial 13 with value: 0.0018706311535826913.
[I 2025-10-16 05:13:53,008] Trial 16 finished with value: 0.0024703368985915827 and parameters: {'C': 5.584321448319306, 'max_iter': 441, 'solver': 'lbfgs'}. Best is trial 13 with value: 0.0018706311535826913.
[I 2025-10-16 05:13:53,115] Trial 17 finished with value: 0.00206145024809012 and parameters: {'C': 8.44906381214592, 'max_iter': 288, 'solver': 'lbfgs'}. Best is trial 13 with value: 0.0018706311535826913.
[I 2025-10-16 05:13:53,258] Trial 18 finished with value: 0.0018975595091441748 and parameters: {'C': 9.99667372367043, 'max_iter': 507, 'solver': 'lbfgs'}. Best is trial 13 with value: 0.0018706311535826913.
[I 2025-10-16 05:13:53,421] Trial 19 finished with value: 0.002335343309284296 and parameters: {'C': 6.2708564455434885, 'max_iter': 100, 'solver': 'lbfgs'}. Best is trial 13 with value: 0.0018706311535826913.
[I 2025-10-16 05:13:53,552] Trial 20 finished with value: 0.0025981420467873486 and parameters: {'C': 4.711260308037265, 'max_iter': 283, 'solver': 'lbfgs'}. Best is trial 13 with value: 0.0018706311535826913.
[I 2025-10-16 05:13:53,692] Trial 21 finished with value: 0.0019137422390415818 and parameters: {'C': 9.845144621535514, 'max_iter': 497, 'solver': 'lbfgs'}. Best is trial 13 with value: 0.0018706311535826913.
[I 2025-10-16 05:13:53,845] Trial 22 finished with value: 0.0019030565993127591 and parameters: {'C': 8.063861227199553, 'max_iter': 548, 'solver': 'lbfgs'}. Best is trial 13 with value: 0.0018706311535826913.
[I 2025-10-16 05:13:54,001] Trial 23 finished with value: 0.0019450486846170733 and parameters: {'C': 9.372809098323616, 'max_iter': 358, 'solver': 'lbfgs'}. Best is trial 13 with value: 0.0018706311535826913.
[I 2025-10-16 05:13:54,158] Trial 24 finished with value: 0.0020461930990032583 and parameters: {'C': 8.561310151551748, 'max_iter': 483, 'solver': 'lbfgs'}. Best is trial 13 with value: 0.0018706311535826913.
[I 2025-10-16 05:13:54,290] Trial 25 finished with value: 0.0019050953230619328 and parameters: {'C': 9.925651712738329, 'max_iter': 551, 'solver': 'lbfgs'}. Best is trial 13 with value: 0.0018706311535826913.
[I 2025-10-16 05:13:54,609] Trial 26 finished with value: 0.02355964845593685 and parameters: {'C': 6.616346587806266, 'max_iter': 337, 'solver': 'liblinear'}. Best is trial 13 with value: 0.0018706311535826913.
[I 2025-10-16 05:13:54,739] Trial 27 finished with value: 0.001998262710383621 and parameters: {'C': 8.930707169670825, 'max_iter': 220, 'solver': 'lbfgs'}. Best is trial 13 with value: 0.0018706311535826913.
[I 2025-10-16 05:13:54,850] Trial 28 finished with value: 0.0019542191679987396 and parameters: {'C': 7.795513977869133, 'max_iter': 457, 'solver': 'lbfgs'}. Best is trial 13 with value: 0.0018706311535826913.
