[I 2025-10-16 23:34:15,636] Trial 23 finished with value: 2.2204460492503136e-16 and parameters: {'n_estimators': 66, 'max_depth': 6, 'min_samples_split': 20, 'min_samples_leaf': 3, 'max_features': None}. Best is trial 1 with value: 2.2204460492503136e-16.
[I 2025-10-16 23:34:17,733] Trial 24 finished with value: 2.2204460492503136e-16 and parameters: {'n_estimators': 70, 'max_depth': 5, 'min_samples_split': 16, 'min_samples_leaf': 2, 'max_features': None}. Best is trial 1 with value: 2.2204460492503136e-16.
[I 2025-10-16 23:34:19,506] Trial 25 finished with value: 0.07450666114273592 and parameters: {'n_estimators': 154, 'max_depth': 7, 'min_samples_split': 18, 'min_samples_leaf': 1, 'max_features': 'sqrt'}. Best is trial 1 with value: 2.2204460492503136e-16.
[I 2025-10-16 23:34:24,478] Trial 26 finished with value: 9.77706029458448e-06 and parameters: {'n_estimators': 179, 'max_depth': 10, 'min_samples_split': 16, 'min_samples_leaf': 3, 'max_features': None}. Best is trial 1 with value: 2.2204460492503136e-16.
[I 2025-10-16 23:34:28,091] Trial 27 finished with value: 2.2204460492503136e-16 and parameters: {'n_estimators': 125, 'max_depth': 13, 'min_samples_split': 19, 'min_samples_leaf': 5, 'max_features': None}. Best is trial 1 with value: 2.2204460492503136e-16.
[I 2025-10-16 23:34:30,796] Trial 28 finished with value: 2.2204460492503136e-16 and parameters: {'n_estimators': 96, 'max_depth': 14, 'min_samples_split': 14, 'min_samples_leaf': 2, 'max_features': None}. Best is trial 1 with value: 2.2204460492503136e-16.
[I 2025-10-16 23:34:32,376] Trial 29 finished with value: 0.10972463884369472 and parameters: {'n_estimators': 138, 'max_depth': 9, 'min_samples_split': 2, 'min_samples_leaf': 8, 'max_features': 'sqrt'}. Best is trial 1 with value: 2.2204460492503136e-16.
INFO:non_major_league_hyperparameter_tuning:random_forest optimization complete
INFO:non_major_league_hyperparameter_tuning:Best score: 0.0000
INFO:non_major_league_hyperparameter_tuning:Best params: {'n_estimators': 152, 'max_depth': 14, 'min_samples_split': 16, 'min_samples_leaf': 2, 'max_features': None}
INFO:non_major_league_hyperparameter_tuning:Optimizing logistic_regression (priority: 4)
INFO:non_major_league_hyperparameter_tuning:Optimizing hyperparameters for logistic_regression
[I 2025-10-16 23:34:32,381] A new study created in memory with name: no-name-b3cfcdb4-20f4-48f3-8595-a749fff522ea
[I 2025-10-16 23:34:32,583] Trial 0 finished with value: 0.003820076962592476 and parameters: {'C': 3.099319711111666, 'max_iter': 837, 'solver': 'lbfgs'}. Best is trial 0 with value: 0.003820076962592476.
[I 2025-10-16 23:34:32,944] Trial 1 finished with value: 0.026404825501540812 and parameters: {'C': 6.952711625145462, 'max_iter': 806, 'solver': 'liblinear'}. Best is trial 0 with value: 0.003820076962592476.
[I 2025-10-16 23:34:33,253] Trial 2 finished with value: 0.023499866366280583 and parameters: {'C': 9.266407984176533, 'max_iter': 844, 'solver': 'liblinear'}. Best is trial 0 with value: 0.003820076962592476.
[I 2025-10-16 23:34:33,403] Trial 3 finished with value: 0.0024476933446264493 and parameters: {'C': 6.553990999944793, 'max_iter': 906, 'solver': 'lbfgs'}. Best is trial 3 with value: 0.0024476933446264493.
[I 2025-10-16 23:34:33,723] Trial 4 finished with value: 0.023457694541371994 and parameters: {'C': 9.306538988648663, 'max_iter': 214, 'solver': 'liblinear'}. Best is trial 3 with value: 0.0024476933446264493.
[I 2025-10-16 23:34:33,818] Trial 5 finished with value: 0.0023979519915687105 and parameters: {'C': 6.755523059130787, 'max_iter': 721, 'solver': 'lbfgs'}. Best is trial 5 with value: 0.0023979519915687105.
[I 2025-10-16 23:34:33,934] Trial 6 finished with value: 0.0025353568345286882 and parameters: {'C': 6.061469475861443, 'max_iter': 519, 'solver': 'lbfgs'}. Best is trial 5 with value: 0.0023979519915687105.
[I 2025-10-16 23:34:34,239] Trial 7 finished with value: 0.027054094432091554 and parameters: {'C': 6.575892947401926, 'max_iter': 565, 'solver': 'liblinear'}. Best is trial 5 with value: 0.0023979519915687105.
[I 2025-10-16 23:34:34,507] Trial 8 finished with value: 0.04515906313438774 and parameters: {'C': 2.0157770066376166, 'max_iter': 308, 'solver': 'liblinear'}. Best is trial 5 with value: 0.0023979519915687105.
[I 2025-10-16 23:34:34,642] Trial 9 finished with value: 0.006323126380521301 and parameters: {'C': 1.514216325665403, 'max_iter': 134, 'solver': 'lbfgs'}. Best is trial 5 with value: 0.0023979519915687105.
[I 2025-10-16 23:34:34,781] Trial 10 finished with value: 0.003395891905807937 and parameters: {'C': 3.608973719727447, 'max_iter': 658, 'solver': 'lbfgs'}. Best is trial 5 with value: 0.0023979519915687105.
[I 2025-10-16 23:34:34,918] Trial 11 finished with value: 0.002132724277911904 and parameters: {'C': 7.9271864934981515, 'max_iter': 997, 'solver': 'lbfgs'}. Best is trial 11 with value: 0.002132724277911904.
[I 2025-10-16 23:34:35,030] Trial 12 finished with value: 0.0021017793974817908 and parameters: {'C': 8.09954456421534, 'max_iter': 991, 'solver': 'lbfgs'}. Best is trial 12 with value: 0.0021017793974817908.
[I 2025-10-16 23:34:35,133] Trial 13 finished with value: 0.0021679876870765906 and parameters: {'C': 8.649713826562573, 'max_iter': 996, 'solver': 'lbfgs'}. Best is trial 12 with value: 0.0021017793974817908.
[I 2025-10-16 23:34:35,226] Trial 14 finished with value: 0.002160587215015839 and parameters: {'C': 7.777182462506624, 'max_iter': 978, 'solver': 'lbfgs'}. Best is trial 12 with value: 0.0021017793974817908.
[I 2025-10-16 23:34:35,362] Trial 15 finished with value: 0.002848672214506109 and parameters: {'C': 4.989881659744405, 'max_iter': 410, 'solver': 'lbfgs'}. Best is trial 12 with value: 0.0021017793974817908.
[I 2025-10-16 23:34:35,561] Trial 16 finished with value: 0.025463454126819548 and parameters: {'C': 0.2215422165633063, 'max_iter': 721, 'solver': 'lbfgs'}. Best is trial 12 with value: 0.0021017793974817908.
[I 2025-10-16 23:34:35,660] Trial 17 finished with value: 0.002117652727293948 and parameters: {'C': 8.0103552375463, 'max_iter': 990, 'solver': 'lbfgs'}. Best is trial 12 with value: 0.0021017793974817908.
[I 2025-10-16 23:34:35,785] Trial 18 finished with value: 0.0020167308279405416 and parameters: {'C': 9.976267815765638, 'max_iter': 893, 'solver': 'lbfgs'}. Best is trial 18 with value: 0.0020167308279405416.
[I 2025-10-16 23:34:35,892] Trial 19 finished with value: 0.0020303663342564073 and parameters: {'C': 9.856149519868822, 'max_iter': 886, 'solver': 'lbfgs'}. Best is trial 18 with value: 0.0020167308279405416.
[I 2025-10-16 23:34:36,013] Trial 20 finished with value: 0.0027940619470300035 and parameters: {'C': 5.138297096938043, 'max_iter': 638, 'solver': 'lbfgs'}. Best is trial 18 with value: 0.0020167308279405416.
[I 2025-10-16 23:34:36,151] Trial 21 finished with value: 0.0020563824202017994 and parameters: {'C': 9.633687737307525, 'max_iter': 894, 'solver': 'lbfgs'}. Best is trial 18 with value: 0.0020167308279405416.
[I 2025-10-16 23:34:36,270] Trial 22 finished with value: 0.0020212373447060015 and parameters: {'C': 9.936294282482262, 'max_iter': 881, 'solver': 'lbfgs'}. Best is trial 18 with value: 0.0020167308279405416.
[I 2025-10-16 23:34:36,407] Trial 23 finished with value: 0.0020229224141859094 and parameters: {'C': 9.921417445130746, 'max_iter': 762, 'solver': 'lbfgs'}. Best is trial 18 with value: 0.0020167308279405416.
[I 2025-10-16 23:34:36,556] Trial 24 finished with value: 0.0021679303249744057 and parameters: {'C': 8.650121362832826, 'max_iter': 765, 'solver': 'lbfgs'}. Best is trial 18 with value: 0.0020167308279405416.
[I 2025-10-16 23:34:36,660] Trial 25 finished with value: 0.002147981935810698 and parameters: {'C': 8.793903852639538, 'max_iter': 769, 'solver': 'lbfgs'}. Best is trial 18 with value: 0.0020167308279405416.
[I 2025-10-16 23:34:36,932] Trial 26 finished with value: 0.022972981871475017 and parameters: {'C': 9.80058725726415, 'max_iter': 643, 'solver': 'liblinear'}. Best is trial 18 with value: 0.0020167308279405416.
[I 2025-10-16 23:34:37,075] Trial 27 finished with value: 0.0022380779632493585 and parameters: {'C': 7.383895472416167, 'max_iter': 899, 'solver': 'lbfgs'}. Best is trial 18 with value: 0.0020167308279405416.
[I 2025-10-16 23:34:37,178] Trial 28 finished with value: 0.0021252230479164255 and parameters: {'C': 8.963088096420664, 'max_iter': 519, 'solver': 'lbfgs'}. Best is trial 18 with value: 0.0020167308279405416.
