[I 2025-10-16 23:18:24,836] Trial 26 finished with value: 0.021289309062640777 and parameters: {'n_estimators': 178, 'max_depth': 5, 'learning_rate': 0.04854074212367834, 'subsample': 0.8680129410720836, 'colsample_bytree': 0.8122998549028808, 'min_child_weight': 4, 'reg_alpha': 0.6430266079949645, 'reg_lambda': 1.2743081947628454}. Best is trial 23 with value: 0.01023306955660576.
[I 2025-10-16 23:18:39,200] Trial 27 finished with value: 0.01030108946123492 and parameters: {'n_estimators': 185, 'max_depth': 4, 'learning_rate': 0.061781202591625936, 'subsample': 0.906922527883749, 'colsample_bytree': 0.8860367418663583, 'min_child_weight': 2, 'reg_alpha': 0.8781525178510124, 'reg_lambda': 0.9219953291735627}. Best is trial 23 with value: 0.01023306955660576.
[I 2025-10-16 23:19:38,893] Trial 28 finished with value: 0.01032790803147209 and parameters: {'n_estimators': 157, 'max_depth': 4, 'learning_rate': 0.06620153378822391, 'subsample': 0.9008274407801405, 'colsample_bytree': 0.8705987738050565, 'min_child_weight': 2, 'reg_alpha': 0.7536080492638869, 'reg_lambda': 1.355904218852084}. Best is trial 23 with value: 0.01023306955660576.
[I 2025-10-16 23:20:32,690] Trial 29 finished with value: 0.05975017997938642 and parameters: {'n_estimators': 156, 'max_depth': 4, 'learning_rate': 0.0652263087006355, 'subsample': 0.7979467520588752, 'colsample_bytree': 0.8753315998771499, 'min_child_weight': 10, 'reg_alpha': 0.762401020070504, 'reg_lambda': 1.4427522992739041}. Best is trial 23 with value: 0.01023306955660576.
INFO:non_major_league_hyperparameter_tuning:xgboost optimization complete
INFO:non_major_league_hyperparameter_tuning:Best score: 0.0102
INFO:non_major_league_hyperparameter_tuning:Best params: {'n_estimators': 182, 'max_depth': 5, 'learning_rate': 0.03822754945608633, 'subsample': 0.9489588389616428, 'colsample_bytree': 0.9948184317827552, 'min_child_weight': 2, 'reg_alpha': 0.7311119726517566, 'reg_lambda': 1.1780281152900898}
INFO:non_major_league_hyperparameter_tuning:Optimizing lightgbm (priority: 2)
INFO:non_major_league_hyperparameter_tuning:Optimizing hyperparameters for lightgbm
[I 2025-10-16 23:20:32,700] A new study created in memory with name: no-name-35937df7-6d4e-4cb5-b52e-362896461c1e
[I 2025-10-16 23:20:55,952] Trial 0 finished with value: 0.0067682702013808285 and parameters: {'n_estimators': 137, 'max_depth': 5, 'learning_rate': 0.038041405806728316, 'num_leaves': 61, 'feature_fraction': 0.8452043189035244, 'bagging_fraction': 0.7477851244035365, 'bagging_freq': 5, 'lambda_l1': 0.4042826518713303, 'lambda_l2': 0.3312570806083428, 'min_data_in_leaf': 45}. Best is trial 0 with value: 0.0067682702013808285.
[I 2025-10-16 23:21:07,524] Trial 1 finished with value: 0.03678674710399574 and parameters: {'n_estimators': 56, 'max_depth': 6, 'learning_rate': 0.047938804569500025, 'num_leaves': 11, 'feature_fraction': 0.7683985401333521, 'bagging_fraction': 0.6954879447878719, 'bagging_freq': 7, 'lambda_l1': 0.6839155144748583, 'lambda_l2': 0.5221579896793642, 'min_data_in_leaf': 45}. Best is trial 0 with value: 0.0067682702013808285.
[I 2025-10-16 23:21:33,601] Trial 2 finished with value: 0.2818701644106469 and parameters: {'n_estimators': 88, 'max_depth': 8, 'learning_rate': 0.01009493261607994, 'num_leaves': 34, 'feature_fraction': 0.6321880918389358, 'bagging_fraction': 0.6139535263974659, 'bagging_freq': 2, 'lambda_l1': 0.17327697467274394, 'lambda_l2': 0.6835022964279924, 'min_data_in_leaf': 27}. Best is trial 0 with value: 0.0067682702013808285.
[I 2025-10-16 23:21:50,219] Trial 3 finished with value: 0.006492699447616333 and parameters: {'n_estimators': 61, 'max_depth': 5, 'learning_rate': 0.07693703924633544, 'num_leaves': 98, 'feature_fraction': 0.8924712984400092, 'bagging_fraction': 0.7844825080698727, 'bagging_freq': 3, 'lambda_l1': 0.3641204054570215, 'lambda_l2': 0.1831986519073634, 'min_data_in_leaf': 34}. Best is trial 3 with value: 0.006492699447616333.
[I 2025-10-16 23:22:35,094] Trial 4 finished with value: 0.009368041549482172 and parameters: {'n_estimators': 186, 'max_depth': 3, 'learning_rate': 0.08669846915588425, 'num_leaves': 65, 'feature_fraction': 0.7154826385415143, 'bagging_fraction': 0.8402633296464566, 'bagging_freq': 9, 'lambda_l1': 0.8537173622603932, 'lambda_l2': 1.0182684796180559, 'min_data_in_leaf': 11}. Best is trial 3 with value: 0.006492699447616333.
[I 2025-10-16 23:23:16,399] Trial 5 finished with value: 0.013859432940156744 and parameters: {'n_estimators': 198, 'max_depth': 5, 'learning_rate': 0.02002109232238407, 'num_leaves': 73, 'feature_fraction': 0.6270460469343252, 'bagging_fraction': 0.9646867188027524, 'bagging_freq': 10, 'lambda_l1': 0.3848946564331819, 'lambda_l2': 1.4926676699874895, 'min_data_in_leaf': 31}. Best is trial 3 with value: 0.006492699447616333.
[I 2025-10-16 23:23:34,875] Trial 6 finished with value: 0.008462662737447588 and parameters: {'n_estimators': 166, 'max_depth': 5, 'learning_rate': 0.09013864948714578, 'num_leaves': 66, 'feature_fraction': 0.6204132773193417, 'bagging_fraction': 0.8460927721065807, 'bagging_freq': 10, 'lambda_l1': 0.7619565128291207, 'lambda_l2': 1.2083150337851287, 'min_data_in_leaf': 43}. Best is trial 3 with value: 0.006492699447616333.
[I 2025-10-16 23:23:39,337] Trial 7 finished with value: 0.012580132161248059 and parameters: {'n_estimators': 56, 'max_depth': 6, 'learning_rate': 0.0878835512647918, 'num_leaves': 24, 'feature_fraction': 0.7440114199730913, 'bagging_fraction': 0.7578416168499229, 'bagging_freq': 8, 'lambda_l1': 0.7518718556371238, 'lambda_l2': 0.8794066069609987, 'min_data_in_leaf': 17}. Best is trial 3 with value: 0.006492699447616333.
[I 2025-10-16 23:23:48,704] Trial 8 finished with value: 0.011699713652462399 and parameters: {'n_estimators': 111, 'max_depth': 4, 'learning_rate': 0.03799309646232347, 'num_leaves': 12, 'feature_fraction': 0.6841959910710532, 'bagging_fraction': 0.6533175420691585, 'bagging_freq': 8, 'lambda_l1': 0.27960894392133506, 'lambda_l2': 0.8369407176203005, 'min_data_in_leaf': 14}. Best is trial 3 with value: 0.006492699447616333.
[I 2025-10-16 23:23:57,731] Trial 9 finished with value: 0.011157010629955846 and parameters: {'n_estimators': 98, 'max_depth': 8, 'learning_rate': 0.07631389837392687, 'num_leaves': 46, 'feature_fraction': 0.8506130466446619, 'bagging_fraction': 0.7962583409384751, 'bagging_freq': 10, 'lambda_l1': 0.8734223953022263, 'lambda_l2': 1.3109081574042716, 'min_data_in_leaf': 22}. Best is trial 3 with value: 0.006492699447616333.
[I 2025-10-16 23:24:03,308] Trial 10 finished with value: 0.002118286070965507 and parameters: {'n_estimators': 141, 'max_depth': 7, 'learning_rate': 0.068760719841495, 'num_leaves': 100, 'feature_fraction': 0.979790285625141, 'bagging_fraction': 0.9312251250843497, 'bagging_freq': 1, 'lambda_l1': 0.039654559885878904, 'lambda_l2': 1.936251147649872, 'min_data_in_leaf': 35}. Best is trial 10 with value: 0.002118286070965507.
[I 2025-10-16 23:24:05,936] Trial 11 finished with value: 0.002059901838046518 and parameters: {'n_estimators': 136, 'max_depth': 7, 'learning_rate': 0.06780799453159785, 'num_leaves': 97, 'feature_fraction': 0.9790755161695286, 'bagging_fraction': 0.9400127563708794, 'bagging_freq': 1, 'lambda_l1': 0.007147616420761449, 'lambda_l2': 1.9254917720795284, 'min_data_in_leaf': 35}. Best is trial 11 with value: 0.002059901838046518.
[I 2025-10-16 23:24:17,903] Trial 12 finished with value: 0.002356851991429353 and parameters: {'n_estimators': 141, 'max_depth': 7, 'learning_rate': 0.06307303017231193, 'num_leaves': 99, 'feature_fraction': 0.996852816892786, 'bagging_fraction': 0.9765714933958585, 'bagging_freq': 1, 'lambda_l1': 0.05172240812112246, 'lambda_l2': 1.9311030325582645, 'min_data_in_leaf': 36}. Best is trial 11 with value: 0.002059901838046518.
[I 2025-10-16 23:24:43,222] Trial 13 finished with value: 0.0020487112821449636 and parameters: {'n_estimators': 154, 'max_depth': 7, 'learning_rate': 0.06326557144506625, 'num_leaves': 84, 'feature_fraction': 0.9863752277828435, 'bagging_fraction': 0.9147663531596469, 'bagging_freq': 4, 'lambda_l1': 0.016630191068688793, 'lambda_l2': 1.9960326621120759, 'min_data_in_leaf': 38}. Best is trial 13 with value: 0.0020487112821449636.
[I 2025-10-16 23:25:02,601] Trial 14 finished with value: 0.002047558700503548 and parameters: {'n_estimators': 159, 'max_depth': 7, 'learning_rate': 0.054288343055531686, 'num_leaves': 83, 'feature_fraction': 0.9352964107285915, 'bagging_fraction': 0.9007461664041484, 'bagging_freq': 4, 'lambda_l1': 0.00012983265673540464, 'lambda_l2': 1.634278354116687, 'min_data_in_leaf': 49}. Best is trial 14 with value: 0.002047558700503548.
[I 2025-10-16 23:25:35,665] Trial 15 finished with value: 0.0032966192105973267 and parameters: {'n_estimators': 167, 'max_depth': 7, 'learning_rate': 0.052174720959764345, 'num_leaves': 81, 'feature_fraction': 0.9230186836038274, 'bagging_fraction': 0.8908402580575958, 'bagging_freq': 4, 'lambda_l1': 0.1846267578709317, 'lambda_l2': 1.6079254814068342, 'min_data_in_leaf': 50}. Best is trial 14 with value: 0.002047558700503548.
[I 2025-10-16 23:25:59,995] Trial 16 finished with value: 0.008559922891104932 and parameters: {'n_estimators': 170, 'max_depth': 8, 'learning_rate': 0.03638332771788512, 'num_leaves': 84, 'feature_fraction': 0.9257921166648563, 'bagging_fraction': 0.8888802717372417, 'bagging_freq': 6, 'lambda_l1': 0.5716368943404304, 'lambda_l2': 1.7086500561699172, 'min_data_in_leaf': 50}. Best is trial 14 with value: 0.002047558700503548.
[I 2025-10-16 23:26:26,639] Trial 17 finished with value: 0.0033150441253665384 and parameters: {'n_estimators': 155, 'max_depth': 6, 'learning_rate': 0.05823795711608959, 'num_leaves': 83, 'feature_fraction': 0.9317465941283379, 'bagging_fraction': 0.8851430859134051, 'bagging_freq': 4, 'lambda_l1': 0.18802610280321308, 'lambda_l2': 1.702352092778459, 'min_data_in_leaf': 41}. Best is trial 14 with value: 0.002047558700503548.
[I 2025-10-16 23:26:46,581] Trial 18 finished with value: 0.005067138019670219 and parameters: {'n_estimators': 118, 'max_depth': 7, 'learning_rate': 0.046405934485523166, 'num_leaves': 49, 'feature_fraction': 0.8269998905867888, 'bagging_fraction': 0.9926632572182975, 'bagging_freq': 5, 'lambda_l1': 0.12042598584010707, 'lambda_l2': 1.4065738432537547, 'min_data_in_leaf': 39}. Best is trial 14 with value: 0.002047558700503548.
[I 2025-10-16 23:27:20,740] Trial 19 finished with value: 0.008295443455771222 and parameters: {'n_estimators': 181, 'max_depth': 8, 'learning_rate': 0.029315283313909972, 'num_leaves': 76, 'feature_fraction': 0.8874326015969378, 'bagging_fraction': 0.9276538184050006, 'bagging_freq': 3, 'lambda_l1': 0.5173543088942059, 'lambda_l2': 1.1409239681955292, 'min_data_in_leaf': 5}. Best is trial 14 with value: 0.002047558700503548.
[I 2025-10-16 23:27:54,868] Trial 20 finished with value: 0.010904896533378658 and parameters: {'n_estimators': 156, 'max_depth': 6, 'learning_rate': 0.07986994753621361, 'num_leaves': 89, 'feature_fraction': 0.9630417105993104, 'bagging_fraction': 0.8471812504732816, 'bagging_freq': 6, 'lambda_l1': 0.9827142472327295, 'lambda_l2': 1.7834571086835949, 'min_data_in_leaf': 26}. Best is trial 14 with value: 0.002047558700503548.
[I 2025-10-16 23:28:20,090] Trial 21 finished with value: 0.0023427713248279874 and parameters: {'n_estimators': 129, 'max_depth': 7, 'learning_rate': 0.06816029652483989, 'num_leaves': 90, 'feature_fraction': 0.9572732260101173, 'bagging_fraction': 0.9227238021911495, 'bagging_freq': 3, 'lambda_l1': 0.011168729232017349, 'lambda_l2': 1.9828112127428215, 'min_data_in_leaf': 31}. Best is trial 14 with value: 0.002047558700503548.
[I 2025-10-16 23:28:53,188] Trial 22 finished with value: 0.002448091622111285 and parameters: {'n_estimators': 148, 'max_depth': 7, 'learning_rate': 0.05919696112141886, 'num_leaves': 91, 'feature_fraction': 0.9918167998667006, 'bagging_fraction': 0.9462612506934646, 'bagging_freq': 2, 'lambda_l1': 0.10186291914750711, 'lambda_l2': 1.5494137157578618, 'min_data_in_leaf': 38}. Best is trial 14 with value: 0.002047558700503548.
[I 2025-10-16 23:29:14,255] Trial 23 finished with value: 0.0038359120495798063 and parameters: {'n_estimators': 126, 'max_depth': 6, 'learning_rate': 0.06842777163390275, 'num_leaves': 73, 'feature_fraction': 0.8966783040417893, 'bagging_fraction': 0.9997091963160256, 'bagging_freq': 4, 'lambda_l1': 0.27805663168994627, 'lambda_l2': 1.8173994615933433, 'min_data_in_leaf': 47}. Best is trial 14 with value: 0.002047558700503548.
[I 2025-10-16 23:29:24,135] Trial 24 finished with value: 0.008361583070973698 and parameters: {'n_estimators': 105, 'max_depth': 8, 'learning_rate': 0.05062006603315035, 'num_leaves': 56, 'feature_fraction': 0.9537423487568328, 'bagging_fraction': 0.8749458158527599, 'bagging_freq': 2, 'lambda_l1': 0.26867089393872423, 'lambda_l2': 1.9796446414143223, 'min_data_in_leaf': 31}. Best is trial 14 with value: 0.002047558700503548.
[I 2025-10-16 23:29:51,517] Trial 25 finished with value: 0.001652537587435377 and parameters: {'n_estimators': 157, 'max_depth': 7, 'learning_rate': 0.06575194238685834, 'num_leaves': 92, 'feature_fraction': 0.8035781409450601, 'bagging_fraction': 0.9102621978667474, 'bagging_freq': 5, 'lambda_l1': 0.0022615978702390264, 'lambda_l2': 1.7981070583094094, 'min_data_in_leaf': 41}. Best is trial 25 with value: 0.001652537587435377.
[I 2025-10-16 23:30:25,566] Trial 26 finished with value: 0.0015331830161815772 and parameters: {'n_estimators': 180, 'max_depth': 7, 'learning_rate': 0.09734419807368996, 'num_leaves': 79, 'feature_fraction': 0.7882365798423899, 'bagging_fraction': 0.827027894782012, 'bagging_freq': 5, 'lambda_l1': 0.11209910655007654, 'lambda_l2': 1.4009185229680479, 'min_data_in_leaf': 41}. Best is trial 26 with value: 0.0015331830161815772.
[I 2025-10-16 23:31:06,241] Trial 27 finished with value: 0.0015881956688149487 and parameters: {'n_estimators': 200, 'max_depth': 6, 'learning_rate': 0.09839205948031454, 'num_leaves': 76, 'feature_fraction': 0.7995222008734273, 'bagging_fraction': 0.8191137200502554, 'bagging_freq': 6, 'lambda_l1': 0.12367599803522056, 'lambda_l2': 1.4204811356599318, 'min_data_in_leaf': 48}. Best is trial 26 with value: 0.0015331830161815772.
[I 2025-10-16 23:32:48,092] Trial 28 finished with value: 0.0014072020231248384 and parameters: {'n_estimators': 199, 'max_depth': 4, 'learning_rate': 0.09939936498022436, 'num_leaves': 71, 'feature_fraction': 0.7944598432202841, 'bagging_fraction': 0.8275521263940526, 'bagging_freq': 7, 'lambda_l1': 0.10846079552796235, 'lambda_l2': 1.3790065449478965, 'min_data_in_leaf': 42}. Best is trial 28 with value: 0.0014072020231248384.
[I 2025-10-16 23:33:12,105] Trial 29 finished with value: 0.00416989744999935 and parameters: {'n_estimators': 195, 'max_depth': 4, 'learning_rate': 0.09976735464074543, 'num_leaves': 60, 'feature_fraction': 0.7743944514119979, 'bagging_fraction': 0.7237959702282212, 'bagging_freq': 7, 'lambda_l1': 0.32598856474368937, 'lambda_l2': 1.3453931268570667, 'min_data_in_leaf': 45}. Best is trial 28 with value: 0.0014072020231248384.
INFO:non_major_league_hyperparameter_tuning:lightgbm optimization complete
INFO:non_major_league_hyperparameter_tuning:Best score: 0.0014
INFO:non_major_league_hyperparameter_tuning:Best params: {'n_estimators': 199, 'max_depth': 4, 'learning_rate': 0.09939936498022436, 'num_leaves': 71, 'feature_fraction': 0.7944598432202841, 'bagging_fraction': 0.8275521263940526, 'bagging_freq': 7, 'lambda_l1': 0.10846079552796235, 'lambda_l2': 1.3790065449478965, 'min_data_in_leaf': 42}
INFO:non_major_league_hyperparameter_tuning:Optimizing random_forest (priority: 3)
INFO:non_major_league_hyperparameter_tuning:Optimizing hyperparameters for random_forest
[I 2025-10-16 23:33:12,124] A new study created in memory with name: no-name-bc9b0046-037b-4097-9c0e-52354dc4ae27
[I 2025-10-16 23:33:13,900] Trial 0 finished with value: 0.31309378590862563 and parameters: {'n_estimators': 142, 'max_depth': 9, 'min_samples_split': 6, 'min_samples_leaf': 8, 'max_features': 'log2'}. Best is trial 0 with value: 0.31309378590862563.
[I 2025-10-16 23:33:19,186] Trial 1 finished with value: 2.2204460492503136e-16 and parameters: {'n_estimators': 152, 'max_depth': 14, 'min_samples_split': 16, 'min_samples_leaf': 2, 'max_features': None}. Best is trial 1 with value: 2.2204460492503136e-16.
[I 2025-10-16 23:33:23,686] Trial 2 finished with value: 2.2204460492503136e-16 and parameters: {'n_estimators': 121, 'max_depth': 9, 'min_samples_split': 17, 'min_samples_leaf': 5, 'max_features': None}. Best is trial 1 with value: 2.2204460492503136e-16.
[I 2025-10-16 23:33:25,032] Trial 3 finished with value: 0.05605765331231439 and parameters: {'n_estimators': 104, 'max_depth': 8, 'min_samples_split': 13, 'min_samples_leaf': 1, 'max_features': 'sqrt'}. Best is trial 1 with value: 2.2204460492503136e-16.
[I 2025-10-16 23:33:26,711] Trial 4 finished with value: 0.26702179519161146 and parameters: {'n_estimators': 182, 'max_depth': 11, 'min_samples_split': 7, 'min_samples_leaf': 6, 'max_features': 'log2'}. Best is trial 1 with value: 2.2204460492503136e-16.
[I 2025-10-16 23:33:28,664] Trial 5 finished with value: 0.07014876100566952 and parameters: {'n_estimators': 192, 'max_depth': 13, 'min_samples_split': 10, 'min_samples_leaf': 4, 'max_features': 'sqrt'}. Best is trial 1 with value: 2.2204460492503136e-16.
[I 2025-10-16 23:33:29,984] Trial 6 finished with value: 0.31771458502538047 and parameters: {'n_estimators': 108, 'max_depth': 15, 'min_samples_split': 16, 'min_samples_leaf': 9, 'max_features': 'log2'}. Best is trial 1 with value: 2.2204460492503136e-16.
[I 2025-10-16 23:33:31,509] Trial 7 finished with value: 0.28985962438892116 and parameters: {'n_estimators': 142, 'max_depth': 9, 'min_samples_split': 14, 'min_samples_leaf': 7, 'max_features': 'log2'}. Best is trial 1 with value: 2.2204460492503136e-16.
[I 2025-10-16 23:33:33,111] Trial 8 finished with value: 0.2877519419791699 and parameters: {'n_estimators': 149, 'max_depth': 10, 'min_samples_split': 13, 'min_samples_leaf': 7, 'max_features': 'log2'}. Best is trial 1 with value: 2.2204460492503136e-16.
[I 2025-10-16 23:33:34,840] Trial 9 finished with value: 0.3430210719977022 and parameters: {'n_estimators': 173, 'max_depth': 8, 'min_samples_split': 2, 'min_samples_leaf': 10, 'max_features': 'log2'}. Best is trial 1 with value: 2.2204460492503136e-16.
[I 2025-10-16 23:33:36,487] Trial 10 finished with value: 2.2204460492503136e-16 and parameters: {'n_estimators': 57, 'max_depth': 4, 'min_samples_split': 20, 'min_samples_leaf': 1, 'max_features': None}. Best is trial 1 with value: 2.2204460492503136e-16.
[I 2025-10-16 23:33:39,261] Trial 11 finished with value: 2.2204460492503136e-16 and parameters: {'n_estimators': 84, 'max_depth': 5, 'min_samples_split': 19, 'min_samples_leaf': 4, 'max_features': None}. Best is trial 1 with value: 2.2204460492503136e-16.
[I 2025-10-16 23:33:42,880] Trial 12 finished with value: 2.2204460492503136e-16 and parameters: {'n_estimators': 121, 'max_depth': 13, 'min_samples_split': 17, 'min_samples_leaf': 3, 'max_features': None}. Best is trial 1 with value: 2.2204460492503136e-16.
[I 2025-10-16 23:33:47,543] Trial 13 finished with value: 1.0873559774455664e-05 and parameters: {'n_estimators': 161, 'max_depth': 6, 'min_samples_split': 17, 'min_samples_leaf': 3, 'max_features': None}. Best is trial 1 with value: 2.2204460492503136e-16.
[I 2025-10-16 23:33:49,964] Trial 14 finished with value: 2.2204460492503136e-16 and parameters: {'n_estimators': 87, 'max_depth': 12, 'min_samples_split': 10, 'min_samples_leaf': 5, 'max_features': None}. Best is trial 1 with value: 2.2204460492503136e-16.
[I 2025-10-16 23:33:53,473] Trial 15 finished with value: 2.2204460492503136e-16 and parameters: {'n_estimators': 125, 'max_depth': 14, 'min_samples_split': 15, 'min_samples_leaf': 2, 'max_features': None}. Best is trial 1 with value: 2.2204460492503136e-16.
[I 2025-10-16 23:33:58,078] Trial 16 finished with value: 1.0873559774455664e-05 and parameters: {'n_estimators': 161, 'max_depth': 7, 'min_samples_split': 18, 'min_samples_leaf': 5, 'max_features': None}. Best is trial 1 with value: 2.2204460492503136e-16.
[I 2025-10-16 23:34:01,743] Trial 17 finished with value: 2.2204460492503136e-16 and parameters: {'n_estimators': 134, 'max_depth': 11, 'min_samples_split': 20, 'min_samples_leaf': 2, 'max_features': None}. Best is trial 1 with value: 2.2204460492503136e-16.
[I 2025-10-16 23:34:02,960] Trial 18 finished with value: 0.08676407269499015 and parameters: {'n_estimators': 111, 'max_depth': 15, 'min_samples_split': 12, 'min_samples_leaf': 6, 'max_features': 'sqrt'}. Best is trial 1 with value: 2.2204460492503136e-16.
[I 2025-10-16 23:34:08,345] Trial 19 finished with value: 8.791961658087593e-06 and parameters: {'n_estimators': 199, 'max_depth': 3, 'min_samples_split': 15, 'min_samples_leaf': 4, 'max_features': None}. Best is trial 1 with value: 2.2204460492503136e-16.
[I 2025-10-16 23:34:10,842] Trial 20 finished with value: 2.2204460492503136e-16 and parameters: {'n_estimators': 90, 'max_depth': 11, 'min_samples_split': 8, 'min_samples_leaf': 2, 'max_features': None}. Best is trial 1 with value: 2.2204460492503136e-16.
[I 2025-10-16 23:34:12,423] Trial 21 finished with value: 2.2204460492503136e-16 and parameters: {'n_estimators': 53, 'max_depth': 3, 'min_samples_split': 20, 'min_samples_leaf': 1, 'max_features': None}. Best is trial 1 with value: 2.2204460492503136e-16.
[I 2025-10-16 23:34:13,835] Trial 22 finished with value: 2.2204460492503136e-16 and parameters: {'n_estimators': 50, 'max_depth': 4, 'min_samples_split': 18, 'min_samples_leaf': 1, 'max_features': None}. Best is trial 1 with value: 2.2204460492503136e-16.
