[I 2025-10-16 22:05:01,527] Trial 27 finished with value: 0.0008304009674224011 and parameters: {'n_estimators': 200, 'max_depth': 6, 'learning_rate': 0.09863474011226384, 'num_leaves': 59, 'feature_fraction': 0.9602634207413071, 'bagging_fraction': 0.7467349255195834, 'bagging_freq': 6, 'lambda_l1': 0.07024405952403949, 'lambda_l2': 0.010697077348480244, 'min_data_in_leaf': 30}. Best is trial 27 with value: 0.0008304009674224011.
[I 2025-10-16 22:05:04,395] Trial 28 finished with value: 0.0032307506338230835 and parameters: {'n_estimators': 200, 'max_depth': 7, 'learning_rate': 0.09878132479218944, 'num_leaves': 58, 'feature_fraction': 0.7999090231057845, 'bagging_fraction': 0.7492446120671298, 'bagging_freq': 6, 'lambda_l1': 0.27606742428863446, 'lambda_l2': 0.012897241612318644, 'min_data_in_leaf': 31}. Best is trial 27 with value: 0.0008304009674224011.
[I 2025-10-16 22:05:06,918] Trial 29 finished with value: 0.0053548906271422185 and parameters: {'n_estimators': 190, 'max_depth': 8, 'learning_rate': 0.09018072892989087, 'num_leaves': 97, 'feature_fraction': 0.9617490835455558, 'bagging_fraction': 0.8196091713819516, 'bagging_freq': 10, 'lambda_l1': 0.4930390284964059, 'lambda_l2': 0.0013184374312641411, 'min_data_in_leaf': 9}. Best is trial 27 with value: 0.0008304009674224011.
INFO:non_major_league_hyperparameter_tuning:lightgbm optimization complete
INFO:non_major_league_hyperparameter_tuning:Best score: 0.0008
INFO:non_major_league_hyperparameter_tuning:Best params: {'n_estimators': 200, 'max_depth': 6, 'learning_rate': 0.09863474011226384, 'num_leaves': 59, 'feature_fraction': 0.9602634207413071, 'bagging_fraction': 0.7467349255195834, 'bagging_freq': 6, 'lambda_l1': 0.07024405952403949, 'lambda_l2': 0.010697077348480244, 'min_data_in_leaf': 30}
INFO:non_major_league_hyperparameter_tuning:Optimizing random_forest (priority: 3)
INFO:non_major_league_hyperparameter_tuning:Optimizing hyperparameters for random_forest
[I 2025-10-16 22:05:06,925] A new study created in memory with name: no-name-22f2ad56-b524-44c9-8fa9-68d81a6b9e1f
[I 2025-10-16 22:05:09,105] Trial 0 finished with value: 2.2204460492503136e-16 and parameters: {'n_estimators': 89, 'max_depth': 11, 'min_samples_split': 14, 'min_samples_leaf': 5, 'max_features': None}. Best is trial 0 with value: 2.2204460492503136e-16.
[I 2025-10-16 22:05:12,806] Trial 1 finished with value: 9.83214261497911e-06 and parameters: {'n_estimators': 178, 'max_depth': 10, 'min_samples_split': 3, 'min_samples_leaf': 6, 'max_features': None}. Best is trial 0 with value: 2.2204460492503136e-16.
[I 2025-10-16 22:05:13,763] Trial 2 finished with value: 0.2602984612581612 and parameters: {'n_estimators': 140, 'max_depth': 14, 'min_samples_split': 9, 'min_samples_leaf': 5, 'max_features': 'log2'}. Best is trial 0 with value: 2.2204460492503136e-16.
[I 2025-10-16 22:05:14,293] Trial 3 finished with value: 0.25673587499072853 and parameters: {'n_estimators': 67, 'max_depth': 12, 'min_samples_split': 9, 'min_samples_leaf': 4, 'max_features': 'log2'}. Best is trial 0 with value: 2.2204460492503136e-16.
[I 2025-10-16 22:05:14,933] Trial 4 finished with value: 0.405368859170363 and parameters: {'n_estimators': 86, 'max_depth': 4, 'min_samples_split': 14, 'min_samples_leaf': 9, 'max_features': 'log2'}. Best is trial 0 with value: 2.2204460492503136e-16.
[I 2025-10-16 22:05:19,639] Trial 5 finished with value: 1.0481717382790457e-05 and parameters: {'n_estimators': 167, 'max_depth': 7, 'min_samples_split': 4, 'min_samples_leaf': 4, 'max_features': None}. Best is trial 0 with value: 2.2204460492503136e-16.
[I 2025-10-16 22:05:20,778] Trial 6 finished with value: 0.09078637818566317 and parameters: {'n_estimators': 129, 'max_depth': 5, 'min_samples_split': 18, 'min_samples_leaf': 2, 'max_features': 'sqrt'}. Best is trial 0 with value: 2.2204460492503136e-16.
[I 2025-10-16 22:05:21,411] Trial 7 finished with value: 0.23548847844377221 and parameters: {'n_estimators': 74, 'max_depth': 3, 'min_samples_split': 13, 'min_samples_leaf': 1, 'max_features': 'sqrt'}. Best is trial 0 with value: 2.2204460492503136e-16.
[I 2025-10-16 22:05:24,076] Trial 8 finished with value: 2.2204460492503136e-16 and parameters: {'n_estimators': 138, 'max_depth': 13, 'min_samples_split': 11, 'min_samples_leaf': 8, 'max_features': None}. Best is trial 0 with value: 2.2204460492503136e-16.
[I 2025-10-16 22:05:25,970] Trial 9 finished with value: 2.2204460492503136e-16 and parameters: {'n_estimators': 103, 'max_depth': 3, 'min_samples_split': 16, 'min_samples_leaf': 8, 'max_features': None}. Best is trial 0 with value: 2.2204460492503136e-16.
[I 2025-10-16 22:05:28,045] Trial 10 finished with value: 2.2204460492503136e-16 and parameters: {'n_estimators': 105, 'max_depth': 10, 'min_samples_split': 20, 'min_samples_leaf': 6, 'max_features': None}. Best is trial 0 with value: 2.2204460492503136e-16.
[I 2025-10-16 22:05:30,863] Trial 11 finished with value: 2.2204460492503136e-16 and parameters: {'n_estimators': 151, 'max_depth': 15, 'min_samples_split': 10, 'min_samples_leaf': 8, 'max_features': None}. Best is trial 0 with value: 2.2204460492503136e-16.
[I 2025-10-16 22:05:32,846] Trial 12 finished with value: 2.2204460492503136e-16 and parameters: {'n_estimators': 109, 'max_depth': 12, 'min_samples_split': 6, 'min_samples_leaf': 10, 'max_features': None}. Best is trial 0 with value: 2.2204460492503136e-16.
[I 2025-10-16 22:05:36,436] Trial 13 finished with value: 8.881447657239621e-06 and parameters: {'n_estimators': 197, 'max_depth': 12, 'min_samples_split': 13, 'min_samples_leaf': 7, 'max_features': None}. Best is trial 0 with value: 2.2204460492503136e-16.
[I 2025-10-16 22:05:39,261] Trial 14 finished with value: 2.2204460492503136e-16 and parameters: {'n_estimators': 118, 'max_depth': 8, 'min_samples_split': 7, 'min_samples_leaf': 3, 'max_features': None}. Best is trial 0 with value: 2.2204460492503136e-16.
[I 2025-10-16 22:05:39,705] Trial 15 finished with value: 0.11350195400306319 and parameters: {'n_estimators': 54, 'max_depth': 14, 'min_samples_split': 15, 'min_samples_leaf': 7, 'max_features': 'sqrt'}. Best is trial 0 with value: 2.2204460492503136e-16.
[I 2025-10-16 22:05:41,432] Trial 16 finished with value: 2.2204460492503136e-16 and parameters: {'n_estimators': 89, 'max_depth': 11, 'min_samples_split': 12, 'min_samples_leaf': 10, 'max_features': None}. Best is trial 0 with value: 2.2204460492503136e-16.
[I 2025-10-16 22:05:44,403] Trial 17 finished with value: 1.1223194293922184e-05 and parameters: {'n_estimators': 156, 'max_depth': 7, 'min_samples_split': 16, 'min_samples_leaf': 5, 'max_features': None}. Best is trial 0 with value: 2.2204460492503136e-16.
[I 2025-10-16 22:05:45,389] Trial 18 finished with value: 0.09866675215869646 and parameters: {'n_estimators': 130, 'max_depth': 13, 'min_samples_split': 7, 'min_samples_leaf': 7, 'max_features': 'sqrt'}. Best is trial 0 with value: 2.2204460492503136e-16.
[I 2025-10-16 22:05:46,002] Trial 19 finished with value: 0.3136851199724701 and parameters: {'n_estimators': 91, 'max_depth': 9, 'min_samples_split': 18, 'min_samples_leaf': 8, 'max_features': 'log2'}. Best is trial 0 with value: 2.2204460492503136e-16.
[I 2025-10-16 22:05:48,686] Trial 20 finished with value: 2.2204460492503136e-16 and parameters: {'n_estimators': 143, 'max_depth': 15, 'min_samples_split': 11, 'min_samples_leaf': 4, 'max_features': None}. Best is trial 0 with value: 2.2204460492503136e-16.
[I 2025-10-16 22:05:50,847] Trial 21 finished with value: 2.2204460492503136e-16 and parameters: {'n_estimators': 104, 'max_depth': 6, 'min_samples_split': 16, 'min_samples_leaf': 8, 'max_features': None}. Best is trial 0 with value: 2.2204460492503136e-16.
[I 2025-10-16 22:05:53,221] Trial 22 finished with value: 2.2204460492503136e-16 and parameters: {'n_estimators': 120, 'max_depth': 10, 'min_samples_split': 18, 'min_samples_leaf': 9, 'max_features': None}. Best is trial 0 with value: 2.2204460492503136e-16.
[I 2025-10-16 22:05:54,977] Trial 23 finished with value: 2.2204460492503136e-16 and parameters: {'n_estimators': 95, 'max_depth': 13, 'min_samples_split': 16, 'min_samples_leaf': 9, 'max_features': None}. Best is trial 0 with value: 2.2204460492503136e-16.
[I 2025-10-16 22:05:56,326] Trial 24 finished with value: 2.2204460492503136e-16 and parameters: {'n_estimators': 73, 'max_depth': 11, 'min_samples_split': 12, 'min_samples_leaf': 6, 'max_features': None}. Best is trial 0 with value: 2.2204460492503136e-16.
[I 2025-10-16 22:05:58,404] Trial 25 finished with value: 2.2204460492503136e-16 and parameters: {'n_estimators': 115, 'max_depth': 3, 'min_samples_split': 14, 'min_samples_leaf': 7, 'max_features': None}. Best is trial 0 with value: 2.2204460492503136e-16.
[I 2025-10-16 22:05:59,370] Trial 26 finished with value: 2.2204460492503136e-16 and parameters: {'n_estimators': 50, 'max_depth': 9, 'min_samples_split': 20, 'min_samples_leaf': 5, 'max_features': None}. Best is trial 0 with value: 2.2204460492503136e-16.
[I 2025-10-16 22:06:01,959] Trial 27 finished with value: 2.2204460492503136e-16 and parameters: {'n_estimators': 134, 'max_depth': 13, 'min_samples_split': 11, 'min_samples_leaf': 8, 'max_features': None}. Best is trial 0 with value: 2.2204460492503136e-16.
[I 2025-10-16 22:06:02,741] Trial 28 finished with value: 0.0812086642306858 and parameters: {'n_estimators': 99, 'max_depth': 11, 'min_samples_split': 17, 'min_samples_leaf': 3, 'max_features': 'sqrt'}. Best is trial 0 with value: 2.2204460492503136e-16.
[I 2025-10-16 22:06:03,688] Trial 29 finished with value: 0.26942102830952597 and parameters: {'n_estimators': 156, 'max_depth': 10, 'min_samples_split': 14, 'min_samples_leaf': 6, 'max_features': 'log2'}. Best is trial 0 with value: 2.2204460492503136e-16.
INFO:non_major_league_hyperparameter_tuning:random_forest optimization complete
INFO:non_major_league_hyperparameter_tuning:Best score: 0.0000
INFO:non_major_league_hyperparameter_tuning:Best params: {'n_estimators': 89, 'max_depth': 11, 'min_samples_split': 14, 'min_samples_leaf': 5, 'max_features': None}
INFO:non_major_league_hyperparameter_tuning:Optimizing logistic_regression (priority: 4)
INFO:non_major_league_hyperparameter_tuning:Optimizing hyperparameters for logistic_regression
[I 2025-10-16 22:06:03,691] A new study created in memory with name: no-name-6dbf1f25-ddf9-4e09-99ec-ec6fba6912f7
[I 2025-10-16 22:06:03,891] Trial 0 finished with value: 0.031331541092474345 and parameters: {'C': 4.650830766481546, 'max_iter': 959, 'solver': 'liblinear'}. Best is trial 0 with value: 0.031331541092474345.
[I 2025-10-16 22:06:04,111] Trial 1 finished with value: 0.02359141887940648 and parameters: {'C': 9.178108225792595, 'max_iter': 956, 'solver': 'liblinear'}. Best is trial 1 with value: 0.02359141887940648.
[I 2025-10-16 22:06:04,298] Trial 2 finished with value: 0.09640697748138481 and parameters: {'C': 0.38389583435181834, 'max_iter': 281, 'solver': 'liblinear'}. Best is trial 1 with value: 0.02359141887940648.
[I 2025-10-16 22:06:04,445] Trial 3 finished with value: 0.03372761604903594 and parameters: {'C': 0.14848283535174012, 'max_iter': 289, 'solver': 'lbfgs'}. Best is trial 1 with value: 0.02359141887940648.
[I 2025-10-16 22:06:04,687] Trial 4 finished with value: 0.024995487708080962 and parameters: {'C': 7.966401165996261, 'max_iter': 939, 'solver': 'liblinear'}. Best is trial 1 with value: 0.02359141887940648.
[I 2025-10-16 22:06:04,924] Trial 5 finished with value: 0.02290584304462877 and parameters: {'C': 9.871895872134804, 'max_iter': 401, 'solver': 'liblinear'}. Best is trial 5 with value: 0.02290584304462877.
[I 2025-10-16 22:06:05,158] Trial 6 finished with value: 0.024860475731153298 and parameters: {'C': 8.072810705145931, 'max_iter': 895, 'solver': 'liblinear'}. Best is trial 5 with value: 0.02290584304462877.
[I 2025-10-16 22:06:05,379] Trial 7 finished with value: 0.036703257730666204 and parameters: {'C': 3.2261470160050165, 'max_iter': 818, 'solver': 'liblinear'}. Best is trial 5 with value: 0.02290584304462877.
[I 2025-10-16 22:06:05,615] Trial 8 finished with value: 0.027143910419495803 and parameters: {'C': 6.521601573329848, 'max_iter': 267, 'solver': 'liblinear'}. Best is trial 5 with value: 0.02290584304462877.
[I 2025-10-16 22:06:05,847] Trial 9 finished with value: 0.028673788063115834 and parameters: {'C': 5.7124231535549495, 'max_iter': 225, 'solver': 'liblinear'}. Best is trial 5 with value: 0.02290584304462877.
[I 2025-10-16 22:06:05,954] Trial 10 finished with value: 0.0020682328223138196 and parameters: {'C': 9.41236926628891, 'max_iter': 531, 'solver': 'lbfgs'}. Best is trial 10 with value: 0.0020682328223138196.
[I 2025-10-16 22:06:06,068] Trial 11 finished with value: 0.0020271312257819337 and parameters: {'C': 9.884424676580371, 'max_iter': 554, 'solver': 'lbfgs'}. Best is trial 11 with value: 0.0020271312257819337.
[I 2025-10-16 22:06:06,181] Trial 12 finished with value: 0.0020155290870005342 and parameters: {'C': 9.9869737181758, 'max_iter': 624, 'solver': 'lbfgs'}. Best is trial 12 with value: 0.0020155290870005342.
[I 2025-10-16 22:06:06,317] Trial 13 finished with value: 0.0020864875740783328 and parameters: {'C': 8.187060440998232, 'max_iter': 692, 'solver': 'lbfgs'}. Best is trial 12 with value: 0.0020155290870005342.
[I 2025-10-16 22:06:06,467] Trial 14 finished with value: 0.00229490958567181 and parameters: {'C': 7.115966084911967, 'max_iter': 602, 'solver': 'lbfgs'}. Best is trial 12 with value: 0.0020155290870005342.
[I 2025-10-16 22:06:06,635] Trial 15 finished with value: 0.003425129386789253 and parameters: {'C': 3.540729653143245, 'max_iter': 461, 'solver': 'lbfgs'}. Best is trial 12 with value: 0.0020155290870005342.
[I 2025-10-16 22:06:06,749] Trial 16 finished with value: 0.0020442470738262558 and parameters: {'C': 9.736379790688186, 'max_iter': 696, 'solver': 'lbfgs'}. Best is trial 12 with value: 0.0020155290870005342.
[I 2025-10-16 22:06:06,876] Trial 17 finished with value: 0.002205873127392057 and parameters: {'C': 8.387701825793185, 'max_iter': 100, 'solver': 'lbfgs'}. Best is trial 12 with value: 0.0020155290870005342.
[I 2025-10-16 22:06:07,063] Trial 18 finished with value: 0.006244552517767788 and parameters: {'C': 1.5413084625287947, 'max_iter': 717, 'solver': 'lbfgs'}. Best is trial 12 with value: 0.0020155290870005342.
[I 2025-10-16 22:06:07,194] Trial 19 finished with value: 0.0023681846062170906 and parameters: {'C': 6.878960121680178, 'max_iter': 580, 'solver': 'lbfgs'}. Best is trial 12 with value: 0.0020155290870005342.
[I 2025-10-16 22:06:07,330] Trial 20 finished with value: 0.0026488355251892293 and parameters: {'C': 5.613940282441345, 'max_iter': 412, 'solver': 'lbfgs'}. Best is trial 12 with value: 0.0020155290870005342.
[I 2025-10-16 22:06:07,452] Trial 21 finished with value: 0.002039111955714552 and parameters: {'C': 9.780397644376611, 'max_iter': 718, 'solver': 'lbfgs'}. Best is trial 12 with value: 0.0020155290870005342.
[I 2025-10-16 22:06:07,584] Trial 22 finished with value: 0.0021376167833711593 and parameters: {'C': 8.870263106288931, 'max_iter': 780, 'solver': 'lbfgs'}. Best is trial 12 with value: 0.0020155290870005342.
[I 2025-10-16 22:06:07,713] Trial 23 finished with value: 0.0022461507865100725 and parameters: {'C': 7.344824207180659, 'max_iter': 628, 'solver': 'lbfgs'}. Best is trial 12 with value: 0.0020155290870005342.
[I 2025-10-16 22:06:07,843] Trial 24 finished with value: 0.0020161250561595546 and parameters: {'C': 9.981661987441484, 'max_iter': 504, 'solver': 'lbfgs'}. Best is trial 12 with value: 0.0020155290870005342.
[I 2025-10-16 22:06:07,974] Trial 25 finished with value: 0.0021427342636955657 and parameters: {'C': 8.832419780949916, 'max_iter': 504, 'solver': 'lbfgs'}. Best is trial 12 with value: 0.0020155290870005342.
[I 2025-10-16 22:06:08,105] Trial 26 finished with value: 0.002027294336309898 and parameters: {'C': 9.882995768831817, 'max_iter': 409, 'solver': 'lbfgs'}. Best is trial 12 with value: 0.0020155290870005342.
[I 2025-10-16 22:06:08,245] Trial 27 finished with value: 0.0021515651430453636 and parameters: {'C': 8.767771798501611, 'max_iter': 505, 'solver': 'lbfgs'}. Best is trial 12 with value: 0.0020155290870005342.
[I 2025-10-16 22:06:08,386] Trial 28 finished with value: 0.0021567838570862486 and parameters: {'C': 7.7973780906791506, 'max_iter': 608, 'solver': 'lbfgs'}. Best is trial 12 with value: 0.0020155290870005342.
