[I 2025-10-16 23:34:37,284] Trial 29 finished with value: 0.0028094745204785138 and parameters: {'C': 5.095072548593332, 'max_iter': 839, 'solver': 'lbfgs'}. Best is trial 18 with value: 0.0020167308279405416.
INFO:non_major_league_hyperparameter_tuning:logistic_regression optimization complete
INFO:non_major_league_hyperparameter_tuning:Best score: 0.0020
INFO:non_major_league_hyperparameter_tuning:Best params: {'C': 9.976267815765638, 'max_iter': 893, 'solver': 'lbfgs'}
INFO:non_major_league_hyperparameter_tuning:Validating optimized hyperparameters
INFO:non_major_league_hyperparameter_tuning:Hyperparameter validation: PASSED
INFO:non_major_league_hyperparameter_tuning:Comparing optimized models
INFO:non_major_league_hyperparameter_tuning:Best model: random_forest
INFO:non_major_league_hyperparameter_tuning:Best score: 0.0000
INFO:non_major_league_hyperparameter_tuning:Evaluating optimized models
INFO:non_major_league_hyperparameter_tuning:Creating optimized models
INFO:non_major_league_hyperparameter_tuning:Created optimized xgboost model
INFO:non_major_league_hyperparameter_tuning:Created optimized lightgbm model
INFO:non_major_league_hyperparameter_tuning:Created optimized random_forest model
INFO:non_major_league_hyperparameter_tuning:Created optimized logistic_regression model
INFO:non_major_league_hyperparameter_tuning:Calculating hyperparameter importance
INFO:phase2_integration:Step 5: Ensemble Modeling
INFO:phase2_integration:Creating ensemble model
INFO:non_major_league_ensemble:Creating base models with conservative parameters
INFO:non_major_league_ensemble:Created 4 base models
INFO:non_major_league_ensemble:Training base models with conservative validation
INFO:non_major_league_ensemble:Training xgboost...
INFO:non_major_league_ensemble:xgboost - Val Acc: 1.0000, Val LogLoss: 0.0190
INFO:non_major_league_ensemble:Training lightgbm...
Training until validation scores don't improve for 30 rounds
Did not meet early stopping. Best iteration is:
[150]	valid_0's multi_logloss: 0.00772959
INFO:non_major_league_ensemble:lightgbm - Val Acc: 1.0000, Val LogLoss: 0.0077
INFO:non_major_league_ensemble:Training random_forest...
INFO:non_major_league_ensemble:random_forest - Val Acc: 1.0000, Val LogLoss: 0.0463
INFO:non_major_league_ensemble:Training logistic_regression...
INFO:non_major_league_ensemble:logistic_regression - Val Acc: 1.0000, Val LogLoss: 0.0265
INFO:non_major_league_ensemble:Creating conservative ensemble
INFO:non_major_league_ensemble:Created ensemble with 4 models
INFO:non_major_league_ensemble:Model weights: {'xgboost': 0.4001754372983308, 'lightgbm': 0.3521543981896826, 'random_forest': 0.14800154084236178, 'logistic_regression': 0.09966862366962478}
INFO:non_major_league_ensemble:Training ensemble model
INFO:non_major_league_ensemble:Ensemble - Val Acc: 1.0000, Val LogLoss: 0.0196
INFO:non_major_league_ensemble:Calibrating model probabilities
INFO:non_major_league_ensemble:Calibrated xgboost
INFO:non_major_league_ensemble:Calibrated lightgbm
INFO:non_major_league_ensemble:Calibrated random_forest
INFO:non_major_league_ensemble:Calibrated logistic_regression
ERROR:non_major_league_ensemble:Error calibrating ensemble: The 'estimator' parameter of CalibratedClassifierCV must be an object implementing 'fit' and 'predict_proba', an object implementing 'fit' and 'decision_function' or None. Got <non_major_league_ensemble.NonMajorLeagueEnsemble.calibrate_models.<locals>.EnsembleWrapper object at 0x7ffb25c50ad0> instead.
INFO:non_major_league_ensemble:Cross-validating ensemble
INFO:non_major_league_ensemble:Cross-validation fold 1/3
INFO:non_major_league_ensemble:Training base models with conservative validation
INFO:non_major_league_ensemble:Training xgboost...
INFO:non_major_league_ensemble:xgboost - Val Acc: 1.0000, Val LogLoss: 0.0782
INFO:non_major_league_ensemble:Training lightgbm...
Training until validation scores don't improve for 30 rounds
Did not meet early stopping. Best iteration is:
[150]	valid_0's multi_logloss: 0.0205198
INFO:non_major_league_ensemble:lightgbm - Val Acc: 1.0000, Val LogLoss: 0.0205
INFO:non_major_league_ensemble:Training random_forest...
INFO:non_major_league_ensemble:random_forest - Val Acc: 1.0000, Val LogLoss: 0.2089
INFO:non_major_league_ensemble:Training logistic_regression...
INFO:non_major_league_ensemble:logistic_regression - Val Acc: 1.0000, Val LogLoss: 0.1272
INFO:non_major_league_ensemble:Creating conservative ensemble
INFO:non_major_league_ensemble:Created ensemble with 4 models
INFO:non_major_league_ensemble:Model weights: {'xgboost': 0.40089981922316914, 'lightgbm': 0.36131663505152317, 'random_forest': 0.14011306061104517, 'logistic_regression': 0.0976704851142626}
INFO:non_major_league_ensemble:Fold 1 - Acc: 1.0000, LogLoss: 0.0772
INFO:non_major_league_ensemble:Cross-validation fold 2/3
INFO:non_major_league_ensemble:Training base models with conservative validation
INFO:non_major_league_ensemble:Training xgboost...
INFO:non_major_league_ensemble:xgboost - Val Acc: 1.0000, Val LogLoss: 0.0383
INFO:non_major_league_ensemble:Training lightgbm...
Training until validation scores don't improve for 30 rounds
Did not meet early stopping. Best iteration is:
[150]	valid_0's multi_logloss: 0.0122501
INFO:non_major_league_ensemble:lightgbm - Val Acc: 1.0000, Val LogLoss: 0.0123
INFO:non_major_league_ensemble:Training random_forest...
INFO:non_major_league_ensemble:random_forest - Val Acc: 1.0000, Val LogLoss: 0.0896
INFO:non_major_league_ensemble:Training logistic_regression...
INFO:non_major_league_ensemble:logistic_regression - Val Acc: 1.0000, Val LogLoss: 0.0544
INFO:non_major_league_ensemble:Creating conservative ensemble
INFO:non_major_league_ensemble:Created ensemble with 4 models
INFO:non_major_league_ensemble:Model weights: {'xgboost': 0.4000386990961013, 'lightgbm': 0.35468407869256435, 'random_forest': 0.1460899493348922, 'logistic_regression': 0.09918727287644212}
INFO:non_major_league_ensemble:Fold 2 - Acc: 1.0000, LogLoss: 0.0375
INFO:non_major_league_ensemble:Cross-validation fold 3/3
INFO:non_major_league_ensemble:Training base models with conservative validation
INFO:non_major_league_ensemble:Training xgboost...
INFO:non_major_league_ensemble:xgboost - Val Acc: 1.0000, Val LogLoss: 0.0259
INFO:non_major_league_ensemble:Training lightgbm...
Training until validation scores don't improve for 30 rounds
Did not meet early stopping. Best iteration is:
[150]	valid_0's multi_logloss: 0.00925354
INFO:non_major_league_ensemble:lightgbm - Val Acc: 1.0000, Val LogLoss: 0.0093
INFO:non_major_league_ensemble:Training random_forest...
INFO:non_major_league_ensemble:random_forest - Val Acc: 1.0000, Val LogLoss: 0.0580
INFO:non_major_league_ensemble:Training logistic_regression...
INFO:non_major_league_ensemble:logistic_regression - Val Acc: 1.0000, Val LogLoss: 0.0359
INFO:non_major_league_ensemble:Creating conservative ensemble
INFO:non_major_league_ensemble:Created ensemble with 4 models
INFO:non_major_league_ensemble:Model weights: {'xgboost': 0.39999541800813954, 'lightgbm': 0.352952990231923, 'random_forest': 0.14756013968577755, 'logistic_regression': 0.09949145207415994}
INFO:non_major_league_ensemble:Fold 3 - Acc: 1.0000, LogLoss: 0.0255
INFO:non_major_league_ensemble:CV Summary - Mean Acc: 1.0000 ¬± 0.0000
INFO:non_major_league_ensemble:CV Summary - Mean LogLoss: 0.0467 ¬± 0.0221
INFO:non_major_league_ensemble:Evaluating ensemble performance
INFO:non_major_league_ensemble:Ensemble Evaluation - Acc: 1.0000, LogLoss: 0.0243
INFO:non_major_league_ensemble:Mean Confidence: 0.9760
INFO:non_major_league_ensemble:Making predictions with confidence filtering
INFO:non_major_league_ensemble:High confidence predictions: 154/154
INFO:non_major_league_ensemble:Calculating ensemble feature importance
INFO:non_major_league_ensemble:Estimating prediction uncertainty
INFO:non_major_league_ensemble:Uncertainty estimation complete
INFO:phase2_integration:Step 6: Model Validation
INFO:phase2_integration:Validating models
INFO:non_major_league_model_validation:Performing comprehensive model validation
INFO:non_major_league_model_validation:Performing time series cross-validation
INFO:non_major_league_model_validation:Time series CV fold 1/3
INFO:non_major_league_model_validation:Fold 1 - Val Acc: 1.0000, Overfitting: 0.0000
INFO:non_major_league_model_validation:Time series CV fold 2/3
INFO:non_major_league_model_validation:Fold 2 - Val Acc: 1.0000, Overfitting: 0.0000
INFO:non_major_league_model_validation:Time series CV fold 3/3
INFO:non_major_league_model_validation:Fold 3 - Val Acc: 1.0000, Overfitting: 0.0000
INFO:non_major_league_model_validation:Time series CV complete: 3 successful folds
INFO:non_major_league_model_validation:Performing walk-forward validation
INFO:non_major_league_model_validation:Walk-forward CV fold 1/3
INFO:non_major_league_model_validation:Fold 1 - Val Acc: 1.0000
INFO:non_major_league_model_validation:Walk-forward CV fold 2/3
INFO:non_major_league_model_validation:Fold 2 - Val Acc: 1.0000
INFO:non_major_league_model_validation:Walk-forward CV fold 3/3
INFO:non_major_league_model_validation:Fold 3 - Val Acc: 1.0000
INFO:non_major_league_model_validation:Walk-forward CV complete: 3 successful folds
INFO:non_major_league_model_validation:Performing bootstrap validation
INFO:non_major_league_model_validation:Bootstrap 1/50
INFO:non_major_league_model_validation:Bootstrap 2/50
INFO:non_major_league_model_validation:Bootstrap 3/50
INFO:non_major_league_model_validation:Bootstrap 4/50
INFO:non_major_league_model_validation:Bootstrap 5/50
INFO:non_major_league_model_validation:Bootstrap 6/50
INFO:non_major_league_model_validation:Bootstrap 7/50
INFO:non_major_league_model_validation:Bootstrap 8/50
INFO:non_major_league_model_validation:Bootstrap 9/50
INFO:non_major_league_model_validation:Bootstrap 10/50
INFO:non_major_league_model_validation:Bootstrap 11/50
INFO:non_major_league_model_validation:Bootstrap 12/50
INFO:non_major_league_model_validation:Bootstrap 13/50
INFO:non_major_league_model_validation:Bootstrap 14/50
INFO:non_major_league_model_validation:Bootstrap 15/50
INFO:non_major_league_model_validation:Bootstrap 16/50
INFO:non_major_league_model_validation:Bootstrap 17/50
INFO:non_major_league_model_validation:Bootstrap 18/50
INFO:non_major_league_model_validation:Bootstrap 19/50
INFO:non_major_league_model_validation:Bootstrap 20/50
INFO:non_major_league_model_validation:Bootstrap 21/50
INFO:non_major_league_model_validation:Bootstrap 22/50
INFO:non_major_league_model_validation:Bootstrap 23/50
INFO:non_major_league_model_validation:Bootstrap 24/50
INFO:non_major_league_model_validation:Bootstrap 25/50
INFO:non_major_league_model_validation:Bootstrap 26/50
INFO:non_major_league_model_validation:Bootstrap 27/50
INFO:non_major_league_model_validation:Bootstrap 28/50
INFO:non_major_league_model_validation:Bootstrap 29/50
INFO:non_major_league_model_validation:Bootstrap 30/50
INFO:non_major_league_model_validation:Bootstrap 31/50
INFO:non_major_league_model_validation:Bootstrap 32/50
INFO:non_major_league_model_validation:Bootstrap 33/50
INFO:non_major_league_model_validation:Bootstrap 34/50
INFO:non_major_league_model_validation:Bootstrap 35/50
INFO:non_major_league_model_validation:Bootstrap 36/50
INFO:non_major_league_model_validation:Bootstrap 37/50
INFO:non_major_league_model_validation:Bootstrap 38/50
INFO:non_major_league_model_validation:Bootstrap 39/50
INFO:non_major_league_model_validation:Bootstrap 40/50
INFO:non_major_league_model_validation:Bootstrap 41/50
INFO:non_major_league_model_validation:Bootstrap 42/50
INFO:non_major_league_model_validation:Bootstrap 43/50
INFO:non_major_league_model_validation:Bootstrap 44/50
INFO:non_major_league_model_validation:Bootstrap 45/50
INFO:non_major_league_model_validation:Bootstrap 46/50
INFO:non_major_league_model_validation:Bootstrap 47/50
INFO:non_major_league_model_validation:Bootstrap 48/50
INFO:non_major_league_model_validation:Bootstrap 49/50
INFO:non_major_league_model_validation:Bootstrap 50/50
INFO:non_major_league_model_validation:Bootstrap validation complete: 50 successful bootstraps
INFO:non_major_league_model_validation:Validating model calibration
INFO:non_major_league_model_validation:Model calibration validation complete
INFO:non_major_league_model_validation:Detecting overfitting
INFO:non_major_league_model_validation:Overfitting detection: NOT DETECTED
INFO:non_major_league_model_validation:Analyzing model stability
INFO:non_major_league_model_validation:Stability analysis: STABLE
INFO:non_major_league_model_validation:Comprehensive validation complete
INFO:phase2_integration:Step 7: Final Integration
INFO:phase2_integration:Integrating Phase 2 results
INFO:phase2_integration:Step 8: Saving Results
INFO:phase2_integration:Saving results for E1
INFO:non_major_league_model_architecture:Saving models to ./models/E1_model_architecture.pkl
INFO:non_major_league_model_architecture:Models saved successfully
INFO:non_major_league_ensemble:Saving ensemble to ./models/E1_ensemble.pkl
INFO:non_major_league_ensemble:Ensemble saved successfully
INFO:non_major_league_hyperparameter_tuning:Saving hyperparameter tuning results to ./models/E1_hyperparameter_tuning.pkl
INFO:non_major_league_hyperparameter_tuning:Hyperparameter tuning results saved successfully
INFO:non_major_league_model_validation:Saving validation results to ./models/E1_validation_results.pkl
INFO:non_major_league_model_validation:Validation results saved successfully
INFO:phase2_integration:Phase 2 results saved successfully
INFO:phase2_integration:Phase 2 pipeline completed successfully
INFO:master_pipeline:Phase 2 completed successfully in 2281.52 seconds
INFO:__main__:‚úÖ Phase 2 completed
INFO:__main__:
üìà STEP 5: Phase 3 - Backtesting
INFO:master_pipeline:================================================================================
INFO:master_pipeline:STARTING PHASE 3: BACKTESTING & STRATEGY VALIDATION
INFO:master_pipeline:================================================================================
INFO:phase3_integration:Output directory: ./results
INFO:phase3_integration:Starting Phase 3 pipeline for E1
INFO:phase3_integration:Step 1: Loading and preparing data
INFO:phase3_integration:Loading data from ./data/E1_features.csv
INFO:phase3_integration:Loaded 767 records with 259 features
INFO:phase3_integration:Step 2: Comprehensive Backtesting
INFO:phase3_integration:Running comprehensive backtesting
INFO:non_major_league_backtesting:Running walk-forward backtesting
INFO:non_major_league_backtesting:Preparing backtest data
INFO:non_major_league_backtesting:Prepared 767 records for backtesting
INFO:non_major_league_backtesting:Bet 1: loss, Profit: -1.00, Capital: 999.00
INFO:non_major_league_backtesting:Bet 2: loss, Profit: -1.00, Capital: 998.00
INFO:non_major_league_backtesting:Bet 3: loss, Profit: -1.00, Capital: 997.00
INFO:non_major_league_backtesting:Bet 4: win, Profit: 2.17, Capital: 999.17
INFO:non_major_league_backtesting:Bet 5: loss, Profit: -1.00, Capital: 998.17
INFO:non_major_league_backtesting:Bet 6: win, Profit: 3.48, Capital: 1001.65
INFO:non_major_league_backtesting:Bet 7: loss, Profit: -1.00, Capital: 1000.65
INFO:non_major_league_backtesting:Bet 8: loss, Profit: -1.00, Capital: 999.65
INFO:non_major_league_backtesting:Bet 9: loss, Profit: -1.00, Capital: 998.65
INFO:non_major_league_backtesting:Bet 10: loss, Profit: -1.00, Capital: 997.65
INFO:non_major_league_backtesting:Bet 11: win, Profit: 0.73, Capital: 998.38
INFO:non_major_league_backtesting:Bet 12: loss, Profit: -1.00, Capital: 997.38
INFO:non_major_league_backtesting:Bet 13: loss, Profit: -1.00, Capital: 996.38
INFO:non_major_league_backtesting:Bet 14: win, Profit: 3.65, Capital: 1000.04
INFO:non_major_league_backtesting:Bet 15: loss, Profit: -1.00, Capital: 999.04
INFO:non_major_league_backtesting:Bet 16: win, Profit: 1.49, Capital: 1000.52
INFO:non_major_league_backtesting:Bet 17: win, Profit: 3.66, Capital: 1004.18
INFO:non_major_league_backtesting:Bet 18: win, Profit: 2.43, Capital: 1006.61
INFO:non_major_league_backtesting:Bet 19: win, Profit: 1.37, Capital: 1007.98
INFO:non_major_league_backtesting:Bet 20: loss, Profit: -1.00, Capital: 1006.98
INFO:non_major_league_backtesting:Bet 21: loss, Profit: -1.00, Capital: 1005.98
INFO:non_major_league_backtesting:Bet 22: loss, Profit: -1.00, Capital: 1004.98
INFO:non_major_league_backtesting:Bet 23: loss, Profit: -1.00, Capital: 1003.98
INFO:non_major_league_backtesting:Bet 24: win, Profit: 1.89, Capital: 1005.87
INFO:non_major_league_backtesting:Bet 25: win, Profit: 3.88, Capital: 1009.75
INFO:non_major_league_backtesting:Bet 26: win, Profit: 2.41, Capital: 1012.16
INFO:non_major_league_backtesting:Bet 27: loss, Profit: -1.00, Capital: 1011.16
INFO:non_major_league_backtesting:Bet 28: loss, Profit: -1.00, Capital: 1010.16
INFO:non_major_league_backtesting:Bet 29: loss, Profit: -1.00, Capital: 1009.16
INFO:non_major_league_backtesting:Bet 30: win, Profit: 2.31, Capital: 1011.46
INFO:non_major_league_backtesting:Bet 31: loss, Profit: -1.00, Capital: 1010.46
INFO:non_major_league_backtesting:Bet 32: loss, Profit: -1.00, Capital: 1009.46
INFO:non_major_league_backtesting:Bet 33: loss, Profit: -1.00, Capital: 1008.46
INFO:non_major_league_backtesting:Bet 34: loss, Profit: -1.00, Capital: 1007.46
INFO:non_major_league_backtesting:Bet 35: win, Profit: 0.56, Capital: 1008.02
INFO:non_major_league_backtesting:Bet 36: loss, Profit: -1.00, Capital: 1007.02
INFO:non_major_league_backtesting:Bet 37: loss, Profit: -1.00, Capital: 1006.02
INFO:non_major_league_backtesting:Bet 38: win, Profit: 1.97, Capital: 1007.98
INFO:non_major_league_backtesting:Bet 39: loss, Profit: -1.00, Capital: 1006.98
INFO:non_major_league_backtesting:Bet 40: loss, Profit: -1.00, Capital: 1005.98
INFO:non_major_league_backtesting:Bet 41: win, Profit: 2.29, Capital: 1008.27
INFO:non_major_league_backtesting:Bet 42: loss, Profit: -1.00, Capital: 1007.27
INFO:non_major_league_backtesting:Bet 43: win, Profit: 3.51, Capital: 1010.78
INFO:non_major_league_backtesting:Bet 44: loss, Profit: -1.00, Capital: 1009.78
INFO:non_major_league_backtesting:Bet 45: loss, Profit: -1.00, Capital: 1008.78
INFO:non_major_league_backtesting:Bet 46: loss, Profit: -1.00, Capital: 1007.78
INFO:non_major_league_backtesting:Bet 47: loss, Profit: -1.00, Capital: 1006.78
INFO:non_major_league_backtesting:Bet 48: win, Profit: 2.66, Capital: 1009.45
INFO:non_major_league_backtesting:Bet 49: win, Profit: 1.72, Capital: 1011.17
INFO:non_major_league_backtesting:Bet 50: loss, Profit: -1.00, Capital: 1010.17
INFO:non_major_league_backtesting:Bet 51: loss, Profit: -1.00, Capital: 1009.17
INFO:non_major_league_backtesting:Bet 52: win, Profit: 0.66, Capital: 1009.83
INFO:non_major_league_backtesting:Bet 53: loss, Profit: -1.00, Capital: 1008.83
INFO:non_major_league_backtesting:Bet 54: loss, Profit: -1.00, Capital: 1007.83
INFO:non_major_league_backtesting:Bet 55: win, Profit: 1.62, Capital: 1009.45
INFO:non_major_league_backtesting:Bet 56: loss, Profit: -1.00, Capital: 1008.45
INFO:non_major_league_backtesting:Bet 57: win, Profit: 2.43, Capital: 1010.88
INFO:non_major_league_backtesting:Bet 58: loss, Profit: -1.00, Capital: 1009.88
INFO:non_major_league_backtesting:Bet 59: loss, Profit: -1.00, Capital: 1008.88
INFO:non_major_league_backtesting:Bet 60: loss, Profit: -1.00, Capital: 1007.88
INFO:non_major_league_backtesting:Bet 61: win, Profit: 0.87, Capital: 1008.75
INFO:non_major_league_backtesting:Bet 62: win, Profit: 2.33, Capital: 1011.08
INFO:non_major_league_backtesting:Bet 63: loss, Profit: -1.00, Capital: 1010.08
INFO:non_major_league_backtesting:Bet 64: loss, Profit: -1.00, Capital: 1009.08
INFO:non_major_league_backtesting:Bet 65: loss, Profit: -1.00, Capital: 1008.08
INFO:non_major_league_backtesting:Bet 66: loss, Profit: -1.00, Capital: 1007.08
INFO:non_major_league_backtesting:Bet 67: win, Profit: 1.56, Capital: 1008.63
INFO:non_major_league_backtesting:Bet 68: win, Profit: 1.44, Capital: 1010.07
INFO:non_major_league_backtesting:Bet 69: loss, Profit: -1.00, Capital: 1009.07
INFO:non_major_league_backtesting:Bet 70: loss, Profit: -1.00, Capital: 1008.07
INFO:non_major_league_backtesting:Bet 71: win, Profit: 3.12, Capital: 1011.20
INFO:non_major_league_backtesting:Bet 72: loss, Profit: -1.00, Capital: 1010.20
INFO:non_major_league_backtesting:Bet 73: loss, Profit: -1.00, Capital: 1009.20
INFO:non_major_league_backtesting:Bet 74: loss, Profit: -1.00, Capital: 1008.20
INFO:non_major_league_backtesting:Bet 75: loss, Profit: -1.00, Capital: 1007.20
INFO:non_major_league_backtesting:Bet 76: loss, Profit: -1.00, Capital: 1006.20
INFO:non_major_league_backtesting:Bet 77: loss, Profit: -1.00, Capital: 1005.20
INFO:non_major_league_backtesting:Bet 78: loss, Profit: -1.00, Capital: 1004.20
INFO:non_major_league_backtesting:Bet 79: loss, Profit: -1.00, Capital: 1003.20
INFO:non_major_league_backtesting:Bet 80: loss, Profit: -1.00, Capital: 1002.20
INFO:non_major_league_backtesting:Bet 81: loss, Profit: -1.00, Capital: 1001.20
INFO:non_major_league_backtesting:Bet 82: win, Profit: 3.66, Capital: 1004.86
INFO:non_major_league_backtesting:Bet 83: loss, Profit: -1.00, Capital: 1003.86
INFO:non_major_league_backtesting:Bet 84: loss, Profit: -1.00, Capital: 1002.86
INFO:non_major_league_backtesting:Bet 85: loss, Profit: -1.00, Capital: 1001.86
INFO:non_major_league_backtesting:Bet 86: loss, Profit: -1.00, Capital: 1000.86
INFO:non_major_league_backtesting:Bet 87: loss, Profit: -1.00, Capital: 999.86
INFO:non_major_league_backtesting:Bet 88: loss, Profit: -1.00, Capital: 998.86
INFO:non_major_league_backtesting:Bet 89: win, Profit: 2.73, Capital: 1001.60
INFO:non_major_league_backtesting:Bet 90: loss, Profit: -1.00, Capital: 1000.60
INFO:non_major_league_backtesting:Bet 91: win, Profit: 3.90, Capital: 1004.50
INFO:non_major_league_backtesting:Bet 92: win, Profit: 0.89, Capital: 1005.38
INFO:non_major_league_backtesting:B